name,disciplines,plus_options,plans,min_plan,district,street,link,metadata,latitude,longitude,description
Crossbox Restelo,['Crosstraining'],False,"['M', 'L', 'XL']",M,Belém,Rua dos Jerónimos 13,https://urbansportsclub.com//de/venues/crossbox-restelo,"{'@context': 'http://schema.org', '@type': 'LocalBusiness', 'name': 'Crossbox Restelo', 'description': 'Espaço de treino funcional com turmas pequenas com foco especial na qualidade dos movimentos e na saúde física dos nossos clientes. Localizado na zona Estádio do Restelo com parque estacionamento gratuito nas imediações.', 'address': {'@type': 'PostalAddress', 'addressLocality': 'Lisbon, Portugal', 'addressCountry': 'Portugal', 'postalCode': '', 'streetAddress': 'Rua dos Jerónimos 13'}, 'telephone': '', 'geo': {'@type': 'GeoCoordinates', 'latitude': '38.7025275', 'longitude': '-9.2068653'}, 'priceRange': '-', 'image': 'https://storage.googleapis.com/download/storage/v1/b/usc-pro-uscweb-live-media/o/de-live%2Foriginal_1024x576_IMG_8806_1636634799375222_admin.jpg?generation=1636634799563099&amp;alt=media'}",38.7025275,-9.2068653,Espaço de treino funcional com turmas pequenas com foco especial na qualidade dos movimentos e na saúde física dos nossos clientes. Localizado na zona Estádio do Restelo com parque estacionamento gratuito nas imediações.
CrossFit® Neverland,['Crosstraining'],False,"['M', 'L', 'XL']",M,Amadora,Rua Henrique Paiva Couceiro 8D,https://urbansportsclub.com//de/venues/crossfitr-neverland,"{'@context': 'http://schema.org', '@type': 'LocalBusiness', 'name': 'CrossFit® Neverland', 'description': 'Box de CrossFit®.', 'address': {'@type': 'PostalAddress', 'addressLocality': 'Lisbon, Portugal', 'addressCountry': 'Portugal', 'postalCode': '2700-453', 'streetAddress': 'Rua Henrique Paiva Couceiro 8D'}, 'telephone': '+351 913 570 470', 'geo': {'@type': 'GeoCoordinates', 'latitude': '38.7543713', 'longitude': '-9.2197966'}, 'priceRange': '-', 'image': 'https://storage.googleapis.com/download/storage/v1/b/usc-pro-uscweb-live-media/o/de-live%2Foriginal_1024x576_PHOTO-2021-02-17-14-59-46_1625583654983742_admin.jpg?alt=media'}",38.7543713,-9.2197966,Box de CrossFit®.
Solinca Classic Vasco da Gama,"['Aqua', 'Fitness', 'Indoorcycling', 'Pilates', 'Schwimmen', 'Yoga']",False,"['M', 'L', 'XL']",M,Parque das Nações,"Centro Comercial Vasco da Gama, Avenida D. João II, Lote 1.05.02",https://urbansportsclub.com//de/venues/solinca-classic-vasco-da-gama,"{'@context': 'http://schema.org', '@type': 'LocalBusiness', 'name': 'Solinca Classic Vasco da Gama', 'description': 'Queremos ajudar a mudar Portugal, uma pessoa de cada vez, estimulando hábitos de vida saudáveis, através da prática regular de exercício físico, contribuindo para uma vida mais equilibrada e feliz. Solinca está determinada a garantir FITNESS PARA TODOS! Tanto no Solinca Classic, com piscina, sauna, banho turco e jacuzzi, como no Solinca Light, terá sempre acesso a planos adaptados aos seus objetivos de treino, às melhores aulas de grupo (incluindo todas as modalidades Les Mills), sempre com o apoio dos melhores profissionais de fitness do país.', 'address': {'@type': 'PostalAddress', 'addressLocality': 'Lisbon, Portugal', 'addressCountry': 'Portugal', 'postalCode': '1990-094', 'streetAddress': 'Centro Comercial Vasco da Gama, Avenida D. João II, Lote 1.05.02'}, 'telephone': '+351 21 892 2870', 'geo': {'@type': 'GeoCoordinates', 'latitude': '38.767721', 'longitude': '-9.0969636'}, 'priceRange': '-', 'image': 'https://storage.googleapis.com/download/storage/v1/b/usc-pro-uscweb-live-media/o/de-live%2Foriginal_1024x576_Solinca%20Classic%20Vasco%20da%20Gama_1621602714228243_admin.jpg?alt=media'}",38.767721,-9.0969636,"Queremos ajudar a mudar Portugal, uma pessoa de cada vez, estimulando hábitos de vida saudáveis, através da prática regular de exercício físico, contribuindo para uma vida mais equilibrada e feliz. Solinca está determinada a garantir FITNESS PARA TODOS! Tanto no Solinca Classic, com piscina, sauna, banho turco e jacuzzi, como no Solinca Light, terá sempre acesso a planos adaptados aos seus objetivos de treino, às melhores aulas de grupo (incluindo todas as modalidades Les Mills), sempre com o apoio dos melhores profissionais de fitness do país."
Padel Factory Sintra,['Padel'],False,"['M', 'L', 'XL']",M,Sintra,"Sulim Park, Alto da Bela Vista",https://urbansportsclub.com//de/venues/padel-factory-sintra,"{'@context': 'http://schema.org', '@type': 'LocalBusiness', 'name': 'Padel Factory Sintra', 'description': 'Padel Factory Sintra (4 Campos indoor) e Padel Factory Expo (7 Campos outdoor num enquadramento único). Venha jogar connosco!', 'address': {'@type': 'PostalAddress', 'addressLocality': 'Lisbon, Portugal', 'addressCountry': 'Portugal', 'postalCode': '2735-340', 'streetAddress': 'Sulim Park, Alto da Bela Vista'}, 'telephone': '', 'geo': {'@type': 'GeoCoordinates', 'latitude': '38.761069', 'longitude': '-9.305439'}, 'priceRange': '-', 'image': 'https://storage.googleapis.com/download/storage/v1/b/usc-pro-uscweb-live-media/o/de-live%2Foriginal_1500x844_pkog2mcrrh0przu3glzi_1680514591973031.png?generation=1680514592058990&amp;alt=media'}",38.761069,-9.305439,Padel Factory Sintra (4 Campos indoor) e Padel Factory Expo (7 Campos outdoor num enquadramento único). Venha jogar connosco!
Om Iyengar Yoga Lisboa,['Yoga'],False,"['M', 'L', 'XL']",M,Saldanha,Avenida Marquês de Tomar 38,https://urbansportsclub.com//de/venues/om-iyengar-yoga-lisboa,"{'@context': 'http://schema.org', '@type': 'LocalBusiness', 'name': 'Om Iyengar Yoga Lisboa', 'description': 'The Om Way. No centro de Lisboa e com 120m2 de jardim, nasce o Om. Um espaço luminoso e acolhedor com uma atmosfera tranquila, dedicado ao ensino e prática do Yoga Iyengar. Fundado pela Prof. Elsa Santos, está aberto diariamente com aulas presenciais e online para diferentes níveis. Criamos as condições para que os nossos utilizadores possam aumentar a sua concentração, e melhorar a saúde física e psicológica.', 'address': {'@type': 'PostalAddress', 'addressLocality': 'Lisbon, Portugal', 'addressCountry': 'Portugal', 'postalCode': '1050-156', 'streetAddress': 'Avenida Marquês de Tomar 38'}, 'telephone': '+49 9131 85259', 'geo': {'@type': 'GeoCoordinates', 'latitude': '38.737096', 'longitude': '-9.149385'}, 'priceRange': '-', 'image': 'https://storage.googleapis.com/download/storage/v1/b/usc-pro-uscweb-live-media/o/de-live%2Foriginal_1024x576_Home_USC_163394480965705_admin.jpg?generation=1633944809201224&amp;alt=media'}",38.737096,-9.149385,"The Om Way. No centro de Lisboa e com 120m2 de jardim, nasce o Om. Um espaço luminoso e acolhedor com uma atmosfera tranquila, dedicado ao ensino e prática do Yoga Iyengar. Fundado pela Prof. Elsa Santos, está aberto diariamente com aulas presenciais e online para diferentes níveis. Criamos as condições para que os nossos utilizadores possam aumentar a sua concentração, e melhorar a saúde física e psicológica."
BodyFit EMS Studio - Campo de Ourique,"['EMS', 'EMS Cardio']",True,"['L', 'XL']",L,Campo de Ourique,Rua de Campo de Ourique 103,https://urbansportsclub.com//de/venues/bodyfit-ems-1,"{'@context': 'http://schema.org', '@type': 'LocalBusiness', 'name': 'BodyFit EMS Studio - Campo de Ourique', 'description': 'A BODYFIT EMS STUDIO é uma nova geração de desporto. 1 sessão de Electrostimulação de 20 minutos equivale a 4 horas de contração muscular. Graças a essa nova tecnologia não perca mais tempo em atingir os seus objetivos ! Acompanhado/a de um Personal Trainer atinja os seus objetivos com atuação em 8 zonas do seu corpo. A BODYFIT EMS STUDIO garante-lhe um treino completo, rápido e com resultados !', 'address': {'@type': 'PostalAddress', 'addressLocality': 'Lisbon, Portugal', 'addressCountry': 'Portugal', 'postalCode': '1250-060', 'streetAddress': 'Rua de Campo de Ourique 103'}, 'telephone': '+351 21 385 0939', 'geo': {'@type': 'GeoCoordinates', 'latitude': '38.7210335', 'longitude': '-9.1636759'}, 'priceRange': '-', 'image': 'https://storage.googleapis.com/download/storage/v1/b/usc-pro-uscweb-live-media/o/de-live%2Foriginal_1024x576_fxfogcx4tm0m3wbkx6xt_1688378035931154.png?generation=1688378036003750&amp;alt=media'}",38.7210335,-9.1636759,"A BODYFIT EMS STUDIO é uma nova geração de desporto. 1 sessão de Electrostimulação de 20 minutos equivale a 4 horas de contração muscular. Graças a essa nova tecnologia não perca mais tempo em atingir os seus objetivos ! Acompanhado/a de um Personal Trainer atinja os seus objetivos com atuação em 8 zonas do seu corpo. A BODYFIT EMS STUDIO garante-lhe um treino completo, rápido e com resultados !"
The Code Laranjeiras,"['Fitness', 'Funktionelles Training', 'Indoorcycling', 'Lauftreff', 'Pilates', 'Yoga']",False,"['M', 'L', 'XL']",M,Laranjeiras,"Azinhaga das Galhardas, Estádio Universitário de Lisboa",https://urbansportsclub.com//de/venues/the-code-laranjeiras,"{'@context': 'http://schema.org', '@type': 'LocalBusiness', 'name': 'The Code Laranjeiras', 'description': 'Um novo conceito de fitness está a chegar. Fitness Studios focados no treino HIIT, FitBoxing e Cycling. Com Alma Fazer uma aula no The Code é dar tudo. É dar o máximo e libertar aquela energia que vem dentro de ti. Estamos cá para te ajudar a mostrares o teu melhor. Música de Arrepiar Aquela batida, aquele som, aquela música que nunca ouviste mas que te marca e puxa por ti no treino. Seleccionamos todos os beats de música ao pormenor. Energia para Objectivos Tudo no The Code é pensado para que consigas dar o máximo em cada aula e alcances os teus objectivos. A música, as luzes, os exercícios, o plano de treino e os equipamentos. Mimamos-te Queremos oferecer-te o nosso melhor. Os nossos balneários estão equipados com tudo o que podes precisar, desde o amaciador, aos produtos para a cara e secadores profissionais. Comunidade Somos CODERS, pensamos diferente, somos diferentes e queremos sempre algo diferente. Mas somos um só quando estamos a treinar, a puxar pelo companheiro do lado a todo o momento.', 'address': {'@type': 'PostalAddress', 'addressLocality': 'Lisbon, Portugal', 'addressCountry': 'Portugal', 'postalCode': '1600-097', 'streetAddress': 'Azinhaga das Galhardas, Estádio Universitário de Lisboa'}, 'telephone': '', 'geo': {'@type': 'GeoCoordinates', 'latitude': '38.752624', 'longitude': '-9.165229'}, 'priceRange': '-', 'image': 'https://storage.googleapis.com/download/storage/v1/b/usc-pro-uscweb-live-media/o/de-live%2Foriginal_1024x576_the%20code_1572515362775864_admin.jpg?alt=media'}",38.752624,-9.165229,"Um novo conceito de fitness está a chegar. Fitness Studios focados no treino HIIT, FitBoxing e Cycling. Com Alma Fazer uma aula no The Code é dar tudo. É dar o máximo e libertar aquela energia que vem dentro de ti. Estamos cá para te ajudar a mostrares o teu melhor. Música de Arrepiar Aquela batida, aquele som, aquela música que nunca ouviste mas que te marca e puxa por ti no treino. Seleccionamos todos os beats de música ao pormenor. Energia para Objectivos Tudo no The Code é pensado para que consigas dar o máximo em cada aula e alcances os teus objectivos. A música, as luzes, os exercícios, o plano de treino e os equipamentos. Mimamos-te Queremos oferecer-te o nosso melhor. Os nossos balneários estão equipados com tudo o que podes precisar, desde o amaciador, aos produtos para a cara e secadores profissionais. Comunidade Somos CODERS, pensamos diferente, somos diferentes e queremos sempre algo diferente. Mas somos um só quando estamos a treinar, a puxar pelo companheiro do lado a todo o momento."
eBody - Expo,"['EMS', 'EMS Cardio']",True,['XL'],XL,Parque das Nações,"Edifício Ecrán Alameda dos Oceanos, Lote 3.14 17A",https://urbansportsclub.com//de/venues/ebody,"{'@context': 'http://schema.org', '@type': 'LocalBusiness', 'name': 'eBody - Expo', 'description': 'Bem-vindo à nova geração do Fitness! O eBody carateriza-se como a próxima geração do Fitness, treinos inteligentes individualizados de apenas 20 minutos por semana mas que equivalem a 3 horas de treino num ginásio convencional! O treino eBody é a solução perfeita, com garantia de resultados em apenas 20 mins por semana, é facilmente adaptável na rotina semanal do cliente, apto para todas as idades e níveis de condição física e com acompanhamento personalizado de acordo com o objectivo e características individuais Pode encontrar estúdios eBody no Porto (Antas, Boavista e Bessa), Matosinhos e Lisboa (Expo/Parque das Nações e Campo de Ourique). Com a eBody o seu corpo nunca mais será o mesmo!', 'address': {'@type': 'PostalAddress', 'addressLocality': 'Lisbon, Portugal', 'addressCountry': 'Portugal', 'postalCode': '1990-197', 'streetAddress': 'Edifício Ecrán Alameda dos Oceanos, Lote 3.14 17A'}, 'telephone': '+351 910 568 273', 'geo': {'@type': 'GeoCoordinates', 'latitude': '38.7564857', 'longitude': '-9.0967341'}, 'priceRange': '-', 'image': 'https://storage.googleapis.com/download/storage/v1/b/usc-pro-uscweb-live-media/o/de-live%2Foriginal_1024x576_DSC03629_1619440015812142_admin.jpg?alt=media'}",38.7564857,-9.0967341,"Bem-vindo à nova geração do Fitness! O eBody carateriza-se como a próxima geração do Fitness, treinos inteligentes individualizados de apenas 20 minutos por semana mas que equivalem a 3 horas de treino num ginásio convencional! O treino eBody é a solução perfeita, com garantia de resultados em apenas 20 mins por semana, é facilmente adaptável na rotina semanal do cliente, apto para todas as idades e níveis de condição física e com acompanhamento personalizado de acordo com o objectivo e características individuais Pode encontrar estúdios eBody no Porto (Antas, Boavista e Bessa), Matosinhos e Lisboa (Expo/Parque das Nações e Campo de Ourique). Com a eBody o seu corpo nunca mais será o mesmo!"
Jazzy Dance Studios - Entrecampos,['Tanzen'],False,"['M', 'L', 'XL']",M,Alvalade,"Rua Sousa Lopes, Lote Pq/Rs – Centro Comercial Gemini, Lisboa",https://urbansportsclub.com//de/venues/jazzy-dance-studios-entrecampos,"{'@context': 'http://schema.org', '@type': 'LocalBusiness', 'name': 'Jazzy Dance Studios - Entrecampos', 'description': '“A DANÇA É PARA TODOS, A JAZZY É PARA TI!“ Com 4 escolas de dança em Lisboa: Santos, Saldanha, Entrecampos e na linha de Cascais e uma escola no Porto (Trindade), os melhores professores e coreógrafos e uma paixão que em sete anos de vida não pára de crescer, a Jazzy Dance Studios é, hoje, uma escola de dança referência a nível nacional e internacional. Aqui há lugar para todas as tribos, para todos os ritmos, para todas as idades. Bem-vindo à tua escola de dança!', 'address': {'@type': 'PostalAddress', 'addressLocality': 'Lisbon, Portugal', 'addressCountry': 'Portugal', 'postalCode': '1600-207', 'streetAddress': 'Rua Sousa Lopes, Lote Pq/Rs – Centro Comercial Gemini, Lisboa'}, 'telephone': '', 'geo': {'@type': 'GeoCoordinates', 'latitude': '38.7441624', 'longitude': '-9.1537049'}, 'priceRange': '-', 'image': 'https://storage.googleapis.com/download/storage/v1/b/usc-pro-uscweb-live-media/o/de-live%2Foriginal_1024x576_2Aniversario_Saldanha60_1601545620497439_admin.jpg?alt=media'}",38.7441624,-9.1537049,"“A DANÇA É PARA TODOS, A JAZZY É PARA TI!“ Com 4 escolas de dança em Lisboa: Santos, Saldanha, Entrecampos e na linha de Cascais e uma escola no Porto (Trindade), os melhores professores e coreógrafos e uma paixão que em sete anos de vida não pára de crescer, a Jazzy Dance Studios é, hoje, uma escola de dança referência a nível nacional e internacional. Aqui há lugar para todas as tribos, para todos os ritmos, para todas as idades. Bem-vindo à tua escola de dança!"
STELLAE STUDIO by Estela Cameira,"['Fitness', 'Pilates', 'Tanzen', 'Yoga']",False,"['S', 'M', 'L', 'XL']",S,Amadora,"Stellae Studio, Praça Natália Correia 14A",https://urbansportsclub.com//de/venues/stellae-studio-by-estela-cameira,"{'@context': 'http://schema.org', '@type': 'LocalBusiness', 'name': 'STELLAE STUDIO by Estela Cameira', 'description': 'Vive com mais alegria e estabilidade emocional! Desafia-te e cuida da tua saúde física e mental de forma divertida e desafiante! Nós Ouvimos Estamos cá para te ouvir e conhecer, queremos que sejas um membro da família Stellae! Nós Ensinamos Nós explicamos todos os exercícios e passos de dança ensinados nas aulas. Estamos sempre prontos para esclarecer as tuas dúvidas mesmo fora das aulas. Nós Adaptamos Sabemos que cada pessoa tem o seu ritmo e por isso adaptamos as aulas para que possas evoluir da melhor forma! Nós curamos O nosso objectivo é restaurar a tua paz interior, a tua felicidade contribuindo para o teu bem-estar físico e mental.', 'address': {'@type': 'PostalAddress', 'addressLocality': 'Lisbon, Portugal', 'addressCountry': 'Portugal', 'postalCode': '2720-065', 'streetAddress': 'Stellae Studio, Praça Natália Correia 14A'}, 'telephone': '+351 917 031 300', 'geo': {'@type': 'GeoCoordinates', 'latitude': '38.7429097', 'longitude': '-9.2169973'}, 'priceRange': '-', 'image': 'https://storage.googleapis.com/download/storage/v1/b/usc-pro-uscweb-live-media/o/de-live%2Foriginal_1056x594_BCE84490-0A6A-43B2-A41A-3CC664FC9DFF_1644884355305309_admin.jpg?generation=1644884355495670&amp;alt=media'}",38.7429097,-9.2169973,"Vive com mais alegria e estabilidade emocional! Desafia-te e cuida da tua saúde física e mental de forma divertida e desafiante! Nós Ouvimos Estamos cá para te ouvir e conhecer, queremos que sejas um membro da família Stellae! Nós Ensinamos Nós explicamos todos os exercícios e passos de dança ensinados nas aulas. Estamos sempre prontos para esclarecer as tuas dúvidas mesmo fora das aulas. Nós Adaptamos Sabemos que cada pessoa tem o seu ritmo e por isso adaptamos as aulas para que possas evoluir da melhor forma! Nós curamos O nosso objectivo é restaurar a tua paz interior, a tua felicidade contribuindo para o teu bem-estar físico e mental."
Move-U,['Pilates Reformer'],True,"['L', 'XL']",L,Parede,Avenida da República 1469,https://urbansportsclub.com//de/venues/move-u,"{'@context': 'http://schema.org', '@type': 'LocalBusiness', 'name': 'Move-U', 'description': 'O Move-U está a aguardar a tua visita!', 'address': {'@type': 'PostalAddress', 'addressLocality': 'Lisbon, Portugal', 'addressCountry': 'Portugal', 'postalCode': '2775-275', 'streetAddress': 'Avenida da República 1469'}, 'telephone': '', 'geo': {'@type': 'GeoCoordinates', 'latitude': '38.6906167', 'longitude': '-9.3569233'}, 'priceRange': '-', 'image': 'https://storage.googleapis.com/download/storage/v1/b/usc-pro-uscweb-live-media/o/de-live%2Foriginal_1920x1080__MG_1151_168907629334987_admin.jpg?generation=1689076293189719&amp;alt=media'}",38.6906167,-9.3569233,O Move-U está a aguardar a tua visita!
Ballerina Body - Alameda,['Personal Training'],False,"['M', 'L', 'XL']",M,Alameda,"O Centro - Rua Barão de Sabrosa, 154B",https://urbansportsclub.com//de/venues/ballerina-body-alameda,"{'@context': 'http://schema.org', '@type': 'LocalBusiness', 'name': 'Ballerina Body - Alameda', 'description': 'Aula criada pela bailarina e coreógrafa Inês Jacques, o método Ballerina Body® conduz a uma silhueta esguia e tonificada. Utiliza o vocabulário da dança como treino físico. Esta actividade combina várias técnicas de dança, de onde se destaca o ballet clássico, em exercícios que o peso do próprio corpo é o maior aliado. Não é uma aula para quem quer dançar, é uma aula para quem quer ter o corpo de uma bailarina! Ballerina Body® proporciona correcção de postura, tonificação muscular e flexibilidade.', 'address': {'@type': 'PostalAddress', 'addressLocality': 'Lisbon, Portugal', 'addressCountry': 'Portugal', 'postalCode': '', 'streetAddress': 'O Centro - Rua Barão de Sabrosa, 154B'}, 'telephone': '+351 938 345 844', 'geo': {'@type': 'GeoCoordinates', 'latitude': '38.7355714', 'longitude': '-9.1288157'}, 'priceRange': '-', 'image': 'https://storage.googleapis.com/download/storage/v1/b/usc-pro-uscweb-live-media/o/de-live%2Foriginal_1024x576_IMG_5277_%20brighter_1680193965992726_admin.jpg?generation=1680193966057379&amp;alt=media'}",38.7355714,-9.1288157,"Aula criada pela bailarina e coreógrafa Inês Jacques, o método Ballerina Body® conduz a uma silhueta esguia e tonificada. Utiliza o vocabulário da dança como treino físico. Esta actividade combina várias técnicas de dança, de onde se destaca o ballet clássico, em exercícios que o peso do próprio corpo é o maior aliado. Não é uma aula para quem quer dançar, é uma aula para quem quer ter o corpo de uma bailarina! Ballerina Body® proporciona correcção de postura, tonificação muscular e flexibilidade."
Shape Studio,"['Fitness', 'Pilates', 'Yoga']",False,"['S', 'M', 'L', 'XL']",S,Loures,"Av. Diogo Cão, 9 - Loja B",https://urbansportsclub.com//de/venues/shape-studio-4,"{'@context': 'http://schema.org', '@type': 'LocalBusiness', 'name': 'Shape Studio', 'description': 'O ShapeStudio®️ sabe o quanto o Bem-Estar do indivíduo pode determinar o seu percurso de vida e, por isso, pretende marcar a diferença, dando oportunidade a todos os seus clientes de desenvolverem ao máximo o seu potencial como pessoas! Propomo-nos a disponibilizar-lhe todos os serviços necessários para que a cada dia se aproxime mais de atingir o seu Bem-estar Integral, assegurando que os valores de responsabilidade social pelos quais nos regemos, Segurança, Especialização, Integridade, Aconselhamento, Personalização e Independência, garantem a qualidade que necessita e merece! Longe de ser um espaço convencional, pretende romper com a monotonia e com as concepções instaladas, de forma simples, agradável, motivadora e responsável, num espaço de bem-estar composto por três áreas a funcionar em cooperação e consonância para que atinja o seu potencial e, acima de tudo, seja feliz e se sinta realizado. ShapeStudio®️ é Shape Fitness, Shape Spa e Shape Therapy, é um ginásio inovador e original para todas as mulheres que querem e gostam que o seu corpo seja tratado de acordo com as suas características e necessidades, é um SPA distinto e glamouroso só para um ou para partilhar a dois e é um centro de terapias não invasivas para a saúde geral e global de toda a família e amigos. Shape Studio é Felicidade!', 'address': {'@type': 'PostalAddress', 'addressLocality': 'Lisbon, Portugal', 'addressCountry': 'Portugal', 'postalCode': '2670-327', 'streetAddress': 'Av. Diogo Cão, 9 - Loja B'}, 'telephone': '', 'geo': {'@type': 'GeoCoordinates', 'latitude': '38.8375322', 'longitude': '-9.1562994'}, 'priceRange': '-', 'image': 'https://storage.googleapis.com/download/storage/v1/b/usc-pro-uscweb-live-media/o/de-live%2Foriginal_1024x576_42705384_268557260658181_248325933788823552_n%20(1)_1661942836688621_admin.jpg?generation=1661942836757878&amp;alt=media'}",38.8375322,-9.1562994,"O ShapeStudio®️ sabe o quanto o Bem-Estar do indivíduo pode determinar o seu percurso de vida e, por isso, pretende marcar a diferença, dando oportunidade a todos os seus clientes de desenvolverem ao máximo o seu potencial como pessoas! Propomo-nos a disponibilizar-lhe todos os serviços necessários para que a cada dia se aproxime mais de atingir o seu Bem-estar Integral, assegurando que os valores de responsabilidade social pelos quais nos regemos, Segurança, Especialização, Integridade, Aconselhamento, Personalização e Independência, garantem a qualidade que necessita e merece! Longe de ser um espaço convencional, pretende romper com a monotonia e com as concepções instaladas, de forma simples, agradável, motivadora e responsável, num espaço de bem-estar composto por três áreas a funcionar em cooperação e consonância para que atinja o seu potencial e, acima de tudo, seja feliz e se sinta realizado. ShapeStudio®️ é Shape Fitness, Shape Spa e Shape Therapy, é um ginásio inovador e original para todas as mulheres que querem e gostam que o seu corpo seja tratado de acordo com as suas características e necessidades, é um SPA distinto e glamouroso só para um ou para partilhar a dois e é um centro de terapias não invasivas para a saúde geral e global de toda a família e amigos. Shape Studio é Felicidade!"
Club de Padel Paiã,['Padel'],False,"['M', 'L', 'XL']",M,Amadora,Rua Major João Luís de Moura Complexo Desportivo CER Tenente Valdez,https://urbansportsclub.com//de/venues/club-de-padel-pai,"{'@context': 'http://schema.org', '@type': 'LocalBusiness', 'name': 'Club de Padel Paiã', 'description': 'Clube de Padel com 6 campos (5 cobertos + 1 descoberto) de última geração (relva WPT mondo e projectores LED), estacionamento privado gratuito, balneários, loja de material de padel e bar cafeteria com vasta esplanada.', 'address': {'@type': 'PostalAddress', 'addressLocality': 'Lisbon, Portugal', 'addressCountry': 'Portugal', 'postalCode': '', 'streetAddress': 'Rua Major João Luís de Moura Complexo Desportivo CER Tenente Valdez'}, 'telephone': '', 'geo': {'@type': 'GeoCoordinates', 'latitude': '38.7782963', 'longitude': '-9.2050189'}, 'priceRange': '-', 'image': 'https://storage.googleapis.com/download/storage/v1/b/usc-pro-uscweb-live-media/o/de-live%2Foriginal_1280x720_PHOTO-2023-10-30-20-51-29_1699451263342713_admin.jpeg?generation=1699451263411617&amp;alt=media'}",38.7782963,-9.2050189,"Clube de Padel com 6 campos (5 cobertos + 1 descoberto) de última geração (relva WPT mondo e projectores LED), estacionamento privado gratuito, balneários, loja de material de padel e bar cafeteria com vasta esplanada."
