name,disciplines,plus_options,plans,min_plan,district,street,link,metadata,latitude,longitude,description
Krav Maga Self Defence,"['Fitness', 'Modern Self Defense']",False,"['M', 'L', 'XL']",M,Sudenburg,Halberstädter Str. 189,https://urbansportsclub.com//en/venues/krav-maga-street-defence,"{'@context': 'http://schema.org', '@type': 'LocalBusiness', 'name': 'Krav Maga Self Defence', 'description': 'Herzlich Willkommen bei Krav Maga Street Defence. Krav Maga Street Defence ist eine Weiterentwicklung des offiziellen Selbstverteidigungssystems. Es wurde 1999 von Michael Rüppel gegründet. Heute ist das System „Krav Maga Street Defence“ und speziell Michael Rüppel weltweit ein Begriff für Qualität im Krav Maga. Die Effizienz dieser Selbstverteidigungsform ermöglicht es, schnell Fortschritte zu erzielen und dabei wichtige Technikserien (gegen einzelne Gefahrenarten) zu lernen. Krav Maga Street Defence ist die ideale Selbstverteidigungsform, da sie sich nicht als Kampfkunst begreift, sondern als effizientes System zur Gefahrenabwehr. Krav Maga Street Defence bedeutet: – an deine eigene Leistungsgrenze gehen – Training voller Herausforderungen – kontinuierliches Erlernen eines Selbstverteidigungssystems – Erfahrungen sammeln mit Gefahrenprävention und Gefahrenabwehr – trainieren von psychologischen Verhaltensweisen – effektiven Verteidigungsmöglichkeiten gegen Gewaltverbrechen – Sensibilisierung für den richtigen Umgang mit Gewalteinflüssen Krav Maga Magdeburg ist in jedem Alter erlernbar. Unterschiedliche körperliche Verfassungen sind kein Problem, jeder beginnt das Training auf seinem Niveau. Damit werden fortgeschrittene Techniken für viele zugänglich gemacht. Als schnell und einfach zu erlernendes Selbstverteidigungssystem ist Krav Maga ideal geeignet für vielbeschäftigte, sicherheitsbewusste Menschen, die ein großartiges Training suchen, das Spaß macht.', 'address': {'@type': 'PostalAddress', 'addressLocality': 'Magdeburg, Germany', 'addressCountry': 'Germany', 'postalCode': '39112', 'streetAddress': 'Halberstädter Str. 189'}, 'telephone': '', 'geo': {'@type': 'GeoCoordinates', 'latitude': '52.105884', 'longitude': '11.5919006'}, 'priceRange': '-', 'image': 'https://storage.googleapis.com/download/storage/v1/b/usc-pro-uscweb-live-media/o/de-live%2Foriginal_1024x576_Foto_Urban_Sports_Club_1_1552571168414826_admin.jpg?alt=media'}",52.105884,11.5919006,"Herzlich Willkommen bei Krav Maga Street Defence. Krav Maga Street Defence ist eine Weiterentwicklung des offiziellen Selbstverteidigungssystems. Es wurde 1999 von Michael Rüppel gegründet. Heute ist das System „Krav Maga Street Defence“ und speziell Michael Rüppel weltweit ein Begriff für Qualität im Krav Maga. Die Effizienz dieser Selbstverteidigungsform ermöglicht es, schnell Fortschritte zu erzielen und dabei wichtige Technikserien (gegen einzelne Gefahrenarten) zu lernen. Krav Maga Street Defence ist die ideale Selbstverteidigungsform, da sie sich nicht als Kampfkunst begreift, sondern als effizientes System zur Gefahrenabwehr. Krav Maga Street Defence bedeutet: – an deine eigene Leistungsgrenze gehen – Training voller Herausforderungen – kontinuierliches Erlernen eines Selbstverteidigungssystems – Erfahrungen sammeln mit Gefahrenprävention und Gefahrenabwehr – trainieren von psychologischen Verhaltensweisen – effektiven Verteidigungsmöglichkeiten gegen Gewaltverbrechen – Sensibilisierung für den richtigen Umgang mit Gewalteinflüssen Krav Maga Magdeburg ist in jedem Alter erlernbar. Unterschiedliche körperliche Verfassungen sind kein Problem, jeder beginnt das Training auf seinem Niveau. Damit werden fortgeschrittene Techniken für viele zugänglich gemacht. Als schnell und einfach zu erlernendes Selbstverteidigungssystem ist Krav Maga ideal geeignet für vielbeschäftigte, sicherheitsbewusste Menschen, die ein großartiges Training suchen, das Spaß macht."
LuckyFitness.de Haldensleben,"['Boxing Sports', 'Fitness', 'Qi Gong and Tai Chi', 'Yoga']",False,"['M', 'L', 'XL']",M,Haldensleben,Gerikestraße 97A,https://urbansportsclub.com//en/venues/luckyfitnessde-haldensleben,"{'@context': 'http://schema.org', '@type': 'LocalBusiness', 'name': 'LuckyFitness.de Haldensleben', 'description': 'Willkommen bei LuckyFitness.de! Wir sind ein Anbieter von besonderen Premium Fitnessstudios, die sich ganz individuell nach deinen persönlichen Bedürfnissen richten. Neben unseren Filialen in Dessau und Magdeburg kannst du unsere Studios auch in Haldensleben, Roßlau und Schönebeck finden. Unsere freundlichen, kompetenten Trainer geben ihr Bestes, um dich mit viel Spaß im Training deinen persönlichen Zielen näher zu bringen. Sie schaffen so eine professionelle Atmosphäre, in der du dich wohl fühlst und gerne regelmäßig zum Training kommst, schließlich ist regelmäßiges Training der Schlüssel zum Erfolg! Ein Premium Fitnessstudio, ganz nach deinem Geschmack', 'address': {'@type': 'PostalAddress', 'addressLocality': 'Magdeburg, Germany', 'addressCountry': 'Germany', 'postalCode': '39340', 'streetAddress': 'Gerikestraße 97A'}, 'telephone': '', 'geo': {'@type': 'GeoCoordinates', 'latitude': '52.280863', 'longitude': '11.4305473'}, 'priceRange': '-', 'image': 'https://storage.googleapis.com/download/storage/v1/b/usc-pro-uscweb-live-media/o/de-live%2Foriginal_1419x798_7800acddeec9-L14A0130_1553778418242924_admin.jpg?alt=media'}",52.280863,11.4305473,"Willkommen bei LuckyFitness.de! Wir sind ein Anbieter von besonderen Premium Fitnessstudios, die sich ganz individuell nach deinen persönlichen Bedürfnissen richten. Neben unseren Filialen in Dessau und Magdeburg kannst du unsere Studios auch in Haldensleben, Roßlau und Schönebeck finden. Unsere freundlichen, kompetenten Trainer geben ihr Bestes, um dich mit viel Spaß im Training deinen persönlichen Zielen näher zu bringen. Sie schaffen so eine professionelle Atmosphäre, in der du dich wohl fühlst und gerne regelmäßig zum Training kommst, schließlich ist regelmäßiges Training der Schlüssel zum Erfolg! Ein Premium Fitnessstudio, ganz nach deinem Geschmack"
LuckyFitness.de Roßlau,['Fitness'],False,"['M', 'L', 'XL']",M,Roßlau,Hauptstrasse 128/129,https://urbansportsclub.com//en/venues/luckyfitnessde-rosslau,"{'@context': 'http://schema.org', '@type': 'LocalBusiness', 'name': 'LuckyFitness.de Roßlau', 'description': 'Willkommen bei LuckyFitness.de! Wir sind ein Anbieter von besonderen Premium Fitnessstudios, die sich ganz individuell nach deinen persönlichen Bedürfnissen richten. Neben unseren Filialen in Dessau und Magdeburg kannst du unsere Studios auch in Haldensleben, Roßlau und Schönebeck finden. Unsere freundlichen, kompetenten Trainer geben ihr Bestes, um dich mit viel Spaß im Training deinen persönlichen Zielen näher zu bringen. Sie schaffen so eine professionelle Atmosphäre, in der du dich wohl fühlst und gerne regelmäßig zum Training kommst, schließlich ist regelmäßiges Training der Schlüssel zum Erfolg! Ein Premium Fitnessstudio, ganz nach deinem Geschmack', 'address': {'@type': 'PostalAddress', 'addressLocality': 'Magdeburg, Germany', 'addressCountry': 'Germany', 'postalCode': '06862', 'streetAddress': 'Hauptstrasse 128/129'}, 'telephone': '', 'geo': {'@type': 'GeoCoordinates', 'latitude': '51.88945', 'longitude': '12.24645'}, 'priceRange': '-', 'image': 'https://storage.googleapis.com/download/storage/v1/b/usc-pro-uscweb-live-media/o/de-live%2Foriginal_1280x720_nnnkp7eq3uqbvr0qheyq_168051257015898.png?generation=1680512570186591&amp;alt=media'}",51.88945,12.24645,"Willkommen bei LuckyFitness.de! Wir sind ein Anbieter von besonderen Premium Fitnessstudios, die sich ganz individuell nach deinen persönlichen Bedürfnissen richten. Neben unseren Filialen in Dessau und Magdeburg kannst du unsere Studios auch in Haldensleben, Roßlau und Schönebeck finden. Unsere freundlichen, kompetenten Trainer geben ihr Bestes, um dich mit viel Spaß im Training deinen persönlichen Zielen näher zu bringen. Sie schaffen so eine professionelle Atmosphäre, in der du dich wohl fühlst und gerne regelmäßig zum Training kommst, schließlich ist regelmäßiges Training der Schlüssel zum Erfolg! Ein Premium Fitnessstudio, ganz nach deinem Geschmack"
LuckyFitness.de Schönebeck,['Fitness'],False,"['M', 'L', 'XL']",M,Schönebeck,Stadionstr. 19,https://urbansportsclub.com//en/venues/luckyfitnessde-schonebeck,"{'@context': 'http://schema.org', '@type': 'LocalBusiness', 'name': 'LuckyFitness.de Schönebeck', 'description': 'Willkommen bei LuckyFitness.de! Wir sind ein Anbieter von besonderen Premium Fitnessstudios, die sich ganz individuell nach deinen persönlichen Bedürfnissen richten. Neben unseren Filialen in Dessau und Magdeburg kannst du unsere Studios auch in Haldensleben, Roßlau und Schönebeck finden. Unsere freundlichen, kompetenten Trainer geben ihr Bestes, um dich mit viel Spaß im Training deinen persönlichen Zielen näher zu bringen. Sie schaffen so eine professionelle Atmosphäre, in der du dich wohl fühlst und gerne regelmäßig zum Training kommst, schließlich ist regelmäßiges Training der Schlüssel zum Erfolg! Ein Premium Fitnessstudio, ganz nach deinem Geschmack', 'address': {'@type': 'PostalAddress', 'addressLocality': 'Magdeburg, Germany', 'addressCountry': 'Germany', 'postalCode': '39218', 'streetAddress': 'Stadionstr. 19'}, 'telephone': '', 'geo': {'@type': 'GeoCoordinates', 'latitude': '52.0136345', 'longitude': '11.7182912'}, 'priceRange': '-', 'image': 'https://storage.googleapis.com/download/storage/v1/b/usc-pro-uscweb-live-media/o/de-live%2Foriginal_1024x576_4ed0af9fac31-IMG_6129_1553778780118132_admin.jpg?alt=media'}",52.0136345,11.7182912,"Willkommen bei LuckyFitness.de! Wir sind ein Anbieter von besonderen Premium Fitnessstudios, die sich ganz individuell nach deinen persönlichen Bedürfnissen richten. Neben unseren Filialen in Dessau und Magdeburg kannst du unsere Studios auch in Haldensleben, Roßlau und Schönebeck finden. Unsere freundlichen, kompetenten Trainer geben ihr Bestes, um dich mit viel Spaß im Training deinen persönlichen Zielen näher zu bringen. Sie schaffen so eine professionelle Atmosphäre, in der du dich wohl fühlst und gerne regelmäßig zum Training kommst, schließlich ist regelmäßiges Training der Schlüssel zum Erfolg! Ein Premium Fitnessstudio, ganz nach deinem Geschmack"
Naherholungszentrum Neustädter See,['Swimming'],False,"['S', 'M', 'L', 'XL']",S,Neustädter See,Bei Hohmann,https://urbansportsclub.com//en/venues/naherholungszentrum-neustadter-see,"{'@context': 'http://schema.org', '@type': 'LocalBusiness', 'name': 'Naherholungszentrum Neustädter See', 'description': 'Über den Urban Sports Club kannst du in Magdeburg in den Bädern schwimmen gehen. In der Sommersaison können zudem auch die Freibäder besucht werden. Bitte achte auf die jeweiligen Besonderheiten rechts beim Besuch des jeweiligen Bades. Viel sonniges und nasses Vergnügen in den Bädern von Magdeburg!', 'address': {'@type': 'PostalAddress', 'addressLocality': 'Magdeburg, Germany', 'addressCountry': 'Germany', 'postalCode': '39126', 'streetAddress': 'Bei Hohmann'}, 'telephone': '', 'geo': {'@type': 'GeoCoordinates', 'latitude': '52.175441', 'longitude': '11.649536'}, 'priceRange': '-', 'image': 'https://storage.googleapis.com/download/storage/v1/b/usc-pro-uscweb-live-media/o/de-live%2Foriginal_1024x576_Neust%C3%A4dter%20See%20Kinderstrand1.jpg?alt=media'}",52.175441,11.649536,Über den Urban Sports Club kannst du in Magdeburg in den Bädern schwimmen gehen. In der Sommersaison können zudem auch die Freibäder besucht werden. Bitte achte auf die jeweiligen Besonderheiten rechts beim Besuch des jeweiligen Bades. Viel sonniges und nasses Vergnügen in den Bädern von Magdeburg!
PILATES HAUS Magdeburg,"['Fitness', 'Pilates', 'Yoga']",False,"['M', 'L', 'XL']",M,Cracau,Pechauer Platz 12,https://urbansportsclub.com//en/venues/pilates-haus-magdeburg,"{'@context': 'http://schema.org', '@type': 'LocalBusiness', 'name': 'PILATES HAUS Magdeburg', 'description': 'Das PILATES HAUS Magdeburg ist ein voll ausgestattetes Pilatesstudio. Die Urform des Pilatestrainings ist hier erstmalig in Magdeburg möglich. Das PILATES Haus und Rehabilitationszentrum Magdeburg bietet Ihnen unterschiedliche Trainingsmöglichkeiten, die individuell auf Ihre Bedürfnisse zugeschnitten sind. Zentrale Leitfrage Ihrer Arbeit ist die Förderung der Gesundheitspotentiale des Einzelnen zur Prävention und Krankheitsbewältigung. Was erhält den Menschen gesund, macht ihn wieder gesund oder lässt ihn mit einer chronischen Erkrankung im gewohnten Lebensumfeld erfüllt leben? Sie arbeiten präventiv, unsere Leistungen können jedoch auch rehabilitativ und kurativ eingesetzt werden. Angeboten werden Yoga-, Pilates- und Rückenschulkurse.', 'address': {'@type': 'PostalAddress', 'addressLocality': 'Magdeburg, Germany', 'addressCountry': 'Germany', 'postalCode': '39114', 'streetAddress': 'Pechauer Platz 12'}, 'telephone': '', 'geo': {'@type': 'GeoCoordinates', 'latitude': '52.11287', 'longitude': '11.6717299'}, 'priceRange': '-', 'image': 'https://storage.googleapis.com/download/storage/v1/b/usc-pro-uscweb-live-media/o/de-live%2Foriginal_1161x653_2016-08-17-um-18-33-51.jpg?alt=media'}",52.11287,11.6717299,"Das PILATES HAUS Magdeburg ist ein voll ausgestattetes Pilatesstudio. Die Urform des Pilatestrainings ist hier erstmalig in Magdeburg möglich. Das PILATES Haus und Rehabilitationszentrum Magdeburg bietet Ihnen unterschiedliche Trainingsmöglichkeiten, die individuell auf Ihre Bedürfnisse zugeschnitten sind. Zentrale Leitfrage Ihrer Arbeit ist die Förderung der Gesundheitspotentiale des Einzelnen zur Prävention und Krankheitsbewältigung. Was erhält den Menschen gesund, macht ihn wieder gesund oder lässt ihn mit einer chronischen Erkrankung im gewohnten Lebensumfeld erfüllt leben? Sie arbeiten präventiv, unsere Leistungen können jedoch auch rehabilitativ und kurativ eingesetzt werden. Angeboten werden Yoga-, Pilates- und Rückenschulkurse."
PILATES HAUS Magdeburg - Massage,['Massage'],True,"['L', 'XL']",L,Cracau,Pechauer Straße 12,https://urbansportsclub.com//en/venues/pilates-haus-magdeburg-massage-1,"{'@context': 'http://schema.org', '@type': 'LocalBusiness', 'name': 'PILATES HAUS Magdeburg - Massage', 'description': 'Das PILATES HAUS Magdeburg ist ein voll ausgestattetes Pilatesstudio. Die Urform des Pilatestrainings ist hier erstmalig in Magdeburg möglich. Das PILATES Haus und Rehabilitationszentrum Magdeburg bietet Ihnen unterschiedliche Trainingsmöglichkeiten, die individuell auf Ihre Bedürfnisse zugeschnitten sind. Zentrale Leitfrage Ihrer Arbeit ist die Förderung der Gesundheitspotentiale des Einzelnen zur Prävention und Krankheitsbewältigung. Was erhält den Menschen gesund, macht ihn wieder gesund oder lässt ihn mit einer chronischen Erkrankung im gewohnten Lebensumfeld erfüllt leben? Sie arbeiten präventiv, unsere Leistungen können jedoch auch rehabilitativ und kurativ eingesetzt werden. Angeboten werden Yoga-, Pilates- und Rückenschulkurse.', 'address': {'@type': 'PostalAddress', 'addressLocality': 'Magdeburg, Germany', 'addressCountry': 'Germany', 'postalCode': '39114', 'streetAddress': 'Pechauer Straße 12'}, 'telephone': '', 'geo': {'@type': 'GeoCoordinates', 'latitude': '52.114115', 'longitude': '11.667163'}, 'priceRange': '-', 'image': 'https://storage.googleapis.com/download/storage/v1/b/usc-pro-uscweb-live-media/o/de-live%2Foriginal_1160x653_mxxhwpoqzxriykmpg7yj_1686670355239521.png?generation=1686670355299927&amp;alt=media'}",52.114115,11.667163,"Das PILATES HAUS Magdeburg ist ein voll ausgestattetes Pilatesstudio. Die Urform des Pilatestrainings ist hier erstmalig in Magdeburg möglich. Das PILATES Haus und Rehabilitationszentrum Magdeburg bietet Ihnen unterschiedliche Trainingsmöglichkeiten, die individuell auf Ihre Bedürfnisse zugeschnitten sind. Zentrale Leitfrage Ihrer Arbeit ist die Förderung der Gesundheitspotentiale des Einzelnen zur Prävention und Krankheitsbewältigung. Was erhält den Menschen gesund, macht ihn wieder gesund oder lässt ihn mit einer chronischen Erkrankung im gewohnten Lebensumfeld erfüllt leben? Sie arbeiten präventiv, unsere Leistungen können jedoch auch rehabilitativ und kurativ eingesetzt werden. Angeboten werden Yoga-, Pilates- und Rückenschulkurse."
Physiotherapie Swaton - Haldensleben,['Massage'],True,"['L', 'XL']",L,Haldensleben,Gerikestraße 4,https://urbansportsclub.com//en/venues/physiotherapie-swaton-haldensleben,"{'@context': 'http://schema.org', '@type': 'LocalBusiness', 'name': 'Physiotherapie Swaton - Haldensleben', 'description': 'Physiotherapie Swaton - mehr als Physiotherapie: Dank hochklassiger Ausbildung und regelmäßiger Fortbildungen sind sie im Bereich Physiotherapie und Osteopathie immer auf dem neuesten Stand. Darauf aufbauend bieten die Praxen ein umfangreiches Angebot verschiedener Techniken und Therapien an, um euch die bestmögliche Betreuung zu bieten. Ob Sportverletzung, Hexenschuss oder Migräne: Die Physiotherapie Swaton hilft euch mit der richtigen Therapie, verlorene Lebensqualität wiederzubekommen. Erreichbarkeit: Die Praxen sind verkehrsgünstig gelegen. In Magdeburg finden ihr sie im Süden, Osten und in der Stadtmitte. In Haldensleben ganz zentral in der Nähe des Bahnhofs. Die Räumlichkeiten bieten euch durch die helle und offene Gestaltung einen Platz zum Wohlfühlen und Entspannen. Egal welches Swaton Therapiezentrum ihr besucht, dasTeam besteht ausschließlich aus Physiotherapeuten, Osteopathen und Heilpraktikern. Euer Wohlbefinden: Mit vereinten Kräften möchten wir die notwendigen Impulse für eure zeitnahe Genesung und euer Wohlbefinden geben. Überzeugt Euch selbst – wir freuen uns auf Euch! Ihre Familie Swaton &amp; die Teams aus Magdeburg sowie Haldensleben', 'address': {'@type': 'PostalAddress', 'addressLocality': 'Magdeburg, Germany', 'addressCountry': 'Germany', 'postalCode': '39340', 'streetAddress': 'Gerikestraße 4'}, 'telephone': '', 'geo': {'@type': 'GeoCoordinates', 'latitude': '52.2875935', 'longitude': '11.4072101'}, 'priceRange': '-', 'image': 'https://storage.googleapis.com/download/storage/v1/b/usc-pro-uscweb-live-media/o/de-live%2Foriginal_1024x576_sw2.png?alt=media'}",52.2875935,11.4072101,"Physiotherapie Swaton - mehr als Physiotherapie: Dank hochklassiger Ausbildung und regelmäßiger Fortbildungen sind sie im Bereich Physiotherapie und Osteopathie immer auf dem neuesten Stand. Darauf aufbauend bieten die Praxen ein umfangreiches Angebot verschiedener Techniken und Therapien an, um euch die bestmögliche Betreuung zu bieten. Ob Sportverletzung, Hexenschuss oder Migräne: Die Physiotherapie Swaton hilft euch mit der richtigen Therapie, verlorene Lebensqualität wiederzubekommen. Erreichbarkeit: Die Praxen sind verkehrsgünstig gelegen. In Magdeburg finden ihr sie im Süden, Osten und in der Stadtmitte. In Haldensleben ganz zentral in der Nähe des Bahnhofs. Die Räumlichkeiten bieten euch durch die helle und offene Gestaltung einen Platz zum Wohlfühlen und Entspannen. Egal welches Swaton Therapiezentrum ihr besucht, dasTeam besteht ausschließlich aus Physiotherapeuten, Osteopathen und Heilpraktikern. Euer Wohlbefinden: Mit vereinten Kräften möchten wir die notwendigen Impulse für eure zeitnahe Genesung und euer Wohlbefinden geben. Überzeugt Euch selbst – wir freuen uns auf Euch! Ihre Familie Swaton &amp; die Teams aus Magdeburg sowie Haldensleben"
Physiotherapie Swaton - Magdeburg Mitte,['Massage'],True,"['L', 'XL']",L,Altstadt,Regierungsstraße 24,https://urbansportsclub.com//en/venues/physiotherapie-swaton-magdeburg-mitte,"{'@context': 'http://schema.org', '@type': 'LocalBusiness', 'name': 'Physiotherapie Swaton - Magdeburg Mitte', 'description': 'Physiotherapie Swaton - mehr als Physiotherapie: Dank hochklassiger Ausbildung und regelmäßiger Fortbildungen sind sie im Bereich Physiotherapie und Osteopathie immer auf dem neuesten Stand. Darauf aufbauend bieten die Praxen ein umfangreiches Angebot verschiedener Techniken und Therapien an, um euch die bestmögliche Betreuung zu bieten. Ob Sportverletzung, Hexenschuss oder Migräne: Die Physiotherapie Swaton hilft euch mit der richtigen Therapie, verlorene Lebensqualität wiederzubekommen. Erreichbarkeit: Die Praxen sind verkehrsgünstig gelegen. In Magdeburg finden ihr sie im Süden, Osten und in der Stadtmitte. In Haldensleben ganz zentral in der Nähe des Bahnhofs. Die Räumlichkeiten bieten euch durch die helle und offene Gestaltung einen Platz zum Wohlfühlen und Entspannen. Egal welches Swaton Therapiezentrum ihr besucht, dasTeam besteht ausschließlich aus Physiotherapeuten, Osteopathen und Heilpraktikern. Euer Wohlbefinden: Mit vereinten Kräften möchten wir die notwendigen Impulse für eure zeitnahe Genesung und euer Wohlbefinden geben. Überzeugt Euch selbst – wir freuen uns auf Euch! Ihre Familie Swaton &amp; die Teams aus Magdeburg sowie Haldensleben', 'address': {'@type': 'PostalAddress', 'addressLocality': 'Magdeburg, Germany', 'addressCountry': 'Germany', 'postalCode': '39104', 'streetAddress': 'Regierungsstraße 24'}, 'telephone': '', 'geo': {'@type': 'GeoCoordinates', 'latitude': '52.129028', 'longitude': '11.6363428'}, 'priceRange': '-', 'image': 'https://urbansportsclub.com/images/merchant/venueHome.jpg'}",52.129028,11.6363428,"Physiotherapie Swaton - mehr als Physiotherapie: Dank hochklassiger Ausbildung und regelmäßiger Fortbildungen sind sie im Bereich Physiotherapie und Osteopathie immer auf dem neuesten Stand. Darauf aufbauend bieten die Praxen ein umfangreiches Angebot verschiedener Techniken und Therapien an, um euch die bestmögliche Betreuung zu bieten. Ob Sportverletzung, Hexenschuss oder Migräne: Die Physiotherapie Swaton hilft euch mit der richtigen Therapie, verlorene Lebensqualität wiederzubekommen. Erreichbarkeit: Die Praxen sind verkehrsgünstig gelegen. In Magdeburg finden ihr sie im Süden, Osten und in der Stadtmitte. In Haldensleben ganz zentral in der Nähe des Bahnhofs. Die Räumlichkeiten bieten euch durch die helle und offene Gestaltung einen Platz zum Wohlfühlen und Entspannen. Egal welches Swaton Therapiezentrum ihr besucht, dasTeam besteht ausschließlich aus Physiotherapeuten, Osteopathen und Heilpraktikern. Euer Wohlbefinden: Mit vereinten Kräften möchten wir die notwendigen Impulse für eure zeitnahe Genesung und euer Wohlbefinden geben. Überzeugt Euch selbst – wir freuen uns auf Euch! Ihre Familie Swaton &amp; die Teams aus Magdeburg sowie Haldensleben"
Physiotherapie Swaton - Magdeburg Süd,['Massage'],True,"['L', 'XL']",L,Leipziger Straße,Förderstedter Straße 30,https://urbansportsclub.com//en/venues/physiotherapie-swaton-magdeburg-sud,"{'@context': 'http://schema.org', '@type': 'LocalBusiness', 'name': 'Physiotherapie Swaton - Magdeburg Süd', 'description': 'Physiotherapie Swaton - mehr als Physiotherapie: Dank hochklassiger Ausbildung und regelmäßiger Fortbildungen sind sie im Bereich Physiotherapie und Osteopathie immer auf dem neuesten Stand. Darauf aufbauend bieten die Praxen ein umfangreiches Angebot verschiedener Techniken und Therapien an, um euch die bestmögliche Betreuung zu bieten. Ob Sportverletzung, Hexenschuss oder Migräne: Die Physiotherapie Swaton hilft euch mit der richtigen Therapie, verlorene Lebensqualität wiederzubekommen. Erreichbarkeit: Die Praxen sind verkehrsgünstig gelegen. In Magdeburg finden ihr sie im Süden, Osten und in der Stadtmitte. In Haldensleben ganz zentral in der Nähe des Bahnhofs. Die Räumlichkeiten bieten euch durch die helle und offene Gestaltung einen Platz zum Wohlfühlen und Entspannen. Egal welches Swaton Therapiezentrum ihr besucht, dasTeam besteht ausschließlich aus Physiotherapeuten, Osteopathen und Heilpraktikern. Euer Wohlbefinden: Mit vereinten Kräften möchten wir die notwendigen Impulse für eure zeitnahe Genesung und euer Wohlbefinden geben. Überzeugt Euch selbst – wir freuen uns auf Euch! Ihre Familie Swaton &amp; die Teams aus Magdeburg sowie Haldensleben', 'address': {'@type': 'PostalAddress', 'addressLocality': 'Magdeburg, Germany', 'addressCountry': 'Germany', 'postalCode': '39112', 'streetAddress': 'Förderstedter Straße 30'}, 'telephone': '', 'geo': {'@type': 'GeoCoordinates', 'latitude': '52.1076602', 'longitude': '11.6176427'}, 'priceRange': '-', 'image': 'https://urbansportsclub.com/images/merchant/venueHome.jpg'}",52.1076602,11.6176427,"Physiotherapie Swaton - mehr als Physiotherapie: Dank hochklassiger Ausbildung und regelmäßiger Fortbildungen sind sie im Bereich Physiotherapie und Osteopathie immer auf dem neuesten Stand. Darauf aufbauend bieten die Praxen ein umfangreiches Angebot verschiedener Techniken und Therapien an, um euch die bestmögliche Betreuung zu bieten. Ob Sportverletzung, Hexenschuss oder Migräne: Die Physiotherapie Swaton hilft euch mit der richtigen Therapie, verlorene Lebensqualität wiederzubekommen. Erreichbarkeit: Die Praxen sind verkehrsgünstig gelegen. In Magdeburg finden ihr sie im Süden, Osten und in der Stadtmitte. In Haldensleben ganz zentral in der Nähe des Bahnhofs. Die Räumlichkeiten bieten euch durch die helle und offene Gestaltung einen Platz zum Wohlfühlen und Entspannen. Egal welches Swaton Therapiezentrum ihr besucht, dasTeam besteht ausschließlich aus Physiotherapeuten, Osteopathen und Heilpraktikern. Euer Wohlbefinden: Mit vereinten Kräften möchten wir die notwendigen Impulse für eure zeitnahe Genesung und euer Wohlbefinden geben. Überzeugt Euch selbst – wir freuen uns auf Euch! Ihre Familie Swaton &amp; die Teams aus Magdeburg sowie Haldensleben"
