name,disciplines,plus_options,plans,min_plan,district,street,link,metadata,latitude,longitude,description
Sea You BCN,"['Skating', 'Stand Up Paddling', 'Surfing', 'Yoga']",False,"['M', 'L', 'XL']",M,La Barceloneta,"Passeig del Mare Nostrum, 14",https://urbansportsclub.com//en/venues/sea-you,"{'@context': 'http://schema.org', '@type': 'LocalBusiness', 'name': 'Sea You BCN', 'description': 'SEA YOU es el punto de encuentro para los amantes del mar y el deporte. El centro esta situado en primera linea de mar y esta totalmente equipado. Las instalaciones cuentan con duchas, vestuarios y taquillas. Nuestros profesores tienen titulación y todos nuestros alumnos disponen de un seguro de RC y accidentes. La única escuela situada en la playa de la Barceloneta.', 'address': {'@type': 'PostalAddress', 'addressLocality': 'Barcelona, Spain', 'addressCountry': 'Spain', 'postalCode': '08039', 'streetAddress': 'Passeig del Mare Nostrum, 14'}, 'telephone': '+34 661 67 37 02', 'geo': {'@type': 'GeoCoordinates', 'latitude': '41.3703914', 'longitude': '2.1886755'}, 'priceRange': '-', 'image': 'https://storage.googleapis.com/download/storage/v1/b/usc-pro-uscweb-live-media/o/de-live%2Foriginal_3024x1701_IMG_0137%202_158203603158147_admin.jpg?alt=media'}",41.3703914,2.1886755,"SEA YOU es el punto de encuentro para los amantes del mar y el deporte. El centro esta situado en primera linea de mar y esta totalmente equipado. Las instalaciones cuentan con duchas, vestuarios y taquillas. Nuestros profesores tienen titulación y todos nuestros alumnos disponen de un seguro de RC y accidentes. La única escuela situada en la playa de la Barceloneta."
BDIRPutxet,"['Aqua', 'Boxing Sports', 'Crosstraining', 'Fitness', 'Indoor Cycling', 'Pilates', 'Yoga']",False,"['S', 'M', 'L', 'XL']",S,El Putget i Farrò,Carrer d'Hurtado 5,https://urbansportsclub.com//en/venues/bdir-putxet-1,"{'@context': 'http://schema.org', '@type': 'LocalBusiness', 'name': 'BDIRPutxet', 'description': '💣FOMENTAR LA ACTIVIDAD FÍSICA Y EL ESTILO DE VIDA SALUDABLE💣 Nuestra misión es la de transmitir los valores del deporte como generadores de salud y cohesión social y orientar a la sociedad hacia unos hábitos de vida saludables.', 'address': {'@type': 'PostalAddress', 'addressLocality': 'Barcelona, Spain', 'addressCountry': 'Spain', 'postalCode': '08023', 'streetAddress': 'Carrer d&#039;Hurtado 5'}, 'telephone': '', 'geo': {'@type': 'GeoCoordinates', 'latitude': '41.4101399', 'longitude': '2.1411897'}, 'priceRange': '-', 'image': 'https://urbansportsclub.com/images/merchant/venueHome.jpg'}",41.4101399,2.1411897,💣FOMENTAR LA ACTIVIDAD FÍSICA Y EL ESTILO DE VIDA SALUDABLE💣 Nuestra misión es la de transmitir los valores del deporte como generadores de salud y cohesión social y orientar a la sociedad hacia unos hábitos de vida saludables.
Soma Yoga BCN - Teatro Griego Outdoor,['Yoga'],False,"['M', 'L', 'XL']",M,Poble-Sec,"Teatro Griego, Montjuíc",https://urbansportsclub.com//en/venues/soma-yoga-bcn-teatro-griego-outdoor,"{'@context': 'http://schema.org', '@type': 'LocalBusiness', 'name': 'Soma Yoga BCN - Teatro Griego Outdoor', 'description': 'En Soma Yoga Barcelona somos un grupo de profesores con amplia experiencia y amor por lo que hacemos. Nos une la intención de hacer de este espacio un lugar para el cultivo del yoga, donde nuestros alumnos puedan venir a nutrirse de esta ciencia milenaria que conduce al encuentro con lo esencial en nosotros.', 'address': {'@type': 'PostalAddress', 'addressLocality': 'Barcelona, Spain', 'addressCountry': 'Spain', 'postalCode': '08029', 'streetAddress': 'Teatro Griego, Montjuíc'}, 'telephone': '', 'geo': {'@type': 'GeoCoordinates', 'latitude': '41.3695356', 'longitude': '2.1598196'}, 'priceRange': '-', 'image': 'https://storage.googleapis.com/download/storage/v1/b/usc-pro-uscweb-live-media/o/de-live%2Foriginal_1024x576_yogaenelgrec-02_1598343053505571_admin.jpg?alt=media'}",41.3695356,2.1598196,"En Soma Yoga Barcelona somos un grupo de profesores con amplia experiencia y amor por lo que hacemos. Nos une la intención de hacer de este espacio un lugar para el cultivo del yoga, donde nuestros alumnos puedan venir a nutrirse de esta ciencia milenaria que conduce al encuentro con lo esencial en nosotros."
Mandiram Gracia,['Yoga'],False,"['S', 'M', 'L', 'XL']",S,Vila de Gràcia,"Torrent d'en Vidalet 43,",https://urbansportsclub.com//en/venues/mandiram-gracia,"{'@context': 'http://schema.org', '@type': 'LocalBusiness', 'name': 'Mandiram Gracia', 'description': 'We are a neighborhood school born in NYC and raised ib Barcelona (2002). Our students are mainly cosmopolitan locals who aim for a fit and toned body and focused mind. We use yogic tools to help you become the best version of yourself. At Mandiram Yoga we teach in Spanish (thank us later;) All our teachers are bilingual.', 'address': {'@type': 'PostalAddress', 'addressLocality': 'Barcelona, Spain', 'addressCountry': 'Spain', 'postalCode': '08012', 'streetAddress': 'Torrent d&#039;en Vidalet 43,'}, 'telephone': '', 'geo': {'@type': 'GeoCoordinates', 'latitude': '41.4047924', 'longitude': '2.1582435'}, 'priceRange': '-', 'image': 'https://storage.googleapis.com/download/storage/v1/b/usc-pro-uscweb-live-media/o/de-live%2Foriginal_1800x1012_sqqrkliuxpvkrnp5fhon_1690477245464776.png?generation=1690477245572357&amp;alt=media'}",41.4047924,2.1582435,We are a neighborhood school born in NYC and raised ib Barcelona (2002). Our students are mainly cosmopolitan locals who aim for a fit and toned body and focused mind. We use yogic tools to help you become the best version of yourself. At Mandiram Yoga we teach in Spanish (thank us later;) All our teachers are bilingual.
Green Fit Lepanto,['Fitness'],False,"['M', 'L', 'XL']",M,Baix Guinardó,"Carrer de Lepant, 374, 378",https://urbansportsclub.com//en/venues/green-fit-lepanto,"{'@context': 'http://schema.org', '@type': 'LocalBusiness', 'name': 'Green Fit Lepanto', 'description': '¡Bienvenido a Green Fit Lepanto! Todo nuestro equipo, formado por grandes profesionales, te ayudará en el día a día con todo lo que necesites. Todo en un ambiente cercano, amable y divertido. Además de tu sala de fitness también te ofrecemos una gran variedad de clases de spinning, zumba, cardiovasculares, acondicionamiento físico y pilates. ¡No esperes más!', 'address': {'@type': 'PostalAddress', 'addressLocality': 'Barcelona, Spain', 'addressCountry': 'Spain', 'postalCode': '08025', 'streetAddress': 'Carrer de Lepant, 374, 378'}, 'telephone': '+34 618 35 33 71', 'geo': {'@type': 'GeoCoordinates', 'latitude': '41.4090413', 'longitude': '2.1707634'}, 'priceRange': '-', 'image': 'https://storage.googleapis.com/download/storage/v1/b/usc-pro-uscweb-live-media/o/de-live%2Foriginal_1024x576_plantilla%20modif2_1609866469957053_admin.png?alt=media'}",41.4090413,2.1707634,"¡Bienvenido a Green Fit Lepanto! Todo nuestro equipo, formado por grandes profesionales, te ayudará en el día a día con todo lo que necesites. Todo en un ambiente cercano, amable y divertido. Además de tu sala de fitness también te ofrecemos una gran variedad de clases de spinning, zumba, cardiovasculares, acondicionamiento físico y pilates. ¡No esperes más!"
Inspira Fitness,['Fitness'],False,"['M', 'L', 'XL']",M,Les Corts,"Calle Caballero, 76",https://urbansportsclub.com//en/venues/inspira-fitness,"{'@context': 'http://schema.org', '@type': 'LocalBusiness', 'name': 'Inspira Fitness', 'description': 'Inspira Fitness es un centro deportivo de más 500 m² dividido en dos plantas. Somos especialistas en entrenamiento personal adaptado y un lugar donde podrás entrenar sin aglomeraciones ni esperas, donde encontraras equipamiento de calidad para que puedas realizar tus entrenamientos con la máxima satisfacción.', 'address': {'@type': 'PostalAddress', 'addressLocality': 'Barcelona, Spain', 'addressCountry': 'Spain', 'postalCode': '08029', 'streetAddress': 'Calle Caballero, 76'}, 'telephone': '+49 931 393137', 'geo': {'@type': 'GeoCoordinates', 'latitude': '41.384149', 'longitude': '2.1387521'}, 'priceRange': '-', 'image': 'https://storage.googleapis.com/download/storage/v1/b/usc-pro-uscweb-live-media/o/de-live%2Foriginal_1024x576_inspira%20fit1_1626276123650162_admin.png?alt=media'}",41.384149,2.1387521,"Inspira Fitness es un centro deportivo de más 500 m² dividido en dos plantas. Somos especialistas en entrenamiento personal adaptado y un lugar donde podrás entrenar sin aglomeraciones ni esperas, donde encontraras equipamiento de calidad para que puedas realizar tus entrenamientos con la máxima satisfacción."
Snap Fitnes Aragó,"['Fitness', 'Functional Training', 'Indoor Cycling']",False,"['S', 'M', 'L', 'XL']",S,Nova Esquerra de l'Eixample,"Carrer d'Aragó, 115",https://urbansportsclub.com//en/venues/snap-fitnes-arago,"{'@context': 'http://schema.org', '@type': 'LocalBusiness', 'name': 'Snap Fitnes Aragó', 'description': 'En la calle Aragó de Barcelona, entre la estación de Sants y la Esquerra del Eixample, una zona con mucha vida, encontrarás un Snap Fitness abierto las 24 horas del día para que puedas entrenar cuando mejor te vaya, tanto si es a primerísima hora de la mañana, por la tarde o por la madrugada. Se trata de unas instalaciones perfectas para que logres los resultados que estás buscando, con las máquinas de ejercicios más modernas, las pesas y materiales de mayor calidad y el apoyo de nuestros técnicos. También tienes la posibilidad de acudir a entrenamientos grupales para ejercitarte de una forma completa mientras te diviertes. En el gym 24 horas de Snap Fitness Aragó conseguirás alcanzar el objetivo que tanto ansías. Conoce las ofertas que tenemos preparadas para ti y benefíciate de unos precios que nos han llevado a ser una compañía global de éxito.', 'address': {'@type': 'PostalAddress', 'addressLocality': 'Barcelona, Spain', 'addressCountry': 'Spain', 'postalCode': '08015', 'streetAddress': 'Carrer d&#039;Aragó, 115'}, 'telephone': '', 'geo': {'@type': 'GeoCoordinates', 'latitude': '41.3829583', 'longitude': '2.1522955'}, 'priceRange': '-', 'image': 'https://storage.googleapis.com/download/storage/v1/b/usc-pro-uscweb-live-media/o/de-live%2Foriginal_1024x576_plantilla%20modif3_1636980186409191_admin.png?generation=1636980186510004&amp;alt=media'}",41.3829583,2.1522955,"En la calle Aragó de Barcelona, entre la estación de Sants y la Esquerra del Eixample, una zona con mucha vida, encontrarás un Snap Fitness abierto las 24 horas del día para que puedas entrenar cuando mejor te vaya, tanto si es a primerísima hora de la mañana, por la tarde o por la madrugada. Se trata de unas instalaciones perfectas para que logres los resultados que estás buscando, con las máquinas de ejercicios más modernas, las pesas y materiales de mayor calidad y el apoyo de nuestros técnicos. También tienes la posibilidad de acudir a entrenamientos grupales para ejercitarte de una forma completa mientras te diviertes. En el gym 24 horas de Snap Fitness Aragó conseguirás alcanzar el objetivo que tanto ansías. Conoce las ofertas que tenemos preparadas para ti y benefíciate de unos precios que nos han llevado a ser una compañía global de éxito."
Bilyana Iliykova,['Yoga'],False,"['M', 'L', 'XL']",M,La Barceloneta,"Plaza Ramon Berenguer El Gran 2, escalera derecha, entresuelo 2",https://urbansportsclub.com//en/venues/tattva-yoga-studio,"{'@context': 'http://schema.org', '@type': 'LocalBusiness', 'name': 'Bilyana Iliykova', 'description': '', 'address': {'@type': 'PostalAddress', 'addressLocality': 'Barcelona, Spain', 'addressCountry': 'Spain', 'postalCode': '08002', 'streetAddress': 'Plaza Ramon Berenguer El Gran 2, escalera derecha, entresuelo 2'}, 'telephone': '+44 623027141', 'geo': {'@type': 'GeoCoordinates', 'latitude': '41.3846215', 'longitude': '2.1774475'}, 'priceRange': '-', 'image': 'https://storage.googleapis.com/download/storage/v1/b/usc-pro-uscweb-live-media/o/de-live%2Foriginal_1200x675_u4o0wzl5ao2f8fslqgld_172786582439812.png?generation=1727865824151064&amp;alt=media'}",41.3846215,2.1774475,
Yoga Studio Barcelona,['Yoga'],False,"['M', 'L', 'XL']",M,Nova Esquerra de l'Eixample,"Plaça de la Universitat, 4",https://urbansportsclub.com//en/venues/yoga-studio-barcelona,"{'@context': 'http://schema.org', '@type': 'LocalBusiness', 'name': 'Yoga Studio Barcelona', 'description': 'Yoga Studio Barcelona es un centro de Yoga, situado en el corazón de Barcelona, a pocos minutos del metro “Plaça Universitat”. Especializado en Vinyasa y Hatha Yoga. Encontrarás un espacio con grandes salas para tu práctica y mejora personal. Encontrarás clases para principiantes y avanzados, sesiones de Meditación, Pranayama, cursos de introducción al Yoga… Todo ello para satisfacer tus deseos de aprender, mejorar y despertar tus capacidades físicas y mentales.', 'address': {'@type': 'PostalAddress', 'addressLocality': 'Barcelona, Spain', 'addressCountry': 'Spain', 'postalCode': '08011', 'streetAddress': 'Plaça de la Universitat, 4'}, 'telephone': '+34 934 51 29 28', 'geo': {'@type': 'GeoCoordinates', 'latitude': '41.38483', 'longitude': '2.1636'}, 'priceRange': '-', 'image': 'https://storage.googleapis.com/download/storage/v1/b/usc-pro-uscweb-live-media/o/de-live%2Foriginal_1068x601_76542536-649f-4da5-acf3-dd753ea4747a_768_1573662939625699_admin.jpg?alt=media'}",41.38483,2.1636,"Yoga Studio Barcelona es un centro de Yoga, situado en el corazón de Barcelona, a pocos minutos del metro “Plaça Universitat”. Especializado en Vinyasa y Hatha Yoga. Encontrarás un espacio con grandes salas para tu práctica y mejora personal. Encontrarás clases para principiantes y avanzados, sesiones de Meditación, Pranayama, cursos de introducción al Yoga… Todo ello para satisfacer tus deseos de aprender, mejorar y despertar tus capacidades físicas y mentales."
Espacio de yoga,['Yoga'],False,"['M', 'L', 'XL']",M,Sant Gervasi-Galvany,Carrer de Buscarons 7,https://urbansportsclub.com//en/venues/espacio-de-yoga,"{'@context': 'http://schema.org', '@type': 'LocalBusiness', 'name': 'Espacio de yoga', 'description': 'Espacio de Yoga es un centro de yoga y terapias alternativas situado en pleno corazón del barrio Sarrià-Sant Gervasi de Barcelona. Dispone de una amplia y bonita sala de yoga y dos consultas de terapias alternativas dedicadas al bienestar y la salud del cuerpo y la mente. Nuestro objetivo es ofrecer un espacio para favorecer el crecimiento personal a través del yoga. Un lugar donde conectar con nuestra creatividad y alegría internas y convertir la vida de la ciudad en una experiencia más profunda e inspiradora. Espacio de Yoga es una pausa, un momento de conexión contigo mismo donde encontrarás clases de yoga de diversos estilos y niveles, talleres, seminarios, actividades y terapias a tu servicio.', 'address': {'@type': 'PostalAddress', 'addressLocality': 'Barcelona, Spain', 'addressCountry': 'Spain', 'postalCode': '08022', 'streetAddress': 'Carrer de Buscarons 7'}, 'telephone': '+34 931 72 29 56', 'geo': {'@type': 'GeoCoordinates', 'latitude': '41.4068858', 'longitude': '2.1380602'}, 'priceRange': '-', 'image': 'https://storage.googleapis.com/download/storage/v1/b/usc-pro-uscweb-live-media/o/de-live%2Foriginal_1100x619_espacio%20del%20yoga%201%20foto_15784054895436_admin.jpg?alt=media'}",41.4068858,2.1380602,"Espacio de Yoga es un centro de yoga y terapias alternativas situado en pleno corazón del barrio Sarrià-Sant Gervasi de Barcelona. Dispone de una amplia y bonita sala de yoga y dos consultas de terapias alternativas dedicadas al bienestar y la salud del cuerpo y la mente. Nuestro objetivo es ofrecer un espacio para favorecer el crecimiento personal a través del yoga. Un lugar donde conectar con nuestra creatividad y alegría internas y convertir la vida de la ciudad en una experiencia más profunda e inspiradora. Espacio de Yoga es una pausa, un momento de conexión contigo mismo donde encontrarás clases de yoga de diversos estilos y niveles, talleres, seminarios, actividades y terapias a tu servicio."
Eurofitness Can Dragó,['Fitness'],False,"['S', 'M', 'L', 'XL']",S,Porta,"Carrer de Rosselló i Porcel, 7",https://urbansportsclub.com//en/venues/eurofitness-can-drago,"{'@context': 'http://schema.org', '@type': 'LocalBusiness', 'name': 'Eurofitness Can Dragó', 'description': 'En los clubs Eurofitness encontrarás gran variedad de actividades y servicios que te ayudarán a conseguir tu objetivo. Mensualmente podrás disfrutar de más de 10.000 horas de actividades y servicios que te ofrecemos para que te sientas bien.', 'address': {'@type': 'PostalAddress', 'addressLocality': 'Barcelona, Spain', 'addressCountry': 'Spain', 'postalCode': '08016', 'streetAddress': 'Carrer de Rosselló i Porcel, 7'}, 'telephone': '', 'geo': {'@type': 'GeoCoordinates', 'latitude': '41.4362678', 'longitude': '2.1831356'}, 'priceRange': '-', 'image': 'https://storage.googleapis.com/download/storage/v1/b/usc-pro-uscweb-live-media/o/de-live%2Foriginal_1120x630_Can%20Drag%C3%B3_1656599999312538_admin.jpg?generation=1656599999371024&amp;alt=media'}",41.4362678,2.1831356,En los clubs Eurofitness encontrarás gran variedad de actividades y servicios que te ayudarán a conseguir tu objetivo. Mensualmente podrás disfrutar de más de 10.000 horas de actividades y servicios que te ofrecemos para que te sientas bien.
YogaOne Sagrada Familia,['Yoga'],False,"['M', 'L', 'XL']",M,El Clot,Carrer de Cartagena 248,https://urbansportsclub.com//en/venues/yogaone-sagrada-familia,"{'@context': 'http://schema.org', '@type': 'LocalBusiness', 'name': 'YogaOne Sagrada Familia', 'description': 'EL YOGA PARA TODOS.', 'address': {'@type': 'PostalAddress', 'addressLocality': 'Barcelona, Spain', 'addressCountry': 'Spain', 'postalCode': '08025', 'streetAddress': 'Carrer de Cartagena 248'}, 'telephone': '', 'geo': {'@type': 'GeoCoordinates', 'latitude': '41.4081229', 'longitude': '2.1785261'}, 'priceRange': '-', 'image': 'https://urbansportsclub.com/images/merchant/venueHome.jpg'}",41.4081229,2.1785261,EL YOGA PARA TODOS.
NICK Spa & Sports Club,['Fitness'],True,"['L', 'XL']",L,La Font d´en Fargues,"Carrer Font d'en Fargas, 6",https://urbansportsclub.com//en/venues/nick-spa-sports-club,"{'@context': 'http://schema.org', '@type': 'LocalBusiness', 'name': 'NICK Spa &amp; Sports Club', 'description': 'Benvinguts al Nick, on el benestar comença. El millor SPA de Barcelona, molt a prop. On t&#039;adjudarem a aconseguir l&#039;impossible. Bienvenidos al Nick, Aquí empieza el bienestar. El mejor SPA de Barcelona, muy cerca. Donde te ayudamos a conseguir lo imposible. Welcome to NIck, where wellfare begins. The best SPA in Barcelona, very close. Where helps you to attain the impossible.', 'address': {'@type': 'PostalAddress', 'addressLocality': 'Barcelona, Spain', 'addressCountry': 'Spain', 'postalCode': '08032', 'streetAddress': 'Carrer Font d&#039;en Fargas, 6'}, 'telephone': '', 'geo': {'@type': 'GeoCoordinates', 'latitude': '41.4214042', 'longitude': '2.1641712'}, 'priceRange': '-', 'image': 'https://storage.googleapis.com/download/storage/v1/b/usc-pro-uscweb-live-media/o/de-live%2Foriginal_1280x720_Nick_Spa_PSD_6_1627490454203950_admin.jpeg?alt=media'}",41.4214042,2.1641712,"Benvinguts al Nick, on el benestar comença. El millor SPA de Barcelona, molt a prop. On t&#039;adjudarem a aconseguir l&#039;impossible. Bienvenidos al Nick, Aquí empieza el bienestar. El mejor SPA de Barcelona, muy cerca. Donde te ayudamos a conseguir lo imposible. Welcome to NIck, where wellfare begins. The best SPA in Barcelona, very close. Where helps you to attain the impossible."
CEM Maresme,"['Fitness', 'Swimming']",False,"['M', 'L', 'XL']",M,el Besòs i el Mareme,"C/ Pallars, 484",https://urbansportsclub.com//en/venues/cem-maresme,"{'@context': 'http://schema.org', '@type': 'LocalBusiness', 'name': 'CEM Maresme', 'description': 'Somos un grupo empresarial que gestiona varios centros deportivos, equipamientos y servicios alrededor del mundo deportivo y educativo: somos deporte para todo el mundo. Contamos con más de 45.000 metros cuadrados de instalaciones deportivas y más de 30.000 usuarios. El objetivo de CET10 es promocionar los beneficios del deporte a la sociedad con profesionalidad, rigor y atención personalizada. Todo esto, a través de un equipo de profesionales con larga experiencia en el sector que trabajan con ilusión y exigencia para ofrecer un servicio deportivo global.', 'address': {'@type': 'PostalAddress', 'addressLocality': 'Barcelona, Spain', 'addressCountry': 'Spain', 'postalCode': '08019', 'streetAddress': 'C/ Pallars, 484'}, 'telephone': '', 'geo': {'@type': 'GeoCoordinates', 'latitude': '41.4132335', 'longitude': '2.2143093'}, 'priceRange': '-', 'image': 'https://storage.googleapis.com/download/storage/v1/b/usc-pro-uscweb-live-media/o/de-live%2Foriginal_5214x2933_MRM_Sala%20Fitness_1682588704908547_admin.jpg?generation=1682588705027431&amp;alt=media'}",41.4132335,2.2143093,"Somos un grupo empresarial que gestiona varios centros deportivos, equipamientos y servicios alrededor del mundo deportivo y educativo: somos deporte para todo el mundo. Contamos con más de 45.000 metros cuadrados de instalaciones deportivas y más de 30.000 usuarios. El objetivo de CET10 es promocionar los beneficios del deporte a la sociedad con profesionalidad, rigor y atención personalizada. Todo esto, a través de un equipo de profesionales con larga experiencia en el sector que trabajan con ilusión y exigencia para ofrecer un servicio deportivo global."
Espai Adarsha,"['Dance', 'Meditation', 'Pilates', 'Yoga']",False,"['S', 'M', 'L', 'XL']",S,Dreta de l'Eixample,"Calle Girona 166, Entresuelo 3",https://urbansportsclub.com//en/venues/espai-adarsha,"{'@context': 'http://schema.org', '@type': 'LocalBusiness', 'name': 'Espai Adarsha', 'description': 'En Espai Adarsha ofrecemos una amplia variedad de clases de yoga y pilates para todos los niveles. Te guiaremos en cada sesión para que aprendas las posturas y técnicas correctamente. Además, complementamos nuestras clases con talleres y otras terapias holísticas para un crecimiento integral. ¡Anímate a probar una clase y sentirás cómo tu cuerpo y mente se transforman!', 'address': {'@type': 'PostalAddress', 'addressLocality': 'Barcelona, Spain', 'addressCountry': 'Spain', 'postalCode': '08037', 'streetAddress': 'Carrer Girona 166, ENT 3'}, 'telephone': '', 'geo': {'@type': 'GeoCoordinates', 'latitude': '41.399767', 'longitude': '2.1647984'}, 'priceRange': '-', 'image': 'https://storage.googleapis.com/download/storage/v1/b/usc-pro-uscweb-live-media/o/de-live%2Foriginal_320x180_jjxbupxae5f4aly4nyal_1712741638777445.png?generation=1712741638850802&amp;alt=media'}",41.399767,2.1647984,"En Espai Adarsha ofrecemos una amplia variedad de clases de yoga y pilates para todos los niveles. Te guiaremos en cada sesión para que aprendas las posturas y técnicas correctamente. Además, complementamos nuestras clases con talleres y otras terapias holísticas para un crecimiento integral. ¡Anímate a probar una clase y sentirás cómo tu cuerpo y mente se transforman!"
Jardín de Hara,"['Pilates', 'Qi Gong and Tai Chi', 'Yoga']",False,"['M', 'L', 'XL']",M,Vila de Gràcia,"Carrer de la Fraternitat, 25",https://urbansportsclub.com//en/venues/jardin-de-hara,"{'@context': 'http://schema.org', '@type': 'LocalBusiness', 'name': 'Jardín de Hara', 'description': 'Situado en el corazón del emblemático barrio de Gracia, entre casitas bajas encontramos el centro de yoga Jardín de hara, un centro que va más allá de la simple práctica del yoga, ya que envuelve las clases con diferentes talleres que hacen de la actividad toda una experiéncia que roza lo místico. Medidas sanitarias tomadas: - Se recomienda el uso de mascarilla y guantes. - Se deberá de traer esterilla propia.', 'address': {'@type': 'PostalAddress', 'addressLocality': 'Barcelona, Spain', 'addressCountry': 'Spain', 'postalCode': '08012', 'streetAddress': 'Carrer de la Fraternitat, 25'}, 'telephone': '+34 699 07 67 62', 'geo': {'@type': 'GeoCoordinates', 'latitude': '41.4004876', 'longitude': '2.1604695'}, 'priceRange': '-', 'image': 'https://storage.googleapis.com/download/storage/v1/b/usc-pro-uscweb-live-media/o/de-live%2Foriginal_1024x576_jardin%20de%20hara%20foto%202_1555482698842145_admin.jpg?alt=media'}",41.4004876,2.1604695,"Situado en el corazón del emblemático barrio de Gracia, entre casitas bajas encontramos el centro de yoga Jardín de hara, un centro que va más allá de la simple práctica del yoga, ya que envuelve las clases con diferentes talleres que hacen de la actividad toda una experiéncia que roza lo místico. Medidas sanitarias tomadas: - Se recomienda el uso de mascarilla y guantes. - Se deberá de traer esterilla propia."
