name,disciplines,plus_options,plans,min_plan,district,street,link,metadata,latitude,longitude,description
Yogakula,"['Fitness', 'Pilates', 'Yoga']",False,"['Classic', 'Premium', 'Max']",Classic,Bilk,Zimmerstraße 11,https://urbansportsclub.com//en/venues/yogakula-1,"{'@context': 'http://schema.org', '@type': 'LocalBusiness', 'name': 'Yogakula', 'description': 'In einem wunderschönen, im Hinterhof gelegenen Loft in Bilk/Friedrichstadt bieten wir Yogakurse in unterschiedlichen Stilrichtungen an. Von sanft und ruhig, meditativ und regenerierend, fordernd und schweißtreibend, für den Anfänger und erfahrenere Yogis und Yoginis, sollte für jeden etwas dabei sein. Der Name Kula kommt aus dem Sanskrit, einer altindischen Sprache und bedeutet so viel wie Familie, Gemeinschaft und Haus. Wir möchten einen Raum schaffen, in dem du zu mehr Kraft, Ruhe und Klarheit findest, um den Herausforderungen des Alltags besser begegnen zu können. In diesem Sinne, freuen wir uns mit dir gemeinsam Yoga zu praktizieren.', 'address': {'@type': 'PostalAddress', 'addressLocality': 'Düsseldorf, Germany', 'addressCountry': 'Germany', 'postalCode': '40215', 'streetAddress': 'Zimmerstraße 11'}, 'telephone': '+49 177 9744395', 'geo': {'@type': 'GeoCoordinates', 'latitude': '51.2093419', 'longitude': '6.781904'}, 'priceRange': '-', 'image': 'https://storage.googleapis.com/download/storage/v1/b/usc-pro-uscweb-live-media/o/de-live%2Foriginal_1024x576_IMG_6136_1657866283818804_admin.jpeg?generation=1657866283891320&amp;alt=media'}",51.2093419,6.781904,"In einem wunderschönen, im Hinterhof gelegenen Loft in Bilk/Friedrichstadt bieten wir Yogakurse in unterschiedlichen Stilrichtungen an. Von sanft und ruhig, meditativ und regenerierend, fordernd und schweißtreibend, für den Anfänger und erfahrenere Yogis und Yoginis, sollte für jeden etwas dabei sein. Der Name Kula kommt aus dem Sanskrit, einer altindischen Sprache und bedeutet so viel wie Familie, Gemeinschaft und Haus. Wir möchten einen Raum schaffen, in dem du zu mehr Kraft, Ruhe und Klarheit findest, um den Herausforderungen des Alltags besser begegnen zu können. In diesem Sinne, freuen wir uns mit dir gemeinsam Yoga zu praktizieren."
Allwetterbad Lintorf,['Swimming'],False,"['Essential', 'Classic', 'Premium', 'Max']",Essential,Ratingen,Jahnstraße 35,https://urbansportsclub.com//en/venues/allwetterbad-lintorf,"{'@context': 'http://schema.org', '@type': 'LocalBusiness', 'name': 'Allwetterbad Lintorf', 'description': 'Die Ratinger Bäder freuen sich auf dich!', 'address': {'@type': 'PostalAddress', 'addressLocality': 'Düsseldorf, Germany', 'addressCountry': 'Germany', 'postalCode': '40885', 'streetAddress': 'Jahnstraße 35'}, 'telephone': '', 'geo': {'@type': 'GeoCoordinates', 'latitude': '51.3313239', 'longitude': '6.8367203'}, 'priceRange': '-', 'image': 'https://storage.googleapis.com/download/storage/v1/b/usc-pro-uscweb-live-media/o/de-live%2Foriginal_1181x664_b6b72de28eec-baeder_ratingen_151128_2752_169597778744989_admin.jpg?generation=1695977787116983&amp;alt=media'}",51.3313239,6.8367203,Die Ratinger Bäder freuen sich auf dich!
Shivasloft - Pempelfort,"['Pilates', 'Yoga']",False,"['Classic', 'Premium', 'Max']",Classic,Pempelfort,Stockkampstr. 12a,https://urbansportsclub.com//en/venues/shivasloft-pempelfort,"{'@context': 'http://schema.org', '@type': 'LocalBusiness', 'name': 'Shivasloft - Pempelfort', 'description': 'WIR LIEBEN YOGA Shivasloft Yoga findet ihr an 3 wunderschönen Standpunkten in Düsseldorf. Zentral gelegen in Flingern, Pempelfort und Friedrichstadt bieten wir offene Yogaklassen für alle Level und Bedürfnisse in unseren ruhig gelegenen Hinterhof-Lofts. SHIVASLOFT ist dein Yogastudio in Düsseldorf für ausrichtungsbasiertes Yoga, Vinyasa Flow, Yin Yoga und Yoga für einen gesunden Rücken. Unsere täglichen Yogaklassen bieten dir ein abwechslungsreiches Programm für alle Level und Bedürfnisse. Wir freuen uns auf Dich ♡ Komm vorbei und lerne das Team von Shivasloft kennen. Du bist jederzeit willkommen! Die Kurse sind auf folgenden Levels bezeichnet: Level 1 - Einsteiger Level 2- Mittelstufe Level 3 - Fortgeschritten', 'address': {'@type': 'PostalAddress', 'addressLocality': 'Düsseldorf, Germany', 'addressCountry': 'Germany', 'postalCode': '40477', 'streetAddress': 'Stockkampstr. 12a'}, 'telephone': '+49 211 46893475', 'geo': {'@type': 'GeoCoordinates', 'latitude': '51.2367832', 'longitude': '6.7858447'}, 'priceRange': '-', 'image': 'https://storage.googleapis.com/download/storage/v1/b/usc-pro-uscweb-live-media/o/de-live%2Foriginal_1280x720_Hanna-Witte-32_1559047399420294_admin.jpeg?alt=media'}",51.2367832,6.7858447,"WIR LIEBEN YOGA Shivasloft Yoga findet ihr an 3 wunderschönen Standpunkten in Düsseldorf. Zentral gelegen in Flingern, Pempelfort und Friedrichstadt bieten wir offene Yogaklassen für alle Level und Bedürfnisse in unseren ruhig gelegenen Hinterhof-Lofts. SHIVASLOFT ist dein Yogastudio in Düsseldorf für ausrichtungsbasiertes Yoga, Vinyasa Flow, Yin Yoga und Yoga für einen gesunden Rücken. Unsere täglichen Yogaklassen bieten dir ein abwechslungsreiches Programm für alle Level und Bedürfnisse. Wir freuen uns auf Dich ♡ Komm vorbei und lerne das Team von Shivasloft kennen. Du bist jederzeit willkommen! Die Kurse sind auf folgenden Levels bezeichnet: Level 1 - Einsteiger Level 2- Mittelstufe Level 3 - Fortgeschritten"
Athletic Bootcamp,"['Bootcamp', 'Functional Training', 'Wellness']",False,"['Classic', 'Premium', 'Max']",Classic,Stadtbezirk 7,Harffstraße 51,https://urbansportsclub.com//en/venues/crossfit-duesseldorf,"{'@context': 'http://schema.org', '@type': 'LocalBusiness', 'name': 'Athletic Bootcamp', 'description': '.', 'address': {'@type': 'PostalAddress', 'addressLocality': 'Düsseldorf, Germany', 'addressCountry': 'Germany', 'postalCode': '40591', 'streetAddress': 'Harffstraße 51'}, 'telephone': '+49 173 5840321', 'geo': {'@type': 'GeoCoordinates', 'latitude': '51.1967176', 'longitude': '6.8166846'}, 'priceRange': '-', 'image': 'https://storage.googleapis.com/download/storage/v1/b/usc-pro-uscweb-live-media/o/de-live%2Foriginal_720x405_jr0gurcnr03iryawvu7w_1710274572690587.png?generation=1710274572826091&amp;alt=media'}",51.1967176,6.8166846,.
Vishnu´s Vibes,"['Pilates', 'Yoga']",False,"['Classic', 'Premium', 'Max']",Classic,Stadtmitte,Schirmerstraße 61,https://urbansportsclub.com//en/venues/vishnus-vibes,"{'@context': 'http://schema.org', '@type': 'LocalBusiness', 'name': 'Vishnu´s Vibes', 'description': 'Zeitgenössisches Yoga bei Vishnus Vibes heißt kreativen, körperlich wie auch spirituellen Yoga Unterricht zu erfahren, den jeder unserer Lehrer mit seiner individuellen Note würzt. Ob im Flow des Vinyasa Yoga, sanft beim Yin Yoga, schwerelos im Aerial Yoga Tuch oder therapiebegleitend. Bewegung und Atmung, Anspannung und Entspannung ergeben immer eine ganzheitliche Praxis. Die Vielfalt des Yoga ist für jede Altersgruppe! Ob Yoga Neuling, Fortgeschrittener Yogi, Senior, Schüler, werdende oder gewordene Mummy. Auch für Krebspatienten und chronisch Erkrankte ist es uns ein großes Anliegen, therapiebegleitend mit Yoga zu helfen. In unseren drei wunderschönen Atelierräumen bieten wir dir einen Platz zum Wohlfühlen, Wachsen und Energie tanken. Yoga ist kein Sport, sondern eine Lebensphilosophie, in der es um deine innere Freiheit geht. Es geht nicht um Leistung und auch nicht um perfekte Haltungen oder dein Aussehen. Wir nehmen Abstand von dogmatischen Vorstellungen, wie etwas zu sein hat! Dennoch wird dein Körper durch Yoga gestärkt, sowie deine mentale/emotionale Verfassung verbessert. Es geht vor allem um deine Atmung und die damit verbundene Sensibilität, welche entsteht. Wenn du atmest, fühlst du! Besonders die meditativen Aspekte der Yogapraxis sind von großer Bedeutung für die moderne Welt! Die Kunst des Seins ist es, mit allen Sinnen zu erfahren und zu wachsen, achtsam im Umgang mit dir UND deinem Umfeld. Durch die Corona-Pandemie ist es noch deutlicher geworden, dass die westliche Gesellschaft unter einem Overload an Informationen leidet. Es herrscht zu viel Tempo und das ausgebrannt sein (Burn out), sowie eine permanente Erschöpfung (Fatique Syndrom) nehmen immer mehr zu… Wir müssen alle mal tief durchatmen und loslassen! Durch den entstehenden Kontakt zu deinem tiefsten Inneren fühlst du dich zunehmend entspannter und energetisch zugleich – bereit, um die Gelassenheit in der Hektik des Alltags zu finden, die du brauchst. Gerne helfen wir dir dabei, dass du dich wieder richtig spüren kannst, stabil bist und mehr Bewusstheit und Freude für dich selbst und deine Umwelt entwickelst.', 'address': {'@type': 'PostalAddress', 'addressLocality': 'Düsseldorf, Germany', 'addressCountry': 'Germany', 'postalCode': '40211', 'streetAddress': 'Schirmerstraße 61'}, 'telephone': '', 'geo': {'@type': 'GeoCoordinates', 'latitude': '51.2306217', 'longitude': '6.7951043'}, 'priceRange': '-', 'image': 'https://storage.googleapis.com/download/storage/v1/b/usc-pro-uscweb-live-media/o/de-live%2Foriginal_2500x1406_SLEU_4SL_6958_1647520861314669_admin.jpg?generation=1647520861422253&amp;alt=media'}",51.2306217,6.7951043,"Zeitgenössisches Yoga bei Vishnus Vibes heißt kreativen, körperlich wie auch spirituellen Yoga Unterricht zu erfahren, den jeder unserer Lehrer mit seiner individuellen Note würzt. Ob im Flow des Vinyasa Yoga, sanft beim Yin Yoga, schwerelos im Aerial Yoga Tuch oder therapiebegleitend. Bewegung und Atmung, Anspannung und Entspannung ergeben immer eine ganzheitliche Praxis. Die Vielfalt des Yoga ist für jede Altersgruppe! Ob Yoga Neuling, Fortgeschrittener Yogi, Senior, Schüler, werdende oder gewordene Mummy. Auch für Krebspatienten und chronisch Erkrankte ist es uns ein großes Anliegen, therapiebegleitend mit Yoga zu helfen. In unseren drei wunderschönen Atelierräumen bieten wir dir einen Platz zum Wohlfühlen, Wachsen und Energie tanken. Yoga ist kein Sport, sondern eine Lebensphilosophie, in der es um deine innere Freiheit geht. Es geht nicht um Leistung und auch nicht um perfekte Haltungen oder dein Aussehen. Wir nehmen Abstand von dogmatischen Vorstellungen, wie etwas zu sein hat! Dennoch wird dein Körper durch Yoga gestärkt, sowie deine mentale/emotionale Verfassung verbessert. Es geht vor allem um deine Atmung und die damit verbundene Sensibilität, welche entsteht. Wenn du atmest, fühlst du! Besonders die meditativen Aspekte der Yogapraxis sind von großer Bedeutung für die moderne Welt! Die Kunst des Seins ist es, mit allen Sinnen zu erfahren und zu wachsen, achtsam im Umgang mit dir UND deinem Umfeld. Durch die Corona-Pandemie ist es noch deutlicher geworden, dass die westliche Gesellschaft unter einem Overload an Informationen leidet. Es herrscht zu viel Tempo und das ausgebrannt sein (Burn out), sowie eine permanente Erschöpfung (Fatique Syndrom) nehmen immer mehr zu… Wir müssen alle mal tief durchatmen und loslassen! Durch den entstehenden Kontakt zu deinem tiefsten Inneren fühlst du dich zunehmend entspannter und energetisch zugleich – bereit, um die Gelassenheit in der Hektik des Alltags zu finden, die du brauchst. Gerne helfen wir dir dabei, dass du dich wieder richtig spüren kannst, stabil bist und mehr Bewusstheit und Freude für dich selbst und deine Umwelt entwickelst."
.,"['EMS', 'EMS Cardio']",True,"['Premium', 'Max']",Premium,Pempelfort,Klever Straße 1,https://urbansportsclub.com//en/venues/fitbox-dusseldorf-pempelfort,"{'@context': 'http://schema.org', '@type': 'LocalBusiness', 'name': '.', 'description': 'Fitbox Düsseldorf Pempelfort freut sich auf Dich!', 'address': {'@type': 'PostalAddress', 'addressLocality': 'Düsseldorf, Germany', 'addressCountry': 'Germany', 'postalCode': '40477', 'streetAddress': 'Klever Straße 1'}, 'telephone': '+44 17664957004', 'geo': {'@type': 'GeoCoordinates', 'latitude': '51.2392404', 'longitude': '6.7724484'}, 'priceRange': '-', 'image': 'https://urbansportsclub.com/images/merchant/venueHome.jpg'}",51.2392404,6.7724484,Fitbox Düsseldorf Pempelfort freut sich auf Dich!
Esport - Neuss 1,"['EMS', 'EMS Cardio']",True,"['Premium', 'Max']",Premium,Neuss,Oberstraße 70,https://urbansportsclub.com//en/venues/esport-neuss-1,"{'@context': 'http://schema.org', '@type': 'LocalBusiness', 'name': 'Esport - Neuss 1', 'description': 'Herzlich Willkommen in deinem esport-Store im Ruhrgebiet. Hier bist du richtig, wenn du etwas mehr für deine Fitness und Gesundheit tun möchtest. Mit dem professionellen EMS-Training wird deine gesamte Muskulatur trainiert, schnell, effektiv und in nur 15 Minuten. Daher ist es das ideale Training-to-go für alle, die wenig Zeit haben. Doch auch für die, die ohnehin schon sportlich aktiv sind, ist es die ideale Ergänzung, da es alle Muskelpartien beansprucht und trainiert. In unserem esport-Store kannst du schnell und zwischendurch deine Muskeln definieren, deine Ausdauer trainierst du dann, wenn du Zeit dafür hast. Komm einfach vorbei und vereinbare deinen Termin. Das Esport freut dich auf dich.', 'address': {'@type': 'PostalAddress', 'addressLocality': 'Düsseldorf, Germany', 'addressCountry': 'Germany', 'postalCode': '41460', 'streetAddress': 'Oberstraße 70'}, 'telephone': '', 'geo': {'@type': 'GeoCoordinates', 'latitude': '51.1961134', 'longitude': '6.6932577'}, 'priceRange': '-', 'image': 'https://storage.googleapis.com/download/storage/v1/b/usc-pro-uscweb-live-media/o/de-live%2Foriginal_1024x576_21751515_488555594834655_8856291386639376873_n_VVDWN.jpg?alt=media'}",51.1961134,6.6932577,"Herzlich Willkommen in deinem esport-Store im Ruhrgebiet. Hier bist du richtig, wenn du etwas mehr für deine Fitness und Gesundheit tun möchtest. Mit dem professionellen EMS-Training wird deine gesamte Muskulatur trainiert, schnell, effektiv und in nur 15 Minuten. Daher ist es das ideale Training-to-go für alle, die wenig Zeit haben. Doch auch für die, die ohnehin schon sportlich aktiv sind, ist es die ideale Ergänzung, da es alle Muskelpartien beansprucht und trainiert. In unserem esport-Store kannst du schnell und zwischendurch deine Muskeln definieren, deine Ausdauer trainierst du dann, wenn du Zeit dafür hast. Komm einfach vorbei und vereinbare deinen Termin. Das Esport freut dich auf dich."
Upscale Massage,['Massage'],True,"['Premium', 'Max']",Premium,Stadtbezirk 2,Goethestraße 38,https://urbansportsclub.com//en/venues/upscale-massage,"{'@context': 'http://schema.org', '@type': 'LocalBusiness', 'name': 'Upscale Massage', 'description': '', 'address': {'@type': 'PostalAddress', 'addressLocality': 'Düsseldorf, Germany', 'addressCountry': 'Germany', 'postalCode': '40237', 'streetAddress': 'Goethestraße 38'}, 'telephone': '+44 17684244006', 'geo': {'@type': 'GeoCoordinates', 'latitude': '51.233293587364', 'longitude': '6.8043631086434'}, 'priceRange': '-', 'image': 'https://storage.googleapis.com/download/storage/v1/b/usc-pro-uscweb-live-media/o/de-live%2Foriginal_1018x573_psydvfhpwgsoyzmj3bz3_1726123065895632.png?generation=1726123065957067&amp;alt=media'}",51.233293587364,6.8043631086434,
BEAT81 - Rochusmarkt Indoor Workout,['Fitness'],False,"['Classic', 'Premium', 'Max']",Classic,Pempelfort,Derendorfer Str 61,https://urbansportsclub.com//en/venues/beat81-rochusmarkt-indoor-workout,"{'@context': 'http://schema.org', '@type': 'LocalBusiness', 'name': 'BEAT81 - Rochusmarkt Indoor Workout', 'description': 'English below Verbrenne bis zu 1000 kcal in weniger als 45 Minuten in effizienten HIIT- und Kraft-Workouts an einem BEAT81 Standort in deiner Nähe. Die Energie der Gruppe und die besten Coaches motivieren dich dazu, über dich hinaus zu wachsen, jedes einzelne Mal. Dein Körper wird von Endorphinen durchströmt und du wirst den Kurs mit einem breiten Lächeln verlassen :) Dank der BEAT81 Herzfrequenz Technologie siehst und spürst du ganz genau, dass sich dein Training lohnt. Behalte deine Fortschritte fest im Blick und erhalte dein persönliches Trainingsergebnis nach jedem Workout. Bei unseren Workouts bist du immer willkommen, egal ob du neu startest oder schon länger trainierst. – Join the movement and burn up to 1000 kcal in less than 45 min with powerful HIIT and strength group classes in a BEAT81 location near you. Our coaches will help you push your limits all while having fun in a circuit training set-up. See and feel how you get fitter with our BEAT81 heart rate technology: track your progress and receive your personalized training results after each workout. Your body will be flooded with endorphins and you will leave the class with a big smile on your face :) We welcome every fitness level.', 'address': {'@type': 'PostalAddress', 'addressLocality': 'Düsseldorf, Germany', 'addressCountry': 'Germany', 'postalCode': '40479', 'streetAddress': 'Derendorfer Str 61'}, 'telephone': '', 'geo': {'@type': 'GeoCoordinates', 'latitude': '51.2342094', 'longitude': '6.7899864'}, 'priceRange': '-', 'image': 'https://storage.googleapis.com/download/storage/v1/b/usc-pro-uscweb-live-media/o/de-live%2Foriginal_2000x1125_Indoor1%20(1)_1677770596793580_admin.jpg?generation=1677770596975576&amp;alt=media'}",51.2342094,6.7899864,"English below Verbrenne bis zu 1000 kcal in weniger als 45 Minuten in effizienten HIIT- und Kraft-Workouts an einem BEAT81 Standort in deiner Nähe. Die Energie der Gruppe und die besten Coaches motivieren dich dazu, über dich hinaus zu wachsen, jedes einzelne Mal. Dein Körper wird von Endorphinen durchströmt und du wirst den Kurs mit einem breiten Lächeln verlassen :) Dank der BEAT81 Herzfrequenz Technologie siehst und spürst du ganz genau, dass sich dein Training lohnt. Behalte deine Fortschritte fest im Blick und erhalte dein persönliches Trainingsergebnis nach jedem Workout. Bei unseren Workouts bist du immer willkommen, egal ob du neu startest oder schon länger trainierst. – Join the movement and burn up to 1000 kcal in less than 45 min with powerful HIIT and strength group classes in a BEAT81 location near you. Our coaches will help you push your limits all while having fun in a circuit training set-up. See and feel how you get fitter with our BEAT81 heart rate technology: track your progress and receive your personalized training results after each workout. Your body will be flooded with endorphins and you will leave the class with a big smile on your face :) We welcome every fitness level."
Hildorado Hilden - Schwimmen,['Swimming'],False,"['Classic', 'Premium', 'Max']",Classic,Hilden,Grünstraße 2,https://urbansportsclub.com//en/venues/hildorado-hilden,"{'@context': 'http://schema.org', '@type': 'LocalBusiness', 'name': 'Hildorado Hilden - Schwimmen', 'description': 'Stadtwerke Hilden freut sich auf Dich!', 'address': {'@type': 'PostalAddress', 'addressLocality': 'Düsseldorf, Germany', 'addressCountry': 'Germany', 'postalCode': '40723', 'streetAddress': 'Grünstraße 2'}, 'telephone': '', 'geo': {'@type': 'GeoCoordinates', 'latitude': '51.16675', 'longitude': '6.94833'}, 'priceRange': '-', 'image': 'https://storage.googleapis.com/download/storage/v1/b/usc-pro-uscweb-live-media/o/de-live%2Foriginal_1688x950_SchwimmenCompressed%20(4)_1651146637239341_admin.jpg?generation=1651146637411670&amp;alt=media'}",51.16675,6.94833,Stadtwerke Hilden freut sich auf Dich!
Holmes Place am Seestern,"['Boxing Sports', 'Fitness', 'Pilates', 'Qi Gong and Tai Chi', 'Sauna', 'Yoga']",False,"['Classic', 'Premium', 'Max']",Classic,Lörick,Oberlöricker Straße 3,https://urbansportsclub.com//en/venues/holmes-place-oberkassel,"{'@context': 'http://schema.org', '@type': 'LocalBusiness', 'name': 'Holmes Place am Seestern', 'description': 'Holmes Place steht für ein besseres Leben. Ganzheitlich und in mehreren Dimensionen. Hier ist man überzeugt, dass ein Sich-Rundum-Wohlfühlen nur möglich ist, wenn Körper und Geist im Einklang sind. Mit Holmes Place kommst du zu einer gesunden Balance aus Bewegung, Ernährung und Entspannung. Im Kursprogramm jedes Clubs spiegelt sich das vielfältige und vor allem gesundheitsorientierte Angebot wieder. Laufen, Rudern oder Radfahren – in den großzügigen Fitnessbereichen wird dir ein umfangreiches und gesundheitsorientiertes Bewegungsprogramm geboten. Ebenfalls bietet der jeder Holmes Place Club (außer Essen) einen Pool und einen Wellnessbereich. Egal in welchen der Holmes Place Clubs – das Team freut sich auf dich und wir wünschen dir viel Spaß! *Bitte beachte, dass der Kursplan monatlich von Holmes Place geändert wird. Es kann zwischendurch immer wieder zu geänderten Kurszeiten kommen. Stelle bitte mit dem Kursplan auf der Holmes Place Website sicher, dass dein Kurs auch wie angezeigt statt findet.*', 'address': {'@type': 'PostalAddress', 'addressLocality': 'Düsseldorf, Germany', 'addressCountry': 'Germany', 'postalCode': '40547', 'streetAddress': 'Oberlöricker Straße 3'}, 'telephone': '+49 211 5206580', 'geo': {'@type': 'GeoCoordinates', 'latitude': '51.245529', 'longitude': '6.7352377'}, 'priceRange': '-', 'image': 'https://storage.googleapis.com/download/storage/v1/b/usc-pro-uscweb-live-media/o/de-live%2Foriginal_1024x576_Du%CC%88sseldorf%20am%20Seestern%20(2)_1667491924473533_admin.png?generation=1667491924525247&amp;alt=media'}",51.245529,6.7352377,"Holmes Place steht für ein besseres Leben. Ganzheitlich und in mehreren Dimensionen. Hier ist man überzeugt, dass ein Sich-Rundum-Wohlfühlen nur möglich ist, wenn Körper und Geist im Einklang sind. Mit Holmes Place kommst du zu einer gesunden Balance aus Bewegung, Ernährung und Entspannung. Im Kursprogramm jedes Clubs spiegelt sich das vielfältige und vor allem gesundheitsorientierte Angebot wieder. Laufen, Rudern oder Radfahren – in den großzügigen Fitnessbereichen wird dir ein umfangreiches und gesundheitsorientiertes Bewegungsprogramm geboten. Ebenfalls bietet der jeder Holmes Place Club (außer Essen) einen Pool und einen Wellnessbereich. Egal in welchen der Holmes Place Clubs – das Team freut sich auf dich und wir wünschen dir viel Spaß! *Bitte beachte, dass der Kursplan monatlich von Holmes Place geändert wird. Es kann zwischendurch immer wieder zu geänderten Kurszeiten kommen. Stelle bitte mit dem Kursplan auf der Holmes Place Website sicher, dass dein Kurs auch wie angezeigt statt findet.*"
