name,disciplines,plus_options,plans,min_plan,district,street,link,metadata,latitude,longitude,description
Anuschka Schielin - Carlstadt,['Fitness'],False,"['Classic', 'Premium', 'Max']",Classic,Altstadt,Königsallee 57,https://urbansportsclub.com//en/venues/anuschka-schielin-konigsallee,"{'@context': 'http://schema.org', '@type': 'LocalBusiness', 'name': 'Anuschka Schielin - Carlstadt', 'description': '&quot;Das Leben besteht in der Bewegung&quot; ( Aristoteles) Ihr wollt Fit werden? Rückenleiden? Abnehmen? Egal welches Ziel, zusammen arbeiten wir daran dieses zu erreichen. Bewegung in einer Sporthalle oder draußen an der frischen Luft. Vom eigenen Körpergewicht bis Hanteln ist alles dabei. Kommt vorbei und überzeugt euch selber!', 'address': {'@type': 'PostalAddress', 'addressLocality': 'Düsseldorf, Germany', 'addressCountry': 'Germany', 'postalCode': '40212', 'streetAddress': 'Königsallee 57'}, 'telephone': '+49 177 2759092', 'geo': {'@type': 'GeoCoordinates', 'latitude': '51.2213414', 'longitude': '6.777753'}, 'priceRange': '-', 'image': 'https://storage.googleapis.com/download/storage/v1/b/usc-pro-uscweb-live-media/o/de-live%2Foriginal_1688x950_Gesundheit_1563962721147432_admin.jpg?alt=media'}",51.2213414,6.777753,"&quot;Das Leben besteht in der Bewegung&quot; ( Aristoteles) Ihr wollt Fit werden? Rückenleiden? Abnehmen? Egal welches Ziel, zusammen arbeiten wir daran dieses zu erreichen. Bewegung in einer Sporthalle oder draußen an der frischen Luft. Vom eigenen Körpergewicht bis Hanteln ist alles dabei. Kommt vorbei und überzeugt euch selber!"
Anuschka Schielin - Hofgarten,['Fitness'],False,"['Classic', 'Premium', 'Max']",Classic,Ratingen,Maximilian-Weyhe-Allee,https://urbansportsclub.com//en/venues/anuschka-schielin-hofgarten,"{'@context': 'http://schema.org', '@type': 'LocalBusiness', 'name': 'Anuschka Schielin - Hofgarten', 'description': '&quot;Das Leben besteht in der Bewegung&quot; ( Aristoteles) Ihr wollt Fit werden? Rückenleiden? Abnehmen? Egal welches Ziel, zusammen arbeiten wir daran dieses zu erreichen. Bewegung in einer Sporthalle oder draußen an der frischen Luft. Vom eigenen Körpergewicht bis Hanteln ist alles dabei. Kommt vorbei und überzeugt euch selber!', 'address': {'@type': 'PostalAddress', 'addressLocality': 'Düsseldorf, Germany', 'addressCountry': 'Germany', 'postalCode': '', 'streetAddress': 'Maximilian-Weyhe-Allee'}, 'telephone': '+49 177 2759092', 'geo': {'@type': 'GeoCoordinates', 'latitude': '51.229767', 'longitude': '6.777561'}, 'priceRange': '-', 'image': 'https://storage.googleapis.com/download/storage/v1/b/usc-pro-uscweb-live-media/o/de-live%2Foriginal_1024x576_3d453ed6ac82-IMG_3628%20%282%29_1566286317147963_admin.jpg?alt=media'}",51.229767,6.777561,"&quot;Das Leben besteht in der Bewegung&quot; ( Aristoteles) Ihr wollt Fit werden? Rückenleiden? Abnehmen? Egal welches Ziel, zusammen arbeiten wir daran dieses zu erreichen. Bewegung in einer Sporthalle oder draußen an der frischen Luft. Vom eigenen Körpergewicht bis Hanteln ist alles dabei. Kommt vorbei und überzeugt euch selber!"
Anuschka Schielin - Kölner Tor,['Fitness'],False,"['Classic', 'Premium', 'Max']",Classic,Gerresheim,Kölner Tor 36,https://urbansportsclub.com//en/venues/anuschka-schielin-kolner-tor,"{'@context': 'http://schema.org', '@type': 'LocalBusiness', 'name': 'Anuschka Schielin - Kölner Tor', 'description': '&quot;Das Leben besteht in der Bewegung&quot; ( Aristoteles) Ihr wollt Fit werden? Rückenleiden? Abnehmen? Egal welches Ziel, zusammen arbeiten wir daran dieses zu erreichen. Bewegung in einer Sporthalle oder draußen an der frischen Luft. Vom eigenen Körpergewicht bis Hanteln ist alles dabei. Kommt vorbei und überzeugt euch selber!', 'address': {'@type': 'PostalAddress', 'addressLocality': 'Düsseldorf, Germany', 'addressCountry': 'Germany', 'postalCode': '40625', 'streetAddress': 'Kölner Tor 36'}, 'telephone': '+49 177 2759092', 'geo': {'@type': 'GeoCoordinates', 'latitude': '51.2351047', 'longitude': '6.8614139'}, 'priceRange': '-', 'image': 'https://storage.googleapis.com/download/storage/v1/b/usc-pro-uscweb-live-media/o/de-live%2Foriginal_2000x1125_image1%20%281%29_1601383561174065_admin.jpeg?alt=media'}",51.2351047,6.8614139,"&quot;Das Leben besteht in der Bewegung&quot; ( Aristoteles) Ihr wollt Fit werden? Rückenleiden? Abnehmen? Egal welches Ziel, zusammen arbeiten wir daran dieses zu erreichen. Bewegung in einer Sporthalle oder draußen an der frischen Luft. Vom eigenen Körpergewicht bis Hanteln ist alles dabei. Kommt vorbei und überzeugt euch selber!"
Ashtanga Yoga Düsseldorf - Benrath,['Yoga'],False,"['Classic', 'Premium', 'Max']",Classic,Benrath,Urdenbacher Allee 6,https://urbansportsclub.com//en/venues/ashtanga-yoga-dusseldorf-more,"{'@context': 'http://schema.org', '@type': 'LocalBusiness', 'name': 'Ashtanga Yoga Düsseldorf - Benrath', 'description': 'Ehemalige Schüler von der Ashtanga Yoga Schule Annika Bauer, Annika Meiring wollten weiterhin in Benrath Ashtanga Yoga machen. So entstand Ashtanga Yoga Düsseldorf &amp; more. Der Raum ist offen für andere Yoga und Sportarten wie z.B. Pilates, Stretch', 'address': {'@type': 'PostalAddress', 'addressLocality': 'Düsseldorf, Germany', 'addressCountry': 'Germany', 'postalCode': '40597', 'streetAddress': 'Urdenbacher Allee 6'}, 'telephone': '+49 175 8528382', 'geo': {'@type': 'GeoCoordinates', 'latitude': '51.1596888', 'longitude': '6.8726996'}, 'priceRange': '-', 'image': 'https://storage.googleapis.com/download/storage/v1/b/usc-pro-uscweb-live-media/o/venues%2Foriginal_1688x950_YogaCompressed_164363952089713_admin.jpg?generation=1751978088532456&amp;alt=media'}",51.1596888,6.8726996,"Ehemalige Schüler von der Ashtanga Yoga Schule Annika Bauer, Annika Meiring wollten weiterhin in Benrath Ashtanga Yoga machen. So entstand Ashtanga Yoga Düsseldorf &amp; more. Der Raum ist offen für andere Yoga und Sportarten wie z.B. Pilates, Stretch"
Basketball - Indoor Oberbilk,['Basketball'],False,"['Classic', 'Premium', 'Max']",Classic,Stadtbezirk 9,Mindener Straße 91,https://urbansportsclub.com//en/venues/basketball-ljubav-basketball-arena,"{'@context': 'http://schema.org', '@type': 'LocalBusiness', 'name': 'Basketball - Indoor Oberbilk', 'description': '.', 'address': {'@type': 'PostalAddress', 'addressLocality': 'Düsseldorf, Germany', 'addressCountry': 'Germany', 'postalCode': '40227', 'streetAddress': 'Mindener Straße 91'}, 'telephone': '+44 15116350002', 'geo': {'@type': 'GeoCoordinates', 'latitude': '51.2127806', 'longitude': '6.8100449'}, 'priceRange': '-', 'image': 'https://storage.googleapis.com/download/storage/v1/b/usc-pro-uscweb-live-media/o/de-live%2Foriginal_800x450_xbjgmetsjf50qmefnumb_171742208455948.jpg?generation=1717422084136284&amp;alt=media'}",51.2127806,6.8100449,.
Basketball - Original Flingern Fitness,['Basketball'],False,"['Classic', 'Premium', 'Max']",Classic,Stadtbezirk 9,Bruchstraße 78,https://urbansportsclub.com//en/venues/basketball-original-flingern-fitness,"{'@context': 'http://schema.org', '@type': 'LocalBusiness', 'name': 'Basketball - Original Flingern Fitness', 'description': '.', 'address': {'@type': 'PostalAddress', 'addressLocality': 'Düsseldorf, Germany', 'addressCountry': 'Germany', 'postalCode': '40235', 'streetAddress': 'Bruchstraße 78'}, 'telephone': '+44 15116350002', 'geo': {'@type': 'GeoCoordinates', 'latitude': '51.22899', 'longitude': '6.81979'}, 'priceRange': '-', 'image': 'https://storage.googleapis.com/download/storage/v1/b/usc-pro-uscweb-live-media/o/de-live%2Foriginal_1024x576_vlyukck2nk2wcokwh5fb_1716977752471491.png?generation=1716977752551979&amp;alt=media'}",51.22899,6.81979,.
Basketball - Outdoor Volksgarten,['Basketball'],False,"['Classic', 'Premium', 'Max']",Classic,Stadtbezirk 9,Stoffeler Kapellenweg 65,https://urbansportsclub.com//en/venues/basketball-outdoor-volksgarten,"{'@context': 'http://schema.org', '@type': 'LocalBusiness', 'name': 'Basketball - Outdoor Volksgarten', 'description': '.', 'address': {'@type': 'PostalAddress', 'addressLocality': 'Düsseldorf, Germany', 'addressCountry': 'Germany', 'postalCode': '40225', 'streetAddress': 'Stoffeler Kapellenweg 65'}, 'telephone': '+44 15116350002', 'geo': {'@type': 'GeoCoordinates', 'latitude': '51.20612', 'longitude': '6.8041074'}, 'priceRange': '-', 'image': 'https://storage.googleapis.com/download/storage/v1/b/usc-pro-uscweb-live-media/o/de-live%2Foriginal_1024x576_lc65xqbmspyzbkyw2hsv_1716977591809638.png?generation=1716977591899484&amp;alt=media'}",51.20612,6.8041074,.
Best Body Grevenbroich,['Fitness'],False,"['Essential', 'Classic', 'Premium', 'Max']",Essential,Grevenbroich,Orkener Straße 92,https://urbansportsclub.com//en/venues/best-body-grevenbroich,"{'@context': 'http://schema.org', '@type': 'LocalBusiness', 'name': 'Best Body Grevenbroich', 'description': 'Best Body Grevenbroich freut sich auf dich!', 'address': {'@type': 'PostalAddress', 'addressLocality': 'Düsseldorf, Germany', 'addressCountry': 'Germany', 'postalCode': '41515', 'streetAddress': 'Orkener Straße 92'}, 'telephone': '', 'geo': {'@type': 'GeoCoordinates', 'latitude': '51.0947558', 'longitude': '6.582051'}, 'priceRange': '-', 'image': 'https://storage.googleapis.com/download/storage/v1/b/usc-pro-uscweb-live-media/o/de-live%2Foriginal_1024x576_Fitness%20(5)_1702913145399279_admin.jpg?generation=1702913145481625&amp;alt=media'}",51.0947558,6.582051,Best Body Grevenbroich freut sich auf dich!
Biokinetic Lab Massagen @HQ,['Massage'],True,"['Premium', 'Max']",Premium,Stadtmitte,Schwerinstraße 17,https://urbansportsclub.com//en/venues/limitless-athletic-massagen-hq,"{'@context': 'http://schema.org', '@type': 'LocalBusiness', 'name': 'Biokinetic Lab Massagen @HQ', 'description': 'Functional Training x Sport Science Join our team for challenging and fun workouts around the city. Track your scores in our App, Measure your progress and Get detailed analysis of your overall fitness. Everyday is a different workout, strategically planned to optimize recovery and reduce injuries. Our programs have 3 components: - Prehab/Rehab/Restore - Functional Skills/Movement - Conditioning Move with confidence in your everyday life. Reduce pain, improve function.', 'address': {'@type': 'PostalAddress', 'addressLocality': 'Düsseldorf, Germany', 'addressCountry': 'Germany', 'postalCode': '40233', 'streetAddress': 'Gerresheimer Straße 86'}, 'telephone': '+49 176 97737286', 'geo': {'@type': 'GeoCoordinates', 'latitude': '51.2263556', 'longitude': '6.8003022'}, 'priceRange': '-', 'image': 'https://storage.googleapis.com/download/storage/v1/b/usc-pro-uscweb-live-media/o/de-live%2Foriginal_828x465_da09guz6i1po5e9mpldb_1701957492700308.png?generation=1701957492918101&amp;alt=media'}",51.2263556,6.8003022,"Functional Training x Sport Science Join our team for challenging and fun workouts around the city. Track your scores in our App, Measure your progress and Get detailed analysis of your overall fitness. Everyday is a different workout, strategically planned to optimize recovery and reduce injuries. Our programs have 3 components: - Prehab/Rehab/Restore - Functional Skills/Movement - Conditioning Move with confidence in your everyday life. Reduce pain, improve function."
BuggyFit Duisburg - Zoopark Düsseldorf,['Fitness'],False,"['Classic', 'Premium', 'Max']",Classic,Düsseltal,Ahnfeldstrasse 7,https://urbansportsclub.com//en/venues/buggyfit-duisburg-zoopark-dusseldorf,"{'@context': 'http://schema.org', '@type': 'LocalBusiness', 'name': 'BuggyFit Duisburg - Zoopark Düsseldorf', 'description': 'Die moderne Alternative für Mütter, die sich trotzdem sportlich betätigen wollen. Hier kannst du dich als Mitglied des Urban Sports Clubs auspowern, fit werden und Spaß haben. Die Kurse sind speziell auf die Bedüfnisse von werdenden bzw. jungen Mütter zugeschnitten. Kompetente und freundliche Trainer helfen dir, deine Ziele zu verwirklichen und stehen dir bei Fragen gerne zur Verfügung. Probier’ doch einfach mal einen Kurrs aus, lerne neue Freunde kennen und entdecke den Sport als Spaß für Mutter und Kind.', 'address': {'@type': 'PostalAddress', 'addressLocality': 'Düsseldorf, Germany', 'addressCountry': 'Germany', 'postalCode': '40239', 'streetAddress': 'Ahnfeldstrasse 7'}, 'telephone': '', 'geo': {'@type': 'GeoCoordinates', 'latitude': '51.2384671', 'longitude': '6.7982884'}, 'priceRange': '-', 'image': 'https://storage.googleapis.com/download/storage/v1/b/usc-pro-uscweb-live-media/o/de-live%2Foriginal_1024x576_BuggyFit_1675269741530236_admin.jpg?generation=1675269741616682&amp;alt=media'}",51.2384671,6.7982884,"Die moderne Alternative für Mütter, die sich trotzdem sportlich betätigen wollen. Hier kannst du dich als Mitglied des Urban Sports Clubs auspowern, fit werden und Spaß haben. Die Kurse sind speziell auf die Bedüfnisse von werdenden bzw. jungen Mütter zugeschnitten. Kompetente und freundliche Trainer helfen dir, deine Ziele zu verwirklichen und stehen dir bei Fragen gerne zur Verfügung. Probier’ doch einfach mal einen Kurrs aus, lerne neue Freunde kennen und entdecke den Sport als Spaß für Mutter und Kind."
Charalampos Tsirakidis,"['Boxing Sports', 'Functional Training', 'Traditional Asian Martial Arts']",False,"['Classic', 'Premium', 'Max']",Classic,Remscheid,Alleestr. 39,https://urbansportsclub.com//en/venues/ganbaru-rucken-und-gesundheitszentrum,"{'@context': 'http://schema.org', '@type': 'LocalBusiness', 'name': 'Charalampos Tsirakidis', 'description': 'Ganbaru Rücken und Gesundheitszentrum freut sich auf Dich!', 'address': {'@type': 'PostalAddress', 'addressLocality': 'Düsseldorf, Germany', 'addressCountry': 'Germany', 'postalCode': '42853', 'streetAddress': 'Alleestr. 39'}, 'telephone': '+49 2191 388020', 'geo': {'@type': 'GeoCoordinates', 'latitude': '51.18039', 'longitude': '7.19031'}, 'priceRange': '-', 'image': 'https://storage.googleapis.com/download/storage/v1/b/usc-pro-uscweb-live-media/o/de-live%2Foriginal_1688x950_Gesundheit_1578477684934736_admin.jpg?alt=media'}",51.18039,7.19031,Ganbaru Rücken und Gesundheitszentrum freut sich auf Dich!
Coach Diefke - Bewegungspark Meerbusch Bösinghoven,['Functional Training'],False,"['Classic', 'Premium', 'Max']",Classic,Meerbusch,Bewegungspark Meerbusch Boesinghoven,https://urbansportsclub.com//en/venues/coach-diefke-bewegungspark-meerbusch-bsinghoven,"{'@context': 'http://schema.org', '@type': 'LocalBusiness', 'name': 'Coach Diefke - Bewegungspark Meerbusch Bösinghoven', 'description': '', 'address': {'@type': 'PostalAddress', 'addressLocality': 'Düsseldorf, Germany', 'addressCountry': 'Germany', 'postalCode': '40668', 'streetAddress': 'Bewegungspark Meerbusch Boesinghoven'}, 'telephone': '', 'geo': {'@type': 'GeoCoordinates', 'latitude': '51.304501', 'longitude': '6.632118'}, 'priceRange': '-', 'image': 'https://storage.googleapis.com/download/storage/v1/b/usc-pro-uscweb-live-media/o/de-live%2Foriginal_1688x949_bzm95khvm5hcyci5r9ur_172250564731669.png?generation=1722505647151946&amp;alt=media'}",51.304501,6.632118,
Coach Diefke - Bewegungspark Meerbusch Büderich Am Eise,['Functional Training'],False,"['Classic', 'Premium', 'Max']",Classic,Meerbusch,Bewegungspark Meerbusch Buederich Am Eisenbrand,https://urbansportsclub.com//en/venues/coach-diefke-bewegungspark-meerbusch-bderich-am-eise,"{'@context': 'http://schema.org', '@type': 'LocalBusiness', 'name': 'Coach Diefke - Bewegungspark Meerbusch Büderich Am Eise', 'description': '', 'address': {'@type': 'PostalAddress', 'addressLocality': 'Düsseldorf, Germany', 'addressCountry': 'Germany', 'postalCode': '40667', 'streetAddress': 'Bewegungspark Meerbusch Buederich Am Eisenbrand'}, 'telephone': '', 'geo': {'@type': 'GeoCoordinates', 'latitude': '51.2455756', 'longitude': '6.6737525'}, 'priceRange': '-', 'image': 'https://storage.googleapis.com/download/storage/v1/b/usc-pro-uscweb-live-media/o/de-live%2Foriginal_1688x949_czih4vfoknzkuca9eqjp_1722505705464662.png?generation=1722505705581046&amp;alt=media'}",51.2455756,6.6737525,
Coach Diefke - Bewegungspark Meerbusch Lank-Latum,['Functional Training'],False,"['Classic', 'Premium', 'Max']",Classic,Meerbusch,Bewegungspark Meerbusch Lank-Latum,https://urbansportsclub.com//en/venues/coach-diefke-bewegungspark-meerbusch-lank-latum,"{'@context': 'http://schema.org', '@type': 'LocalBusiness', 'name': 'Coach Diefke - Bewegungspark Meerbusch Lank-Latum', 'description': '', 'address': {'@type': 'PostalAddress', 'addressLocality': 'Düsseldorf, Germany', 'addressCountry': 'Germany', 'postalCode': '40667', 'streetAddress': 'Bewegungspark Meerbusch Lank-Latum'}, 'telephone': '', 'geo': {'@type': 'GeoCoordinates', 'latitude': '51.3035764', 'longitude': '6.6705053'}, 'priceRange': '-', 'image': 'https://storage.googleapis.com/download/storage/v1/b/usc-pro-uscweb-live-media/o/de-live%2Foriginal_1688x949_hy7jytzhadpso9yfobhj_1722505692635678.png?generation=1722505692773876&amp;alt=media'}",51.3035764,6.6705053,
Coach Diefke - Bewegungspark Meerbusch Osterath,['Functional Training'],False,"['Classic', 'Premium', 'Max']",Classic,Meerbusch,Bewegungspark Meerbusch Osterath,https://urbansportsclub.com//en/venues/coach-diefke-bewegungspark-meerbusch-osterath,"{'@context': 'http://schema.org', '@type': 'LocalBusiness', 'name': 'Coach Diefke - Bewegungspark Meerbusch Osterath', 'description': '', 'address': {'@type': 'PostalAddress', 'addressLocality': 'Düsseldorf, Germany', 'addressCountry': 'Germany', 'postalCode': '40670', 'streetAddress': 'Bewegungspark Meerbusch Osterath'}, 'telephone': '', 'geo': {'@type': 'GeoCoordinates', 'latitude': '51.2742765', 'longitude': '6.6078254'}, 'priceRange': '-', 'image': 'https://storage.googleapis.com/download/storage/v1/b/usc-pro-uscweb-live-media/o/de-live%2Foriginal_1688x949_chv4hi6mry5qx05cnv1v_1722505619483716.png?generation=1722505619613949&amp;alt=media'}",51.2742765,6.6078254,
Coaching Sport - Mental Coaching für Sportler,"['Personal Training', 'Relaxation', 'Wellness']",False,"['Essential', 'Classic', 'Premium', 'Max']",Essential,Neuss,Further Straße 27,https://urbansportsclub.com//en/venues/coaching-sport-mental-coaching-fur-sportler,"{'@context': 'http://schema.org', '@type': 'LocalBusiness', 'name': 'Coaching Sport - Mental Coaching für Sportler', 'description': 'Wellness für den Verstand - so lautet unser Motto der Praxis für Mentaltraining und Philosophische Beratung. In unserem Kurz-Coaching kannst Du Dich mit der mentalen Seite deines Sports und deiner sportlichen Aktivität auseinandersetzen und besser auf deine nächste sportliche Herausforderung fokussieren. In unseren Kursen erfährst Du alles Wissenswerte zur mentalen Seite des Sports. Finde deinen sportlichen Fokus und erreiche deine Ziele mit deinem mentalen Training für Leistungs- und Hobby-Sportler. Hole Dir eine erste Einschätzung zu den mentalen Aspekten deines Sports ab, entwickele deine eigenen Gedanken oder Übungen mit uns gemeinsam weiter oder bereite Dich auf dein nächstes Turnier oder den nächsten Wettbewerb vor. Buche deinen Kurs direkt hier über App. Das Kurz-Coaching kannst Du über unsere Website https://coaching-sport.de buchen. Hier erhältst Du auch die Möglichkeit, rabattierte Einzelcoachings zu buchen. Gib dafür im Buchungsprozess deine Urban Sports Club Nummer an. Wir freuen uns auf Dich!', 'address': {'@type': 'PostalAddress', 'addressLocality': 'Düsseldorf, Germany', 'addressCountry': 'Germany', 'postalCode': '41462', 'streetAddress': 'Further Straße 27'}, 'telephone': '', 'geo': {'@type': 'GeoCoordinates', 'latitude': '51.2047839', 'longitude': '6.6805482'}, 'priceRange': '-', 'image': 'https://storage.googleapis.com/download/storage/v1/b/usc-pro-uscweb-live-media/o/de-live%2Foriginal_1024x576_coaching_sport_mentalcoaching_bild1_header_urban_sports-1024_576__1691653489486545_admin.png?generation=1691653489550251&amp;alt=media'}",51.2047839,6.6805482,"Wellness für den Verstand - so lautet unser Motto der Praxis für Mentaltraining und Philosophische Beratung. In unserem Kurz-Coaching kannst Du Dich mit der mentalen Seite deines Sports und deiner sportlichen Aktivität auseinandersetzen und besser auf deine nächste sportliche Herausforderung fokussieren. In unseren Kursen erfährst Du alles Wissenswerte zur mentalen Seite des Sports. Finde deinen sportlichen Fokus und erreiche deine Ziele mit deinem mentalen Training für Leistungs- und Hobby-Sportler. Hole Dir eine erste Einschätzung zu den mentalen Aspekten deines Sports ab, entwickele deine eigenen Gedanken oder Übungen mit uns gemeinsam weiter oder bereite Dich auf dein nächstes Turnier oder den nächsten Wettbewerb vor. Buche deinen Kurs direkt hier über App. Das Kurz-Coaching kannst Du über unsere Website https://coaching-sport.de buchen. Hier erhältst Du auch die Möglichkeit, rabattierte Einzelcoachings zu buchen. Gib dafür im Buchungsprozess deine Urban Sports Club Nummer an. Wir freuen uns auf Dich!"
Corefit - outdoor cross zone - Breddert,['Fitness'],False,"['Classic', 'Premium', 'Max']",Classic,Hilden,Breddert 2,https://urbansportsclub.com//en/venues/corefit-breddert,"{'@context': 'http://schema.org', '@type': 'LocalBusiness', 'name': 'Corefit - outdoor cross zone - Breddert', 'description': 'CoreFit bedeutet für uns &quot;stark von innen heraus&quot;. Wir glauben daran, dass ein starker Geist in einem starken Körper wohnen sollte und setzen auf genau diese Wechselwirkung: Es geht bei CoreFit nicht nur darum, sich “ab und zu mal zu bewegen... um was gemacht zu haben... wegen Gewissen und so ...”, sondern wir glauben, dass ein trainierter Körper dich darin unterstützt, den Ansprüchen deines Alltags gerecht zu werden – physischen wie mentalen.', 'address': {'@type': 'PostalAddress', 'addressLocality': 'Düsseldorf, Germany', 'addressCountry': 'Germany', 'postalCode': '40723', 'streetAddress': 'Breddert 2'}, 'telephone': '', 'geo': {'@type': 'GeoCoordinates', 'latitude': '51.1640293', 'longitude': '6.9510388'}, 'priceRange': '-', 'image': 'https://urbansportsclub.com/images/merchant/venueHome.jpg'}",51.1640293,6.9510388,"CoreFit bedeutet für uns &quot;stark von innen heraus&quot;. Wir glauben daran, dass ein starker Geist in einem starken Körper wohnen sollte und setzen auf genau diese Wechselwirkung: Es geht bei CoreFit nicht nur darum, sich “ab und zu mal zu bewegen... um was gemacht zu haben... wegen Gewissen und so ...”, sondern wir glauben, dass ein trainierter Körper dich darin unterstützt, den Ansprüchen deines Alltags gerecht zu werden – physischen wie mentalen."
Corefit - outdoor cross zone - Elberfelder Str.,['Fitness'],False,"['Classic', 'Premium', 'Max']",Classic,Hilden,Elberfelder Str. 175,https://urbansportsclub.com//en/venues/corefit-outdoor-cross-zone-elberfelder-str,"{'@context': 'http://schema.org', '@type': 'LocalBusiness', 'name': 'Corefit - outdoor cross zone - Elberfelder Str.', 'description': 'CoreFit bedeutet für uns &quot;stark von innen heraus&quot;. Wir glauben daran, dass ein starker Geist in einem starken Körper wohnen sollte und setzen auf genau diese Wechselwirkung: Es geht bei CoreFit nicht nur darum, sich “ab und zu mal zu bewegen... um was gemacht zu haben... wegen Gewissen und so ...”, sondern wir glauben, dass ein trainierter Körper dich darin unterstützt, den Ansprüchen deines Alltags gerecht zu werden – physischen wie mentalen.', 'address': {'@type': 'PostalAddress', 'addressLocality': 'Düsseldorf, Germany', 'addressCountry': 'Germany', 'postalCode': '40721', 'streetAddress': 'Elberfelder Str. 175'}, 'telephone': '', 'geo': {'@type': 'GeoCoordinates', 'latitude': '51.1774854', 'longitude': '6.9593162'}, 'priceRange': '-', 'image': 'https://storage.googleapis.com/download/storage/v1/b/usc-pro-uscweb-live-media/o/de-live%2Foriginal_1024x576_1a3f70a72274-2F4A2685ooo_1628500647654874_admin.jpg?generation=1628500647745644&amp;alt=media'}",51.1774854,6.9593162,"CoreFit bedeutet für uns &quot;stark von innen heraus&quot;. Wir glauben daran, dass ein starker Geist in einem starken Körper wohnen sollte und setzen auf genau diese Wechselwirkung: Es geht bei CoreFit nicht nur darum, sich “ab und zu mal zu bewegen... um was gemacht zu haben... wegen Gewissen und so ...”, sondern wir glauben, dass ein trainierter Körper dich darin unterstützt, den Ansprüchen deines Alltags gerecht zu werden – physischen wie mentalen."
