name,disciplines,plus_options,plans,min_plan,district,street,link,metadata,latitude,longitude,description
Studio für Bewegung,"['Fitness', 'Pilates', 'Yoga']",False,"['M', 'L', 'XL']",M,Niederrad,Güntherstraße 39,https://urbansportsclub.com//de/venues/studio-fur-bewegung,"{'@context': 'http://schema.org', '@type': 'LocalBusiness', 'name': 'Studio für Bewegung', 'description': 'Schon lange, seit 1983 kann man sich im Studio für Bewegung in Niederrad austoben. Ob Aerobic-, Kraft- oder Yoga-Kurse im großzügigen und hellen Kursraum oder Kraft- und Ausdauertraining im angeschlossenen Geräteraum – das Studio hat seit seiner ersten Eröffnung viele Veränderungen, Anpassungen und Modernisierungen erfahren, doch eines ist geblieben: Persönliche und individuelle Betreuung und Beratung. Christoph Striefler, Inhaber und Seele des Studios kümmert sich mit Fachkompetenz, Herz und viel Erfahrung um seine Kunden und legt großen wert darauf ausschließlich Profis in seinem Team zu beschäftigen. Und wenn du dann nach deinem Training entspannen willst steht dir der Saunabereich samt Ruhezone zur Verfügung. xa0 Eine Runde Sache also für deine sportlichen Ziele und deine Gesundheit. Das Team in Niederrad freut sich auf dich!', 'address': {'@type': 'PostalAddress', 'addressLocality': 'Frankfurt, Germany', 'addressCountry': 'Germany', 'postalCode': '60528', 'streetAddress': 'Güntherstraße 39'}, 'telephone': '+49 69 91316925', 'geo': {'@type': 'GeoCoordinates', 'latitude': '50.0822717', 'longitude': '8.6468357'}, 'priceRange': '-', 'image': 'https://storage.googleapis.com/download/storage/v1/b/usc-pro-uscweb-live-media/o/de-live%2Foriginal_1024x576_Bildschirmfoto%202017-09-05%20um%2014.44.10.png?alt=media'}",50.0822717,8.6468357,"Schon lange, seit 1983 kann man sich im Studio für Bewegung in Niederrad austoben. Ob Aerobic-, Kraft- oder Yoga-Kurse im großzügigen und hellen Kursraum oder Kraft- und Ausdauertraining im angeschlossenen Geräteraum – das Studio hat seit seiner ersten Eröffnung viele Veränderungen, Anpassungen und Modernisierungen erfahren, doch eines ist geblieben: Persönliche und individuelle Betreuung und Beratung. Christoph Striefler, Inhaber und Seele des Studios kümmert sich mit Fachkompetenz, Herz und viel Erfahrung um seine Kunden und legt großen wert darauf ausschließlich Profis in seinem Team zu beschäftigen. Und wenn du dann nach deinem Training entspannen willst steht dir der Saunabereich samt Ruhezone zur Verfügung. xa0 Eine Runde Sache also für deine sportlichen Ziele und deine Gesundheit. Das Team in Niederrad freut sich auf dich!"
PRIME TIME fitness - Frankfurt Main Tower,['Fitness'],False,"['M', 'L', 'XL']",M,Bahnhofsviertel,Neue Mainzer Straße 52-58,https://urbansportsclub.com//de/venues/prime-time-fitness-frankfurt-main-tower,"{'@context': 'http://schema.org', '@type': 'LocalBusiness', 'name': 'PRIME TIME fitness - Frankfurt Main Tower', 'description': 'PRIME TIME fitness freut sich auf Dich!', 'address': {'@type': 'PostalAddress', 'addressLocality': 'Frankfurt, Germany', 'addressCountry': 'Germany', 'postalCode': '60311', 'streetAddress': 'Neue Mainzer Straße 52-58'}, 'telephone': '', 'geo': {'@type': 'GeoCoordinates', 'latitude': '50.11254', 'longitude': '8.67214'}, 'priceRange': '-', 'image': 'https://storage.googleapis.com/download/storage/v1/b/usc-pro-uscweb-live-media/o/de-live%2Foriginal_2000x1125_Leon%20Milon%20Main%20Tower_wei%C3%9F_2-2_1630327207176449_admin.jpg?generation=1630327207297915&amp;alt=media'}",50.11254,8.67214,PRIME TIME fitness freut sich auf Dich!
Fitnesscenter Riedbad Bergen-Enkheim,"['Fahrrad fahren', 'Fitness', 'Funktionelles Training', 'Indoorcycling', 'Pilates', 'Yoga']",False,"['M', 'L', 'XL']",M,Bergen-Enkheim,Fritz-Schubert-Ring 2,https://urbansportsclub.com//de/venues/fitnesscenter-riedbad-bergen-enkheim,"{'@context': 'http://schema.org', '@type': 'LocalBusiness', 'name': 'Fitnesscenter Riedbad Bergen-Enkheim', 'description': 'Fitnesscenter Titus Therme &amp; Riedbad Bergen-Enkheim freuen sich auf Dich!', 'address': {'@type': 'PostalAddress', 'addressLocality': 'Frankfurt, Germany', 'addressCountry': 'Germany', 'postalCode': '60388', 'streetAddress': 'Fritz-Schubert-Ring 2'}, 'telephone': '', 'geo': {'@type': 'GeoCoordinates', 'latitude': '50.1509814', 'longitude': '8.7653062'}, 'priceRange': '-', 'image': 'https://storage.googleapis.com/download/storage/v1/b/usc-pro-uscweb-live-media/o/de-live%2Foriginal_1686x948_fitnesscompressed_1559031811403684_admin.jpg?alt=media'}",50.1509814,8.7653062,Fitnesscenter Titus Therme &amp; Riedbad Bergen-Enkheim freuen sich auf Dich!
Day Night Sports Marburg,['Fitness'],False,"['S', 'M', 'L', 'XL']",S,Marburg,Afföller Straße 98,https://urbansportsclub.com//de/venues/day-night-sports-marburg,"{'@context': 'http://schema.org', '@type': 'LocalBusiness', 'name': 'Day Night Sports Marburg', 'description': 'Völlig neue Trainingsmethoden erlauben es dir Ziele und Grenzen zu erreichen, welche für dich vorher unerreichbar schienen. Fordere dich mit funktionellem Training im DNS Cross-Bereich, forme deinen Körper im umfangreichen Gerätepark, verbrenne Kalorien auf zahlreichen Cardiogeräten, trainiere ungestört in der separaten Ladycorner oder power dich in einem der zahlreichen Kurse (u.a. von Les Mills) aus. Erfahre es selbst und mache deinen Körper zum Mittelpunkt deiner eigenen Erfolgsgeschichte! Unser motiviertes Team unterstützt dich bei der Erreichung deiner individuellen Ziele. Ob Trainings- oder Ernährungsfragen, mit uns stehen dir kompetente Trainer zur Seite, die gemeinsam mit dir die Verwirklichung deiner Ziele planen und dich auf deinem Weg begleiten.', 'address': {'@type': 'PostalAddress', 'addressLocality': 'Frankfurt, Germany', 'addressCountry': 'Germany', 'postalCode': '35039', 'streetAddress': 'Afföller Straße 98'}, 'telephone': '', 'geo': {'@type': 'GeoCoordinates', 'latitude': '50.831716', 'longitude': '8.7694789'}, 'priceRange': '-', 'image': 'https://storage.googleapis.com/download/storage/v1/b/usc-pro-uscweb-live-media/o/de-live%2Foriginal_2000x1125_DSC08853%20(1)_1657817214778146_admin.jpg?generation=1657817214838328&amp;alt=media'}",50.831716,8.7694789,"Völlig neue Trainingsmethoden erlauben es dir Ziele und Grenzen zu erreichen, welche für dich vorher unerreichbar schienen. Fordere dich mit funktionellem Training im DNS Cross-Bereich, forme deinen Körper im umfangreichen Gerätepark, verbrenne Kalorien auf zahlreichen Cardiogeräten, trainiere ungestört in der separaten Ladycorner oder power dich in einem der zahlreichen Kurse (u.a. von Les Mills) aus. Erfahre es selbst und mache deinen Körper zum Mittelpunkt deiner eigenen Erfolgsgeschichte! Unser motiviertes Team unterstützt dich bei der Erreichung deiner individuellen Ziele. Ob Trainings- oder Ernährungsfragen, mit uns stehen dir kompetente Trainer zur Seite, die gemeinsam mit dir die Verwirklichung deiner Ziele planen und dich auf deinem Weg begleiten."
Clever fit Fitnessstudio Neu-Isenburg,['Fitness'],False,"['M', 'L', 'XL']",M,Neu Isenburg,Frankfurter Str. 175-181,https://urbansportsclub.com//de/venues/clever-fit-fitnessstudio-neu-isenburg,"{'@context': 'http://schema.org', '@type': 'LocalBusiness', 'name': 'Clever fit Fitnessstudio Neu-Isenburg', 'description': 'WILLKOMMEN IM CLEVER FIT FITNESSSTUDIO Neu-Isenburg Clever fit ist das standortstärkste Fitnessstudio in Deutschland und bietet dir alles was du für dein persönliches Workout in Neu-Isenburg brauchst: Ausdauertraining, Kraftsport und Gerätetraining mit modernsten Geräten für Profis und für Einsteiger. Unterstütze deine Diät mit Muskelaufbau um schneller abzunehmen. Unterstütze dein Immun- und Herz-Kreislauf-System mit Cardio-Training. Unsere geschulten Mitarbeiter erstellen dir auf Wunsch einen Trainingsplan um dein persönliches Ziel schnell zu erreichen. Unsere Tarife beinhalten kostenlose Parkplätze und kostenlose Getränke. Im Solarium kannst du dir deine Portion Vitamin D abholen. Und mit unserer Massageliege kannst du nach dem Training deine Muskulatur Entspannen lassen.', 'address': {'@type': 'PostalAddress', 'addressLocality': 'Frankfurt, Germany', 'addressCountry': 'Germany', 'postalCode': '63263', 'streetAddress': 'Frankfurter Str. 175-181'}, 'telephone': '+49 6102 3528324', 'geo': {'@type': 'GeoCoordinates', 'latitude': '50.0484556', 'longitude': '8.6949936'}, 'priceRange': '-', 'image': 'https://storage.googleapis.com/download/storage/v1/b/usc-pro-uscweb-live-media/o/de-live%2Foriginal_5120x2880_3002a56d867f-IMG_20220422_171900_166314337497421_admin.jpg?generation=1663143374339067&amp;alt=media'}",50.0484556,8.6949936,"WILLKOMMEN IM CLEVER FIT FITNESSSTUDIO Neu-Isenburg Clever fit ist das standortstärkste Fitnessstudio in Deutschland und bietet dir alles was du für dein persönliches Workout in Neu-Isenburg brauchst: Ausdauertraining, Kraftsport und Gerätetraining mit modernsten Geräten für Profis und für Einsteiger. Unterstütze deine Diät mit Muskelaufbau um schneller abzunehmen. Unterstütze dein Immun- und Herz-Kreislauf-System mit Cardio-Training. Unsere geschulten Mitarbeiter erstellen dir auf Wunsch einen Trainingsplan um dein persönliches Ziel schnell zu erreichen. Unsere Tarife beinhalten kostenlose Parkplätze und kostenlose Getränke. Im Solarium kannst du dir deine Portion Vitamin D abholen. Und mit unserer Massageliege kannst du nach dem Training deine Muskulatur Entspannen lassen."
Fitness World Rodgau,['Fitness'],False,"['M', 'L', 'XL']",M,Rodgau,Borsigstr. 3-5,https://urbansportsclub.com//de/venues/fitness-world-rodgau,"{'@context': 'http://schema.org', '@type': 'LocalBusiness', 'name': 'Fitness World Rodgau', 'description': 'Die Fitness World Rodgau freut sich auf Dich!', 'address': {'@type': 'PostalAddress', 'addressLocality': 'Frankfurt, Germany', 'addressCountry': 'Germany', 'postalCode': '63110', 'streetAddress': 'Borsigstr. 3-5'}, 'telephone': '', 'geo': {'@type': 'GeoCoordinates', 'latitude': '49.9930841', 'longitude': '8.8711841'}, 'priceRange': '-', 'image': 'https://storage.googleapis.com/download/storage/v1/b/usc-pro-uscweb-live-media/o/de-live%2Foriginal_4000x2250_ccc8f1133e8e-20220214_154452_1646127347548423_admin.jpg?generation=1646127347687825&amp;alt=media'}",49.9930841,8.8711841,Die Fitness World Rodgau freut sich auf Dich!
Meine Sportzeit,['Fitness'],False,"['M', 'L', 'XL']",M,Limburg an der Lahn,Bahnhofspl. 2,https://urbansportsclub.com//de/venues/sportivo-limburg,"{'@context': 'http://schema.org', '@type': 'LocalBusiness', 'name': 'Meine Sportzeit', 'description': 'Wir sind Eure Spezialisten rund um gesundheitsorientiertes Fitnesstraining in Limburg. Endlich abnehmen, etwas für die eigene Gesundheit tun, die Leistungsfähigkeit steigern und bis ins hohe Alter beweglich bleiben: In Meine SportZEIT findet ihr alles, was ihr dafür braucht. Auf zwei Etagen mit 14 Studiobereichen bieten wir Functional Fitness auf unserem kultigen „Gleis8“ Functional Bereich, einen moderner Milon Zirkel, einen Five Mobilitätszirkel, einen großzügigen und multifunktionaler Kursraum mit Kursen wie Les Mills Bodypump, Yoga, Jumping Fitness, Yoga, Zumba,… eine Kurs- und Fitnessterrasse, ein Wellness- und Spa-Paradies mit Atriumgarten und vieles mehr! Erlebt die einzigartigen Möglichkeiten in unserem Fitnessclub in Limburg und startet mit uns in ein aktives Leben - wir freuen uns darauf, Euch auf Eurem Weg begleiten zu dürfen! Aktuelles findet ihr auch auf Facebook und Instagram: sportzeit_limburg Bis bald in Meine SportZEIT!', 'address': {'@type': 'PostalAddress', 'addressLocality': 'Frankfurt, Germany', 'addressCountry': 'Germany', 'postalCode': '65549', 'streetAddress': 'Bahnhofspl. 2'}, 'telephone': '', 'geo': {'@type': 'GeoCoordinates', 'latitude': '50.3848228', 'longitude': '8.0607961'}, 'priceRange': '-', 'image': 'https://storage.googleapis.com/download/storage/v1/b/usc-pro-uscweb-live-media/o/de-live%2Foriginal_1159x652_09._161717495378674_admin.png?alt=media'}",50.3848228,8.0607961,"Wir sind Eure Spezialisten rund um gesundheitsorientiertes Fitnesstraining in Limburg. Endlich abnehmen, etwas für die eigene Gesundheit tun, die Leistungsfähigkeit steigern und bis ins hohe Alter beweglich bleiben: In Meine SportZEIT findet ihr alles, was ihr dafür braucht. Auf zwei Etagen mit 14 Studiobereichen bieten wir Functional Fitness auf unserem kultigen „Gleis8“ Functional Bereich, einen moderner Milon Zirkel, einen Five Mobilitätszirkel, einen großzügigen und multifunktionaler Kursraum mit Kursen wie Les Mills Bodypump, Yoga, Jumping Fitness, Yoga, Zumba,… eine Kurs- und Fitnessterrasse, ein Wellness- und Spa-Paradies mit Atriumgarten und vieles mehr! Erlebt die einzigartigen Möglichkeiten in unserem Fitnessclub in Limburg und startet mit uns in ein aktives Leben - wir freuen uns darauf, Euch auf Eurem Weg begleiten zu dürfen! Aktuelles findet ihr auch auf Facebook und Instagram: sportzeit_limburg Bis bald in Meine SportZEIT!"
BLACK BOX TRAINING,['Fitness'],False,"['M', 'L', 'XL']",M,Rödelheim,Rödelheimer Bahnweg 21,https://urbansportsclub.com//de/venues/studio-black-box,"{'@context': 'http://schema.org', '@type': 'LocalBusiness', 'name': 'BLACK BOX TRAINING', 'description': 'AMIGA Frauenfitness Rödelheim: Modern und zeitlos elegant: Auf den 650 Quadratmetern unseres Studios in Frankfurt-Rödelheim finden Sie viel Platz für Training und Entspannung. Das Angebot wird ständig auf dem neuesten Stand gehalten und ergänzt. Aktuelles Highlight: der Express Workout-Circle, mit dem Sie in nur zwanzig Minuten ein effektives Kraft-Ausdauer-Training bekommen. Für’s Wohlfühlen und Relaxen sorgt unser stilvoller Wellnessbereich mit Sauna, Dampfbad und Massage. „Alles dafür tun, dass unsere Kundinnen wirklich abschalten können. Das ist unser Prinzip und das perfektionieren wir laufend.“ AMIGA Women Fitness Bockenheim: Unser Fitnessstudio in Frankfurt-Bockenheim liegt gleich neben der Universität – und trotzdem geht hier probieren über studieren! Auf über 600 Quadratmeter Fläche und in inspirierendem Ambiente bieten wir Frauen Gelegenheit, mit viel Spaß Erfolgserlebnisse beim Trainieren zu gewinnen. Ein mitreißendes Kursprogramm sorgt für Vielfalt und Abwechslung und unterstützt unsere Kundinnen dabei, immer wieder Selbstbewusstsein und Fitness zu tanken. „Wenn unsere Mitglieder vom Alltag gestresst zu uns kommen und entspannt, glücklich und mit einem Lächeln wieder gehen, wissen wir, dass wir hier das Wesentliche richtig machen.“ AMIGA Women Fitness Black Box Training: In der BLACKBOX erlebst du ein 45 minütiges hoch intensives und dynamisches Intervalltraining mit Nachbrenneffekt in einer Small Group Class (max. 8 Personen). Durch die hohe Intensität hast du ein effektives und effizientes Training mit hohem Kalorienverbrauch (bis zu 1.000 kcal) bei geringem Zeitaufwand. Und zusätzlich noch viel Spaß beim Gruppentraining. ROOM45 ist ein interaktives, motivierendes und vielseitiges neues HIIT-Trainingsprogramm für Männer und Frauen, bei dem abwechselnd Schnelligkeit, Beweglichkeit, Mobilität und Kraft trainiert werden. Hoher Kalorienverbrach (bis zu 1.000 kcal) und Spaß garantiert. ROOM45 spricht alle Sinne an und kombiniert hochintensives 45 minütiges Small Group Training + Challenges in einem multisensorischen Training Room mit Music + Light + Fun.', 'address': {'@type': 'PostalAddress', 'addressLocality': 'Frankfurt, Germany', 'addressCountry': 'Germany', 'postalCode': '60489', 'streetAddress': 'Rödelheimer Bahnweg 21'}, 'telephone': '', 'geo': {'@type': 'GeoCoordinates', 'latitude': '50.12523', 'longitude': '8.60722'}, 'priceRange': '-', 'image': 'https://storage.googleapis.com/download/storage/v1/b/usc-pro-uscweb-live-media/o/de-live%2Foriginal_1100x619_b4251b81735b-Blackbox_Urban2_1563128730919340_admin.jpg?alt=media'}",50.12523,8.60722,"AMIGA Frauenfitness Rödelheim: Modern und zeitlos elegant: Auf den 650 Quadratmetern unseres Studios in Frankfurt-Rödelheim finden Sie viel Platz für Training und Entspannung. Das Angebot wird ständig auf dem neuesten Stand gehalten und ergänzt. Aktuelles Highlight: der Express Workout-Circle, mit dem Sie in nur zwanzig Minuten ein effektives Kraft-Ausdauer-Training bekommen. Für’s Wohlfühlen und Relaxen sorgt unser stilvoller Wellnessbereich mit Sauna, Dampfbad und Massage. „Alles dafür tun, dass unsere Kundinnen wirklich abschalten können. Das ist unser Prinzip und das perfektionieren wir laufend.“ AMIGA Women Fitness Bockenheim: Unser Fitnessstudio in Frankfurt-Bockenheim liegt gleich neben der Universität – und trotzdem geht hier probieren über studieren! Auf über 600 Quadratmeter Fläche und in inspirierendem Ambiente bieten wir Frauen Gelegenheit, mit viel Spaß Erfolgserlebnisse beim Trainieren zu gewinnen. Ein mitreißendes Kursprogramm sorgt für Vielfalt und Abwechslung und unterstützt unsere Kundinnen dabei, immer wieder Selbstbewusstsein und Fitness zu tanken. „Wenn unsere Mitglieder vom Alltag gestresst zu uns kommen und entspannt, glücklich und mit einem Lächeln wieder gehen, wissen wir, dass wir hier das Wesentliche richtig machen.“ AMIGA Women Fitness Black Box Training: In der BLACKBOX erlebst du ein 45 minütiges hoch intensives und dynamisches Intervalltraining mit Nachbrenneffekt in einer Small Group Class (max. 8 Personen). Durch die hohe Intensität hast du ein effektives und effizientes Training mit hohem Kalorienverbrauch (bis zu 1.000 kcal) bei geringem Zeitaufwand. Und zusätzlich noch viel Spaß beim Gruppentraining. ROOM45 ist ein interaktives, motivierendes und vielseitiges neues HIIT-Trainingsprogramm für Männer und Frauen, bei dem abwechselnd Schnelligkeit, Beweglichkeit, Mobilität und Kraft trainiert werden. Hoher Kalorienverbrach (bis zu 1.000 kcal) und Spaß garantiert. ROOM45 spricht alle Sinne an und kombiniert hochintensives 45 minütiges Small Group Training + Challenges in einem multisensorischen Training Room mit Music + Light + Fun."
Clever Fit Friedberg,['Fitness'],False,"['S', 'M', 'L', 'XL']",S,Friedberg (Hessen),Hanauer Straße 39,https://urbansportsclub.com//de/venues/clever-fit-friedberg,"{'@context': 'http://schema.org', '@type': 'LocalBusiness', 'name': 'Clever Fit Friedberg', 'description': 'Clever Fit Friedberg freut sich auf dich!', 'address': {'@type': 'PostalAddress', 'addressLocality': 'Frankfurt, Germany', 'addressCountry': 'Germany', 'postalCode': '61169', 'streetAddress': 'Hanauer Straße 39'}, 'telephone': '', 'geo': {'@type': 'GeoCoordinates', 'latitude': '50.3328526', 'longitude': '8.7594074'}, 'priceRange': '-', 'image': 'https://storage.googleapis.com/download/storage/v1/b/usc-pro-uscweb-live-media/o/de-live%2Foriginal_1280x720_7e5cd4ed27fb-PHOTO_2021_09_23_20_46_14_1648210876879233_admin.jpg?generation=1648210876989803&amp;alt=media'}",50.3328526,8.7594074,Clever Fit Friedberg freut sich auf dich!
Studio Fitness Büdingen,['Fitness'],False,"['S', 'M', 'L', 'XL']",S,Harheim,Industriestraße 35,https://urbansportsclub.com//de/venues/studio-fitness-budingen,"{'@context': 'http://schema.org', '@type': 'LocalBusiness', 'name': 'Studio Fitness Büdingen', 'description': 'STUDIO FITNESS – GENIAL.GUT.GÜNSTIG Genial.Gut.Günstig – Unser Slogan ist unser Anspruch. Trainiere ab sofort im Studio Fitness in Büdingen, Gerlingen, Leonberg oder Weilimdorf. Fitness Training in angenehmer Atmosphäre, in einem top ausgestatteten Studio und das zum günstigen Preis. TRAINING Exklusive und moderne Kraft- sowie Ausdauergeräte machen das Training im Studio Fitness zu einem Erlebnis. Teste neue Trainingsmethoden, trainiere einzelne Muskelgruppen oder ganzheitliche Bewegungsmuster. Bei uns hast du die Auswahl, so dass es nie langweilig wird. Egal, ob du ein Training an Geräten, mit freien Gewichten, im Cardio- oder funktionellen Bereich bevorzugst – für jeden Geschmack ist etwas dabei. Studio Fitness Training LEISTUNGEN Fitness and more. Im Studio Fitness werden dir nicht nur Geräte und Hanteln geboten, sondern es gibt weitere Leistungen, die du beim Training genießen kannst. Zum Beispiel kostenloses WLAN, das dir die Möglichkeit gibt, auch während deinem Training online Musik zu hören. Unsere Wasser- und Mineralbar sorgt dafür, dass dein Flüssigkeitshaushalt ausgeglichen werden kann - und vieles mehr.', 'address': {'@type': 'PostalAddress', 'addressLocality': 'Frankfurt, Germany', 'addressCountry': 'Germany', 'postalCode': '63654', 'streetAddress': 'Industriestraße 35'}, 'telephone': '', 'geo': {'@type': 'GeoCoordinates', 'latitude': '50.2710655', 'longitude': '9.1092047'}, 'priceRange': '-', 'image': 'https://storage.googleapis.com/download/storage/v1/b/usc-pro-uscweb-live-media/o/de-live%2Foriginal_1024x576_leistungen.jpg?alt=media'}",50.2710655,9.1092047,"STUDIO FITNESS – GENIAL.GUT.GÜNSTIG Genial.Gut.Günstig – Unser Slogan ist unser Anspruch. Trainiere ab sofort im Studio Fitness in Büdingen, Gerlingen, Leonberg oder Weilimdorf. Fitness Training in angenehmer Atmosphäre, in einem top ausgestatteten Studio und das zum günstigen Preis. TRAINING Exklusive und moderne Kraft- sowie Ausdauergeräte machen das Training im Studio Fitness zu einem Erlebnis. Teste neue Trainingsmethoden, trainiere einzelne Muskelgruppen oder ganzheitliche Bewegungsmuster. Bei uns hast du die Auswahl, so dass es nie langweilig wird. Egal, ob du ein Training an Geräten, mit freien Gewichten, im Cardio- oder funktionellen Bereich bevorzugst – für jeden Geschmack ist etwas dabei. Studio Fitness Training LEISTUNGEN Fitness and more. Im Studio Fitness werden dir nicht nur Geräte und Hanteln geboten, sondern es gibt weitere Leistungen, die du beim Training genießen kannst. Zum Beispiel kostenloses WLAN, das dir die Möglichkeit gibt, auch während deinem Training online Musik zu hören. Unsere Wasser- und Mineralbar sorgt dafür, dass dein Flüssigkeitshaushalt ausgeglichen werden kann - und vieles mehr."
Silvio Minakawa,['Fitness'],False,"['M', 'L', 'XL']",M,Hausen,Grüneburgpark,https://urbansportsclub.com//de/venues/primal-movement,"{'@context': 'http://schema.org', '@type': 'LocalBusiness', 'name': 'Silvio Minakawa', 'description': 'Primal Movement bietet vielseitiges Outdoor Kleingruppentraining nach dem Movnat - Prinzip bzw. nach der Méthode Naturelle, der Vorläuferbewegung des Parkour. Entsprechend finden sich viele Elemente des Parkour, Obstacle Course Running, Calisthenics, Ninja Sport, aber auch Kampfsport und Strongman wieder. Durch intelligentes Scaling können wir unter trotz individueller Unterschiede gemeinsam trainieren, denn Gemeinschaft ist ein wichtiger Bestandteil unseres Konzepts. Eine Einheit beinhaltet klassisch 1) Aktivierung 2) technischer Schwerpunkt wie z.B. Seilklettertechniken oder Hebetechniken aber auch Flowtools 3) Combo, also ein relativ technischer Stationszirkel ähnlich einem Crossfit WOD und 4) Ausklang und Ausblick', 'address': {'@type': 'PostalAddress', 'addressLocality': 'Frankfurt, Germany', 'addressCountry': 'Germany', 'postalCode': '60323', 'streetAddress': 'Grüneburgpark'}, 'telephone': '+49 178 5083507', 'geo': {'@type': 'GeoCoordinates', 'latitude': '50.1273707', 'longitude': '8.6616409'}, 'priceRange': '-', 'image': 'https://storage.googleapis.com/download/storage/v1/b/usc-pro-uscweb-live-media/o/de-live%2Foriginal_1487x836_primal%20movement_1592546782182337_admin.jpg?alt=media'}",50.1273707,8.6616409,"Primal Movement bietet vielseitiges Outdoor Kleingruppentraining nach dem Movnat - Prinzip bzw. nach der Méthode Naturelle, der Vorläuferbewegung des Parkour. Entsprechend finden sich viele Elemente des Parkour, Obstacle Course Running, Calisthenics, Ninja Sport, aber auch Kampfsport und Strongman wieder. Durch intelligentes Scaling können wir unter trotz individueller Unterschiede gemeinsam trainieren, denn Gemeinschaft ist ein wichtiger Bestandteil unseres Konzepts. Eine Einheit beinhaltet klassisch 1) Aktivierung 2) technischer Schwerpunkt wie z.B. Seilklettertechniken oder Hebetechniken aber auch Flowtools 3) Combo, also ein relativ technischer Stationszirkel ähnlich einem Crossfit WOD und 4) Ausklang und Ausblick"
Ki Sports,['Fitness'],False,"['M', 'L', 'XL']",M,Hünfeld,Fuldaer Str. 52,https://urbansportsclub.com//de/venues/ki-sports,"{'@context': 'http://schema.org', '@type': 'LocalBusiness', 'name': 'Ki Sports', 'description': 'Gesundheit zum anfassen - Modernste Ausstattung mit Loftcharakter Ki Sports ist mehr als nur eine „Muckibude“. Auf 3 Etagen und über 2000qm möchten Wir Ihnen ein breit gefächertes Sport- und Erholungsangebot zur Verfügung stellen. Vom Spa-Bereich, über ausreichend Parkplätze, bis hin zur Ki Sports Lounge lassen wir nichts vermissen.', 'address': {'@type': 'PostalAddress', 'addressLocality': 'Frankfurt, Germany', 'addressCountry': 'Germany', 'postalCode': '36088', 'streetAddress': 'Fuldaer Str. 52'}, 'telephone': '', 'geo': {'@type': 'GeoCoordinates', 'latitude': '50.6626496', 'longitude': '9.7544256'}, 'priceRange': '-', 'image': 'https://storage.googleapis.com/download/storage/v1/b/usc-pro-uscweb-live-media/o/de-live%2Foriginal_1024x576_3bf6553d83b9-Zeichenfl%C3%A4che_1_1664352477810896_admin.png?generation=1664352478031962&amp;alt=media'}",50.6626496,9.7544256,"Gesundheit zum anfassen - Modernste Ausstattung mit Loftcharakter Ki Sports ist mehr als nur eine „Muckibude“. Auf 3 Etagen und über 2000qm möchten Wir Ihnen ein breit gefächertes Sport- und Erholungsangebot zur Verfügung stellen. Vom Spa-Bereich, über ausreichend Parkplätze, bis hin zur Ki Sports Lounge lassen wir nichts vermissen."
