name,disciplines,plus_options,plans,min_plan,district,street,link,metadata,latitude,longitude,description
EMS-Lounge Gelnhausen-Zentrum,"['EMS', 'EMS Cardio']",True,"['L', 'XL']",L,Langenselbold,Im Ziegelhaus 26,https://urbansportsclub.com//de/venues/ems-lounge-gelnhausen-zentrum,"{'@context': 'http://schema.org', '@type': 'LocalBusiness', 'name': 'EMS-Lounge Gelnhausen-Zentrum', 'description': 'Freue dich auf deine persönliche Betreuung durch nette und kompetente Personal Trainer in der EMS-Lounge® Gelnhausen-Zentrum. Dich erwarten neben einer modernen Studioeinrichtung sowie den neuesten Geräte, saubere Umkleiden und Duschen. Vor dem Training solltest du ausreichend Flüssigkeit und eine Kleinigkeit zu Essen zu dir genommen haben. Auch im Nachhinein ist es wichtig, dass du ausreichend trinkst und deinem Körper die nötigen Ruhephasen gönnst. Du sollst dich wohlfühlen! EMS-LOUNGE® GELNHAUSEN-ZENTRUM: MIT DEINEM PERSONAL TRAINER INDIVIDUELLE ERFOLGE ERZIELEN! Mit komplexem EMS-Training können in wenigen Wochen Ergebnisse erzielt werden, für die beim klassischen Krafttraining regelmäßige stundenlange Einheiten nötig sind. Im Gegensatz zu konventionellem Krafttraining, wird dabei die Tiefenmuskulatur angesprochen, die sonst nur schwer zu erreichen ist. So kann gezielt die allgemeine Fitness und Leistungsfähigkeit positiv beeinflusst und auch die Rückenmuskulatur gestärkt werden. Du trainierst mit maximal einer anderen Person zusammen, sodass sich dein Personal Trainer ganz auf dich konzentrieren kann und dir Übungen zeigt, die auf deine individuellen Wünsche und Ziele zugeschnitten sind. Feiere selbst deine eigenen Erfolge und das mit nur 20 Minuten Training pro Woche. Komm vorbei! Deine EMS-Lounge® liegt im Zentrum der Barbarossastadt Gelnhausen, nur drei Minuten Fußweg vom Bahnhof entfernt. Direkt in der Hailerer Straße 6 findest du auch Parkmöglichkeiten. Wir freuen uns auf dich!', 'address': {'@type': 'PostalAddress', 'addressLocality': 'Frankfurt, Germany', 'addressCountry': 'Germany', 'postalCode': '63571', 'streetAddress': 'Im Ziegelhaus 26'}, 'telephone': '', 'geo': {'@type': 'GeoCoordinates', 'latitude': '50.1980075', 'longitude': '9.1908713'}, 'priceRange': '-', 'image': 'https://storage.googleapis.com/download/storage/v1/b/usc-pro-uscweb-live-media/o/de-live%2Foriginal_2021x1137_c9cdd36c1661-Testsieger_Service_1638370096941469_admin.jpg?generation=1638370097258035&amp;alt=media'}",50.1980075,9.1908713,"Freue dich auf deine persönliche Betreuung durch nette und kompetente Personal Trainer in der EMS-Lounge® Gelnhausen-Zentrum. Dich erwarten neben einer modernen Studioeinrichtung sowie den neuesten Geräte, saubere Umkleiden und Duschen. Vor dem Training solltest du ausreichend Flüssigkeit und eine Kleinigkeit zu Essen zu dir genommen haben. Auch im Nachhinein ist es wichtig, dass du ausreichend trinkst und deinem Körper die nötigen Ruhephasen gönnst. Du sollst dich wohlfühlen! EMS-LOUNGE® GELNHAUSEN-ZENTRUM: MIT DEINEM PERSONAL TRAINER INDIVIDUELLE ERFOLGE ERZIELEN! Mit komplexem EMS-Training können in wenigen Wochen Ergebnisse erzielt werden, für die beim klassischen Krafttraining regelmäßige stundenlange Einheiten nötig sind. Im Gegensatz zu konventionellem Krafttraining, wird dabei die Tiefenmuskulatur angesprochen, die sonst nur schwer zu erreichen ist. So kann gezielt die allgemeine Fitness und Leistungsfähigkeit positiv beeinflusst und auch die Rückenmuskulatur gestärkt werden. Du trainierst mit maximal einer anderen Person zusammen, sodass sich dein Personal Trainer ganz auf dich konzentrieren kann und dir Übungen zeigt, die auf deine individuellen Wünsche und Ziele zugeschnitten sind. Feiere selbst deine eigenen Erfolge und das mit nur 20 Minuten Training pro Woche. Komm vorbei! Deine EMS-Lounge® liegt im Zentrum der Barbarossastadt Gelnhausen, nur drei Minuten Fußweg vom Bahnhof entfernt. Direkt in der Hailerer Straße 6 findest du auch Parkmöglichkeiten. Wir freuen uns auf dich!"
fitbox Frankfurt Riedberg,"['EMS', 'EMS Cardio']",True,"['L', 'XL']",L,Kalbach-Riedberg,Ernst-Abbe-Straße 2,https://urbansportsclub.com//de/venues/fitbox,"{'@context': 'http://schema.org', '@type': 'LocalBusiness', 'name': 'fitbox Frankfurt Riedberg', 'description': 'fitbox freut sich auf deinen Besuch!', 'address': {'@type': 'PostalAddress', 'addressLocality': 'Frankfurt, Germany', 'addressCountry': 'Germany', 'postalCode': '60438', 'streetAddress': 'Ernst-Abbe-Straße 2'}, 'telephone': '', 'geo': {'@type': 'GeoCoordinates', 'latitude': '50.1783427', 'longitude': '8.628342'}, 'priceRange': '-', 'image': 'https://storage.googleapis.com/download/storage/v1/b/usc-pro-uscweb-live-media/o/de-live%2Foriginal_1650x928_EMSCompressed_1550065922700653_admin.jpg?alt=media'}",50.1783427,8.628342,fitbox freut sich auf deinen Besuch!
2 Hearts Performance Frankfurt,['Funktionelles Training'],False,"['S', 'M', 'L', 'XL']",S,Ostend,Hafenpark,https://urbansportsclub.com//de/venues/2-hearts-performance-1,"{'@context': 'http://schema.org', '@type': 'LocalBusiness', 'name': '2 Hearts Performance Frankfurt', 'description': 'Herzlich Willkommen bei unserem öffentlichen Outdoor Training Durch Einsatz des eigenen Körpergewichtes und einfacher Ausstattung definieren wir deine Fähigkeiten neu. Im Fokus stehen funktionelle Bewegungsabläufe für Anfänger und Fortgeschrittene. Verbessere deine Lebensqualität und Leistung beim gemeinsamen Training unter motivierten Herzen wie dir, mit der Anleitung von Coaches, denen dein Erfolg am Herzen liegt und werde Teil unserer großartigen Community. Facebook: https://www.facebook.com/2heartsperformance/ Instagram: https://www.instagram.com/2heartsperformance/ YouTube: https://www.youtube.com/channel/UC6RUb7hn6DLL7EwlulJOmcQ/videos', 'address': {'@type': 'PostalAddress', 'addressLocality': 'Frankfurt, Germany', 'addressCountry': 'Germany', 'postalCode': '60314', 'streetAddress': 'Hafenpark'}, 'telephone': '+49 1590 1005049', 'geo': {'@type': 'GeoCoordinates', 'latitude': '50.10822', 'longitude': '8.706322'}, 'priceRange': '-', 'image': 'https://storage.googleapis.com/download/storage/v1/b/usc-pro-uscweb-live-media/o/de-live%2Foriginal_1024x576_2HP%20Frankfurt_1638354851257708_admin.png?generation=1638354851363982&amp;alt=media'}",50.10822,8.706322,"Herzlich Willkommen bei unserem öffentlichen Outdoor Training Durch Einsatz des eigenen Körpergewichtes und einfacher Ausstattung definieren wir deine Fähigkeiten neu. Im Fokus stehen funktionelle Bewegungsabläufe für Anfänger und Fortgeschrittene. Verbessere deine Lebensqualität und Leistung beim gemeinsamen Training unter motivierten Herzen wie dir, mit der Anleitung von Coaches, denen dein Erfolg am Herzen liegt und werde Teil unserer großartigen Community. Facebook: https://www.facebook.com/2heartsperformance/ Instagram: https://www.instagram.com/2heartsperformance/ YouTube: https://www.youtube.com/channel/UC6RUb7hn6DLL7EwlulJOmcQ/videos"
Enjoy Wellness- und Fitness World,"['Fitness', 'Funktionelles Training', 'Indoorcycling', 'Pilates', 'Yoga']",False,"['M', 'L', 'XL']",M,Schwanheim,Martinskirchstraße 70,https://urbansportsclub.com//de/venues/enjoy-wellness-und-fitness-world,"{'@context': 'http://schema.org', '@type': 'LocalBusiness', 'name': 'Enjoy Wellness- und Fitness World', 'description': 'Das etwas andere Fitnessstudio! Enjoy Wellness- und Fitness World freut sich auf Dich!', 'address': {'@type': 'PostalAddress', 'addressLocality': 'Frankfurt, Germany', 'addressCountry': 'Germany', 'postalCode': '60529', 'streetAddress': 'Martinskirchstraße 70'}, 'telephone': '', 'geo': {'@type': 'GeoCoordinates', 'latitude': '50.0875986', 'longitude': '8.5815309'}, 'priceRange': '-', 'image': 'https://storage.googleapis.com/download/storage/v1/b/usc-pro-uscweb-live-media/o/de-live%2Foriginal_1282x721_3a717e28c3cd-Homepage__7___1558515831800972_admin.jpg?alt=media'}",50.0875986,8.5815309,Das etwas andere Fitnessstudio! Enjoy Wellness- und Fitness World freut sich auf Dich!
Fitness First Frankfurt - Ladies Club - Sachsenhausen,"['Fitness', 'Pilates', 'Yoga']",False,"['M', 'L', 'XL']",M,Sachsenhausen,Hedderichstraße 51,https://urbansportsclub.com//de/venues/fitness-first-frankfurt-sachsenhausen,"{'@context': 'http://schema.org', '@type': 'LocalBusiness', 'name': 'Fitness First Frankfurt - Ladies Club - Sachsenhausen', 'description': 'Fitness First freut sich auf dich!', 'address': {'@type': 'PostalAddress', 'addressLocality': 'Frankfurt, Germany', 'addressCountry': 'Germany', 'postalCode': '60594', 'streetAddress': 'Hedderichstraße 51'}, 'telephone': '', 'geo': {'@type': 'GeoCoordinates', 'latitude': '50.0998498', 'longitude': '8.6859247'}, 'priceRange': '-', 'image': 'https://storage.googleapis.com/download/storage/v1/b/usc-pro-uscweb-live-media/o/de-live%2Foriginal_1102x620_FF_Headerbild_Frankfurt_Sachsenhausen_1600x620px_2008_3_1599637375286907_admin.jpg?alt=media'}",50.0998498,8.6859247,Fitness First freut sich auf dich!
PRIME TIME fitness - Frankfurt Schweizer Platz,['Fitness'],False,"['M', 'L', 'XL']",M,Sachsenhausen,Schwanthalerstraße 48A,https://urbansportsclub.com//de/venues/prime-time-fitness-frankfurt-schweizer-platz,"{'@context': 'http://schema.org', '@type': 'LocalBusiness', 'name': 'PRIME TIME fitness - Frankfurt Schweizer Platz', 'description': 'PRIME TIME fitness freut sich auf Dich!', 'address': {'@type': 'PostalAddress', 'addressLocality': 'Frankfurt, Germany', 'addressCountry': 'Germany', 'postalCode': '60596', 'streetAddress': 'Schwanthalerstraße 48A'}, 'telephone': '', 'geo': {'@type': 'GeoCoordinates', 'latitude': '50.10089', 'longitude': '8.67968'}, 'priceRange': '-', 'image': 'https://storage.googleapis.com/download/storage/v1/b/usc-pro-uscweb-live-media/o/de-live%2Foriginal_640x360_bwe1g8z073xyhcg6lxnj_1692623177961697.png?generation=1692623178006304&amp;alt=media'}",50.10089,8.67968,PRIME TIME fitness freut sich auf Dich!
clever fit Frankfurt Höchst,['Fitness'],False,"['S', 'M', 'L', 'XL']",S,Höchst,Königsteiner Straße 11-13,https://urbansportsclub.com//de/venues/clever-fit-frankfurt-hochst,"{'@context': 'http://schema.org', '@type': 'LocalBusiness', 'name': 'clever fit Frankfurt Höchst', 'description': 'clever fit Frankfurt Höchst freut sich auf Dich!', 'address': {'@type': 'PostalAddress', 'addressLocality': 'Frankfurt, Germany', 'addressCountry': 'Germany', 'postalCode': '65929', 'streetAddress': 'Königsteiner Straße 11-13'}, 'telephone': '', 'geo': {'@type': 'GeoCoordinates', 'latitude': '50.1013005', 'longitude': '8.548615'}, 'priceRange': '-', 'image': 'https://storage.googleapis.com/download/storage/v1/b/usc-pro-uscweb-live-media/o/de-live%2Foriginal_3024x1701_IMG_8552_1649227085197190_admin.jpg?generation=1649227085446835&amp;alt=media'}",50.1013005,8.548615,clever fit Frankfurt Höchst freut sich auf Dich!
fit & fun Butzbach,"['Fitness', 'Funktionelles Training', 'Indoorcycling', 'Pilates', 'Yoga']",False,"['M', 'L', 'XL']",M,Butzbach,Rockenberger Weg 2,https://urbansportsclub.com//de/venues/fit-fun-butzbach,"{'@context': 'http://schema.org', '@type': 'LocalBusiness', 'name': 'fit &amp; fun Butzbach', 'description': 'fit &amp; fun Butzbach freut sich auf Dich!', 'address': {'@type': 'PostalAddress', 'addressLocality': 'Frankfurt, Germany', 'addressCountry': 'Germany', 'postalCode': '35510', 'streetAddress': 'Rockenberger Weg 2'}, 'telephone': '', 'geo': {'@type': 'GeoCoordinates', 'latitude': '50.4350762', 'longitude': '8.6869397'}, 'priceRange': '-', 'image': 'https://storage.googleapis.com/download/storage/v1/b/usc-pro-uscweb-live-media/o/de-live%2Foriginal_1686x948_fitnesscompressed_1560332694614042_admin.jpg?alt=media'}",50.4350762,8.6869397,fit &amp; fun Butzbach freut sich auf Dich!
AMIGA WOMEN FITNESS Rödelheim,"['Fitness', 'Pilates', 'Qi Gong und Tai Chi', 'Sauna', 'Wellness', 'Yoga']",False,"['M', 'L', 'XL']",M,Rödelheim,Rödelheimer Bahnweg 21,https://urbansportsclub.com//de/venues/studio-amiga-rodelheim,"{'@context': 'http://schema.org', '@type': 'LocalBusiness', 'name': 'AMIGA WOMEN FITNESS Rödelheim', 'description': 'AMIGA Frauenfitness Rödelheim: Modern und zeitlos elegant: Auf den 650 Quadratmetern unseres Studios in Frankfurt-Rödelheim finden Sie viel Platz für Training und Entspannung. Das Angebot wird ständig auf dem neuesten Stand gehalten und ergänzt. Aktuelles Highlight: der Express Workout-Circle, mit dem Sie in nur zwanzig Minuten ein effektives Kraft-Ausdauer-Training bekommen. Für’s Wohlfühlen und Relaxen sorgt unser stilvoller Wellnessbereich mit Sauna, Dampfbad und Massage. „Alles dafür tun, dass unsere Kundinnen wirklich abschalten können. Das ist unser Prinzip und das perfektionieren wir laufend.“ AMIGA Women Fitness Bockenheim: Unser Fitnessstudio in Frankfurt-Bockenheim liegt gleich neben der Universität – und trotzdem geht hier probieren über studieren! Auf über 600 Quadratmeter Fläche und in inspirierendem Ambiente bieten wir Frauen Gelegenheit, mit viel Spaß Erfolgserlebnisse beim Trainieren zu gewinnen. Ein mitreißendes Kursprogramm sorgt für Vielfalt und Abwechslung und unterstützt unsere Kundinnen dabei, immer wieder Selbstbewusstsein und Fitness zu tanken. „Wenn unsere Mitglieder vom Alltag gestresst zu uns kommen und entspannt, glücklich und mit einem Lächeln wieder gehen, wissen wir, dass wir hier das Wesentliche richtig machen.“ AMIGA Women Fitness Black Box Training: In der BLACKBOX erlebst du ein 45 minütiges hoch intensives und dynamisches Intervalltraining mit Nachbrenneffekt in einer Small Group Class (max. 8 Personen). Durch die hohe Intensität hast du ein effektives und effizientes Training mit hohem Kalorienverbrauch (bis zu 1.000 kcal) bei geringem Zeitaufwand. Und zusätzlich noch viel Spaß beim Gruppentraining. ROOM45 ist ein interaktives, motivierendes und vielseitiges neues HIIT-Trainingsprogramm für Männer und Frauen, bei dem abwechselnd Schnelligkeit, Beweglichkeit, Mobilität und Kraft trainiert werden. Hoher Kalorienverbrach (bis zu 1.000 kcal) und Spaß garantiert. ROOM45 spricht alle Sinne an und kombiniert hochintensives 45 minütiges Small Group Training + Challenges in einem multisensorischen Training Room mit Music + Light + Fun.', 'address': {'@type': 'PostalAddress', 'addressLocality': 'Frankfurt, Germany', 'addressCountry': 'Germany', 'postalCode': '60489', 'streetAddress': 'Rödelheimer Bahnweg 21'}, 'telephone': '', 'geo': {'@type': 'GeoCoordinates', 'latitude': '50.1252402', 'longitude': '8.6071551'}, 'priceRange': '-', 'image': 'https://storage.googleapis.com/download/storage/v1/b/usc-pro-uscweb-live-media/o/de-live%2Foriginal_1920x1080_Profilbild%20Studio%20Ro%CC%88delheim_1595337716268460_admin.jpg?alt=media'}",50.1252402,8.6071551,"AMIGA Frauenfitness Rödelheim: Modern und zeitlos elegant: Auf den 650 Quadratmetern unseres Studios in Frankfurt-Rödelheim finden Sie viel Platz für Training und Entspannung. Das Angebot wird ständig auf dem neuesten Stand gehalten und ergänzt. Aktuelles Highlight: der Express Workout-Circle, mit dem Sie in nur zwanzig Minuten ein effektives Kraft-Ausdauer-Training bekommen. Für’s Wohlfühlen und Relaxen sorgt unser stilvoller Wellnessbereich mit Sauna, Dampfbad und Massage. „Alles dafür tun, dass unsere Kundinnen wirklich abschalten können. Das ist unser Prinzip und das perfektionieren wir laufend.“ AMIGA Women Fitness Bockenheim: Unser Fitnessstudio in Frankfurt-Bockenheim liegt gleich neben der Universität – und trotzdem geht hier probieren über studieren! Auf über 600 Quadratmeter Fläche und in inspirierendem Ambiente bieten wir Frauen Gelegenheit, mit viel Spaß Erfolgserlebnisse beim Trainieren zu gewinnen. Ein mitreißendes Kursprogramm sorgt für Vielfalt und Abwechslung und unterstützt unsere Kundinnen dabei, immer wieder Selbstbewusstsein und Fitness zu tanken. „Wenn unsere Mitglieder vom Alltag gestresst zu uns kommen und entspannt, glücklich und mit einem Lächeln wieder gehen, wissen wir, dass wir hier das Wesentliche richtig machen.“ AMIGA Women Fitness Black Box Training: In der BLACKBOX erlebst du ein 45 minütiges hoch intensives und dynamisches Intervalltraining mit Nachbrenneffekt in einer Small Group Class (max. 8 Personen). Durch die hohe Intensität hast du ein effektives und effizientes Training mit hohem Kalorienverbrauch (bis zu 1.000 kcal) bei geringem Zeitaufwand. Und zusätzlich noch viel Spaß beim Gruppentraining. ROOM45 ist ein interaktives, motivierendes und vielseitiges neues HIIT-Trainingsprogramm für Männer und Frauen, bei dem abwechselnd Schnelligkeit, Beweglichkeit, Mobilität und Kraft trainiert werden. Hoher Kalorienverbrach (bis zu 1.000 kcal) und Spaß garantiert. ROOM45 spricht alle Sinne an und kombiniert hochintensives 45 minütiges Small Group Training + Challenges in einem multisensorischen Training Room mit Music + Light + Fun."
Schwimmhalle Textorbad,['Schwimmen'],False,"['S', 'M', 'L', 'XL']",S,Sachsenhausen,Textorstraße 42,https://urbansportsclub.com//de/venues/schwimmhalle-textorbad,"{'@context': 'http://schema.org', '@type': 'LocalBusiness', 'name': 'Schwimmhalle Textorbad', 'description': 'Schwimmsport auf Hochtour! Für alle Wasserratten genau das Richtige, mit einem Sportbecken / 29°C, Sprungbecken mit 1- und 3-m-Sprungbrett / 29°C, dazu auch ein Nichtschwimmerbecken / 29°C und für die Kleinsten ein Planschbecken / 31°C. Hier werden dir auch tolle Aquakurse geboten, für nur 4€ Zuzahlung vor Ort. Ein Gastronomiebereich steht für Erfrischungen und Stärkungen zur Verfügung. Die Bäder Betriebe Frankfurt und Urban Sports Club wünschenxa0dir viel Spaß!', 'address': {'@type': 'PostalAddress', 'addressLocality': 'Frankfurt, Germany', 'addressCountry': 'Germany', 'postalCode': '60594', 'streetAddress': 'Textorstraße 42'}, 'telephone': '+49 69 2710891400', 'geo': {'@type': 'GeoCoordinates', 'latitude': '50.1014968', 'longitude': '8.6855491'}, 'priceRange': '-', 'image': 'https://storage.googleapis.com/download/storage/v1/b/usc-pro-uscweb-live-media/o/de-live%2Foriginal_640x480_49908_tab_textorbad.jpg?alt=media'}",50.1014968,8.6855491,"Schwimmsport auf Hochtour! Für alle Wasserratten genau das Richtige, mit einem Sportbecken / 29°C, Sprungbecken mit 1- und 3-m-Sprungbrett / 29°C, dazu auch ein Nichtschwimmerbecken / 29°C und für die Kleinsten ein Planschbecken / 31°C. Hier werden dir auch tolle Aquakurse geboten, für nur 4€ Zuzahlung vor Ort. Ein Gastronomiebereich steht für Erfrischungen und Stärkungen zur Verfügung. Die Bäder Betriebe Frankfurt und Urban Sports Club wünschenxa0dir viel Spaß!"
Jumpers Langen,['Fitness'],False,"['S', 'M', 'L', 'XL']",S,Langen,Ampérestraße 7-11,https://urbansportsclub.com//de/venues/jumpers-fitness-langen,"{'@context': 'http://schema.org', '@type': 'LocalBusiness', 'name': 'Jumpers Langen', 'description': 'Ich packe meinen Koffer und nehme mit: meine Sportsachen – und meine Urban Sports Club-App. Und schon geht&#039;s los! Als Urban Sports Mitglied kannst du in allen jumpers Standorten in Deutschland einchecken. Ob du deine Oma in Hessen besuchst, auf Geschäftsreise in Baden-Württemberg bist oder Urlaub in Bayern, Rheinland-Pfalz oder dem Saarland machst: Auf dein Sportprogramm musst du nicht verzichten. Alle Jumpers Studios bieten dir Kraft- und Ausdauertraining. Genauso steht dir aber auch Functional- oder Zirkeltraining zur Verfügung. Du möchtest mehr erfahren über das volle Angebot im Jumpers Studio deiner Wahl? Dann folge dem link zur Jumpers-website. Deine Urban Sports Club Mitgliedschaft entspricht den Angeboten des Jumpers Premium-Pakets (ausgenommen Cardio Scan). Das Jumpers Team freut sich bereits auf deinen Besuch!', 'address': {'@type': 'PostalAddress', 'addressLocality': 'Frankfurt, Germany', 'addressCountry': 'Germany', 'postalCode': '63225', 'streetAddress': 'Ampérestraße 7-11'}, 'telephone': '', 'geo': {'@type': 'GeoCoordinates', 'latitude': '49.9982835', 'longitude': '8.6520984'}, 'priceRange': '-', 'image': 'https://storage.googleapis.com/download/storage/v1/b/usc-pro-uscweb-live-media/o/de-live%2Foriginal_1024x576_IMG_7960_1_2-1200x800%20(1)_1675416402958757_admin.jpeg?generation=1675416403028433&amp;alt=media'}",49.9982835,8.6520984,"Ich packe meinen Koffer und nehme mit: meine Sportsachen – und meine Urban Sports Club-App. Und schon geht&#039;s los! Als Urban Sports Mitglied kannst du in allen jumpers Standorten in Deutschland einchecken. Ob du deine Oma in Hessen besuchst, auf Geschäftsreise in Baden-Württemberg bist oder Urlaub in Bayern, Rheinland-Pfalz oder dem Saarland machst: Auf dein Sportprogramm musst du nicht verzichten. Alle Jumpers Studios bieten dir Kraft- und Ausdauertraining. Genauso steht dir aber auch Functional- oder Zirkeltraining zur Verfügung. Du möchtest mehr erfahren über das volle Angebot im Jumpers Studio deiner Wahl? Dann folge dem link zur Jumpers-website. Deine Urban Sports Club Mitgliedschaft entspricht den Angeboten des Jumpers Premium-Pakets (ausgenommen Cardio Scan). Das Jumpers Team freut sich bereits auf deinen Besuch!"
Easyfitness Großwallstadt,"['Fitness', 'Funktionelles Training', 'Yoga']",False,"['M', 'L', 'XL']",M,Großwallstadt,Einsteinstr. 4A,https://urbansportsclub.com//de/venues/easyfitness-grosswallstadt,"{'@context': 'http://schema.org', '@type': 'LocalBusiness', 'name': 'Easyfitness Großwallstadt', 'description': 'Du willst die volle Vielfalt in Sachen Fitness haben? Und das in angenehmer und freundlicher Atmosphäre? Dann bist du bei EASYFITNESS in Riedstadt genau richtig! Hier kannst du dich auf einen großen Cardio-, Geräte- und Freihantel-Bereich freuen, Kurse besuchen oder Zirkel- und Vibrationstraining machen. Auch für deine Erholung ist gesorgt. Nutze unsere Massageliege oder genieße die Zeit unter der modernen Sonnenbank von Ergoline. Im Cardio-Bereich kannst du an modernen Laufbändern, effektiven Steppern, gelenkschonenden Crosstrainern oder an Fahrradergometern schnell wieder in Form kommen. Wenn du deine Kraft trainieren willst, stehen dir neben zahlreichen Freigewichten und Hanteln auch Multipressen, an denen du sicher und gestützt verschiedene Übungen durchführen kannst, zur Verfügung. Von klassischem Bankdrücken, über Kniebeugen oder Kreuzheben ist hier alles möglich. Und wenn du einfach ein klassisches und effektives Ganzkörpertraining machen willst, dann nutze den EASYFITNESS-Zirkel. Wenn dir das alles zu klassisch ist, kannst du dich auf den EASYVIBRA-Platten austoben! Auch in Sachen Kurse kannst du voll auf deine Kosten kommen: Bellicon (Kraft-Ausdauertraining auf dem Trampolin), über Faszientraining, Bauchtraining bis hin zu Zumba und Yoga ist hier alles dabei. Also, auf geht`s und lerne die große Vielfalt bei EASYFITNESS Riedstadt kennen! Das kompetente und freundliche Trainerteam freut sich schon auf dich!', 'address': {'@type': 'PostalAddress', 'addressLocality': 'Frankfurt, Germany', 'addressCountry': 'Germany', 'postalCode': '63868', 'streetAddress': 'Einsteinstr. 4A'}, 'telephone': '', 'geo': {'@type': 'GeoCoordinates', 'latitude': '50.1109221', 'longitude': '8.6821267'}, 'priceRange': '-', 'image': 'https://storage.googleapis.com/download/storage/v1/b/usc-pro-uscweb-live-media/o/de-live%2Foriginal_1024x576_mh6qetzrjxx44bfc3pvx_1680192419609552.jpg?generation=1680192419682762&amp;alt=media'}",50.1109221,8.6821267,"Du willst die volle Vielfalt in Sachen Fitness haben? Und das in angenehmer und freundlicher Atmosphäre? Dann bist du bei EASYFITNESS in Riedstadt genau richtig! Hier kannst du dich auf einen großen Cardio-, Geräte- und Freihantel-Bereich freuen, Kurse besuchen oder Zirkel- und Vibrationstraining machen. Auch für deine Erholung ist gesorgt. Nutze unsere Massageliege oder genieße die Zeit unter der modernen Sonnenbank von Ergoline. Im Cardio-Bereich kannst du an modernen Laufbändern, effektiven Steppern, gelenkschonenden Crosstrainern oder an Fahrradergometern schnell wieder in Form kommen. Wenn du deine Kraft trainieren willst, stehen dir neben zahlreichen Freigewichten und Hanteln auch Multipressen, an denen du sicher und gestützt verschiedene Übungen durchführen kannst, zur Verfügung. Von klassischem Bankdrücken, über Kniebeugen oder Kreuzheben ist hier alles möglich. Und wenn du einfach ein klassisches und effektives Ganzkörpertraining machen willst, dann nutze den EASYFITNESS-Zirkel. Wenn dir das alles zu klassisch ist, kannst du dich auf den EASYVIBRA-Platten austoben! Auch in Sachen Kurse kannst du voll auf deine Kosten kommen: Bellicon (Kraft-Ausdauertraining auf dem Trampolin), über Faszientraining, Bauchtraining bis hin zu Zumba und Yoga ist hier alles dabei. Also, auf geht`s und lerne die große Vielfalt bei EASYFITNESS Riedstadt kennen! Das kompetente und freundliche Trainerteam freut sich schon auf dich!"
