name,disciplines,plus_options,plans,min_plan,district,street,link,metadata,latitude,longitude,description
wellyou - Stendal,['Fitness'],False,"['M', 'L', 'XL']",M,Stendal,Gneisenaustraße 2d,https://urbansportsclub.com//en/venues/wellyou-stendal,"{'@context': 'http://schema.org', '@type': 'LocalBusiness', 'name': 'wellyou - Stendal', 'description': 'Wir beweisen, was andere nur versprechen: Bei wellyou erreichst Du Deine Ziele – ohne Kompromisse! Wie das geht? Durch qualitativ hochwertiges Fitnesstraining - wellyou zeichnet sich durch modernste Fitnessgeräte, professionelle Betreuung, individuelle Beratung und ein umfangreiches Kursangebot von Live- und Cyberkursen aus. Bei wellyou stehst Du im Mittelpunkt! Jedes wellyou Studio besitzt einen großzügigen Freihantelbereich, vielfältige Möglichkeiten des Functional-Trainings sowie einen abwechslungsreichen Cadiopark. Zudem überzeugen viele wellyou-Studios mit Solarium, Power-Plate oder einer eigenen Ladies Area, wo Frauen ungestört trainieren können. Die langen Öffnungszeiten ermöglichen ein individuelles Training ganz nach Deinem Geschmack. Überzeuge Dich und komm vorbei! Wir freuen uns, Dich wieder bei uns begrüßen zu dürfen!', 'address': {'@type': 'PostalAddress', 'addressLocality': 'Magdeburg, Germany', 'addressCountry': 'Germany', 'postalCode': '39576', 'streetAddress': 'Gneisenaustraße 2d'}, 'telephone': '+49 40 30030404', 'geo': {'@type': 'GeoCoordinates', 'latitude': '52.6103144', 'longitude': '11.8421492'}, 'priceRange': '-', 'image': 'https://storage.googleapis.com/download/storage/v1/b/usc-pro-uscweb-live-media/o/de-live%2Foriginal_1024x576_1_167533159377581_admin.png?generation=1675331593144577&amp;alt=media'}",52.6103144,11.8421492,"Wir beweisen, was andere nur versprechen: Bei wellyou erreichst Du Deine Ziele – ohne Kompromisse! Wie das geht? Durch qualitativ hochwertiges Fitnesstraining - wellyou zeichnet sich durch modernste Fitnessgeräte, professionelle Betreuung, individuelle Beratung und ein umfangreiches Kursangebot von Live- und Cyberkursen aus. Bei wellyou stehst Du im Mittelpunkt! Jedes wellyou Studio besitzt einen großzügigen Freihantelbereich, vielfältige Möglichkeiten des Functional-Trainings sowie einen abwechslungsreichen Cadiopark. Zudem überzeugen viele wellyou-Studios mit Solarium, Power-Plate oder einer eigenen Ladies Area, wo Frauen ungestört trainieren können. Die langen Öffnungszeiten ermöglichen ein individuelles Training ganz nach Deinem Geschmack. Überzeuge Dich und komm vorbei! Wir freuen uns, Dich wieder bei uns begrüßen zu dürfen!"
Activ Vital,"['Fitness', 'Indoor Cycling', 'Pilates', 'Yoga']",False,"['M', 'L', 'XL']",M,Leipziger Straße,Semmelweisstraße 12,https://urbansportsclub.com//en/venues/injoy-magdeburg,"{'@context': 'http://schema.org', '@type': 'LocalBusiness', 'name': 'Activ Vital', 'description': 'Fitnessstudio Activ Vital – das ganzheitliche, wirkungsvolle Konzept für Ihre Fitness und Gesundheit: qualitativ hochwertig, mit persönlicher Betreuung, computergesteuertes Krafttraining, Cardiotraining, intelligentes Zirkeltraining, Rückenzentrum, Fle-xx, Gruppenfitness, Reha und Prävention, Highend Geräte, Ernährungsspezialisten, Sauna und Wellness. Du möchtest an deiner Ausdauer arbeiten, oder an deinem Muskelaufbau, benötigst professionelle Trainingsunterstützung, Beratung zu deiner Ernährung, einen Plan der individuell für dich funktioniert? Du möchtest präventiv etwas gegen Schmerzen im Alter tun? Du möchtest dich auspowern, abschalten, suchst Motivation, Gruppendynamik oder möchtest dich entspannen, eine tolle Gesellschaft genießen …? Ob Einsteiger, Freizeitsportler oder Profi – im Fitnessstudio INJOY Magdeburg bist du sicher gut aufgehoben: hochwertig, vielseitig und ganz persönlich mit viel Erfahrung und Leidenschaft für Fitness. Activ Vital ist mehr Fitness, mehr Gesundheit, mehr Lebensfreude für jede Generation! Das Team freut sich auf dich.', 'address': {'@type': 'PostalAddress', 'addressLocality': 'Magdeburg, Germany', 'addressCountry': 'Germany', 'postalCode': '39112', 'streetAddress': 'Semmelweisstraße 12'}, 'telephone': '', 'geo': {'@type': 'GeoCoordinates', 'latitude': '52.10851', 'longitude': '11.61753'}, 'priceRange': '-', 'image': 'https://urbansportsclub.com/images/merchant/venueHome.jpg'}",52.10851,11.61753,"Fitnessstudio Activ Vital – das ganzheitliche, wirkungsvolle Konzept für Ihre Fitness und Gesundheit: qualitativ hochwertig, mit persönlicher Betreuung, computergesteuertes Krafttraining, Cardiotraining, intelligentes Zirkeltraining, Rückenzentrum, Fle-xx, Gruppenfitness, Reha und Prävention, Highend Geräte, Ernährungsspezialisten, Sauna und Wellness. Du möchtest an deiner Ausdauer arbeiten, oder an deinem Muskelaufbau, benötigst professionelle Trainingsunterstützung, Beratung zu deiner Ernährung, einen Plan der individuell für dich funktioniert? Du möchtest präventiv etwas gegen Schmerzen im Alter tun? Du möchtest dich auspowern, abschalten, suchst Motivation, Gruppendynamik oder möchtest dich entspannen, eine tolle Gesellschaft genießen …? Ob Einsteiger, Freizeitsportler oder Profi – im Fitnessstudio INJOY Magdeburg bist du sicher gut aufgehoben: hochwertig, vielseitig und ganz persönlich mit viel Erfahrung und Leidenschaft für Fitness. Activ Vital ist mehr Fitness, mehr Gesundheit, mehr Lebensfreude für jede Generation! Das Team freut sich auf dich."
California Sun,"['Cryotherapy', 'EMS', 'EMS Cardio']",True,"['L', 'XL']",L,Sudenburg,Wiener Str. 2,https://urbansportsclub.com//en/venues/california-sun,"{'@context': 'http://schema.org', '@type': 'LocalBusiness', 'name': 'California Sun', 'description': 'CRYOTHERAPIE MIT DER ICECUBE KÄLTEKAMMER: FIT BEI -85°C Immer mehr Menschen nutzen die positiven Auswirkungen der Kältetherapie, um ihren Körper fitter, gesünder und schlanker zu machen. Nur 3 Minuten Anwendungszeit können Ihre Leistungsfähigkeit verbessern und Ihr allgemeines Wohlbefinden steigern. Die trockene Kälte wirkt sofort auf Ihren Körper und beeinflusst diesen positiv. Bei bis zu -85 °C kann es zu einer Verdopplung der Sauerstoffaufnahme kommen. Dadurch vermehrt sich die körpereigene Glückshormonproduktion signifikant, wodurch sich bei den meisten unserer Kunden schon nach kurzer Zeit ein spontanes Hochgefühl einstellt. Sie entspannen sich und tanken gleichzeitig neue Kraft und Energie. Profitieren auch Sie von den vielen Vorteilen der CRYOTHERAPIE: •tVerbessertes Wohlbefinden •tBeschleunigte Regeneration •tErhöhte Vitalität •tErleichterte Gewichtsabnahme •tVerbesserte Beweglichkeit und Leistungsfähigkeit •tFördert die Muskelentspannung EMS-GANZKÖRPERTRAINING: FIT IN NUR 20 MINUTEN EMS bedeutet Elektro‐Muskel‐Stimulation und ist eine echte Innovation im Fitnessbereich! Nur 20 Minuten pro Woche können ausreichen, um rasch individuelle Trainingserfolge zu erzielen! Anders als beim herkömmlichen Training, wo die Muskeln über elektrische Signale vom zentralen Nervensystem gesteuert werden, erhält die Muskulatur bei der Elektro-Muskel-Stimulation Impulse von außen. Beim EMS-Training wird dieser Impuls über eine spezielle Funktionsweste, die mit Elektroden bestückt ist, direkt auf die Hauptmuskelgruppen abgegeben. Der Impuls aktiviert und kontrahiert die Muskeln und wirkt somit wie ein Booster des körpereigenen Prinzips. Durch ein gleichzeitiges Trainieren aller großen Muskelgruppen werden einseitige Belastungen und muskuläre Dysbalancen vermieden, Schonhaltungen werden ausgeglichen. Die Einbeziehung alltagsrelevanter Übungen schult zudem die Motorik und verbessert die Koordination. Das EMS-Training wird im California Sun &amp; Beauty Studio in Magdeburg in der Wiener Straße 2 angeboten.', 'address': {'@type': 'PostalAddress', 'addressLocality': 'Magdeburg, Germany', 'addressCountry': 'Germany', 'postalCode': '39112', 'streetAddress': 'Wiener Str. 2'}, 'telephone': '', 'geo': {'@type': 'GeoCoordinates', 'latitude': '52.110014', 'longitude': '11.619727'}, 'priceRange': '-', 'image': 'https://storage.googleapis.com/download/storage/v1/b/usc-pro-uscweb-live-media/o/de-live%2Foriginal_1024x576_Profil%20Bild%201_1586346656371243_admin.jpg?alt=media'}",52.110014,11.619727,"CRYOTHERAPIE MIT DER ICECUBE KÄLTEKAMMER: FIT BEI -85°C Immer mehr Menschen nutzen die positiven Auswirkungen der Kältetherapie, um ihren Körper fitter, gesünder und schlanker zu machen. Nur 3 Minuten Anwendungszeit können Ihre Leistungsfähigkeit verbessern und Ihr allgemeines Wohlbefinden steigern. Die trockene Kälte wirkt sofort auf Ihren Körper und beeinflusst diesen positiv. Bei bis zu -85 °C kann es zu einer Verdopplung der Sauerstoffaufnahme kommen. Dadurch vermehrt sich die körpereigene Glückshormonproduktion signifikant, wodurch sich bei den meisten unserer Kunden schon nach kurzer Zeit ein spontanes Hochgefühl einstellt. Sie entspannen sich und tanken gleichzeitig neue Kraft und Energie. Profitieren auch Sie von den vielen Vorteilen der CRYOTHERAPIE: •tVerbessertes Wohlbefinden •tBeschleunigte Regeneration •tErhöhte Vitalität •tErleichterte Gewichtsabnahme •tVerbesserte Beweglichkeit und Leistungsfähigkeit •tFördert die Muskelentspannung EMS-GANZKÖRPERTRAINING: FIT IN NUR 20 MINUTEN EMS bedeutet Elektro‐Muskel‐Stimulation und ist eine echte Innovation im Fitnessbereich! Nur 20 Minuten pro Woche können ausreichen, um rasch individuelle Trainingserfolge zu erzielen! Anders als beim herkömmlichen Training, wo die Muskeln über elektrische Signale vom zentralen Nervensystem gesteuert werden, erhält die Muskulatur bei der Elektro-Muskel-Stimulation Impulse von außen. Beim EMS-Training wird dieser Impuls über eine spezielle Funktionsweste, die mit Elektroden bestückt ist, direkt auf die Hauptmuskelgruppen abgegeben. Der Impuls aktiviert und kontrahiert die Muskeln und wirkt somit wie ein Booster des körpereigenen Prinzips. Durch ein gleichzeitiges Trainieren aller großen Muskelgruppen werden einseitige Belastungen und muskuläre Dysbalancen vermieden, Schonhaltungen werden ausgeglichen. Die Einbeziehung alltagsrelevanter Übungen schult zudem die Motorik und verbessert die Koordination. Das EMS-Training wird im California Sun &amp; Beauty Studio in Magdeburg in der Wiener Straße 2 angeboten."
Elbe-Schwimmhalle,['Swimming'],False,"['S', 'M', 'L', 'XL']",S,Altstadt,Virchowstraße 9,https://urbansportsclub.com//en/venues/elbe-schwimmhalle,"{'@context': 'http://schema.org', '@type': 'LocalBusiness', 'name': 'Elbe-Schwimmhalle', 'description': 'Über den Urban Sports Club kannst du in Magdeburg in den Bädern schwimmen gehen. In der Sommersaison können zudem auch die Freibäder besucht werden. Bitte achte auf die jeweiligen Besonderheiten rechts beim Besuch des jeweiligen Bades. Viel sonniges und nasses Vergnügen in den Bädern von Magdeburg!', 'address': {'@type': 'PostalAddress', 'addressLocality': 'Magdeburg, Germany', 'addressCountry': 'Germany', 'postalCode': '39104', 'streetAddress': 'Virchowstraße 9'}, 'telephone': '', 'geo': {'@type': 'GeoCoordinates', 'latitude': '52.1350633', 'longitude': '11.6298613'}, 'priceRange': '-', 'image': 'https://storage.googleapis.com/download/storage/v1/b/usc-pro-uscweb-live-media/o/de-live%2Foriginal_1024x576_Eingangsbereich%20Elbe-Schwimmhalle.jpg?alt=media'}",52.1350633,11.6298613,Über den Urban Sports Club kannst du in Magdeburg in den Bädern schwimmen gehen. In der Sommersaison können zudem auch die Freibäder besucht werden. Bitte achte auf die jeweiligen Besonderheiten rechts beim Besuch des jeweiligen Bades. Viel sonniges und nasses Vergnügen in den Bädern von Magdeburg!
Fitness Class Women,"['Fitness', 'Functional Training', 'Pilates']",False,"['M', 'L', 'XL']",M,Altstadt,Breiter Weg 125a,https://urbansportsclub.com//en/venues/fitness-class-women,"{'@context': 'http://schema.org', '@type': 'LocalBusiness', 'name': 'Fitness Class Women', 'description': 'Herzlich Willkommen im Fitness Class Women! Eine persönliche Atmosphäre zu schaffen, in der Frauen Zeit für ihren Körper und ihre Seele finden, ist die Idee aus der das Fitness Class Women entstanden ist. Auf einer Fläche von 900m² sind die Geräte-, Ausdauer- und Kursangebote so abgestimmt, dass sie weiblichen Bedürfnissen optimal gerecht werden. Ob beim Fitness oder in der Sauna hier kann der Schweiß fließen - völlig ungezwungen, zeitlos und nur unter Frauen. Das Fitness Class Woman fundiert über professionelle Beratungen und verfügt über eine kindgerechte Betreuung. Der erste Schritt in Richtung Gesundheit und Figurverbesserung: Die Anmeldung in einem Fitnessstudio. Aber in welchem sollte ich mich anmelden? Welches passt zu mir und meinen Bedürfnissen? Fitness Class Women ist nicht nur ein Fitnessstudio, sondern auch ein Gesundheitsstudio, in dem ihr in ruhigem Ambiente und angenehmer Atmosphäre trainieren und entspannen könnt. Ihr findet hier nicht nur die klassischen Fitness- und Cardiogeräte, sondern ein vielfältiges Angebot rund um Wellness und Gesundheit. Ein Team aus ausgebildeten Trainern kümmert sich um euch. Ihr werdet von geschultem Personal in die Trainingsabläufe eingewiesen und durch die weitere Betreuung wird langfristiger Erfolg ermöglicht. Außerdem findet ihr hier viele Kurse, mit denen ihr eure sportlichen Aktivitäten ergänzen könnt. Laut einer aktuellen Mitgliederumfrage wird unser Studio von ca. 95% der Berfragten mit sehr gut oder gut bewertet. Dafür sagen wir Danke. Jetzt kannst Du uns testen und Dich von der Qualität unserer Angebote überzeugen.', 'address': {'@type': 'PostalAddress', 'addressLocality': 'Magdeburg, Germany', 'addressCountry': 'Germany', 'postalCode': '39104', 'streetAddress': 'Breiter Weg 125a'}, 'telephone': '', 'geo': {'@type': 'GeoCoordinates', 'latitude': '52.13362', 'longitude': '11.63726'}, 'priceRange': '-', 'image': 'https://storage.googleapis.com/download/storage/v1/b/usc-pro-uscweb-live-media/o/de-live%2Foriginal_1920x1080_DSC_5524%5BW-4061x2702.Schneider%5D.jpg?alt=media'}",52.13362,11.63726,"Herzlich Willkommen im Fitness Class Women! Eine persönliche Atmosphäre zu schaffen, in der Frauen Zeit für ihren Körper und ihre Seele finden, ist die Idee aus der das Fitness Class Women entstanden ist. Auf einer Fläche von 900m² sind die Geräte-, Ausdauer- und Kursangebote so abgestimmt, dass sie weiblichen Bedürfnissen optimal gerecht werden. Ob beim Fitness oder in der Sauna hier kann der Schweiß fließen - völlig ungezwungen, zeitlos und nur unter Frauen. Das Fitness Class Woman fundiert über professionelle Beratungen und verfügt über eine kindgerechte Betreuung. Der erste Schritt in Richtung Gesundheit und Figurverbesserung: Die Anmeldung in einem Fitnessstudio. Aber in welchem sollte ich mich anmelden? Welches passt zu mir und meinen Bedürfnissen? Fitness Class Women ist nicht nur ein Fitnessstudio, sondern auch ein Gesundheitsstudio, in dem ihr in ruhigem Ambiente und angenehmer Atmosphäre trainieren und entspannen könnt. Ihr findet hier nicht nur die klassischen Fitness- und Cardiogeräte, sondern ein vielfältiges Angebot rund um Wellness und Gesundheit. Ein Team aus ausgebildeten Trainern kümmert sich um euch. Ihr werdet von geschultem Personal in die Trainingsabläufe eingewiesen und durch die weitere Betreuung wird langfristiger Erfolg ermöglicht. Außerdem findet ihr hier viele Kurse, mit denen ihr eure sportlichen Aktivitäten ergänzen könnt. Laut einer aktuellen Mitgliederumfrage wird unser Studio von ca. 95% der Berfragten mit sehr gut oder gut bewertet. Dafür sagen wir Danke. Jetzt kannst Du uns testen und Dich von der Qualität unserer Angebote überzeugen."
Fitness Pur,['Fitness'],False,"['S', 'M', 'L', 'XL']",S,Aschersleben,Bahnhofstraße 32,https://urbansportsclub.com//en/venues/fitness-pur,"{'@context': 'http://schema.org', '@type': 'LocalBusiness', 'name': 'Fitness Pur', 'description': 'Unser Fitness Pur freut sich auf Dich!', 'address': {'@type': 'PostalAddress', 'addressLocality': 'Magdeburg, Germany', 'addressCountry': 'Germany', 'postalCode': '06449', 'streetAddress': 'Bahnhofstraße 32'}, 'telephone': '', 'geo': {'@type': 'GeoCoordinates', 'latitude': '51.7538403', 'longitude': '11.4682438'}, 'priceRange': '-', 'image': 'https://storage.googleapis.com/download/storage/v1/b/usc-pro-uscweb-live-media/o/de-live%2Foriginal_1686x948_fitnesscompressed_1552576741636402_admin.jpg?alt=media'}",51.7538403,11.4682438,Unser Fitness Pur freut sich auf Dich!
Fitnessinsel Magdeburg,"['Fitness', 'Traditional Asian Martial Arts']",False,"['S', 'M', 'L', 'XL']",S,Neu Olvenstedt,Johannes-Göderitz-Straße 114,https://urbansportsclub.com//en/venues/fitnessinsel-magdeburg,"{'@context': 'http://schema.org', '@type': 'LocalBusiness', 'name': 'Fitnessinsel Magdeburg', 'description': 'Wir heißen Sie in unserem gemütlichen Sportstudio in der Stadt Magdeburg herzlich Willkommen. Was zeichnet uns aus? Seit 1993 halten wir uns nun erfolgreich im Fitness und Wellness Geschäft. Hinter der Idee steckt ein liebevoll eingerichtetes Fitnessstudio mit Umfangreichem Angebot und moderaten Preisen. u200b In der heutigen Zeit bleiben die Zwischenmenschlichen Dinge zu sehr auf der Strecke, darum legen wir besonders großen Wert auf eine familiäre Atmosphäre! u200b Sie können uns nicht vergleichen mit großen Fitnessketten! u200b Außerdem bietet der nahe liegende Park, die Schwimmhalle sowie das Freibad optimale weitere andere Freizeitmöglichkeiten. Unser Gym beinhaltet auf ca. 250m² Trainingfläche:u200b L&amp;K Kraftgeräte L&amp;K Freihantelbereich L&amp;K Zirkeltraining u200b Precor Ausdauergeräte 2 x Laufbänder 954i 2 x Ellipsentrainer 576i 4 x Liegeergometer 846ir 4 x Fahrräder 846i 4x Spinningbike mit Klicksystem In einer Gruppe fühlen Sie sich wohler? Wir bieten Ihnen viele verschiedene Kurse an um sich Auszupowern. Zumba, Langhantel, Aerobic, Step-Aerobic, Rückenschule, Körperausgleich. Auch für Massagetermine gibt es in der Fitnessinsel die Möglichkeit auf einen Terminvereinbarung. Melde dich dazu einfach telefonisch an.', 'address': {'@type': 'PostalAddress', 'addressLocality': 'Magdeburg, Germany', 'addressCountry': 'Germany', 'postalCode': '39130', 'streetAddress': 'Johannes-Göderitz-Straße 114'}, 'telephone': '', 'geo': {'@type': 'GeoCoordinates', 'latitude': '52.1514753', 'longitude': '11.5938146'}, 'priceRange': '-', 'image': 'https://storage.googleapis.com/download/storage/v1/b/usc-pro-uscweb-live-media/o/de-live%2Foriginal_1047x589_Capture1_VCPHV.png?alt=media'}",52.1514753,11.5938146,"Wir heißen Sie in unserem gemütlichen Sportstudio in der Stadt Magdeburg herzlich Willkommen. Was zeichnet uns aus? Seit 1993 halten wir uns nun erfolgreich im Fitness und Wellness Geschäft. Hinter der Idee steckt ein liebevoll eingerichtetes Fitnessstudio mit Umfangreichem Angebot und moderaten Preisen. u200b In der heutigen Zeit bleiben die Zwischenmenschlichen Dinge zu sehr auf der Strecke, darum legen wir besonders großen Wert auf eine familiäre Atmosphäre! u200b Sie können uns nicht vergleichen mit großen Fitnessketten! u200b Außerdem bietet der nahe liegende Park, die Schwimmhalle sowie das Freibad optimale weitere andere Freizeitmöglichkeiten. Unser Gym beinhaltet auf ca. 250m² Trainingfläche:u200b L&amp;K Kraftgeräte L&amp;K Freihantelbereich L&amp;K Zirkeltraining u200b Precor Ausdauergeräte 2 x Laufbänder 954i 2 x Ellipsentrainer 576i 4 x Liegeergometer 846ir 4 x Fahrräder 846i 4x Spinningbike mit Klicksystem In einer Gruppe fühlen Sie sich wohler? Wir bieten Ihnen viele verschiedene Kurse an um sich Auszupowern. Zumba, Langhantel, Aerobic, Step-Aerobic, Rückenschule, Körperausgleich. Auch für Massagetermine gibt es in der Fitnessinsel die Möglichkeit auf einen Terminvereinbarung. Melde dich dazu einfach telefonisch an."
Fitnessinsel Magdeburg Massage,['Massage'],True,"['L', 'XL']",L,Neu Olvenstedt,Johannes-Göderitz-Straße 114,https://urbansportsclub.com//en/venues/fitnessinsel-magdeburg-massage,"{'@context': 'http://schema.org', '@type': 'LocalBusiness', 'name': 'Fitnessinsel Magdeburg Massage', 'description': 'Wir heißen Sie in unserem gemütlichen Sportstudio in der Stadt Magdeburg herzlich Willkommen. Was zeichnet uns aus? Seit 1993 halten wir uns nun erfolgreich im Fitness und Wellness Geschäft. Hinter der Idee steckt ein liebevoll eingerichtetes Fitnessstudio mit Umfangreichem Angebot und moderaten Preisen. u200b In der heutigen Zeit bleiben die Zwischenmenschlichen Dinge zu sehr auf der Strecke, darum legen wir besonders großen Wert auf eine familiäre Atmosphäre! u200b Sie können uns nicht vergleichen mit großen Fitnessketten! u200b Außerdem bietet der nahe liegende Park, die Schwimmhalle sowie das Freibad optimale weitere andere Freizeitmöglichkeiten. Unser Gym beinhaltet auf ca. 250m² Trainingfläche:u200b L&amp;K Kraftgeräte L&amp;K Freihantelbereich L&amp;K Zirkeltraining u200b Precor Ausdauergeräte 2 x Laufbänder 954i 2 x Ellipsentrainer 576i 4 x Liegeergometer 846ir 4 x Fahrräder 846i 4x Spinningbike mit Klicksystem In einer Gruppe fühlen Sie sich wohler? Wir bieten Ihnen viele verschiedene Kurse an um sich Auszupowern. Zumba, Langhantel, Aerobic, Step-Aerobic, Rückenschule, Körperausgleich. Auch für Massagetermine gibt es in der Fitnessinsel die Möglichkeit auf einen Terminvereinbarung. Melde dich dazu einfach telefonisch an.', 'address': {'@type': 'PostalAddress', 'addressLocality': 'Magdeburg, Germany', 'addressCountry': 'Germany', 'postalCode': '39130', 'streetAddress': 'Johannes-Göderitz-Straße 114'}, 'telephone': '', 'geo': {'@type': 'GeoCoordinates', 'latitude': '52.1515559', 'longitude': '11.5938488'}, 'priceRange': '-', 'image': 'https://storage.googleapis.com/download/storage/v1/b/usc-pro-uscweb-live-media/o/de-live%2Foriginal_1024x576_suo6ilj6wv4ruhruf6ql_1685541019520562.png?generation=1685541019582354&amp;alt=media'}",52.1515559,11.5938488,"Wir heißen Sie in unserem gemütlichen Sportstudio in der Stadt Magdeburg herzlich Willkommen. Was zeichnet uns aus? Seit 1993 halten wir uns nun erfolgreich im Fitness und Wellness Geschäft. Hinter der Idee steckt ein liebevoll eingerichtetes Fitnessstudio mit Umfangreichem Angebot und moderaten Preisen. u200b In der heutigen Zeit bleiben die Zwischenmenschlichen Dinge zu sehr auf der Strecke, darum legen wir besonders großen Wert auf eine familiäre Atmosphäre! u200b Sie können uns nicht vergleichen mit großen Fitnessketten! u200b Außerdem bietet der nahe liegende Park, die Schwimmhalle sowie das Freibad optimale weitere andere Freizeitmöglichkeiten. Unser Gym beinhaltet auf ca. 250m² Trainingfläche:u200b L&amp;K Kraftgeräte L&amp;K Freihantelbereich L&amp;K Zirkeltraining u200b Precor Ausdauergeräte 2 x Laufbänder 954i 2 x Ellipsentrainer 576i 4 x Liegeergometer 846ir 4 x Fahrräder 846i 4x Spinningbike mit Klicksystem In einer Gruppe fühlen Sie sich wohler? Wir bieten Ihnen viele verschiedene Kurse an um sich Auszupowern. Zumba, Langhantel, Aerobic, Step-Aerobic, Rückenschule, Körperausgleich. Auch für Massagetermine gibt es in der Fitnessinsel die Möglichkeit auf einen Terminvereinbarung. Melde dich dazu einfach telefonisch an."
Fitnesspark Hettstedt,"['Dance', 'Fitness', 'Indoor Cycling', 'Pilates', 'Yoga']",False,"['M', 'L', 'XL']",M,Hettstedt,Markt 51-53,https://urbansportsclub.com//en/venues/fitnesspark-hettstedt,"{'@context': 'http://schema.org', '@type': 'LocalBusiness', 'name': 'Fitnesspark Hettstedt', 'description': 'Unser Partner Fitnesspark Aschersleben/Hettstedt freut sich auf Dich!', 'address': {'@type': 'PostalAddress', 'addressLocality': 'Magdeburg, Germany', 'addressCountry': 'Germany', 'postalCode': '06333', 'streetAddress': 'Markt 51-53'}, 'telephone': '', 'geo': {'@type': 'GeoCoordinates', 'latitude': '51.6450634', 'longitude': '11.5122475'}, 'priceRange': '-', 'image': 'https://storage.googleapis.com/download/storage/v1/b/usc-pro-uscweb-live-media/o/de-live%2Foriginal_1686x948_fitnesscompressed_1552574082851541_admin.jpg?alt=media'}",51.6450634,11.5122475,Unser Partner Fitnesspark Aschersleben/Hettstedt freut sich auf Dich!
Freibad Süd,['Swimming'],False,"['S', 'M', 'L', 'XL']",S,Reform,Leipziger Chaussee 20,https://urbansportsclub.com//en/venues/freibad-sud,"{'@context': 'http://schema.org', '@type': 'LocalBusiness', 'name': 'Freibad Süd', 'description': 'Über den Urban Sports Club kannst du in Magdeburg in den Bädern schwimmen gehen. In der Sommersaison können zudem auch die Freibäder besucht werden. Bitte achte auf die jeweiligen Besonderheiten rechts beim Besuch des jeweiligen Bades. Viel sonniges und nasses Vergnügen in den Bädern von Magdeburg!', 'address': {'@type': 'PostalAddress', 'addressLocality': 'Magdeburg, Germany', 'addressCountry': 'Germany', 'postalCode': '39118', 'streetAddress': 'Leipziger Chaussee 20'}, 'telephone': '', 'geo': {'@type': 'GeoCoordinates', 'latitude': '52.095304', 'longitude': '11.620411'}, 'priceRange': '-', 'image': 'https://storage.googleapis.com/download/storage/v1/b/usc-pro-uscweb-live-media/o/de-live%2Foriginal_1024x576_09-Wasserbecken%202.jpg?alt=media'}",52.095304,11.620411,Über den Urban Sports Club kannst du in Magdeburg in den Bädern schwimmen gehen. In der Sommersaison können zudem auch die Freibäder besucht werden. Bitte achte auf die jeweiligen Besonderheiten rechts beim Besuch des jeweiligen Bades. Viel sonniges und nasses Vergnügen in den Bädern von Magdeburg!
