name,disciplines,plus_options,plans,min_plan,district,street,link,metadata,latitude,longitude,description
Bootchamps Box Barcelona,['Bootcamp'],False,"['S', 'M', 'L', 'XL']",S,La Barceloneta,"Carrer de l'Atlàntida, 78",https://urbansportsclub.com//en/venues/bootchamps-beach,"{'@context': 'http://schema.org', '@type': 'LocalBusiness', 'name': 'Bootchamps Box Barcelona', 'description': 'Every single session at BootChamps is unique, motivating, challenging and effective. We constantly keep an eye on you so we instantly, if needed, adjust the exercises to your personal fitness level. All movements we practice during Bootcamp are “functional movements” which means that we integrate our daily activities in the workout. By activating a lot of muscles at the same time the body needs to work hard. As a result we burn more calories not only during, but also long after the workout. The so called Afterburn. It´s a Bodyweight workout which makes that you can adjust the intensity at all time and you can make it as heavy as you want. By creating variety during the training both body and mind are constantly challenged and they don´t get used to a certain routine. That for example is way more effective and you will achieve results quicker. Besides it´s way more FUN! :-) Cada sesión en BootChamps es única, motivadora, desafiante y efectiva. Constantemente lo vigilamos, por lo que instantáneamente, si es necesario, ajustamos los ejercicios a su nivel de condición física personal. Todos los movimientos que practicamos durante Bootcamp son &quot;movimientos funcionales&quot;, lo que significa que integramos nuestras actividades diarias en el entrenamiento. Al activar muchos músculos al mismo tiempo, el cuerpo necesita trabajar duro. Como resultado, quemamos más calorías no solo durante, sino también mucho después del entrenamiento. El llamado Afterburn. Es un entrenamiento de peso corporal que hace que puedas ajustar la intensidad en todo momento y puedas hacerlo tan pesado como quieras. Al crear variedad durante el entrenamiento, tanto el cuerpo como la mente son desafiados constantemente y no se acostumbran a una cierta rutina. Eso, por ejemplo, es mucho más efectivo y lograrás resultados más rápido. Además es mucho más divertido! :-)', 'address': {'@type': 'PostalAddress', 'addressLocality': 'Barcelona, Spain', 'addressCountry': 'Spain', 'postalCode': '08003', 'streetAddress': 'Carrer de l&#039;Atlàntida, 78'}, 'telephone': '+34 660 09 73 75', 'geo': {'@type': 'GeoCoordinates', 'latitude': '41.3771874', 'longitude': '2.1907608'}, 'priceRange': '-', 'image': 'https://storage.googleapis.com/download/storage/v1/b/usc-pro-uscweb-live-media/o/de-live%2Foriginal_1060x596_boot%20beach_1559731958169446_admin.jpg?alt=media'}",41.3771874,2.1907608,"Every single session at BootChamps is unique, motivating, challenging and effective. We constantly keep an eye on you so we instantly, if needed, adjust the exercises to your personal fitness level. All movements we practice during Bootcamp are “functional movements” which means that we integrate our daily activities in the workout. By activating a lot of muscles at the same time the body needs to work hard. As a result we burn more calories not only during, but also long after the workout. The so called Afterburn. It´s a Bodyweight workout which makes that you can adjust the intensity at all time and you can make it as heavy as you want. By creating variety during the training both body and mind are constantly challenged and they don´t get used to a certain routine. That for example is way more effective and you will achieve results quicker. Besides it´s way more FUN! :-) Cada sesión en BootChamps es única, motivadora, desafiante y efectiva. Constantemente lo vigilamos, por lo que instantáneamente, si es necesario, ajustamos los ejercicios a su nivel de condición física personal. Todos los movimientos que practicamos durante Bootcamp son &quot;movimientos funcionales&quot;, lo que significa que integramos nuestras actividades diarias en el entrenamiento. Al activar muchos músculos al mismo tiempo, el cuerpo necesita trabajar duro. Como resultado, quemamos más calorías no solo durante, sino también mucho después del entrenamiento. El llamado Afterburn. Es un entrenamiento de peso corporal que hace que puedas ajustar la intensidad en todo momento y puedas hacerlo tan pesado como quieras. Al crear variedad durante el entrenamiento, tanto el cuerpo como la mente son desafiados constantemente y no se acostumbran a una cierta rutina. Eso, por ejemplo, es mucho más efectivo y lograrás resultados más rápido. Además es mucho más divertido! :-)"
Bootchamps Maka Maka,"['Bootcamp', 'Fitness']",False,"['S', 'M', 'L', 'XL']",S,La Barceloneta,Pla de Miquel Tarradell,https://urbansportsclub.com//en/venues/bootchamps-port-olimpic,"{'@context': 'http://schema.org', '@type': 'LocalBusiness', 'name': 'Bootchamps Maka Maka', 'description': 'Every single session at BootChamps is unique, motivating, challenging and effective. We constantly keep an eye on you so we instantly, if needed, adjust the exercises to your personal fitness level. All movements we practice during Bootcamp are “functional movements” which means that we integrate our daily activities in the workout. By activating a lot of muscles at the same time the body needs to work hard. As a result we burn more calories not only during, but also long after the workout. The so called Afterburn. It´s a Bodyweight workout which makes that you can adjust the intensity at all time and you can make it as heavy as you want. By creating variety during the training both body and mind are constantly challenged and they don´t get used to a certain routine. That for example is way more effective and you will achieve results quicker. Besides it´s way more FUN! :-) Cada sesión en BootChamps es única, motivadora, desafiante y efectiva. Constantemente lo vigilamos, por lo que instantáneamente, si es necesario, ajustamos los ejercicios a su nivel de condición física personal. Todos los movimientos que practicamos durante Bootcamp son &quot;movimientos funcionales&quot;, lo que significa que integramos nuestras actividades diarias en el entrenamiento. Al activar muchos músculos al mismo tiempo, el cuerpo necesita trabajar duro. Como resultado, quemamos más calorías no solo durante, sino también mucho después del entrenamiento. El llamado Afterburn. Es un entrenamiento de peso corporal que hace que puedas ajustar la intensidad en todo momento y puedas hacerlo tan pesado como quieras. Al crear variedad durante el entrenamiento, tanto el cuerpo como la mente son desafiados constantemente y no se acostumbran a una cierta rutina. Eso, por ejemplo, es mucho más efectivo y lograrás resultados más rápido. Además es mucho más divertido! :-)', 'address': {'@type': 'PostalAddress', 'addressLocality': 'Barcelona, Spain', 'addressCountry': 'Spain', 'postalCode': '08039', 'streetAddress': 'Pla de Miquel Tarradell'}, 'telephone': '+34 660 09 73 75', 'geo': {'@type': 'GeoCoordinates', 'latitude': '41.3767298', 'longitude': '2.1878032'}, 'priceRange': '-', 'image': 'https://storage.googleapis.com/download/storage/v1/b/usc-pro-uscweb-live-media/o/de-live%2Foriginal_1060x596_zluwa9y1j7bx3qo7zx8t_1683537883655802.png?generation=1683537883708946&amp;alt=media'}",41.3767298,2.1878032,"Every single session at BootChamps is unique, motivating, challenging and effective. We constantly keep an eye on you so we instantly, if needed, adjust the exercises to your personal fitness level. All movements we practice during Bootcamp are “functional movements” which means that we integrate our daily activities in the workout. By activating a lot of muscles at the same time the body needs to work hard. As a result we burn more calories not only during, but also long after the workout. The so called Afterburn. It´s a Bodyweight workout which makes that you can adjust the intensity at all time and you can make it as heavy as you want. By creating variety during the training both body and mind are constantly challenged and they don´t get used to a certain routine. That for example is way more effective and you will achieve results quicker. Besides it´s way more FUN! :-) Cada sesión en BootChamps es única, motivadora, desafiante y efectiva. Constantemente lo vigilamos, por lo que instantáneamente, si es necesario, ajustamos los ejercicios a su nivel de condición física personal. Todos los movimientos que practicamos durante Bootcamp son &quot;movimientos funcionales&quot;, lo que significa que integramos nuestras actividades diarias en el entrenamiento. Al activar muchos músculos al mismo tiempo, el cuerpo necesita trabajar duro. Como resultado, quemamos más calorías no solo durante, sino también mucho después del entrenamiento. El llamado Afterburn. Es un entrenamiento de peso corporal que hace que puedas ajustar la intensidad en todo momento y puedas hacerlo tan pesado como quieras. Al crear variedad durante el entrenamiento, tanto el cuerpo como la mente son desafiados constantemente y no se acostumbran a una cierta rutina. Eso, por ejemplo, es mucho más efectivo y lograrás resultados más rápido. Además es mucho más divertido! :-)"
Boxing 4 Women - Parc De Carles I,['Unknown'],False,"['M', 'L', 'XL']",M,La Vila Olímpica del Poblenou,"Av. d'Icària, 121",https://urbansportsclub.com//en/venues/boxing-4-women-parc-de-carles-i,"{'@context': 'http://schema.org', '@type': 'LocalBusiness', 'name': 'Boxing 4 Women - Parc De Carles I', 'description': 'Boxing4Women es una classe exterior creada especialmente para mujeres. Involucra cardio y ejercicios de fuerzas que se centran en golpes, combinaciones, coordinación, fuerza, velocidad y mucho mucho más.', 'address': {'@type': 'PostalAddress', 'addressLocality': 'Barcelona, Spain', 'addressCountry': 'Spain', 'postalCode': '08005', 'streetAddress': 'Av. d&#039;Icària, 121'}, 'telephone': '+34 711 01 40 76', 'geo': {'@type': 'GeoCoordinates', 'latitude': '41.389396087', 'longitude': '2.193147583'}, 'priceRange': '-', 'image': 'https://urbansportsclub.com/images/merchant/venueHome.jpg'}",41.389396087,2.193147583,"Boxing4Women es una classe exterior creada especialmente para mujeres. Involucra cardio y ejercicios de fuerzas que se centran en golpes, combinaciones, coordinación, fuerza, velocidad y mucho mucho más."
Brigada 24 - Moll de la Marina,['Functional Training'],False,"['S', 'M', 'L', 'XL']",S,La Vila Olímpica del Poblenou,Moll de la marina,https://urbansportsclub.com//en/venues/brigada-24,"{'@context': 'http://schema.org', '@type': 'LocalBusiness', 'name': 'Brigada 24 - Moll de la Marina', 'description': 'A partir de la propia experiencia de Ornella Barbini, manager y entrenadora de Brigada 24, nace la idea de este curioso outdoor, que ha ido creciendo con el tiempo hasta llegar a reunir a muchísima gente en sus entrenamientos outdoors, que hacen que el propio entreno sea una experiencia del todo gratificante tanto por lo que hace a sus resultados físicos como al buen rollo que se respira.', 'address': {'@type': 'PostalAddress', 'addressLocality': 'Barcelona, Spain', 'addressCountry': 'Spain', 'postalCode': '', 'streetAddress': 'Moll de la marina'}, 'telephone': '+34 654 77 23 00', 'geo': {'@type': 'GeoCoordinates', 'latitude': '41.385611', 'longitude': '2.198917'}, 'priceRange': '-', 'image': 'https://storage.googleapis.com/download/storage/v1/b/usc-pro-uscweb-live-media/o/de-live%2Foriginal_1920x1080_brigada%2024%20foto%202_1554206174789941_admin.jpg?alt=media'}",41.385611,2.198917,"A partir de la propia experiencia de Ornella Barbini, manager y entrenadora de Brigada 24, nace la idea de este curioso outdoor, que ha ido creciendo con el tiempo hasta llegar a reunir a muchísima gente en sus entrenamientos outdoors, que hacen que el propio entreno sea una experiencia del todo gratificante tanto por lo que hace a sus resultados físicos como al buen rollo que se respira."
Capoeira en Movimiento. Espai cooperatiu el Poblet,['Capoeira'],False,"['M', 'L', 'XL']",M,El Clot,"Carrer Independencia, 240",https://urbansportsclub.com//en/venues/capoeira-en-movimiento-el-nou-poblet,"{'@context': 'http://schema.org', '@type': 'LocalBusiness', 'name': 'Capoeira en Movimiento. Espai cooperatiu el Poblet', 'description': 'Trabaja tu fuerza, agilidad, coordinación y flexibilidad, a la vez que te diviertes y aprendes un arte marcial llena de juego, expresión y ritmo. Técnica de juego, acrobacias, música, percusión y buen ambiente. Clases para todos los niveles. Instructora de Mata (Estel) Capoeira Besouro Preto', 'address': {'@type': 'PostalAddress', 'addressLocality': 'Barcelona, Spain', 'addressCountry': 'Spain', 'postalCode': '08026', 'streetAddress': 'Carrer Independencia, 240'}, 'telephone': '+34 687 53 45 02', 'geo': {'@type': 'GeoCoordinates', 'latitude': '41.4065739', 'longitude': '2.1830552'}, 'priceRange': '-', 'image': 'https://storage.googleapis.com/download/storage/v1/b/usc-pro-uscweb-live-media/o/de-live%2Foriginal_640x360_jlxpstu1oey3cppqwdx3_1724983437327005.png?generation=1724983437414884&amp;alt=media'}",41.4065739,2.1830552,"Trabaja tu fuerza, agilidad, coordinación y flexibilidad, a la vez que te diviertes y aprendes un arte marcial llena de juego, expresión y ritmo. Técnica de juego, acrobacias, música, percusión y buen ambiente. Clases para todos los niveles. Instructora de Mata (Estel) Capoeira Besouro Preto"
Casa del Moviment - Plus,['Unknown'],True,"['L', 'XL']",L,Nova Esquerra de l'Eixample,"Calle Sepúlveda, 32",https://urbansportsclub.com//en/venues/casa-del-moviment-plus,"{'@context': 'http://schema.org', '@type': 'LocalBusiness', 'name': 'Casa del Moviment - Plus', 'description': 'Come and enjoy Yoga, Contemporary Dance, Ballet, Contact-Improvisation, Functional Training and Personal Training. Alongside with other activities offered by Casa del Moviment. Raquel Miro and Carl Staaf are both professional dancers and have been working with the body for more than 20 years dancing, living and touring all over Europe. Raquel is as well a certified Jivamukti Yoga teacher and Carl is a Personal Trainer and Holistic Lifestyle Coach trained in the CHEK system. At Casa del Moviment we love to move! Come join us!', 'address': {'@type': 'PostalAddress', 'addressLocality': 'Barcelona, Spain', 'addressCountry': 'Spain', 'postalCode': '08015', 'streetAddress': 'Calle Sepúlveda, 32'}, 'telephone': '', 'geo': {'@type': 'GeoCoordinates', 'latitude': '41.3762445', 'longitude': '2.1535234'}, 'priceRange': '-', 'image': 'https://urbansportsclub.com/images/merchant/venueHome.jpg'}",41.3762445,2.1535234,"Come and enjoy Yoga, Contemporary Dance, Ballet, Contact-Improvisation, Functional Training and Personal Training. Alongside with other activities offered by Casa del Moviment. Raquel Miro and Carl Staaf are both professional dancers and have been working with the body for more than 20 years dancing, living and touring all over Europe. Raquel is as well a certified Jivamukti Yoga teacher and Carl is a Personal Trainer and Holistic Lifestyle Coach trained in the CHEK system. At Casa del Moviment we love to move! Come join us!"
Centro Tiaki,['Massage'],True,"['L', 'XL']",L,Pedralbes,"Avenida Madrid, 45",https://urbansportsclub.com//en/venues/centro-tiaki,"{'@context': 'http://schema.org', '@type': 'LocalBusiness', 'name': 'Centro Tiaki', 'description': 'Su ambiente chillout, junto con sus profesionales hacen del centro Tiaki un espacio de relajación que te hará olvidar tus dolores de cabeza y preocupaciones del día a día y hará que te transportes a un ambiente de paz y armonía. MEDIDAS SANITARIAS - Gel desinfectante en todos los espacios - Los clientes tienen que llevar mascarilla en todos los espacios comunes y sólo se la pueden quitar en su espacio propio de masaje - Desinfección de manos en la recepción y en todos los espacios - Desinfección con productos certificados de los espacios y materiales después de cada uso y limpieza a fondo diaria del centro', 'address': {'@type': 'PostalAddress', 'addressLocality': 'Barcelona, Spain', 'addressCountry': 'Spain', 'postalCode': '08028', 'streetAddress': 'Avenida Madrid, 45'}, 'telephone': '+34 621 02 14 54', 'geo': {'@type': 'GeoCoordinates', 'latitude': '41.3774384', 'longitude': '2.1252701'}, 'priceRange': '-', 'image': 'https://storage.googleapis.com/download/storage/v1/b/usc-pro-uscweb-live-media/o/de-live%2Foriginal_1200x675_centro%20tiaki%20foto%203_1556617284276731_admin.jpg?alt=media'}",41.3774384,2.1252701,"Su ambiente chillout, junto con sus profesionales hacen del centro Tiaki un espacio de relajación que te hará olvidar tus dolores de cabeza y preocupaciones del día a día y hará que te transportes a un ambiente de paz y armonía. MEDIDAS SANITARIAS - Gel desinfectante en todos los espacios - Los clientes tienen que llevar mascarilla en todos los espacios comunes y sólo se la pueden quitar en su espacio propio de masaje - Desinfección de manos en la recepción y en todos los espacios - Desinfección con productos certificados de los espacios y materiales después de cada uso y limpieza a fondo diaria del centro"
Club Team Hybrid,['Swimming'],False,"['M', 'L', 'XL']",M,El Poblenou,Avenida del litoral 86/96,https://urbansportsclub.com//en/venues/club-team-hybrid,"{'@context': 'http://schema.org', '@type': 'LocalBusiness', 'name': 'Club Team Hybrid', 'description': 'Club de triatlón para todos los niveles, al aire libre. Entrenamos en grupo y adaptamos los entrenamientos para que consigas tus metas personales y para pasar grandes momentos con el equipo.', 'address': {'@type': 'PostalAddress', 'addressLocality': 'Barcelona, Spain', 'addressCountry': 'Spain', 'postalCode': '08005', 'streetAddress': 'Avenida del litoral 86/96'}, 'telephone': '+34 632 10 83 63', 'geo': {'@type': 'GeoCoordinates', 'latitude': '41.400352424098', 'longitude': '2.2125907749002'}, 'priceRange': '-', 'image': 'https://storage.googleapis.com/download/storage/v1/b/usc-pro-uscweb-live-media/o/de-live%2Foriginal_3096x1741_20220726_080250%20(1)_1664808938954913_admin.jpg?generation=1664808939032126&amp;alt=media'}",41.400352424098,2.2125907749002,"Club de triatlón para todos los niveles, al aire libre. Entrenamos en grupo y adaptamos los entrenamientos para que consigas tus metas personales y para pasar grandes momentos con el equipo."
Cristian Serran,"['Crosstraining', 'Massage']",True,"['S', 'M', 'L', 'XL']",S,Horta,"Carrer de Dante Alighieri, 6",https://urbansportsclub.com//en/venues/mes-salut-wellness-crossfit-horta,"{'@context': 'http://schema.org', '@type': 'LocalBusiness', 'name': 'Cristian Serran', 'description': 'Es una empresa innovadora que nace de la fusión del Crossfit®, los servicios de rehabilitación y readaptación, la medicina china y la acupuntura estética. Somos entusiastas y apasionados que vivimos en un mundo en constante evolución y eso hace que siempre queramos estar actualizados para poder ofrecer los mejores servicios. Ofreceremos un estudio de salud personalizado y nos enfocamos en un servicio más exclusivo donde entrenarán un máximo de 12 clientes a en la misma clase. También se realizarán servicios de fisioterapia, acupuntura estética y medicina estética enfocados en la salud del paciente con tratamientos específicos tratando el problema desde la raíz para poder obtener unos resultados 100% óptimos en la salud y en la belleza. MEDIDAS SANITARIAS - Geles Hidroalcohólicos en la entrada del club y de la sala de entreno. - Desinfección de la suela de los zapatos al entrar. - Uso de mascarilla obligatorio por el centro hasta llegar a tú zona de entreno (puedes quitartela) - Duchas y vestuarios cerrados, solo se podrá ir al baño', 'address': {'@type': 'PostalAddress', 'addressLocality': 'Barcelona, Spain', 'addressCountry': 'Spain', 'postalCode': '08032', 'streetAddress': 'Carrer de Dante Alighieri, 6'}, 'telephone': '+44 691939435', 'geo': {'@type': 'GeoCoordinates', 'latitude': '41.4291072', 'longitude': '2.1619162'}, 'priceRange': '-', 'image': 'https://storage.googleapis.com/download/storage/v1/b/usc-pro-uscweb-live-media/o/de-live%2Foriginal_3016x1697_mes_1557409054644474_admin.jpg?alt=media'}",41.4291072,2.1619162,"Es una empresa innovadora que nace de la fusión del Crossfit®, los servicios de rehabilitación y readaptación, la medicina china y la acupuntura estética. Somos entusiastas y apasionados que vivimos en un mundo en constante evolución y eso hace que siempre queramos estar actualizados para poder ofrecer los mejores servicios. Ofreceremos un estudio de salud personalizado y nos enfocamos en un servicio más exclusivo donde entrenarán un máximo de 12 clientes a en la misma clase. También se realizarán servicios de fisioterapia, acupuntura estética y medicina estética enfocados en la salud del paciente con tratamientos específicos tratando el problema desde la raíz para poder obtener unos resultados 100% óptimos en la salud y en la belleza. MEDIDAS SANITARIAS - Geles Hidroalcohólicos en la entrada del club y de la sala de entreno. - Desinfección de la suela de los zapatos al entrar. - Uso de mascarilla obligatorio por el centro hasta llegar a tú zona de entreno (puedes quitartela) - Duchas y vestuarios cerrados, solo se podrá ir al baño"
Crossfit® Travessia,"['Crosstraining', 'Fitness']",False,"['M', 'L', 'XL']",M,L’Hospitalet de Llobregat,"Travessia Industrial, 107-109",https://urbansportsclub.com//en/venues/crossfit-travessia,"{'@context': 'http://schema.org', '@type': 'LocalBusiness', 'name': 'Crossfit® Travessia', 'description': 'BOX afiliado de Crossfit®, equipado con las primeras marcas mundiales ELEIKO y MAXIMUS, los mejores coaches que te ayudaran a sacar lo mejor de ti mismo y una comunidad con la que compartir tus logros y experiencias. MEDIDAS SANITARIAS - Mascarilla Obligatoria - Distancia de seguridad - Toalla obligatoria - Aforo máximo de 8 personas en vestuarios - Desinfección de manos y calzado - Toma de Temperatura...', 'address': {'@type': 'PostalAddress', 'addressLocality': 'Barcelona, Spain', 'addressCountry': 'Spain', 'postalCode': '08907', 'streetAddress': 'Travessia Industrial, 107-109'}, 'telephone': '+34 640 96 97 32', 'geo': {'@type': 'GeoCoordinates', 'latitude': '41.3522493', 'longitude': '2.1057403'}, 'priceRange': '-', 'image': 'https://storage.googleapis.com/download/storage/v1/b/usc-pro-uscweb-live-media/o/de-live%2Foriginal_1600x900_WhatsApp%20Image%202019-02-28%20at%2011.16.19%20%281%29%20%283%29_1554134330355240_admin.jpeg?alt=media'}",41.3522493,2.1057403,"BOX afiliado de Crossfit®, equipado con las primeras marcas mundiales ELEIKO y MAXIMUS, los mejores coaches que te ayudaran a sacar lo mejor de ti mismo y una comunidad con la que compartir tus logros y experiencias. MEDIDAS SANITARIAS - Mascarilla Obligatoria - Distancia de seguridad - Toalla obligatoria - Aforo máximo de 8 personas en vestuarios - Desinfección de manos y calzado - Toma de Temperatura..."
Córporal Center Sarrià,"['Fitness', 'Functional Training', 'Yoga']",True,"['L', 'XL']",L,Sarrià,"Calle de Francesc Carbonell, 21",https://urbansportsclub.com//en/venues/corporal-center-sarria,"{'@context': 'http://schema.org', '@type': 'LocalBusiness', 'name': 'Córporal Center Sarrià', 'description': 'Nos especializamos en la prevención y tratamiento de lesiones músculo-esqueléticas, y en el cuidado de la salud general del aparato locomotor, usando como base los principios de la fisioterapia activa más avanzada y los conocimientos ancestrales del yoga. Lo formamos un equipo multidisciplinar de fisioterapeutas, especialistas en salud postural, biomecánica y fisiología del movimiento. En Córporal te enseñamos a prever posibles lesiones músculo-esqueléticas, tratamos tus dolores articulares y de espalda, corregimos tus posturas, te recordamos cómo debes usar tu cuerpo, como evitar los dolores y sentirte bien, y sobre todo, nos aseguramos que lo apliques en tu día a día.', 'address': {'@type': 'PostalAddress', 'addressLocality': 'Barcelona, Spain', 'addressCountry': 'Spain', 'postalCode': '08034', 'streetAddress': 'Calle de Francesc Carbonell, 21'}, 'telephone': '+34 932 03 31 37', 'geo': {'@type': 'GeoCoordinates', 'latitude': '41.3930274', 'longitude': '2.1257771'}, 'priceRange': '-', 'image': 'https://storage.googleapis.com/download/storage/v1/b/usc-pro-uscweb-live-media/o/de-live%2Foriginal_6000x3375_SARRIA%CC%80%205_1658391973536716_admin.jpg?generation=1658391973681261&amp;alt=media'}",41.3930274,2.1257771,"Nos especializamos en la prevención y tratamiento de lesiones músculo-esqueléticas, y en el cuidado de la salud general del aparato locomotor, usando como base los principios de la fisioterapia activa más avanzada y los conocimientos ancestrales del yoga. Lo formamos un equipo multidisciplinar de fisioterapeutas, especialistas en salud postural, biomecánica y fisiología del movimiento. En Córporal te enseñamos a prever posibles lesiones músculo-esqueléticas, tratamos tus dolores articulares y de espalda, corregimos tus posturas, te recordamos cómo debes usar tu cuerpo, como evitar los dolores y sentirte bien, y sobre todo, nos aseguramos que lo apliques en tu día a día."
