name,disciplines,plus_options,plans,min_plan,district,street,link,metadata,latitude,longitude,description
Coolbox Essen,"['Kryotherapie', 'Massage']",True,"['L', 'XL']",L,Rüttenscheid,Rüttenscheider Straße 16,https://urbansportsclub.com//de/venues/coolbox-essen,"{'@context': 'http://schema.org', '@type': 'LocalBusiness', 'name': 'Coolbox Essen', 'description': 'Ein paar Minuten frieren, um gesund und schön zu sein? Die Kryoanwendung ist ein etablierter Trend, der wirklich funktioniert. Nicht umsonst schwören internationale Profisportler, Stars und Models darauf. Was früher eine Luxusanwendung war ist jetzt in der Coolbox Essen für jeden zugänglich. Und so funktioniert es - In der Kältekammer wird dein Körper für wenige Minuten einer Temperatur von -85 Grad ausgesetzt. Durch die Kälte ziehen sich die Gefäße zusammen und der Blutfluss verlangsamt sich. Dadurch wird das Gewebe weniger schmerzempfindlich und die Durchblutung sowie die Sauerstoffversorgung laufen nach der Behandlung auf Hochtouren. Ebenso verbessert sich dein Stoffwechsel und deine Leistungsfähigkeit. Eine regelmäßige Anwendung stärkt auch dein Immunsystem und Schmerzen sowie Entzündungen werden gelindert. Vor allem im Sport hat es große Vorteile, da sich deine Regeneration deutlich verbessert und sich dein Körper schneller erholen kann. Die perfekte Ergänzung zu deiner Gesundheit. Klingt spannend? Dann probiere es doch einfach mal aus und lasse dich von den positiven Effekten der Kältekammer überraschen und erfahre ein komplett neues Erlebnis.', 'address': {'@type': 'PostalAddress', 'addressLocality': 'Essen, Germany', 'addressCountry': 'Germany', 'postalCode': '45131', 'streetAddress': 'Kunigundastraße 22'}, 'telephone': '+49 172 5676612', 'geo': {'@type': 'GeoCoordinates', 'latitude': '51.4312704', 'longitude': '7.0088652'}, 'priceRange': '-', 'image': 'https://storage.googleapis.com/download/storage/v1/b/usc-pro-uscweb-live-media/o/de-live%2Foriginal_1024x576_b66fffcaedd4-100_161918151322446_admin.jpg?alt=media'}",51.4312704,7.0088652,"Ein paar Minuten frieren, um gesund und schön zu sein? Die Kryoanwendung ist ein etablierter Trend, der wirklich funktioniert. Nicht umsonst schwören internationale Profisportler, Stars und Models darauf. Was früher eine Luxusanwendung war ist jetzt in der Coolbox Essen für jeden zugänglich. Und so funktioniert es - In der Kältekammer wird dein Körper für wenige Minuten einer Temperatur von -85 Grad ausgesetzt. Durch die Kälte ziehen sich die Gefäße zusammen und der Blutfluss verlangsamt sich. Dadurch wird das Gewebe weniger schmerzempfindlich und die Durchblutung sowie die Sauerstoffversorgung laufen nach der Behandlung auf Hochtouren. Ebenso verbessert sich dein Stoffwechsel und deine Leistungsfähigkeit. Eine regelmäßige Anwendung stärkt auch dein Immunsystem und Schmerzen sowie Entzündungen werden gelindert. Vor allem im Sport hat es große Vorteile, da sich deine Regeneration deutlich verbessert und sich dein Körper schneller erholen kann. Die perfekte Ergänzung zu deiner Gesundheit. Klingt spannend? Dann probiere es doch einfach mal aus und lasse dich von den positiven Effekten der Kältekammer überraschen und erfahre ein komplett neues Erlebnis."
Pranava Yoga - Irina Freihold,['Yoga'],False,"['M', 'L', 'XL']",M,Stadtbezirke II,Krawehlstraße 7,https://urbansportsclub.com//de/venues/pranava-yoga-irina-freihold,"{'@context': 'http://schema.org', '@type': 'LocalBusiness', 'name': 'Pranava Yoga - Irina Freihold', 'description': 'Das Yogastudio Pranava Yoga ist im innenstadtnahen belebten Essener Stadtteil Rüttenscheid zu finden. Hier findest du undogmatischen, zeitgemäßen Yogaunterricht auf hohem Niveau. Anfänger*innen und Fortgeschrittene sind gleichermaßen willkommen. Der Schwerpunkt des vielfältigen Kursplanes liegt auf kraftvollem, kreativem und alignmentbasiertem Vinyasa Yoga. Außerdem findest Du auch Trends wie Katonah Yoga, Yin Yoga, Atemarbeit bzw. Breathwork und Sound Healing bei uns im Yogastudio. Die Kurse finden in Form von Gruppenunterricht statt. Der helle Yogaraum mit seinen bodentiefen Fenstern und einem Blick ins Grüne, lädt Dich ein den Trubel des Alltags zu entfliehen und in unserer Ruheoase im Herzen Rüttenscheids zu entspannen. Eine Wellnessauszeit für Körper und Geist! Unser schönes Yogastudio befindet sich in direkter Nähe zum Rüttenscheider Stern Anschlussstellen des ÖPNV befinden sich in direkter Nähe mit den Linien: U11, 101/106, 108 Haltestelle Rüttenscheider Stern. Wir freuen uns auf Dich!', 'address': {'@type': 'PostalAddress', 'addressLocality': 'Essen, Germany', 'addressCountry': 'Germany', 'postalCode': '45130', 'streetAddress': 'Krawehlstraße 7'}, 'telephone': '', 'geo': {'@type': 'GeoCoordinates', 'latitude': '51.4394559', 'longitude': '7.0053571'}, 'priceRange': '-', 'image': 'https://storage.googleapis.com/download/storage/v1/b/usc-pro-uscweb-live-media/o/de-live%2Foriginal_4032x2268_c02576464326-IMG_0064_1701251927143858_admin.jpeg?generation=1701251927278761&amp;alt=media'}",51.4394559,7.0053571,"Das Yogastudio Pranava Yoga ist im innenstadtnahen belebten Essener Stadtteil Rüttenscheid zu finden. Hier findest du undogmatischen, zeitgemäßen Yogaunterricht auf hohem Niveau. Anfänger*innen und Fortgeschrittene sind gleichermaßen willkommen. Der Schwerpunkt des vielfältigen Kursplanes liegt auf kraftvollem, kreativem und alignmentbasiertem Vinyasa Yoga. Außerdem findest Du auch Trends wie Katonah Yoga, Yin Yoga, Atemarbeit bzw. Breathwork und Sound Healing bei uns im Yogastudio. Die Kurse finden in Form von Gruppenunterricht statt. Der helle Yogaraum mit seinen bodentiefen Fenstern und einem Blick ins Grüne, lädt Dich ein den Trubel des Alltags zu entfliehen und in unserer Ruheoase im Herzen Rüttenscheids zu entspannen. Eine Wellnessauszeit für Körper und Geist! Unser schönes Yogastudio befindet sich in direkter Nähe zum Rüttenscheider Stern Anschlussstellen des ÖPNV befinden sich in direkter Nähe mit den Linien: U11, 101/106, 108 Haltestelle Rüttenscheider Stern. Wir freuen uns auf Dich!"
Eva Pilates,"['Barre', 'Fitness', 'Pilates', 'Yoga']",False,"['L', 'XL']",L,Rüttenscheid,Gudulastr. 5,https://urbansportsclub.com//de/venues/eva-pilates,"{'@context': 'http://schema.org', '@type': 'LocalBusiness', 'name': 'Eva Pilates', 'description': 'Eva Pilates ist ein Pilates-Studio mitten in Essen-Rüttenscheid und bietet Pilates-Unterricht auf hohem Niveau. Es gibt viele verschiedene Mattenstunden bei unterschiedlichen Trainern, die alle zertifiert sind und mit viel Leidenschaft unterrichten. Zusätzlich zu den Pilates-Kursen gibt es Barre Workout - ein intensives &amp; effektives Training an der Ballettstange - und Pilates für Mütter nach der Schwangerschaft.', 'address': {'@type': 'PostalAddress', 'addressLocality': 'Essen, Germany', 'addressCountry': 'Germany', 'postalCode': '45131', 'streetAddress': 'Gudulastr. 5'}, 'telephone': '', 'geo': {'@type': 'GeoCoordinates', 'latitude': '51.432964', 'longitude': '7.0103487'}, 'priceRange': '-', 'image': 'https://storage.googleapis.com/download/storage/v1/b/usc-pro-uscweb-live-media/o/de-live%2Foriginal_2048x1152_15384389_1317467534982921_4233949753625873610_o.jpg?alt=media'}",51.432964,7.0103487,"Eva Pilates ist ein Pilates-Studio mitten in Essen-Rüttenscheid und bietet Pilates-Unterricht auf hohem Niveau. Es gibt viele verschiedene Mattenstunden bei unterschiedlichen Trainern, die alle zertifiert sind und mit viel Leidenschaft unterrichten. Zusätzlich zu den Pilates-Kursen gibt es Barre Workout - ein intensives &amp; effektives Training an der Ballettstange - und Pilates für Mütter nach der Schwangerschaft."
Rosemarie Lill - Massagen,['Massage'],True,"['L', 'XL']",L,Rüttenscheid,Klarastr. 47,https://urbansportsclub.com//de/venues/rosemarie-lill-massagen,"{'@context': 'http://schema.org', '@type': 'LocalBusiness', 'name': 'Rosemarie Lill - Massagen', 'description': 'Gönne dir etwas &quot;Ruhe und Zeit&quot; für dich. Nimm dir eine Auszeit vom stressigen Alltag und tu etwas für deinen Körper und deinen Geist oder lass dich sportlich massieren und geh fit in den Tag.', 'address': {'@type': 'PostalAddress', 'addressLocality': 'Essen, Germany', 'addressCountry': 'Germany', 'postalCode': '45130', 'streetAddress': 'Klarastr. 47'}, 'telephone': '', 'geo': {'@type': 'GeoCoordinates', 'latitude': '51.4390514', 'longitude': '7.0097668'}, 'priceRange': '-', 'image': 'https://storage.googleapis.com/download/storage/v1/b/usc-pro-uscweb-live-media/o/de-live%2Foriginal_1080x608_Screenshot_2023-03-01-06-25-01-101-edit_com.android.chrome_1679673613757621_admin.jpg?generation=1679673613834818&amp;alt=media'}",51.4390514,7.0097668,Gönne dir etwas &quot;Ruhe und Zeit&quot; für dich. Nimm dir eine Auszeit vom stressigen Alltag und tu etwas für deinen Körper und deinen Geist oder lass dich sportlich massieren und geh fit in den Tag.
Yoga Arts,['Yoga'],False,"['L', 'XL']",L,Stadtwald,Frankenstr. 280,https://urbansportsclub.com//de/venues/yoga-arts,"{'@context': 'http://schema.org', '@type': 'LocalBusiness', 'name': 'Yoga Arts', 'description': 'Im Yogastudio Yoga Arts in Essen - Stadtwald erwartet dich Yoga in einer zeitgemäßen Form: fundiertes Yoga-Wissen klar vermittelt. Der Unterricht zeichnet sich durch Präzision und Konzentration aus. Kraftaufbau und Loslassen. Energieaufladung und Entspannung. Eine liebevolle Atmosphäre fördert den Raum für Inspiration und positiver Veränderung. Nachhaltige Erholung und erfrischende Energie sind die Folge, so dass wir mit mehr Klarheit durch die Turbulenzen des Lebens navigieren können. Yoga Arts bietet Dir Ashtangayoga in der Tradition Sri K. Pattabhi Jois&#039;, Yin Yoga, Rückenyoga, Hatha Yoga und andere Kurse und Workshops im Essener Süden. Die Stunden sind offen für jeden - egal welchen Alters. Einstieg in die laufenden Kurse ist jederzeit möglich. Das Team freut sich auf dich !', 'address': {'@type': 'PostalAddress', 'addressLocality': 'Essen, Germany', 'addressCountry': 'Germany', 'postalCode': '45134', 'streetAddress': 'Frankenstr. 280'}, 'telephone': '+49 201 6159719', 'geo': {'@type': 'GeoCoordinates', 'latitude': '51.420348', 'longitude': '7.0245666'}, 'priceRange': '-', 'image': 'https://storage.googleapis.com/download/storage/v1/b/usc-pro-uscweb-live-media/o/de-live%2Foriginal_2000x1125__02A0993_1583746587947109_admin.jpeg?alt=media'}",51.420348,7.0245666,"Im Yogastudio Yoga Arts in Essen - Stadtwald erwartet dich Yoga in einer zeitgemäßen Form: fundiertes Yoga-Wissen klar vermittelt. Der Unterricht zeichnet sich durch Präzision und Konzentration aus. Kraftaufbau und Loslassen. Energieaufladung und Entspannung. Eine liebevolle Atmosphäre fördert den Raum für Inspiration und positiver Veränderung. Nachhaltige Erholung und erfrischende Energie sind die Folge, so dass wir mit mehr Klarheit durch die Turbulenzen des Lebens navigieren können. Yoga Arts bietet Dir Ashtangayoga in der Tradition Sri K. Pattabhi Jois&#039;, Yin Yoga, Rückenyoga, Hatha Yoga und andere Kurse und Workshops im Essener Süden. Die Stunden sind offen für jeden - egal welchen Alters. Einstieg in die laufenden Kurse ist jederzeit möglich. Das Team freut sich auf dich !"
Yogaschule Ashtanga Essen,['Yoga'],False,"['M', 'L', 'XL']",M,Rüttenscheid,Gudulastr. 5,https://urbansportsclub.com//de/venues/yogaschule-ashtanga-essen,"{'@context': 'http://schema.org', '@type': 'LocalBusiness', 'name': 'Yogaschule Ashtanga Essen', 'description': 'Die Yogaschule Ashtanga Essen freut sich auf Dich!', 'address': {'@type': 'PostalAddress', 'addressLocality': 'Essen, Germany', 'addressCountry': 'Germany', 'postalCode': '45131', 'streetAddress': 'Gudulastr. 5'}, 'telephone': '', 'geo': {'@type': 'GeoCoordinates', 'latitude': '51.4329763', 'longitude': '7.0103157'}, 'priceRange': '-', 'image': 'https://storage.googleapis.com/download/storage/v1/b/usc-pro-uscweb-live-media/o/de-live%2Foriginal_1688x950_Yoga_1664280989651570_admin.jpg?generation=1664280989712944&amp;alt=media'}",51.4329763,7.0103157,Die Yogaschule Ashtanga Essen freut sich auf Dich!
Pilates Dorothee Strathmann,['Pilates'],False,"['L', 'XL']",L,Rüttenscheid,Annastraße 68,https://urbansportsclub.com//de/venues/pilates-dorothee-strathmann,"{'@context': 'http://schema.org', '@type': 'LocalBusiness', 'name': 'Pilates Dorothee Strathmann', 'description': 'Du möchtest Pilates erlernen, oder Du hast bereits Pilates-Erfahrungen? Dann bist Du in meinem Pilates Studio herzlich willkommen! Bei Pilates Dorothee Strathmann erreichst Du unter professioneller Anleitung bei regelmäßigem Training beachtliche Erfolge. Du wirst nicht nur beweglicher und stärker, sondern erzielst eine gute Körperhaltung und ein gutes Körpergefühl und somit eine positive Ausstrahlung. Mehr Infos über mein Studio, meine Angebote und über mich findest Du auf meiner Website www.pilates-in-essen.de', 'address': {'@type': 'PostalAddress', 'addressLocality': 'Essen, Germany', 'addressCountry': 'Germany', 'postalCode': '45130', 'streetAddress': 'Annastraße 68'}, 'telephone': '', 'geo': {'@type': 'GeoCoordinates', 'latitude': '51.4403312', 'longitude': '7.0091977'}, 'priceRange': '-', 'image': 'https://storage.googleapis.com/download/storage/v1/b/usc-pro-uscweb-live-media/o/de-live%2Foriginal_1024x576_LMF_9695_1540284103316681_admin.jpg?alt=media'}",51.4403312,7.0091977,"Du möchtest Pilates erlernen, oder Du hast bereits Pilates-Erfahrungen? Dann bist Du in meinem Pilates Studio herzlich willkommen! Bei Pilates Dorothee Strathmann erreichst Du unter professioneller Anleitung bei regelmäßigem Training beachtliche Erfolge. Du wirst nicht nur beweglicher und stärker, sondern erzielst eine gute Körperhaltung und ein gutes Körpergefühl und somit eine positive Ausstrahlung. Mehr Infos über mein Studio, meine Angebote und über mich findest Du auf meiner Website www.pilates-in-essen.de"
Fitness First Dorsten,"['Fitness', 'Funktionelles Training', 'Yoga']",False,"['M', 'L', 'XL']",M,Dorsten,Fürst-Leopold-Allee 77,https://urbansportsclub.com//de/venues/fitnessloft-dorsten,"{'@context': 'http://schema.org', '@type': 'LocalBusiness', 'name': 'Fitness First Dorsten', 'description': 'FITNESSLOFT FITNESS NEU ERLEBEN. „Fitness neu erleben“ – hier stehst Du im Mittelpunkt. Seit der Gründung 2009 breitet sich das FitnessLOFT mit seinem individuellen Lifestyle-Entwurf stetig weiter aus. Wir beweisen, was andere nur versprechen: Im LOFT erreichst Du Deine Ziele – ohne Kompromiss! Wie das geht? Qualitative Ausstattung und loftiges Ambiente schaffen einen Wohlfühlort, den Du am liebsten gar nicht mehr verlassen möchtest. Moderne Geräte, fundierte Trainingsmethoden und eigens ausgebildete Trainer sind dem FitnessLOFT wichtig. Dank Kraft- und Cardiogeräten, dem populären TRX- und Vibrationstraining sowie dem modernen, chipgesteuerten milon Zirkel können Mitglieder sich in die Form ihres Lebens trainieren. Deine Workout-Buddys dürfen nicht fehlen? Bei dem im Monat 200 Kurse umfassenden Kursprogramm bleibt kein T-Shirt trocken – zusammen schafft ihr alles! Von Zumba® über Langhantelkurse bis hin zu Pilates kann sich ordentlich ausgepowert werden - und das zu einem fairen Preis-Leistungsverhältnis. Du willst Teil der Fitnessloft-Community werden? Dann verschaffe Dir einen eigenen Eindruck und besuche uns. Das FitnessLOFT-Team freut sich auf Dich.', 'address': {'@type': 'PostalAddress', 'addressLocality': 'Essen, Germany', 'addressCountry': 'Germany', 'postalCode': '46284', 'streetAddress': 'Fürst-Leopold-Allee 77'}, 'telephone': '', 'geo': {'@type': 'GeoCoordinates', 'latitude': '51.673526', 'longitude': '6.9851786'}, 'priceRange': '-', 'image': 'https://storage.googleapis.com/download/storage/v1/b/usc-pro-uscweb-live-media/o/de-live%2Foriginal_640x360_xonrdyoa9ehxwhe1ikfm_1699346058348212.png?generation=1699346058448558&amp;alt=media'}",51.673526,6.9851786,"FITNESSLOFT FITNESS NEU ERLEBEN. „Fitness neu erleben“ – hier stehst Du im Mittelpunkt. Seit der Gründung 2009 breitet sich das FitnessLOFT mit seinem individuellen Lifestyle-Entwurf stetig weiter aus. Wir beweisen, was andere nur versprechen: Im LOFT erreichst Du Deine Ziele – ohne Kompromiss! Wie das geht? Qualitative Ausstattung und loftiges Ambiente schaffen einen Wohlfühlort, den Du am liebsten gar nicht mehr verlassen möchtest. Moderne Geräte, fundierte Trainingsmethoden und eigens ausgebildete Trainer sind dem FitnessLOFT wichtig. Dank Kraft- und Cardiogeräten, dem populären TRX- und Vibrationstraining sowie dem modernen, chipgesteuerten milon Zirkel können Mitglieder sich in die Form ihres Lebens trainieren. Deine Workout-Buddys dürfen nicht fehlen? Bei dem im Monat 200 Kurse umfassenden Kursprogramm bleibt kein T-Shirt trocken – zusammen schafft ihr alles! Von Zumba® über Langhantelkurse bis hin zu Pilates kann sich ordentlich ausgepowert werden - und das zu einem fairen Preis-Leistungsverhältnis. Du willst Teil der Fitnessloft-Community werden? Dann verschaffe Dir einen eigenen Eindruck und besuche uns. Das FitnessLOFT-Team freut sich auf Dich."
Ai Fitness - Studio Essen-Kray,"['Entspannung', 'Fitness', 'Funktionelles Training', 'Pilates', 'Tanzen', 'Yoga']",False,"['S', 'M', 'L', 'XL']",S,Kray,Am Luftschacht 11,https://urbansportsclub.com//de/venues/ai-fitness-studio-essen-kray,"{'@context': 'http://schema.org', '@type': 'LocalBusiness', 'name': 'Ai Fitness - Studio Essen-Kray', 'description': 'Als eine der am schnellsten wachsenden und innovativsten Fitnessstudioketten in Deutschland, ist der Kern unseres Unternehmens eine ehrliche Leidenschaft für Fitness, Gesundheit und Wellbeing. Ziel ist es, unseren Mitgliedern ein erstklassiges Fitnesserlebnis zu bieten, das begeistert, motiviert und dabei erschwinglich bleibt. Um dies zu erreichen, verfolgt Ai Fitness seit 2003 einen ganzheitlichen Ansatz, der auf vier verschiedenen Säulen beruht: Hohe Servicequalität, niedrige Preise All inclusive an 365 Tagen im Jahr. Wir bieten ein herausragendes Leistungsangebot und das zu einem fairen und transparenten Preis. Vielfalt in Training und Ausstattung Fitnesstraining hat sich in den letzten Jahren extrem diversifiziert. Unsere Trainingsmöglichkeiten spiegeln dies wieder und bieten für jeden etwas. Angenehmes Umfeld und Ambiente In jedem unserer Studios hat eine angenehme Trainingsatmosphäre oberste Priorität. So sorgen wir für Motivation und Erfolg im Training. Effiziente Strukturen und Abläufe Mit über 20 Jahren Erfahrung in der Branche wissen wir, worauf es ankommt. Das Ergebnis ist ein erstklassiger Service bei gleichzeitig niedrigen Preisen. Wir kombinieren diese Erfolgsfaktoren zu einem Rundum-Sorglos-Paket, dass jedem Mitglied an 365 Tagen im Jahr zur Verfügung steht. Dabei richtet sich unser Angebot an ein breites Publikum – egal ob Anfänger, Hobbysportler oder fortgeschrittener Athlet – jeder findet hier sein sportliches Zuhause und eine erstklassige Betreuung. In der Praxis findet sich dieses Konzept in der Studiogestaltung wieder. Jeder Ai Fitnessclub ist gemäß der unterschiedlichen Trainingskonzepte in verschiedene Bereiche unterteilt: Funktionales Training, klassisches Gerätetraining, Fitnesskurse, Zirkeltraining oder Cardio – hier findet jeder seinen ganz eigenen Lieblingsbereich. Mit zertifizierten Trainern, einer großen Bandbreite an Trainingsmöglichkeiten, State of the Art-Fitnessequipment, einem vielseitigen Kursangebot, Gesundheitscheck und innovativen Sonderleistungen haben wir den Begriff all inclusive Fitness etabliert. Abgerundet wird dieses attraktive Gesamtpaket durch eine offene und lichtdurchflutete Architektur, hochwertige Umkleiden und Sanitärbereiche mit kostenlosen Duschen sowie unserem stets hilfsbereites Personal. In unseren Studios schaffen wir eine einzigartige Atmosphäre, in der jeder willkommen ist und sich wohlfühlen kann. Unsere Mitglieder sollen sich dabei nicht nur als Kunden, sondern Teil einer inspirierenden und motivierenden Community verstehen. Mit regelmäßigen Aktionen und dynamischen After-Work-Events schaffen wir ein vertrauensvolles Umfeld, das sonst oftmals durch Anonymität gekennzeichnet ist. Fitness in Wohlfühl-Atmosphäre – denn nur wer sich wirklich wohlfühlt, kommt auch gerne zum Training und hat langfristig Erfolg. Und der Trainingserfolg unserer Mitglieder ist dabei unsere Leidenschaft. Ein Ai Fitnessstudio findet sich bestimmt auch in deiner Nähe. Überzeuge dich selbst und lerne uns im Rahmen eines kostenlosen Probetrainings kennen. Wir freuen uns auf dich. Ai Fitness - Erlebe den Unterschied! Bitte schaue vor deinem Besuch in die Hausordnung: https://www.ai-fitness.de/service/hausordnung', 'address': {'@type': 'PostalAddress', 'addressLocality': 'Essen, Germany', 'addressCountry': 'Germany', 'postalCode': '45307', 'streetAddress': 'Am Luftschacht 11'}, 'telephone': '', 'geo': {'@type': 'GeoCoordinates', 'latitude': '51.46042', 'longitude': '7.06786'}, 'priceRange': '-', 'image': 'https://urbansportsclub.com/images/merchant/venueHome.jpg'}",51.46042,7.06786,"Als eine der am schnellsten wachsenden und innovativsten Fitnessstudioketten in Deutschland, ist der Kern unseres Unternehmens eine ehrliche Leidenschaft für Fitness, Gesundheit und Wellbeing. Ziel ist es, unseren Mitgliedern ein erstklassiges Fitnesserlebnis zu bieten, das begeistert, motiviert und dabei erschwinglich bleibt. Um dies zu erreichen, verfolgt Ai Fitness seit 2003 einen ganzheitlichen Ansatz, der auf vier verschiedenen Säulen beruht: Hohe Servicequalität, niedrige Preise All inclusive an 365 Tagen im Jahr. Wir bieten ein herausragendes Leistungsangebot und das zu einem fairen und transparenten Preis. Vielfalt in Training und Ausstattung Fitnesstraining hat sich in den letzten Jahren extrem diversifiziert. Unsere Trainingsmöglichkeiten spiegeln dies wieder und bieten für jeden etwas. Angenehmes Umfeld und Ambiente In jedem unserer Studios hat eine angenehme Trainingsatmosphäre oberste Priorität. So sorgen wir für Motivation und Erfolg im Training. Effiziente Strukturen und Abläufe Mit über 20 Jahren Erfahrung in der Branche wissen wir, worauf es ankommt. Das Ergebnis ist ein erstklassiger Service bei gleichzeitig niedrigen Preisen. Wir kombinieren diese Erfolgsfaktoren zu einem Rundum-Sorglos-Paket, dass jedem Mitglied an 365 Tagen im Jahr zur Verfügung steht. Dabei richtet sich unser Angebot an ein breites Publikum – egal ob Anfänger, Hobbysportler oder fortgeschrittener Athlet – jeder findet hier sein sportliches Zuhause und eine erstklassige Betreuung. In der Praxis findet sich dieses Konzept in der Studiogestaltung wieder. Jeder Ai Fitnessclub ist gemäß der unterschiedlichen Trainingskonzepte in verschiedene Bereiche unterteilt: Funktionales Training, klassisches Gerätetraining, Fitnesskurse, Zirkeltraining oder Cardio – hier findet jeder seinen ganz eigenen Lieblingsbereich. Mit zertifizierten Trainern, einer großen Bandbreite an Trainingsmöglichkeiten, State of the Art-Fitnessequipment, einem vielseitigen Kursangebot, Gesundheitscheck und innovativen Sonderleistungen haben wir den Begriff all inclusive Fitness etabliert. Abgerundet wird dieses attraktive Gesamtpaket durch eine offene und lichtdurchflutete Architektur, hochwertige Umkleiden und Sanitärbereiche mit kostenlosen Duschen sowie unserem stets hilfsbereites Personal. In unseren Studios schaffen wir eine einzigartige Atmosphäre, in der jeder willkommen ist und sich wohlfühlen kann. Unsere Mitglieder sollen sich dabei nicht nur als Kunden, sondern Teil einer inspirierenden und motivierenden Community verstehen. Mit regelmäßigen Aktionen und dynamischen After-Work-Events schaffen wir ein vertrauensvolles Umfeld, das sonst oftmals durch Anonymität gekennzeichnet ist. Fitness in Wohlfühl-Atmosphäre – denn nur wer sich wirklich wohlfühlt, kommt auch gerne zum Training und hat langfristig Erfolg. Und der Trainingserfolg unserer Mitglieder ist dabei unsere Leidenschaft. Ein Ai Fitnessstudio findet sich bestimmt auch in deiner Nähe. Überzeuge dich selbst und lerne uns im Rahmen eines kostenlosen Probetrainings kennen. Wir freuen uns auf dich. Ai Fitness - Erlebe den Unterschied! Bitte schaue vor deinem Besuch in die Hausordnung: https://www.ai-fitness.de/service/hausordnung"
