name,disciplines,plus_options,plans,min_plan,district,street,link,metadata,latitude,longitude,description
Frischluft Muckis,['Functional Training'],False,"['M', 'L', 'XL']",M,Korschenbroich,Johannes-Büchner-Straße,https://urbansportsclub.com//en/venues/frischluft-muckis,"{'@context': 'http://schema.org', '@type': 'LocalBusiness', 'name': 'Frischluft Muckis', 'description': 'Muckis freut sich auf dich!', 'address': {'@type': 'PostalAddress', 'addressLocality': 'Mönchengladbach, Germany', 'addressCountry': 'Germany', 'postalCode': '41352', 'streetAddress': 'Johannes-Büchner-Straße'}, 'telephone': '+49 1514 4951581', 'geo': {'@type': 'GeoCoordinates', 'latitude': '51.159467', 'longitude': '6.574556'}, 'priceRange': '-', 'image': 'https://storage.googleapis.com/download/storage/v1/b/usc-pro-uscweb-live-media/o/de-live%2Foriginal_640x360_rm5fgxnxpuxixldvcpy5_1716797393511165.png?generation=1716797393587694&amp;alt=media'}",51.159467,6.574556,Muckis freut sich auf dich!
Kletterkirche Mönchengladbach,"['Bouldering', 'Climbing']",False,"['L', 'XL']",L,Mönchengladbach,Nicodemstraße 36,https://urbansportsclub.com//en/venues/kletterkirche-monchengladbach,"{'@context': 'http://schema.org', '@type': 'LocalBusiness', 'name': 'Kletterkirche Mönchengladbach', 'description': 'Deutschlands erste Kletterkirche steht in Mönchengladbach. Die ehemalige Pfarrkirche St. Peter im Mönchengladbacher Stadtteil Waldhausen ist heute ein 1.300m² großes Kletterparadies für Groß und Klein. Aufgeteilt in einen Einsteiger-, Fun- und Extrembereich. Mit Wandhöhen bis zu 13 Metern wird die Kirche allen Ansprüchen gerecht, egal ob man Einsteiger ist oder Fortgeschrittener. Wir haben 10 Selbst-Sicherungs-Automaten. Damit ist es auch Einsteigern, Familien, Großeltern mit ihren Enkelchen oder Kletterern ohne Kletterpartner möglich bei uns zu Klettrern, ohne eine Sicherungseinweisung gemacht zu haben. Eine Einweisung in die Automaten vor Ort durch unser Personal reicht aus. Auf der Empore befindet sich ein aufwändig gestalteter Boulderbereich, der neben vielfältigen Trainingsmöglichkeiten einen atemberaubenden Blick über die Kletterhalle bereithält. Zusätzlich gibt es im Sommer einen Außenbereich mit Mega Außenboulder (derzeit im Aufbau), Slack- und Highline, Riesenleiter, Kletter- und Spielmöglichkeiten für Kinder. Jeden Donnerstag findet ab 18:00 Uhr ein offener Klettertreff statt. Genau das Richtige, um das in einer Sicherungseinweisung Gelernte direkt zu vertiefen. Oder um neue Leute kennenzulernen.', 'address': {'@type': 'PostalAddress', 'addressLocality': 'Mönchengladbach, Germany', 'addressCountry': 'Germany', 'postalCode': '41068', 'streetAddress': 'Nicodemstraße 36'}, 'telephone': '+49 2161 4613960', 'geo': {'@type': 'GeoCoordinates', 'latitude': '51.1958144', 'longitude': '6.4111429'}, 'priceRange': '-', 'image': 'https://storage.googleapis.com/download/storage/v1/b/usc-pro-uscweb-live-media/o/de-live%2Foriginal_4608x2592_3e75ca34a221-20210417_172707_1656926083211647_admin.jpg?generation=1656926083289705&amp;alt=media'}",51.1958144,6.4111429,"Deutschlands erste Kletterkirche steht in Mönchengladbach. Die ehemalige Pfarrkirche St. Peter im Mönchengladbacher Stadtteil Waldhausen ist heute ein 1.300m² großes Kletterparadies für Groß und Klein. Aufgeteilt in einen Einsteiger-, Fun- und Extrembereich. Mit Wandhöhen bis zu 13 Metern wird die Kirche allen Ansprüchen gerecht, egal ob man Einsteiger ist oder Fortgeschrittener. Wir haben 10 Selbst-Sicherungs-Automaten. Damit ist es auch Einsteigern, Familien, Großeltern mit ihren Enkelchen oder Kletterern ohne Kletterpartner möglich bei uns zu Klettrern, ohne eine Sicherungseinweisung gemacht zu haben. Eine Einweisung in die Automaten vor Ort durch unser Personal reicht aus. Auf der Empore befindet sich ein aufwändig gestalteter Boulderbereich, der neben vielfältigen Trainingsmöglichkeiten einen atemberaubenden Blick über die Kletterhalle bereithält. Zusätzlich gibt es im Sommer einen Außenbereich mit Mega Außenboulder (derzeit im Aufbau), Slack- und Highline, Riesenleiter, Kletter- und Spielmöglichkeiten für Kinder. Jeden Donnerstag findet ab 18:00 Uhr ein offener Klettertreff statt. Genau das Richtige, um das in einer Sicherungseinweisung Gelernte direkt zu vertiefen. Oder um neue Leute kennenzulernen."
Muckis,['Functional Training'],False,"['M', 'L', 'XL']",M,Korschenbroich,Schwohenend 6,https://urbansportsclub.com//en/venues/muckis-schwohenend,"{'@context': 'http://schema.org', '@type': 'LocalBusiness', 'name': 'Muckis', 'description': 'Muckis freut sich auf dich!', 'address': {'@type': 'PostalAddress', 'addressLocality': 'Mönchengladbach, Germany', 'addressCountry': 'Germany', 'postalCode': '41352', 'streetAddress': 'Schwohenend 6'}, 'telephone': '+49 1514 4951581', 'geo': {'@type': 'GeoCoordinates', 'latitude': '51.164777321', 'longitude': '6.575605567'}, 'priceRange': '-', 'image': 'https://storage.googleapis.com/download/storage/v1/b/usc-pro-uscweb-live-media/o/de-live%2Foriginal_640x360_xvd7klksadmqczl16ats_1716797046941402.png?generation=1716797047039569&amp;alt=media'}",51.164777321,6.575605567,Muckis freut sich auf dich!
WingTsun-Schule Mönchengladbach,['Modern Self Defense'],False,"['L', 'XL']",L,Mönchengladbach,Bozener Str. 41,https://urbansportsclub.com//en/venues/wing-tsun-schule-monchengladbach-1,"{'@context': 'http://schema.org', '@type': 'LocalBusiness', 'name': 'WingTsun-Schule Mönchengladbach', 'description': 'Effiziente Selbstverteidigung und Gewaltprävention Lerne als effiziente Selbstverteidigung und ganzheitliches Körpertraining WingTsun in Mönchengladbach und Rheydt kennen. Im allgemeinen WingTsun-Unterricht für Erwachsene werden für Männer und Frauen spezifische Konfliktsituationen im Alltag dargestellt und geklärt, d.h. Selbstverteidigungssituationen im Rahmen des BlitzDefence-Programms (spezifisches Rollenverhalten für Mann und Frau) sind in den Unterricht integriert.', 'address': {'@type': 'PostalAddress', 'addressLocality': 'Mönchengladbach, Germany', 'addressCountry': 'Germany', 'postalCode': '41063', 'streetAddress': 'Bozener Str. 41'}, 'telephone': '+49 2161 651980', 'geo': {'@type': 'GeoCoordinates', 'latitude': '51.203543045', 'longitude': '6.450547216'}, 'priceRange': '-', 'image': 'https://storage.googleapis.com/download/storage/v1/b/usc-pro-uscweb-live-media/o/de-live%2Foriginal_1024x576_Technik_1550150643488443_admin.jpg?alt=media'}",51.203543045,6.450547216,"Effiziente Selbstverteidigung und Gewaltprävention Lerne als effiziente Selbstverteidigung und ganzheitliches Körpertraining WingTsun in Mönchengladbach und Rheydt kennen. Im allgemeinen WingTsun-Unterricht für Erwachsene werden für Männer und Frauen spezifische Konfliktsituationen im Alltag dargestellt und geklärt, d.h. Selbstverteidigungssituationen im Rahmen des BlitzDefence-Programms (spezifisches Rollenverhalten für Mann und Frau) sind in den Unterricht integriert."
Zumbamone,['Fitness'],False,"['M', 'L', 'XL']",M,Erkelenz,In Granterath 6,https://urbansportsclub.com//en/venues/zumbamone,"{'@context': 'http://schema.org', '@type': 'LocalBusiness', 'name': 'Zumbamone', 'description': 'Zumba - lasse dich von lateinamerikanischen Rhythmen inspirieren und habe Spaß an der Bewegung. Tanzen macht den Kopf frei und die Seele glücklich. Sei dabei! Ich freue mich auf deinen Besuch! Deine Simone (ZUMBAMONE)', 'address': {'@type': 'PostalAddress', 'addressLocality': 'Mönchengladbach, Germany', 'addressCountry': 'Germany', 'postalCode': '41812', 'streetAddress': 'In Granterath 6'}, 'telephone': '', 'geo': {'@type': 'GeoCoordinates', 'latitude': '51.05614', 'longitude': '6.29502'}, 'priceRange': '-', 'image': 'https://storage.googleapis.com/download/storage/v1/b/usc-pro-uscweb-live-media/o/de-live%2Foriginal_1024x576_51cf5df9728e-IMG_6274_1568718938680325_admin.jpg?alt=media'}",51.05614,6.29502,Zumba - lasse dich von lateinamerikanischen Rhythmen inspirieren und habe Spaß an der Bewegung. Tanzen macht den Kopf frei und die Seele glücklich. Sei dabei! Ich freue mich auf deinen Besuch! Deine Simone (ZUMBAMONE)
fitbox Erkelenz City,"['EMS', 'EMS Cardio']",True,"['L', 'XL']",L,Erkelenz,Aachener Str. 46,https://urbansportsclub.com//en/venues/fitbox-erkelenz,"{'@context': 'http://schema.org', '@type': 'LocalBusiness', 'name': 'fitbox Erkelenz City', 'description': 'EMS steht für Elektrische Muskelstimulation. Beim EMS Training hast Du eine Funktionsweste an, durch die bioelektrische Impulse fließen. Diese Impulse stimulieren gleichzeitig rund 90 Prozent Deiner Muskelgruppen ca. 85 Mal pro Sekunde. Das macht Übungen mit EMS sehr, sehr viel intensiver und somit auch wirksamer als bei normalem Fitnesstraining. Das bedeutet konkret: Unsere 20 Minuten ersetzen mehrere Stunden herkömmliches Training. Außerdem trainierst Du bei uns nie allein. Unsere Personal Trainer:innen wissen, wie man die EMS-Übungen präzise ausführt. Sie leiten Dich an und korrigieren Dich. Alle unsere Trainer:innen wurden für das Training am EMS-Gerät zertifiziert und haben umfangreiche Lizenzen und Qualifikationen im Fitness- und Gesundheitssport.', 'address': {'@type': 'PostalAddress', 'addressLocality': 'Mönchengladbach, Germany', 'addressCountry': 'Germany', 'postalCode': '41812', 'streetAddress': 'Aachener Str. 46'}, 'telephone': '+49 2431 9757606', 'geo': {'@type': 'GeoCoordinates', 'latitude': '51.0782103', 'longitude': '6.3128835'}, 'priceRange': '-', 'image': 'https://storage.googleapis.com/download/storage/v1/b/usc-pro-uscweb-live-media/o/de-live%2Foriginal_4000x2250_07869bcc1e79-Training_PT_3_1678978429881619_admin.jpg?generation=1678978429972168&amp;alt=media'}",51.0782103,6.3128835,"EMS steht für Elektrische Muskelstimulation. Beim EMS Training hast Du eine Funktionsweste an, durch die bioelektrische Impulse fließen. Diese Impulse stimulieren gleichzeitig rund 90 Prozent Deiner Muskelgruppen ca. 85 Mal pro Sekunde. Das macht Übungen mit EMS sehr, sehr viel intensiver und somit auch wirksamer als bei normalem Fitnesstraining. Das bedeutet konkret: Unsere 20 Minuten ersetzen mehrere Stunden herkömmliches Training. Außerdem trainierst Du bei uns nie allein. Unsere Personal Trainer:innen wissen, wie man die EMS-Übungen präzise ausführt. Sie leiten Dich an und korrigieren Dich. Alle unsere Trainer:innen wurden für das Training am EMS-Gerät zertifiziert und haben umfangreiche Lizenzen und Qualifikationen im Fitness- und Gesundheitssport."
körpergefühl,"['EMS', 'EMS Cardio']",True,"['L', 'XL']",L,Mönchengladbach,Burgfreiheit 65,https://urbansportsclub.com//en/venues/korpergefuhl-1,"{'@context': 'http://schema.org', '@type': 'LocalBusiness', 'name': 'körpergefühl', 'description': 'Bei uns spielen Gesundheit, Fitness und Ästhetik die Hauptrolle. Unser auf EMS-Fitness spezialisierte Studio verfügt über moderne Geräte für Trainings und Massagen. Wir als Personal Trainer begleiten dich beim Erreichen der individuellen sportlichen Ziele und passen Trainingskonzepte individuell an.', 'address': {'@type': 'PostalAddress', 'addressLocality': 'Mönchengladbach, Germany', 'addressCountry': 'Germany', 'postalCode': '41199', 'streetAddress': 'Burgfreiheit 65'}, 'telephone': '+49 2166 1461776', 'geo': {'@type': 'GeoCoordinates', 'latitude': '51.1333272', 'longitude': '6.4517883'}, 'priceRange': '-', 'image': 'https://storage.googleapis.com/download/storage/v1/b/usc-pro-uscweb-live-media/o/de-live%2Foriginal_1619x911_EMSCompressed_1561366787522550_admin.jpg?alt=media'}",51.1333272,6.4517883,"Bei uns spielen Gesundheit, Fitness und Ästhetik die Hauptrolle. Unser auf EMS-Fitness spezialisierte Studio verfügt über moderne Geräte für Trainings und Massagen. Wir als Personal Trainer begleiten dich beim Erreichen der individuellen sportlichen Ziele und passen Trainingskonzepte individuell an."
