name,disciplines,plus_options,plans,min_plan,district,street,link,metadata,latitude,longitude,description
WOF 3 - Aachen West,['Fitness'],False,"['Essential', 'Classic', 'Premium', 'Max']",Essential,Laurensberg,Roermonder Straße 143,https://urbansportsclub.com//en/venues/wof-3-aachen-west,"{'@context': 'http://schema.org', '@type': 'LocalBusiness', 'name': 'WOF 3 - Aachen West', 'description': '&quot;Luft und Licht.... Der eine liebt es, sich an Geräten auszutoben – der andere tankt Kraft in der Ruhe. Lassen Sie sich von der Vielfalt und Großzügigkeit, von Luft und Licht dieser Anlage überraschen; genießen Sie die vielen Möglichkeiten, sich selbst etwas Gutes zu tun. Ganz besonders der stilvolle Wellnessbereich in unserem WOF 1 lädt dazu ein, die Seele baumeln zu lassen. „Zufriedenheit ist Glück!“ Thomas Fuller (1608 – 1661) englischer Prediger&quot;', 'address': {'@type': 'PostalAddress', 'addressLocality': 'Aachen, Germany', 'addressCountry': 'Germany', 'postalCode': '52072', 'streetAddress': 'Roermonder Straße 143'}, 'telephone': '', 'geo': {'@type': 'GeoCoordinates', 'latitude': '50.78738', 'longitude': '6.06875'}, 'priceRange': '-', 'image': 'https://storage.googleapis.com/download/storage/v1/b/usc-pro-uscweb-live-media/o/de-live%2Foriginal_1024x576_29f10c5bcd08-WOF3_Sauna_1024x576_1576768773211275_admin.jpg?alt=media'}",50.78738,6.06875,"&quot;Luft und Licht.... Der eine liebt es, sich an Geräten auszutoben – der andere tankt Kraft in der Ruhe. Lassen Sie sich von der Vielfalt und Großzügigkeit, von Luft und Licht dieser Anlage überraschen; genießen Sie die vielen Möglichkeiten, sich selbst etwas Gutes zu tun. Ganz besonders der stilvolle Wellnessbereich in unserem WOF 1 lädt dazu ein, die Seele baumeln zu lassen. „Zufriedenheit ist Glück!“ Thomas Fuller (1608 – 1661) englischer Prediger&quot;"
Bäder Aachen - Elisabethhalle,['Swimming'],False,"['Essential', 'Classic', 'Premium', 'Max']",Essential,Aachen,Elisabethstraße 10 Aachen,https://urbansportsclub.com//en/venues/elisabethhalle,"{'@context': 'http://schema.org', '@type': 'LocalBusiness', 'name': 'Bäder Aachen - Elisabethhalle', 'description': 'Die Bäder Aachen freuen sich auf Dich! Bitte beachte die Informationen zu den aktuellen Öffnungszeiten der Bäder im jeweiligen Standort-Text oder unter: http://www.aachen.de/DE/kultur_freizeit/sport/aktuelles/index.html', 'address': {'@type': 'PostalAddress', 'addressLocality': 'Aachen, Germany', 'addressCountry': 'Germany', 'postalCode': '52062', 'streetAddress': 'Elisabethstraße 10 Aachen'}, 'telephone': '', 'geo': {'@type': 'GeoCoordinates', 'latitude': '50.7733018', 'longitude': '6.0855527'}, 'priceRange': '-', 'image': 'https://storage.googleapis.com/download/storage/v1/b/usc-pro-uscweb-live-media/o/de-live%2Foriginal_1688x950_um3zdgsyqoon7r3qarpi_1680511138931540.png?generation=1680511139039146&amp;alt=media'}",50.7733018,6.0855527,Die Bäder Aachen freuen sich auf Dich! Bitte beachte die Informationen zu den aktuellen Öffnungszeiten der Bäder im jeweiligen Standort-Text oder unter: http://www.aachen.de/DE/kultur_freizeit/sport/aktuelles/index.html
dieHalle,"['Badminton', 'Bouldering', 'Football', 'Trampoline', 'Volleyball']",False,"['Classic', 'Premium', 'Max']",Classic,Aachen,Grüner Weg 22,https://urbansportsclub.com//en/venues/diehalle,"{'@context': 'http://schema.org', '@type': 'LocalBusiness', 'name': 'dieHalle', 'description': 'Auf 4000m2 bieten wir euch in zwei Hallen vielfältige Möglichkeiten Sport zu treiben. Halle 1: Bouldern Parkour Ninja Warrior Trampolin Workout Area In Halle 1 könnt ihr alle Sportarten gleichzeitig machen und müsst Euch nicht festlegen. Dadurch bieten wir ein perfektes Ganzkörpertraining mit viel Spaß. Die notwendige Sicherheit bekommt ihr durch eine Einweisung. Zusätzlich lässt unser neuartiges Konzept echtes Strandfeeling aufkommen: Halle 2 BEACH Beachvolleyball Beachsoccer Beachminton Spikeball Duschen und Umkleiden gehören genauso wie ein Bistro mit Getränken und kleinen Speisen dazu.', 'address': {'@type': 'PostalAddress', 'addressLocality': 'Aachen, Germany', 'addressCountry': 'Germany', 'postalCode': '52070', 'streetAddress': 'Grüner Weg 22'}, 'telephone': '+49 241 609588144', 'geo': {'@type': 'GeoCoordinates', 'latitude': '50.7860434', 'longitude': '6.1018486'}, 'priceRange': '-', 'image': 'https://storage.googleapis.com/download/storage/v1/b/usc-pro-uscweb-live-media/o/de-live%2Foriginal_1024x576_die-halle_fotoshoot_37_1660809835427623_admin.jpg?generation=1660809835495409&amp;alt=media'}",50.7860434,6.1018486,Auf 4000m2 bieten wir euch in zwei Hallen vielfältige Möglichkeiten Sport zu treiben. Halle 1: Bouldern Parkour Ninja Warrior Trampolin Workout Area In Halle 1 könnt ihr alle Sportarten gleichzeitig machen und müsst Euch nicht festlegen. Dadurch bieten wir ein perfektes Ganzkörpertraining mit viel Spaß. Die notwendige Sicherheit bekommt ihr durch eine Einweisung. Zusätzlich lässt unser neuartiges Konzept echtes Strandfeeling aufkommen: Halle 2 BEACH Beachvolleyball Beachsoccer Beachminton Spikeball Duschen und Umkleiden gehören genauso wie ein Bistro mit Getränken und kleinen Speisen dazu.
Bäder Aachen - Schwimmhalle Süd,['Swimming'],False,"['Essential', 'Classic', 'Premium', 'Max']",Essential,Aachen,Amyastraße 8 Aachen,https://urbansportsclub.com//en/venues/schwimmhalle-sud-1,"{'@context': 'http://schema.org', '@type': 'LocalBusiness', 'name': 'Bäder Aachen - Schwimmhalle Süd', 'description': 'Die Bäder Aachen freuen sich auf Dich! Bitte beachte die Informationen zu den aktuellen Öffnungszeiten der Bäder im jeweiligen Standort-Text oder unter: http://www.aachen.de/DE/kultur_freizeit/sport/aktuelles/index.html', 'address': {'@type': 'PostalAddress', 'addressLocality': 'Aachen, Germany', 'addressCountry': 'Germany', 'postalCode': '52066', 'streetAddress': 'Amyastraße 8 Aachen'}, 'telephone': '', 'geo': {'@type': 'GeoCoordinates', 'latitude': '50.76074', 'longitude': '6.08743'}, 'priceRange': '-', 'image': 'https://storage.googleapis.com/download/storage/v1/b/usc-pro-uscweb-live-media/o/de-live%2Foriginal_1688x950_x2a2ivblxm9yrez1c3un_1680511153496980.png?generation=1680511153581954&amp;alt=media'}",50.76074,6.08743,Die Bäder Aachen freuen sich auf Dich! Bitte beachte die Informationen zu den aktuellen Öffnungszeiten der Bäder im jeweiligen Standort-Text oder unter: http://www.aachen.de/DE/kultur_freizeit/sport/aktuelles/index.html
Tivoli Sports,"['Badminton', 'Climbing']",False,"['Classic', 'Premium', 'Max']",Classic,Haaren,Strangenhäuschen 11,https://urbansportsclub.com//en/venues/tivoli-sports-1,"{'@context': 'http://schema.org', '@type': 'LocalBusiness', 'name': 'Tivoli Sports', 'description': 'Herzlich Willkommen bei Tivoli Sports! Unsere Sportanlage bietet euch Badminton und Klettern auf über 1600m². Die Badmintonhalle bietet 12 Badmintonfelder, die mit einem gelenkschonenden Boden ausgestattet und perfekt ausgeleuchtet sind. Sowohl ambitionierte Amateurspieler als auch leistungsorientierte Turnierspieler finden hier beste Trainingsmöglichkeiten. Kletterwände bis 16m Höhe und über 100 ständig wechselnde Routen bieten Klettersport für Kletterer in allen Schwierigkeitsgraden.', 'address': {'@type': 'PostalAddress', 'addressLocality': 'Aachen, Germany', 'addressCountry': 'Germany', 'postalCode': '52070', 'streetAddress': 'Strangenhäuschen 11'}, 'telephone': '', 'geo': {'@type': 'GeoCoordinates', 'latitude': '50.8018765', 'longitude': '6.1116093'}, 'priceRange': '-', 'image': 'https://urbansportsclub.com/images/merchant/venueHome.jpg'}",50.8018765,6.1116093,"Herzlich Willkommen bei Tivoli Sports! Unsere Sportanlage bietet euch Badminton und Klettern auf über 1600m². Die Badmintonhalle bietet 12 Badmintonfelder, die mit einem gelenkschonenden Boden ausgestattet und perfekt ausgeleuchtet sind. Sowohl ambitionierte Amateurspieler als auch leistungsorientierte Turnierspieler finden hier beste Trainingsmöglichkeiten. Kletterwände bis 16m Höhe und über 100 ständig wechselnde Routen bieten Klettersport für Kletterer in allen Schwierigkeitsgraden."
JUICY GYM Kohlscheid,"['Fitness', 'Functional Training', 'Hyrox']",False,"['Classic', 'Premium', 'Max']",Classic,Herzogenrath,Kaiserstraße 96,https://urbansportsclub.com//en/venues/juicy-gym-kohlscheid,"{'@context': 'http://schema.org', '@type': 'LocalBusiness', 'name': 'JUICY GYM Kohlscheid', 'description': '', 'address': {'@type': 'PostalAddress', 'addressLocality': 'Aachen, Germany', 'addressCountry': 'Germany', 'postalCode': '52134', 'streetAddress': 'Kaiserstraße 96'}, 'telephone': '', 'geo': {'@type': 'GeoCoordinates', 'latitude': '50.8309679', 'longitude': '6.0839548'}, 'priceRange': '-', 'image': 'https://storage.googleapis.com/download/storage/v1/b/usc-pro-uscweb-live-media/o/de-live%2Foriginal_500x281_lfahd2pnjjol5o2g4ghu_1735906792199481.png?generation=1735906792278283&amp;alt=media'}",50.8309679,6.0839548,
Warung Yoga Aachen,['Yoga'],False,"['Classic', 'Premium', 'Max']",Classic,Aachen,Marienbongard 24,https://urbansportsclub.com//en/venues/warung-yoga-aachen,"{'@context': 'http://schema.org', '@type': 'LocalBusiness', 'name': 'Warung Yoga Aachen', 'description': 'Warung Yoga Aachen freut sich auf Dich!', 'address': {'@type': 'PostalAddress', 'addressLocality': 'Aachen, Germany', 'addressCountry': 'Germany', 'postalCode': '52062', 'streetAddress': 'Marienbongard 24'}, 'telephone': '+49 163 5169366', 'geo': {'@type': 'GeoCoordinates', 'latitude': '50.779968878', 'longitude': '6.078564077'}, 'priceRange': '-', 'image': 'https://storage.googleapis.com/download/storage/v1/b/usc-pro-uscweb-live-media/o/de-live%2Foriginal_640x360_ti083e3gsnxsousecppl_16872677162786.png?generation=1687267716068374&amp;alt=media'}",50.779968878,6.078564077,Warung Yoga Aachen freut sich auf Dich!
Drehimpuls Aachen,"['Pole Dance', 'Relaxation']",False,"['Classic', 'Premium', 'Max']",Classic,Aachen,Goffartstraße 26,https://urbansportsclub.com//en/venues/drehimpuls-aachen,"{'@context': 'http://schema.org', '@type': 'LocalBusiness', 'name': 'Drehimpuls Aachen', 'description': '', 'address': {'@type': 'PostalAddress', 'addressLocality': 'Aachen, Germany', 'addressCountry': 'Germany', 'postalCode': '52066', 'streetAddress': 'Goffartstraße 26'}, 'telephone': '+44 17663479546', 'geo': {'@type': 'GeoCoordinates', 'latitude': '50.7668288', 'longitude': '6.1034789'}, 'priceRange': '-', 'image': 'https://storage.googleapis.com/download/storage/v1/b/usc-pro-uscweb-live-media/o/venues%2Foriginal_640x360_nan2v5ujhspp3kfqiuyc_1753790340325362.png?generation=1753790340416420&amp;alt=media'}",50.7668288,6.1034789,
Superfly Air Sports - Aachen,['Trampoline'],False,"['Classic', 'Premium', 'Max']",Classic,Kohlscheid,Roermonder Str. 55,https://urbansportsclub.com//en/venues/superfly-air-sports-aachen,"{'@context': 'http://schema.org', '@type': 'LocalBusiness', 'name': 'Superfly Air Sports - Aachen', 'description': 'SUPERFLY AIR SPORTS – GO FLY OR GO HOME! Bei SUPERFLY AIR SPORTS hast Du die Möglichkeit, in den größten und angesagtesten Trampolinparks Deutschlands Dein sportliches Können unter Beweis zu stellen. Wir bieten Dir ein Erlebnis der Extraklasse. Auf verschiedenen riesigen Trampolinflächen und Attraktionen wie Ninja Parcours, Freefall Slide, Flying Dunk, Balance Court, Waterfall Trampoline oder Swing Fall kannst Du Deine Kraft, Balance, Beweglichkeit und Ausdauer testen und verbessern. SUPERFLY AIR SPORTS Parks werden von hochwertigen Sound- und Lichtinstallationen flankiert, die aus reinen Sport- und Freizeitstätten, echte It-Spots für jede Gelegenheit machen. Neben sportlichen Ansprüchen zählen daher Ausstattung und Design zu den obersten Prämissen. Jeder Park erscheint in seinem ganz eigenen Look und präsentiert sich in einer eigenen Farbwelt. Mit insgesamt neun Parks in ganz Deutschland gehört SUPERFLY AIR SPORTS zu den größten Trampolinpark-Anbietern Deutschlands. Zu finden sind die Megaparks in Aachen, Bielefeld, Dortmund, Dresden, Düsseldorf, Duisburg, Hannover, München und Wiesbaden. Als absoluter Trendsetter im Bereich Indoor-Sport setzt SUPERFLY AIR SPORTS neue Maßstäbe – Dein Besuch bei uns im Park wird auch für Dich ein unvergessliches Erlebnis!', 'address': {'@type': 'PostalAddress', 'addressLocality': 'Aachen, Germany', 'addressCountry': 'Germany', 'postalCode': '52134', 'streetAddress': 'Roermonder Str. 55'}, 'telephone': '', 'geo': {'@type': 'GeoCoordinates', 'latitude': '50.8333995', 'longitude': '6.0763938'}, 'priceRange': '-', 'image': 'https://storage.googleapis.com/download/storage/v1/b/usc-pro-uscweb-live-media/o/de-live%2Foriginal_2000x1125_Unbenannt_1581608759761018_admin.png?alt=media'}",50.8333995,6.0763938,"SUPERFLY AIR SPORTS – GO FLY OR GO HOME! Bei SUPERFLY AIR SPORTS hast Du die Möglichkeit, in den größten und angesagtesten Trampolinparks Deutschlands Dein sportliches Können unter Beweis zu stellen. Wir bieten Dir ein Erlebnis der Extraklasse. Auf verschiedenen riesigen Trampolinflächen und Attraktionen wie Ninja Parcours, Freefall Slide, Flying Dunk, Balance Court, Waterfall Trampoline oder Swing Fall kannst Du Deine Kraft, Balance, Beweglichkeit und Ausdauer testen und verbessern. SUPERFLY AIR SPORTS Parks werden von hochwertigen Sound- und Lichtinstallationen flankiert, die aus reinen Sport- und Freizeitstätten, echte It-Spots für jede Gelegenheit machen. Neben sportlichen Ansprüchen zählen daher Ausstattung und Design zu den obersten Prämissen. Jeder Park erscheint in seinem ganz eigenen Look und präsentiert sich in einer eigenen Farbwelt. Mit insgesamt neun Parks in ganz Deutschland gehört SUPERFLY AIR SPORTS zu den größten Trampolinpark-Anbietern Deutschlands. Zu finden sind die Megaparks in Aachen, Bielefeld, Dortmund, Dresden, Düsseldorf, Duisburg, Hannover, München und Wiesbaden. Als absoluter Trendsetter im Bereich Indoor-Sport setzt SUPERFLY AIR SPORTS neue Maßstäbe – Dein Besuch bei uns im Park wird auch für Dich ein unvergessliches Erlebnis!"
Yoga & Pilates mit Sermin,"['Pilates', 'Yoga']",False,"['Classic', 'Premium', 'Max']",Classic,Düren,Markt 33,https://urbansportsclub.com//en/venues/yoga-pilates-mit-sermin,"{'@context': 'http://schema.org', '@type': 'LocalBusiness', 'name': 'Yoga &amp; Pilates mit Sermin', 'description': '', 'address': {'@type': 'PostalAddress', 'addressLocality': 'Aachen, Germany', 'addressCountry': 'Germany', 'postalCode': '52349', 'streetAddress': 'Markt 33'}, 'telephone': '+44 1639 788854', 'geo': {'@type': 'GeoCoordinates', 'latitude': '50.8020168', 'longitude': '6.4840921'}, 'priceRange': '-', 'image': 'https://storage.googleapis.com/download/storage/v1/b/usc-pro-uscweb-live-media/o/venues%2Foriginal_640x360_ufh4xybhybkfgfjujfwx_1764705468821568.png?generation=1764705468963175&amp;alt=media'}",50.8020168,6.4840921,
Rurbad Düren,['Swimming'],False,"['Essential', 'Classic', 'Premium', 'Max']",Essential,Düren,Nippesstraße 6,https://urbansportsclub.com//en/venues/rurbad-dren,"{'@context': 'http://schema.org', '@type': 'LocalBusiness', 'name': 'Rurbad Düren', 'description': 'Rurbad Düren freut sich auf dich!', 'address': {'@type': 'PostalAddress', 'addressLocality': 'Aachen, Germany', 'addressCountry': 'Germany', 'postalCode': '52349', 'streetAddress': 'Nippesstraße 6'}, 'telephone': '+44 24219980660', 'geo': {'@type': 'GeoCoordinates', 'latitude': '50.7938744', 'longitude': '6.4865061'}, 'priceRange': '-', 'image': 'https://storage.googleapis.com/download/storage/v1/b/usc-pro-uscweb-live-media/o/de-live%2Foriginal_777x437_neaipslvvavfyxus18us_1727783518221801.png?generation=1727783518276603&amp;alt=media'}",50.7938744,6.4865061,Rurbad Düren freut sich auf dich!
Fit & Fight Arena UG ESCHWEILER,"['Boxing Sports', 'Free Fight']",False,"['Classic', 'Premium', 'Max']",Classic,Eschweiler,Englerthstraße 3,https://urbansportsclub.com//en/venues/fit-fight-arena-ug-eschweiler,"{'@context': 'http://schema.org', '@type': 'LocalBusiness', 'name': 'Fit &amp; Fight Arena UG ESCHWEILER ', 'description': 'Die Fit &amp; Fight Arena freut sich auf Dich!', 'address': {'@type': 'PostalAddress', 'addressLocality': 'Aachen, Germany', 'addressCountry': 'Germany', 'postalCode': '52249', 'streetAddress': 'Mittelstr. 31'}, 'telephone': '+49 1525 4009094', 'geo': {'@type': 'GeoCoordinates', 'latitude': '50.813893203', 'longitude': '6.258535949'}, 'priceRange': '-', 'image': 'https://storage.googleapis.com/download/storage/v1/b/usc-pro-uscweb-live-media/o/de-live%2Foriginal_4032x2268_daa6b2a9029f-A2FD7117_F7D3_4658_AF2D_334830996011_1662040272352873_admin.jpeg?generation=1662040272465361&amp;alt=media'}",50.813893203,6.258535949,Die Fit &amp; Fight Arena freut sich auf Dich!
Derby Arena,['Badminton'],False,"['Classic', 'Premium', 'Max']",Classic,Kohlscheid,Derby Arena,https://urbansportsclub.com//en/venues/derby-arena,"{'@context': 'http://schema.org', '@type': 'LocalBusiness', 'name': 'Derby Arena', 'description': 'Derby Arena freut sich auf Dich!', 'address': {'@type': 'PostalAddress', 'addressLocality': 'Aachen, Germany', 'addressCountry': 'Germany', 'postalCode': '52134', 'streetAddress': 'Kaiserstraße 96'}, 'telephone': '+49 2407 559000', 'geo': {'@type': 'GeoCoordinates', 'latitude': '50.8309679', 'longitude': '6.0839548'}, 'priceRange': '-', 'image': 'https://storage.googleapis.com/download/storage/v1/b/usc-pro-uscweb-live-media/o/de-live%2Foriginal_2000x1125_TennisCompressed_1582284515749196_admin.jpg?alt=media'}",50.8309679,6.0839548,Derby Arena freut sich auf Dich!
Rala Yoga @Energieraum,"['Pilates', 'Yoga']",False,"['Classic', 'Premium', 'Max']",Classic,Heinsberg,Liecker Straße 22,https://urbansportsclub.com//en/venues/rala-yoga-energieraum,"{'@context': 'http://schema.org', '@type': 'LocalBusiness', 'name': 'Rala Yoga @Energieraum', 'description': '', 'address': {'@type': 'PostalAddress', 'addressLocality': 'Aachen, Germany', 'addressCountry': 'Germany', 'postalCode': '52525', 'streetAddress': 'Liecker Straße 22'}, 'telephone': '+44 15904543583', 'geo': {'@type': 'GeoCoordinates', 'latitude': '51.0640439', 'longitude': '6.0932625'}, 'priceRange': '-', 'image': 'https://storage.googleapis.com/download/storage/v1/b/usc-pro-uscweb-live-media/o/de-live%2Foriginal_533x299_fjymggve1ybgjbikewgc_1742221239416411.png?generation=1742221239507237&amp;alt=media'}",51.0640439,6.0932625,
"Alexa Harst, Tanz & Gymnastik","['Dance', 'Fitness', 'Pilates', 'Yoga']",False,"['Classic', 'Premium', 'Max']",Classic,Würselen,Morlaixplatz 5,https://urbansportsclub.com//en/venues/alexa-harst-tanz-gymnastik,"{'@context': 'http://schema.org', '@type': 'LocalBusiness', 'name': 'Alexa Harst, Tanz &amp; Gymnastik', 'description': 'Alexa Harst, Tanz &amp; Gymnastik freut sich auf Dich!', 'address': {'@type': 'PostalAddress', 'addressLocality': 'Aachen, Germany', 'addressCountry': 'Germany', 'postalCode': '52146', 'streetAddress': 'Morlaixplatz 5'}, 'telephone': '', 'geo': {'@type': 'GeoCoordinates', 'latitude': '50.8195715', 'longitude': '6.1311295'}, 'priceRange': '-', 'image': 'https://storage.googleapis.com/download/storage/v1/b/usc-pro-uscweb-live-media/o/de-live%2Foriginal_1688x950_Tanzen%20compressed_158340009828067_admin.jpg?alt=media'}",50.8195715,6.1311295,"Alexa Harst, Tanz &amp; Gymnastik freut sich auf Dich!"
JAHA Training - Outdoor,"['Bootcamp', 'Family Sports', 'Fitness', 'Personal Training', 'Relaxation']",False,"['Classic', 'Premium', 'Max']",Classic,Alsdorf,Konrad-Adenauer-Allee 1-3,https://urbansportsclub.com//en/venues/your-bootcamp-kubiz-alsdorf,"{'@context': 'http://schema.org', '@type': 'LocalBusiness', 'name': 'JAHA Training - Outdoor', 'description': 'Training draußen - immer! Jeder ist anders und so sind es unsere einzelnen Schwerpunkte auch! Das ist wir: Your Bootcamp ist Teamwork, denn auch die besten Einzelkämpfer trainieren im Team! Lass Dich motivieren! Dein Coach betreut dich intensiv. Wir arbeiten effektiv durch abwechslungsreiches Functional Training. Wir lassen dein „Das kann ich nicht…“ im Keim ersticken! Mit oder ohne Vertragsbindung. Deine Entscheidung! Wir sorgen für Spaß! Auch im Bootcamp darf gelacht werden. Jeder kann hier mitmachen! Dein Coach passt die Belastung an.', 'address': {'@type': 'PostalAddress', 'addressLocality': 'Aachen, Germany', 'addressCountry': 'Germany', 'postalCode': '52477', 'streetAddress': 'Konrad-Adenauer-Allee 1-3'}, 'telephone': '', 'geo': {'@type': 'GeoCoordinates', 'latitude': '50.8739727', 'longitude': '6.1478389'}, 'priceRange': '-', 'image': 'https://storage.googleapis.com/download/storage/v1/b/usc-pro-uscweb-live-media/o/de-live%2Foriginal_3076x1730_069a8c05925a-X_1_1592385042633772_admin.jpg?alt=media'}",50.8739727,6.1478389,"Training draußen - immer! Jeder ist anders und so sind es unsere einzelnen Schwerpunkte auch! Das ist wir: Your Bootcamp ist Teamwork, denn auch die besten Einzelkämpfer trainieren im Team! Lass Dich motivieren! Dein Coach betreut dich intensiv. Wir arbeiten effektiv durch abwechslungsreiches Functional Training. Wir lassen dein „Das kann ich nicht…“ im Keim ersticken! Mit oder ohne Vertragsbindung. Deine Entscheidung! Wir sorgen für Spaß! Auch im Bootcamp darf gelacht werden. Jeder kann hier mitmachen! Dein Coach passt die Belastung an."
Aachener Boulder Club,['Bouldering'],False,"['Classic', 'Premium', 'Max']",Classic,Aachen,Charlottenstraße 14,https://urbansportsclub.com//en/venues/andres-boulder-club,"{'@context': 'http://schema.org', '@type': 'LocalBusiness', 'name': 'Aachener Boulder Club', 'description': 'Andres Boulder Club freut sich auf DIch!', 'address': {'@type': 'PostalAddress', 'addressLocality': 'Aachen, Germany', 'addressCountry': 'Germany', 'postalCode': '52070', 'streetAddress': 'Charlottenstraße 14'}, 'telephone': '+49 176 32119973', 'geo': {'@type': 'GeoCoordinates', 'latitude': '50.7712877', 'longitude': '6.1052881'}, 'priceRange': '-', 'image': 'https://storage.googleapis.com/download/storage/v1/b/usc-pro-uscweb-live-media/o/de-live%2Foriginal_640x360_hw58osif21xw0fsp1e5o_1688118024469869.png?generation=1688118024551843&amp;alt=media'}",50.7712877,6.1052881,Andres Boulder Club freut sich auf DIch!
Yogaworx Schanz Lütticherstraße,['Yoga'],False,"['Classic', 'Premium', 'Max']",Classic,Aachen,Lütticher Straße 10,https://urbansportsclub.com//en/venues/yogaworx-schanz-ltticherstrae,"{'@context': 'http://schema.org', '@type': 'LocalBusiness', 'name': 'Yogaworx Schanz Lütticherstraße', 'description': 'Yogaworx freut sich auf dich !', 'address': {'@type': 'PostalAddress', 'addressLocality': 'Aachen, Germany', 'addressCountry': 'Germany', 'postalCode': '52064', 'streetAddress': 'Lütticher Straße 10'}, 'telephone': '+49 174 9811858', 'geo': {'@type': 'GeoCoordinates', 'latitude': '50.768718', 'longitude': '6.0735615'}, 'priceRange': '-', 'image': 'https://storage.googleapis.com/download/storage/v1/b/usc-pro-uscweb-live-media/o/de-live%2Foriginal_640x360_bcemksxozwffxtyk1g4d_1732885745127749.png?generation=1732885745210291&amp;alt=media'}",50.768718,6.0735615,Yogaworx freut sich auf dich !
Boltzcamp,"['Crosstraining', 'Functional Training', 'Yoga']",False,"['Classic', 'Premium', 'Max']",Classic,Gangelt,Borsigstr 70,https://urbansportsclub.com//en/venues/boltzcamp,"{'@context': 'http://schema.org', '@type': 'LocalBusiness', 'name': 'Boltzcamp', 'description': 'Wir sind ein kleines, familiäres Gym. Alle Coaches sind Spezialisten auf diversen Gebieten. Unsere Community ist der absolute Wahnsinn und gemeinsam mit uns und allen anderen Athleten/innen erreichst du deine sportlichen Ziele', 'address': {'@type': 'PostalAddress', 'addressLocality': 'Aachen, Germany', 'addressCountry': 'Germany', 'postalCode': '52525', 'streetAddress': 'Borsigstr 70'}, 'telephone': '', 'geo': {'@type': 'GeoCoordinates', 'latitude': '51.0664', 'longitude': '6.11745'}, 'priceRange': '-', 'image': 'https://storage.googleapis.com/download/storage/v1/b/usc-pro-uscweb-live-media/o/de-live%2Foriginal_2560x1440_7a4356ff9a93-20210302_121440_scaled_170107381074393_admin.jpg?generation=1701073810155412&amp;alt=media'}",51.0664,6.11745,"Wir sind ein kleines, familiäres Gym. Alle Coaches sind Spezialisten auf diversen Gebieten. Unsere Community ist der absolute Wahnsinn und gemeinsam mit uns und allen anderen Athleten/innen erreichst du deine sportlichen Ziele"
