name,disciplines,plus_options,plans,min_plan,district,street,link,metadata,latitude,longitude,description
Fitness First Magdeburg,"['Fitness', 'Functional Training', 'Pilates', 'Yoga']",False,"['M', 'L', 'XL']",M,Sudenburg,Kroatenweg 70-72,https://urbansportsclub.com//en/venues/fitnessloft-magdeburg-1,"{'@context': 'http://schema.org', '@type': 'LocalBusiness', 'name': 'Fitness First Magdeburg', 'description': 'FITNESSLOFT FITNESS NEU ERLEBEN. „Fitness neu erleben“ – hier stehst Du im Mittelpunkt. Seit der Gründung 2009 breitet sich das FitnessLOFT mit seinem individuellen Lifestyle-Entwurf stetig weiter aus. Wir beweisen, was andere nur versprechen: Im LOFT erreichst Du Deine Ziele – ohne Kompromiss! Wie das geht? Qualitative Ausstattung und loftiges Ambiente schaffen einen Wohlfühlort, den Du am liebsten gar nicht mehr verlassen möchtest. Moderne Geräte, fundierte Trainingsmethoden und eigens ausgebildete Trainer sind dem FitnessLOFT wichtig. Dank Kraft- und Cardiogeräten, dem populären TRX- und Vibrationstraining sowie dem modernen, chipgesteuerten milon Zirkel können Mitglieder sich in die Form ihres Lebens trainieren. Deine Workout-Buddys dürfen nicht fehlen? Bei dem im Monat 200 Kurse umfassenden Kursprogramm bleibt kein T-Shirt trocken – zusammen schafft ihr alles! Von Zumba® über Langhantelkurse bis hin zu Pilates kann sich ordentlich ausgepowert werden - und das zu einem fairen Preis-Leistungsverhältnis. Du willst Teil der Fitnessloft-Community werden? Dann verschaffe Dir einen eigenen Eindruck und besuche uns. Das FitnessLOFT-Team freut sich auf Dich.', 'address': {'@type': 'PostalAddress', 'addressLocality': 'Magdeburg, Germany', 'addressCountry': 'Germany', 'postalCode': '39116', 'streetAddress': 'Kroatenweg 70-72'}, 'telephone': '', 'geo': {'@type': 'GeoCoordinates', 'latitude': '52.1075809', 'longitude': '11.5908814'}, 'priceRange': '-', 'image': 'https://storage.googleapis.com/download/storage/v1/b/usc-pro-uscweb-live-media/o/de-live%2Foriginal_640x360_foizhpggcfkqekxc3o3a_1699345575295803.png?generation=1699345575400655&amp;alt=media'}",52.1075809,11.5908814,"FITNESSLOFT FITNESS NEU ERLEBEN. „Fitness neu erleben“ – hier stehst Du im Mittelpunkt. Seit der Gründung 2009 breitet sich das FitnessLOFT mit seinem individuellen Lifestyle-Entwurf stetig weiter aus. Wir beweisen, was andere nur versprechen: Im LOFT erreichst Du Deine Ziele – ohne Kompromiss! Wie das geht? Qualitative Ausstattung und loftiges Ambiente schaffen einen Wohlfühlort, den Du am liebsten gar nicht mehr verlassen möchtest. Moderne Geräte, fundierte Trainingsmethoden und eigens ausgebildete Trainer sind dem FitnessLOFT wichtig. Dank Kraft- und Cardiogeräten, dem populären TRX- und Vibrationstraining sowie dem modernen, chipgesteuerten milon Zirkel können Mitglieder sich in die Form ihres Lebens trainieren. Deine Workout-Buddys dürfen nicht fehlen? Bei dem im Monat 200 Kurse umfassenden Kursprogramm bleibt kein T-Shirt trocken – zusammen schafft ihr alles! Von Zumba® über Langhantelkurse bis hin zu Pilates kann sich ordentlich ausgepowert werden - und das zu einem fairen Preis-Leistungsverhältnis. Du willst Teil der Fitnessloft-Community werden? Dann verschaffe Dir einen eigenen Eindruck und besuche uns. Das FitnessLOFT-Team freut sich auf Dich."
Crossfit® Magdeburg,['Crosstraining'],False,"['L', 'XL']",L,Alte Neustadt,Harsdorfer Str. 31a,https://urbansportsclub.com//en/venues/crossfit-magdeburg,"{'@context': 'http://schema.org', '@type': 'LocalBusiness', 'name': 'Crossfit® Magdeburg', 'description': 'Crossfit® Magdeburg - die erste Adresse in Deiner Stadt für abwechslungsreiches Training Ganzheitlich - oder wie wir sagen: &quot;Ein mal überall Muskelkater, bitte&quot; Funktionell - auf Deutsch: &quot;Wir trainieren ohne Geräteschnickschnack und für den Alltagsgebrauch&quot; Individuell - wir bieten individuelle Lösungen für jeden Sportlertyp ob Anfänger oder Profi Professionell - langjährige Erfahrung im Bereich CrossFit - mehr wirst Du in Magdeburg nicht finden Trau Dich! Komm einfach mal vorbei, lerne unsere Community kennen und genieße einen entspannten Blick auf die Elbe (aber erst nach dem Training)', 'address': {'@type': 'PostalAddress', 'addressLocality': 'Magdeburg, Germany', 'addressCountry': 'Germany', 'postalCode': '39110', 'streetAddress': 'Harsdorfer Str. 31a'}, 'telephone': '', 'geo': {'@type': 'GeoCoordinates', 'latitude': '52.1340082', 'longitude': '11.5996366'}, 'priceRange': '-', 'image': 'https://storage.googleapis.com/download/storage/v1/b/usc-pro-uscweb-live-media/o/de-live%2Foriginal_1920x1080_141.jpg?alt=media'}",52.1340082,11.5996366,"Crossfit® Magdeburg - die erste Adresse in Deiner Stadt für abwechslungsreiches Training Ganzheitlich - oder wie wir sagen: &quot;Ein mal überall Muskelkater, bitte&quot; Funktionell - auf Deutsch: &quot;Wir trainieren ohne Geräteschnickschnack und für den Alltagsgebrauch&quot; Individuell - wir bieten individuelle Lösungen für jeden Sportlertyp ob Anfänger oder Profi Professionell - langjährige Erfahrung im Bereich CrossFit - mehr wirst Du in Magdeburg nicht finden Trau Dich! Komm einfach mal vorbei, lerne unsere Community kennen und genieße einen entspannten Blick auf die Elbe (aber erst nach dem Training)"
Jens Herte Relaxarium,['Wellness'],False,"['M', 'L', 'XL']",M,Sudenburg,Halberstädter Str.,https://urbansportsclub.com//en/venues/relaxarium,"{'@context': 'http://schema.org', '@type': 'LocalBusiness', 'name': 'Jens Herte Relaxarium', 'description': 'Du möchtest dich erholen, entspannen und dabei etwas für deine Gesundheit tun? Kein Telefon, keine Eile und Hektik, nur die Seele baumeln lassen und Meeresklima genießen? Dann erlebe in einmaliger Atmosphäre die Heilkraft der Salzes im Magdeburger Gesundheitsparadies RELAXarium. Wenn du für einen Augenblick in den Salzräumen die Augen zum Atmen schließt, kannst du die Frische der Berge oder des Meeres empfinden. Und wenn du die Augen wieder öffnest, überraschst dich schon der nächste Genuss - das Lichtspiel berührt dich bis in die Seele. Das Salz entwickelt einen Schutzmantel vor elektromagnetischer Strahlung. Jeder Atemzug bringt die geistige und körperliche Leistungsfähigkeit in Schwung. Dem Salz wird nach ärztlichen Untersuchungen eine senkende Wirkung der Herzfrequenz bescheinigt. Eine perfekte Voraussetzung für eine tiefsinnige Entspannung. Das Team begleitet dich, deine Familie, Freunde oder Kollegen und verwöhnt dich mit seinem vielfältigen Wellness Programm! Das ganze Team freut sich, dich bald als Gast im RELAXarium Magdeburg zu begrüßen.', 'address': {'@type': 'PostalAddress', 'addressLocality': 'Magdeburg, Germany', 'addressCountry': 'Germany', 'postalCode': '39112', 'streetAddress': 'Halberstädter Str.'}, 'telephone': '+44 1605 231284', 'geo': {'@type': 'GeoCoordinates', 'latitude': '52.1122563', 'longitude': '11.6057078'}, 'priceRange': '-', 'image': 'https://storage.googleapis.com/download/storage/v1/b/usc-pro-uscweb-live-media/o/de-live%2Foriginal_1024x576_7G7A2736_1024.jpg?alt=media'}",52.1122563,11.6057078,"Du möchtest dich erholen, entspannen und dabei etwas für deine Gesundheit tun? Kein Telefon, keine Eile und Hektik, nur die Seele baumeln lassen und Meeresklima genießen? Dann erlebe in einmaliger Atmosphäre die Heilkraft der Salzes im Magdeburger Gesundheitsparadies RELAXarium. Wenn du für einen Augenblick in den Salzräumen die Augen zum Atmen schließt, kannst du die Frische der Berge oder des Meeres empfinden. Und wenn du die Augen wieder öffnest, überraschst dich schon der nächste Genuss - das Lichtspiel berührt dich bis in die Seele. Das Salz entwickelt einen Schutzmantel vor elektromagnetischer Strahlung. Jeder Atemzug bringt die geistige und körperliche Leistungsfähigkeit in Schwung. Dem Salz wird nach ärztlichen Untersuchungen eine senkende Wirkung der Herzfrequenz bescheinigt. Eine perfekte Voraussetzung für eine tiefsinnige Entspannung. Das Team begleitet dich, deine Familie, Freunde oder Kollegen und verwöhnt dich mit seinem vielfältigen Wellness Programm! Das ganze Team freut sich, dich bald als Gast im RELAXarium Magdeburg zu begrüßen."
EASYFITNESS Magdeburg,"['Fitness', 'Functional Training']",False,"['M', 'L', 'XL']",M,Halberstadt,Otto-von-Guericke-Straße 14,https://urbansportsclub.com//en/venues/easyfitness-magdeburg,"{'@context': 'http://schema.org', '@type': 'LocalBusiness', 'name': 'EASYFITNESS Magdeburg', 'description': 'KOMM REIN. SEI DU SELBST. MACH DEIN DING. Fitness und aktives Gesundheitstraining gehören heute zum Lifestyle. Es geht mittlerweile um mehr als nur um fit werden und Sport in einem Fitnessstudio. Es geht um die Gemeinschaft und um das persönliche Wachstum &amp; die Selbstverwirklichung, um das Erleben der und des Raumes – eben um einen ganz eigenen Lifestyle. Lifestyle and Sport ist das Leitmotiv der Philosophie von EASYFITNESS. Wir stehen dafür, Euch die Inspiration für einen aktiven Alltag zu bieten, Freunde zu treffen und neue Kontakte zu knüpfen. Das Erfolgsrezept dahinter ist denkbar einfach: Sportliche Aktivitäten sollen zu einem festen Lebensbestandteil werden und für jeden zugänglich sein, unabhängig vom Alter, der bisherigen Fitness oder dem Gesundheitszustand. Mit einem attraktiven Beitrag und einer hochwertigen Studioausstattung spricht EASYFITNESS all jene an, die preisbewusst sind, einen hohen Anspruch an das Geräteangebot und Ihr Training stellen und keine Abstriche beim Ambiente des Clubs machen. Die EASYFITNESS-Philosophie „lifestyle and sport“ inspiriert die Mitglieder zu einem aktiven und engagierten Leben. Der Fitness- und Gesundheitssport bei EASYFITNESS soll so einfach und locker sein, dass ihn jeder Mensch in möglichst kurzer Zeit ausüben kann.', 'address': {'@type': 'PostalAddress', 'addressLocality': 'Magdeburg, Germany', 'addressCountry': 'Germany', 'postalCode': '39104', 'streetAddress': 'Otto-von-Guericke-Straße 14'}, 'telephone': '', 'geo': {'@type': 'GeoCoordinates', 'latitude': '52.12997', 'longitude': '11.63085'}, 'priceRange': '-', 'image': 'https://storage.googleapis.com/download/storage/v1/b/usc-pro-uscweb-live-media/o/de-live%2Foriginal_1024x576_1_1635524401988772_admin.jpg?generation=1635524402219531&amp;alt=media'}",52.12997,11.63085,"KOMM REIN. SEI DU SELBST. MACH DEIN DING. Fitness und aktives Gesundheitstraining gehören heute zum Lifestyle. Es geht mittlerweile um mehr als nur um fit werden und Sport in einem Fitnessstudio. Es geht um die Gemeinschaft und um das persönliche Wachstum &amp; die Selbstverwirklichung, um das Erleben der und des Raumes – eben um einen ganz eigenen Lifestyle. Lifestyle and Sport ist das Leitmotiv der Philosophie von EASYFITNESS. Wir stehen dafür, Euch die Inspiration für einen aktiven Alltag zu bieten, Freunde zu treffen und neue Kontakte zu knüpfen. Das Erfolgsrezept dahinter ist denkbar einfach: Sportliche Aktivitäten sollen zu einem festen Lebensbestandteil werden und für jeden zugänglich sein, unabhängig vom Alter, der bisherigen Fitness oder dem Gesundheitszustand. Mit einem attraktiven Beitrag und einer hochwertigen Studioausstattung spricht EASYFITNESS all jene an, die preisbewusst sind, einen hohen Anspruch an das Geräteangebot und Ihr Training stellen und keine Abstriche beim Ambiente des Clubs machen. Die EASYFITNESS-Philosophie „lifestyle and sport“ inspiriert die Mitglieder zu einem aktiven und engagierten Leben. Der Fitness- und Gesundheitssport bei EASYFITNESS soll so einfach und locker sein, dass ihn jeder Mensch in möglichst kurzer Zeit ausüben kann."
Carl-Miller-Bad,['Swimming'],False,"['S', 'M', 'L', 'XL']",S,Leipziger Straße,Carl-Miller-Straße,https://urbansportsclub.com//en/venues/carl-miller-bad,"{'@context': 'http://schema.org', '@type': 'LocalBusiness', 'name': 'Carl-Miller-Bad', 'description': 'Über den Urban Sports Club kannst du in Magdeburg in den Bädern schwimmen gehen. In der Sommersaison können zudem auch die Freibäder besucht werden. Bitte achte auf die jeweiligen Besonderheiten rechts beim Besuch des jeweiligen Bades. Viel sonniges und nasses Vergnügen in den Bädern von Magdeburg!', 'address': {'@type': 'PostalAddress', 'addressLocality': 'Magdeburg, Germany', 'addressCountry': 'Germany', 'postalCode': '39112', 'streetAddress': 'Carl-Miller-Straße'}, 'telephone': '', 'geo': {'@type': 'GeoCoordinates', 'latitude': '52.117834', 'longitude': '11.62199'}, 'priceRange': '-', 'image': 'https://storage.googleapis.com/download/storage/v1/b/usc-pro-uscweb-live-media/o/de-live%2Foriginal_1024x576_01-Wasserbecken%202.jpg?alt=media'}",52.117834,11.62199,Über den Urban Sports Club kannst du in Magdeburg in den Bädern schwimmen gehen. In der Sommersaison können zudem auch die Freibäder besucht werden. Bitte achte auf die jeweiligen Besonderheiten rechts beim Besuch des jeweiligen Bades. Viel sonniges und nasses Vergnügen in den Bädern von Magdeburg!
Tabula Rasa 2.0 | Ganzheitlich Gesund Erfolgreich,['Yoga'],False,"['M', 'L', 'XL']",M,Cracau,Cracauer Straße 66,https://urbansportsclub.com//en/venues/tabula-rasa-20-ganzheitlich-gesund-erfolgreich,"{'@context': 'http://schema.org', '@type': 'LocalBusiness', 'name': 'Tabula Rasa 2.0 | Ganzheitlich Gesund Erfolgreich', 'description': 'Namasté und herzlich willkommen! Liebe Yogini, lieber Yogin, unser Körper und unser Geist brauchen Pausen, um zur Ruhe zu kommen, um körperliche und geistige Regeneration möglich zu machen, im Fokus, geerdet und gesund zu werden und/oder zu bleiben. Yoga ist ein kräftiges Werkzeug zur Regeneration und bietet damit den perfekten Ausgleich zu den körperlichen und geistigen Anforderungen und Anspannungen des digitalen Zeitalters. Mein Yoga ist ein klassischer Hatha-Yoga der Sivananda-Tradition; mit intensiven Shavasana (Anfangs- und Endentspannungen), Meditation, Pranayama (Atemübungen) und den Asanas (Körperübungen). Der Yoga des Swami Sivananda ist jedoch der integrale Yoga. Immer wieder fließen deshalb Elemente und Übungen aus dem Kundalini-Yoga (dem Yoga der Energie), Raja-Yoga (mentales Training), Jnana-Yoga (dem Yoga des Wissens) und dem Bhakti-Yoga (Herzöffnung und Hingabe, z.B. durch das Singen von Mantra-s) ein. In meiner Yoga-Praxis kommen ätherische Öle zum Einsatz, um das jeweilige Thema oder die jeweilige Grundstimmung zu unterstützen. Ich bin promovierte Verhaltensneurobiologin, Autorin, Yogalehrerin, systemische Coach, Wanderführerin uvm. Ich habe es mir zur Aufgabe gemacht, Menschen ganzheitlich gesund, zufrieden und erfolgreich zu machen. Yoga ist ein Teil des Puzzles zu ganzheitlicher Gesundheit, Zufriedenheit und letztlich dem eigenen Lebensglück. Ich freu mich auf Dich auf der Yogamatte! Herzliche Sonnengrüße Kathrin', 'address': {'@type': 'PostalAddress', 'addressLocality': 'Magdeburg, Germany', 'addressCountry': 'Germany', 'postalCode': '39114', 'streetAddress': 'Cracauer Straße 66'}, 'telephone': '', 'geo': {'@type': 'GeoCoordinates', 'latitude': '52.1188705', 'longitude': '11.6612827'}, 'priceRange': '-', 'image': 'https://storage.googleapis.com/download/storage/v1/b/usc-pro-uscweb-live-media/o/de-live%2Foriginal_1024x576_1_165631842431271_admin.png?generation=1656318424128174&amp;alt=media'}",52.1188705,11.6612827,"Namasté und herzlich willkommen! Liebe Yogini, lieber Yogin, unser Körper und unser Geist brauchen Pausen, um zur Ruhe zu kommen, um körperliche und geistige Regeneration möglich zu machen, im Fokus, geerdet und gesund zu werden und/oder zu bleiben. Yoga ist ein kräftiges Werkzeug zur Regeneration und bietet damit den perfekten Ausgleich zu den körperlichen und geistigen Anforderungen und Anspannungen des digitalen Zeitalters. Mein Yoga ist ein klassischer Hatha-Yoga der Sivananda-Tradition; mit intensiven Shavasana (Anfangs- und Endentspannungen), Meditation, Pranayama (Atemübungen) und den Asanas (Körperübungen). Der Yoga des Swami Sivananda ist jedoch der integrale Yoga. Immer wieder fließen deshalb Elemente und Übungen aus dem Kundalini-Yoga (dem Yoga der Energie), Raja-Yoga (mentales Training), Jnana-Yoga (dem Yoga des Wissens) und dem Bhakti-Yoga (Herzöffnung und Hingabe, z.B. durch das Singen von Mantra-s) ein. In meiner Yoga-Praxis kommen ätherische Öle zum Einsatz, um das jeweilige Thema oder die jeweilige Grundstimmung zu unterstützen. Ich bin promovierte Verhaltensneurobiologin, Autorin, Yogalehrerin, systemische Coach, Wanderführerin uvm. Ich habe es mir zur Aufgabe gemacht, Menschen ganzheitlich gesund, zufrieden und erfolgreich zu machen. Yoga ist ein Teil des Puzzles zu ganzheitlicher Gesundheit, Zufriedenheit und letztlich dem eigenen Lebensglück. Ich freu mich auf Dich auf der Yogamatte! Herzliche Sonnengrüße Kathrin"
"TC ""Blau-Weiß"" Schönebeck",['Tennis'],False,"['S', 'M', 'L', 'XL']",S,Schönebeck,"Stadionstraße 17,",https://urbansportsclub.com//en/venues/tc-blau-weiss-schonebeck,"{'@context': 'http://schema.org', '@type': 'LocalBusiness', 'name': 'TC &quot;Blau-Weiß&quot; Schönebeck', 'description': 'Spiel, Satz &amp; SIEG…! Für Tennis ist es nie zu spät beim TC Blau-Weiß Schönebeck! Tennis ist eine faszinierende Sportart. Für uns gibt es kaum etwas Schöneres als unter freiem Himmel und manchmal abends bei Flutlicht einfach ein paar Bälle zu schlagen. Auf unserem ganzjährig bespielbaren Tennisplatz ist es möglich in familiärer Geselligkeit der gelben Filzkugel nach zu jagen. Als gesündeste Ballsportart laut „Kopenhagen City Heart“-Studie schult Tennis weiterhin die Beweglichkeit, Schnelligkeit, Konzentration und das Reaktionsvermögen. Jedes einzelne Match begeistert uns immer wieder aufs Neue. Das Treffen mit Gleichgesinnten auf der Anlage für ein gemeinsames Spiel am Nachmittag, das Training am Morgen, gemeinschaftliche Turniere….wir möchten uns gar nicht mehr vorstellen, wie unsere Wochenenden wohl ohne „Tennis“ wären.Tennis ist leicht zu erlernen und bis ins hohe Alter zu spielen. Alles was Sie benötigen, sind ein paar Sportschuhe, einen Schläger und Bälle (können ausgeborgt werden). Haben wir Sie neugierig gemacht? Dann nutzen Sie unsere Angebotspalette vom Tennis spielen über Cardio Tennis, Beachtennis bis hin zum Beachvolleyball. Als prämierter Tennisverein des Jahres 2018 in Sachsen-Anhalt, freuen wir uns auf Ihren Besuch und Ihre persönliche Kontaktaufnahme. „Mit anderen Menschen zu spielen und zu interagieren hat wahrscheinlich einzigartige psychologische und physiologische Effekte.“ JAMES O’KEEFE', 'address': {'@type': 'PostalAddress', 'addressLocality': 'Magdeburg, Germany', 'addressCountry': 'Germany', 'postalCode': '39218', 'streetAddress': 'Stadionstraße 17,'}, 'telephone': '+49 177 3723197', 'geo': {'@type': 'GeoCoordinates', 'latitude': '52.01306', 'longitude': '11.71936'}, 'priceRange': '-', 'image': 'https://storage.googleapis.com/download/storage/v1/b/usc-pro-uscweb-live-media/o/de-live%2Foriginal_1024x576_TC%20Blau%20Weis%20Schonebeck_Luftaufna%20hmen_Tennisplatz_TC_und_Kinder_1568038546762722_admin.jpg?alt=media'}",52.01306,11.71936,"Spiel, Satz &amp; SIEG…! Für Tennis ist es nie zu spät beim TC Blau-Weiß Schönebeck! Tennis ist eine faszinierende Sportart. Für uns gibt es kaum etwas Schöneres als unter freiem Himmel und manchmal abends bei Flutlicht einfach ein paar Bälle zu schlagen. Auf unserem ganzjährig bespielbaren Tennisplatz ist es möglich in familiärer Geselligkeit der gelben Filzkugel nach zu jagen. Als gesündeste Ballsportart laut „Kopenhagen City Heart“-Studie schult Tennis weiterhin die Beweglichkeit, Schnelligkeit, Konzentration und das Reaktionsvermögen. Jedes einzelne Match begeistert uns immer wieder aufs Neue. Das Treffen mit Gleichgesinnten auf der Anlage für ein gemeinsames Spiel am Nachmittag, das Training am Morgen, gemeinschaftliche Turniere….wir möchten uns gar nicht mehr vorstellen, wie unsere Wochenenden wohl ohne „Tennis“ wären.Tennis ist leicht zu erlernen und bis ins hohe Alter zu spielen. Alles was Sie benötigen, sind ein paar Sportschuhe, einen Schläger und Bälle (können ausgeborgt werden). Haben wir Sie neugierig gemacht? Dann nutzen Sie unsere Angebotspalette vom Tennis spielen über Cardio Tennis, Beachtennis bis hin zum Beachvolleyball. Als prämierter Tennisverein des Jahres 2018 in Sachsen-Anhalt, freuen wir uns auf Ihren Besuch und Ihre persönliche Kontaktaufnahme. „Mit anderen Menschen zu spielen und zu interagieren hat wahrscheinlich einzigartige psychologische und physiologische Effekte.“ JAMES O’KEEFE"
Salzland im Hotel Ratswaage,['Wellness'],False,"['S', 'M', 'L', 'XL']",S,Altstadt,Julius-Bremer-Straße 5,https://urbansportsclub.com//en/venues/salzland-im-hotel-ratswaage,"{'@context': 'http://schema.org', '@type': 'LocalBusiness', 'name': 'Salzland im Hotel Ratswaage', 'description': 'Entspanne in der wohligen Atmosphäre unserer Salzgrotte und tue dabei deiner Haut und deinen Atemwegen etwas Gutes. Du genießt deine Auszeit auf unseren Relax-Liegen, eingekuschelt in eine Decke und verzaubert von sanften Klängen und dem orangefarbenen Schein des Himalaya-Salzes. Die mineralhaltige Luft in der Salzgrotte kann dein Immunsystem stärken und chronischen Krankheiten vorbeugen oder deren Symptome lindern. Vor allem aber bieten wir die ideale Atmosphäre, um dem Alltagsstress zu entfliehen und wieder Kraft zu tanken. Unsere Stammkunden finden, dass sich eine dreiviertel Stunde bei uns fast so anfühlt wie ein Tag am Meer. Ein schöneres Kompliment kann man nicht bekommen. Der 45-minütige Besuch der Salzgrotte beginnt immer zur vollen Stunde. Wir empfehlen eine telefonische Anmeldung, da es durch Gruppenmietungen oder Sonderveranstaltung auch mal voller werden kann. Du trägst deine Alltagskleidung und weiße Strümpfe, welche du selbst mitbringen oder bei uns ausleihen oder kaufen kannst. An mehr musst du nicht denken und so auch keine Sporttasche packen. Um deine Auszeit abzurunden, bieten wir zusätzlich diverse Wohlfühl-Anwendungen an. Als L oder XL-Mitglied kannst du dich auch für eine Rückenmassage entscheiden. Der Rücken ist oft die Problemzone Nummer eins und wird es dir danken, wenn die Muskulatur gelockert und Verspannungen gelöst werden. Bitte beachte, dass wir keine medizinischen, sondern lediglich Wellness-Massagen anbieten. Für die Massage benötigst du in jedem Fall einen Termin. Details findest du in den Besuchsregelungen. Selbstverständlich können alle unsere Leistungen auch zusätzlich zur USC-Mitgliedschaft gebucht werden. Wir beraten dich gerne.', 'address': {'@type': 'PostalAddress', 'addressLocality': 'Magdeburg, Germany', 'addressCountry': 'Germany', 'postalCode': '39104', 'streetAddress': 'Julius-Bremer-Straße 5'}, 'telephone': '', 'geo': {'@type': 'GeoCoordinates', 'latitude': '52.133417', 'longitude': '11.6388751'}, 'priceRange': '-', 'image': 'https://storage.googleapis.com/download/storage/v1/b/usc-pro-uscweb-live-media/o/de-live%2Foriginal_4134x2325_Sitzecke_1548774273517803_admin.jpg?alt=media'}",52.133417,11.6388751,"Entspanne in der wohligen Atmosphäre unserer Salzgrotte und tue dabei deiner Haut und deinen Atemwegen etwas Gutes. Du genießt deine Auszeit auf unseren Relax-Liegen, eingekuschelt in eine Decke und verzaubert von sanften Klängen und dem orangefarbenen Schein des Himalaya-Salzes. Die mineralhaltige Luft in der Salzgrotte kann dein Immunsystem stärken und chronischen Krankheiten vorbeugen oder deren Symptome lindern. Vor allem aber bieten wir die ideale Atmosphäre, um dem Alltagsstress zu entfliehen und wieder Kraft zu tanken. Unsere Stammkunden finden, dass sich eine dreiviertel Stunde bei uns fast so anfühlt wie ein Tag am Meer. Ein schöneres Kompliment kann man nicht bekommen. Der 45-minütige Besuch der Salzgrotte beginnt immer zur vollen Stunde. Wir empfehlen eine telefonische Anmeldung, da es durch Gruppenmietungen oder Sonderveranstaltung auch mal voller werden kann. Du trägst deine Alltagskleidung und weiße Strümpfe, welche du selbst mitbringen oder bei uns ausleihen oder kaufen kannst. An mehr musst du nicht denken und so auch keine Sporttasche packen. Um deine Auszeit abzurunden, bieten wir zusätzlich diverse Wohlfühl-Anwendungen an. Als L oder XL-Mitglied kannst du dich auch für eine Rückenmassage entscheiden. Der Rücken ist oft die Problemzone Nummer eins und wird es dir danken, wenn die Muskulatur gelockert und Verspannungen gelöst werden. Bitte beachte, dass wir keine medizinischen, sondern lediglich Wellness-Massagen anbieten. Für die Massage benötigst du in jedem Fall einen Termin. Details findest du in den Besuchsregelungen. Selbstverständlich können alle unsere Leistungen auch zusätzlich zur USC-Mitgliedschaft gebucht werden. Wir beraten dich gerne."
