name,disciplines,plus_options,plans,min_plan,district,street,link,metadata,latitude,longitude,description
GFX Pilates - Cascais,['Pilates Reformer'],False,"['M', 'L', 'XL']",M,Cascais,Av. de Sintra 1135,https://urbansportsclub.com//de/venues/gfx-pilates-cascais-1,"{'@context': 'http://schema.org', '@type': 'LocalBusiness', 'name': 'GFX Pilates - Cascais', 'description': 'A GFX Pilates e Reabilitação, é uma marca do Grupo GIC, Guthra Investement Corporation, e nasce do sonho de um dos sócios que vive e ama dar aulas de Pilates com Equipamentos, e da visão empresarial do outro sócio da empresa, juntando a estes dois factores o facto do Grupo GIC ser já o representante e distribuidor de marcas fabricante de equipamentos de Pilates MetaLife para Portugal e Espanha Espanha e Palop. E a marca All PILATES onde é possível encontrar a solução ideal para Pilates, estava encontrada a formula de sucesso deste aliciante Projecto.', 'address': {'@type': 'PostalAddress', 'addressLocality': 'Lisbon, Portugal', 'addressCountry': 'Portugal', 'postalCode': '2750-496', 'streetAddress': 'Av. de Sintra 1135'}, 'telephone': '+351 913 268 208', 'geo': {'@type': 'GeoCoordinates', 'latitude': '38.7115911', 'longitude': '-9.4179675'}, 'priceRange': '-', 'image': 'https://storage.googleapis.com/download/storage/v1/b/usc-pro-uscweb-live-media/o/de-live%2Foriginal_1024x576_logo_GFX_bg_blue_1664366714851321_admin.jpg?generation=1664366714919021&amp;alt=media'}",38.7115911,-9.4179675,"A GFX Pilates e Reabilitação, é uma marca do Grupo GIC, Guthra Investement Corporation, e nasce do sonho de um dos sócios que vive e ama dar aulas de Pilates com Equipamentos, e da visão empresarial do outro sócio da empresa, juntando a estes dois factores o facto do Grupo GIC ser já o representante e distribuidor de marcas fabricante de equipamentos de Pilates MetaLife para Portugal e Espanha Espanha e Palop. E a marca All PILATES onde é possível encontrar a solução ideal para Pilates, estava encontrada a formula de sucesso deste aliciante Projecto."
Ginásio Korpus,['Fitness'],False,"['S', 'M', 'L', 'XL']",S,Sintra,Pavilhão Desportivo MTBA,https://urbansportsclub.com//de/venues/ginasio-korpus,"{'@context': 'http://schema.org', '@type': 'LocalBusiness', 'name': 'Ginásio Korpus', 'description': 'O Ginásio Korpus está a aguardar a tua visita!', 'address': {'@type': 'PostalAddress', 'addressLocality': 'Lisbon, Portugal', 'addressCountry': 'Portugal', 'postalCode': '', 'streetAddress': 'Pavilhão Desportivo MTBA'}, 'telephone': '', 'geo': {'@type': 'GeoCoordinates', 'latitude': '38.8661677', 'longitude': '-9.4258434'}, 'priceRange': '-', 'image': 'https://storage.googleapis.com/download/storage/v1/b/usc-pro-uscweb-live-media/o/de-live%2Foriginal_1686x948_fitnesscompressed_1579081001461354_admin.jpg?alt=media'}",38.8661677,-9.4258434,O Ginásio Korpus está a aguardar a tua visita!
Ginásio Musclepower,['Fitness'],False,"['S', 'M', 'L', 'XL']",S,Sesimbra,"Rua Ribeiro Sanches, Lote 170",https://urbansportsclub.com//de/venues/ginasio-musclepower,"{'@context': 'http://schema.org', '@type': 'LocalBusiness', 'name': 'Ginásio Musclepower', 'description': 'Treinos personalizados específicos a cada cliente, preparação de atletas para competição, treino pós-parto entre outros, ambiente familiar.', 'address': {'@type': 'PostalAddress', 'addressLocality': 'Lisbon, Portugal', 'addressCountry': 'Portugal', 'postalCode': '2975-404', 'streetAddress': 'Rua Ribeiro Sanches, Lote 170'}, 'telephone': '', 'geo': {'@type': 'GeoCoordinates', 'latitude': '38.5742917', 'longitude': '-9.0383582'}, 'priceRange': '-', 'image': 'https://storage.googleapis.com/download/storage/v1/b/usc-pro-uscweb-live-media/o/de-live%2Foriginal_1024x576_20200427_121017_1636717662650382_admin.jpg?generation=1636717662780516&amp;alt=media'}",38.5742917,-9.0383582,"Treinos personalizados específicos a cada cliente, preparação de atletas para competição, treino pós-parto entre outros, ambiente familiar."
Ginásio O2Fit Barcarena,"['Bootcamp', 'Fitness']",False,"['S', 'M', 'L', 'XL']",S,Oeiras,Piscina Municipal de Barcarena,https://urbansportsclub.com//de/venues/ginasio-o2fit-outurela,"{'@context': 'http://schema.org', '@type': 'LocalBusiness', 'name': 'Ginásio O2Fit Barcarena', 'description': 'Ajudamos e acompanhamos o seu treino de forma personalizada para que se sinta motivado(a) a alcançar os seus objetivos.', 'address': {'@type': 'PostalAddress', 'addressLocality': 'Lisbon, Portugal', 'addressCountry': 'Portugal', 'postalCode': '2730-063', 'streetAddress': 'Piscina Municipal de Barcarena'}, 'telephone': '+351 913 714 030', 'geo': {'@type': 'GeoCoordinates', 'latitude': '38.731092', 'longitude': '-9.28298799'}, 'priceRange': '-', 'image': 'https://storage.googleapis.com/download/storage/v1/b/usc-pro-uscweb-live-media/o/de-live%2Foriginal_1024x576_o2fit11_1583169241568951_admin.jpeg?alt=media'}",38.731092,-9.28298799,Ajudamos e acompanhamos o seu treino de forma personalizada para que se sinta motivado(a) a alcançar os seus objetivos.
Ginásio O2Fit Carnaxide,"['Bootcamp', 'Fitness', 'Pilates', 'Tanzen']",False,"['S', 'M', 'L', 'XL']",S,Carnaxide,"Estr. São Marçal 44B,  Carnaxide",https://urbansportsclub.com//de/venues/o2fit,"{'@context': 'http://schema.org', '@type': 'LocalBusiness', 'name': 'Ginásio O2Fit Carnaxide', 'description': 'Ajudamos e acompanhamos o seu treino de forma personalizada para que se sinta motivado(a) a alcançar os seus objetivos.', 'address': {'@type': 'PostalAddress', 'addressLocality': 'Lisbon, Portugal', 'addressCountry': 'Portugal', 'postalCode': '2795-618', 'streetAddress': 'Estr. São Marçal 44B,  Carnaxide'}, 'telephone': '+351 913 714 030', 'geo': {'@type': 'GeoCoordinates', 'latitude': '38.723092', 'longitude': '-9.2242512'}, 'priceRange': '-', 'image': 'https://storage.googleapis.com/download/storage/v1/b/usc-pro-uscweb-live-media/o/de-live%2Foriginal_1024x576_o2fit_1583169384247082_admin.jpeg?alt=media'}",38.723092,-9.2242512,Ajudamos e acompanhamos o seu treino de forma personalizada para que se sinta motivado(a) a alcançar os seus objetivos.
Ginásio Spald Lourel/Sintra - PT,['Personal Training'],True,"['L', 'XL']",L,Sintra,"Avenida da Aviação Portuguesa, Edíficio dos Bombeiros de Sintra",https://urbansportsclub.com//de/venues/ginasio-spald-lourel-sintra-plus,"{'@context': 'http://schema.org', '@type': 'LocalBusiness', 'name': 'Ginásio Spald Lourel/Sintra - PT', 'description': 'Os Ginásios SPALD, fundados em 1993, sempre tiveram um papel importante e inovador nas atividades físicas e desportivas do concelho de Sintra. São uma referência no Desporto de Sintra e pioneiro no conceito de Clube com a finalidade de atividades de “fitness”. Em 2005 o “velhinho” ginásio SPALD no Hochey Clube de Sintra encerra portas e dá lugar ao primeiro clube com piscina no Edifício dos Bombeiros de Sintra. Em 2011 dá se abertura do 2º clube com piscina no edifício dos Bombeiros de São Pedro de Sintra com a introdução do serviço de Nutrição e treino personalizado. Desde de 1993 que os ginásios SPALD têm como missão promover a atividade física de uma forma consciente, em segurança e num ambiente familiar e tranquilo. Desta forma queremos contribuir com a visão de uma comunidade mais saudável promovendo o bem-estar físico e mental. Fica o convite, venha conhecer o seu Ginásio em Sintra desde 1993 e comprovar a nossa experiência de mais de 25 anos!', 'address': {'@type': 'PostalAddress', 'addressLocality': 'Lisbon, Portugal', 'addressCountry': 'Portugal', 'postalCode': '2710-536', 'streetAddress': 'Avenida da Aviação Portuguesa, Edíficio dos Bombeiros de Sintra'}, 'telephone': '', 'geo': {'@type': 'GeoCoordinates', 'latitude': '38.8076774', 'longitude': '-9.3778532'}, 'priceRange': '-', 'image': 'https://storage.googleapis.com/download/storage/v1/b/usc-pro-uscweb-live-media/o/de-live%2Foriginal_1024x576_unnamed_1669719183916529_admin.png?generation=1669719183973362&amp;alt=media'}",38.8076774,-9.3778532,"Os Ginásios SPALD, fundados em 1993, sempre tiveram um papel importante e inovador nas atividades físicas e desportivas do concelho de Sintra. São uma referência no Desporto de Sintra e pioneiro no conceito de Clube com a finalidade de atividades de “fitness”. Em 2005 o “velhinho” ginásio SPALD no Hochey Clube de Sintra encerra portas e dá lugar ao primeiro clube com piscina no Edifício dos Bombeiros de Sintra. Em 2011 dá se abertura do 2º clube com piscina no edifício dos Bombeiros de São Pedro de Sintra com a introdução do serviço de Nutrição e treino personalizado. Desde de 1993 que os ginásios SPALD têm como missão promover a atividade física de uma forma consciente, em segurança e num ambiente familiar e tranquilo. Desta forma queremos contribuir com a visão de uma comunidade mais saudável promovendo o bem-estar físico e mental. Fica o convite, venha conhecer o seu Ginásio em Sintra desde 1993 e comprovar a nossa experiência de mais de 25 anos!"
Ginásio Spald São Pedro de Sintra - PT,['Personal Training'],True,"['L', 'XL']",L,Sintra,"Avenida de Cascais, Edifício Bombeiros, São Pedro",https://urbansportsclub.com//de/venues/ginasio-spald-sao-pedro-de-sintra-plus,"{'@context': 'http://schema.org', '@type': 'LocalBusiness', 'name': 'Ginásio Spald São Pedro de Sintra - PT', 'description': 'Os Ginásios SPALD, fundados em 1993, sempre tiveram um papel importante e inovador nas atividades físicas e desportivas do concelho de Sintra. São uma referência no Desporto de Sintra e pioneiro no conceito de Clube com a finalidade de atividades de “fitness”. Em 2005 o “velhinho” ginásio SPALD no Hochey Clube de Sintra encerra portas e dá lugar ao primeiro clube com piscina no Edifício dos Bombeiros de Sintra. Em 2011 dá se abertura do 2º clube com piscina no edifício dos Bombeiros de São Pedro de Sintra com a introdução do serviço de Nutrição e treino personalizado. Desde de 1993 que os ginásios SPALD têm como missão promover a atividade física de uma forma consciente, em segurança e num ambiente familiar e tranquilo. Desta forma queremos contribuir com a visão de uma comunidade mais saudável promovendo o bem-estar físico e mental. Fica o convite, venha conhecer o seu Ginásio em Sintra desde 1993 e comprovar a nossa experiência de mais de 25 anos!', 'address': {'@type': 'PostalAddress', 'addressLocality': 'Lisbon, Portugal', 'addressCountry': 'Portugal', 'postalCode': '2710-328', 'streetAddress': 'Avenida de Cascais, Edifício Bombeiros, São Pedro'}, 'telephone': '', 'geo': {'@type': 'GeoCoordinates', 'latitude': '38.7825572', 'longitude': '-9.376734'}, 'priceRange': '-', 'image': 'https://storage.googleapis.com/download/storage/v1/b/usc-pro-uscweb-live-media/o/de-live%2Foriginal_1024x576_unnamed_1669722195791084_admin.png?generation=1669722195857688&amp;alt=media'}",38.7825572,-9.376734,"Os Ginásios SPALD, fundados em 1993, sempre tiveram um papel importante e inovador nas atividades físicas e desportivas do concelho de Sintra. São uma referência no Desporto de Sintra e pioneiro no conceito de Clube com a finalidade de atividades de “fitness”. Em 2005 o “velhinho” ginásio SPALD no Hochey Clube de Sintra encerra portas e dá lugar ao primeiro clube com piscina no Edifício dos Bombeiros de Sintra. Em 2011 dá se abertura do 2º clube com piscina no edifício dos Bombeiros de São Pedro de Sintra com a introdução do serviço de Nutrição e treino personalizado. Desde de 1993 que os ginásios SPALD têm como missão promover a atividade física de uma forma consciente, em segurança e num ambiente familiar e tranquilo. Desta forma queremos contribuir com a visão de uma comunidade mais saudável promovendo o bem-estar físico e mental. Fica o convite, venha conhecer o seu Ginásio em Sintra desde 1993 e comprovar a nossa experiência de mais de 25 anos!"
H2O Vita,"['Entspannung', 'Fitness', 'Pilates', 'Tanzen', 'Wellness', 'Yoga']",False,"['S', 'M', 'L', 'XL']",S,Odivelas,"Rua Bento de Jesus Caraça 12, Serra da Amoreira",https://urbansportsclub.com//de/venues/h2o-vita,"{'@context': 'http://schema.org', '@type': 'LocalBusiness', 'name': 'H2O Vita', 'description': 'O H2O Vita é um clube que se diferencia pela qualidade do serviço que presta a todos os clientes, procurando que cada um tenha um programa de treino individualizado, seguro e eficaz, sendo cada membro avaliado sistematicamente. O usufruto da piscina em modalidade de Natação Livre apenas é possível após um teste de natação para garantir a segurança dos nossos membros. Também dispomos de um variado leque de aulas de grupo de forma a abordar todas as qualidades físicas e objetivos (treino de força, treino aeróbio, flexibilidade e mobilidade, dança e lazer).', 'address': {'@type': 'PostalAddress', 'addressLocality': 'Lisbon, Portugal', 'addressCountry': 'Portugal', 'postalCode': '2620-379', 'streetAddress': 'Rua Bento de Jesus Caraça 12, Serra da Amoreira'}, 'telephone': '+351 21 934 7132', 'geo': {'@type': 'GeoCoordinates', 'latitude': '38.806376', 'longitude': '-9.191837'}, 'priceRange': '-', 'image': 'https://storage.googleapis.com/download/storage/v1/b/usc-pro-uscweb-live-media/o/de-live%2Foriginal_1024x576_estudio%201_1570182590444604_admin.jpg?alt=media'}",38.806376,-9.191837,"O H2O Vita é um clube que se diferencia pela qualidade do serviço que presta a todos os clientes, procurando que cada um tenha um programa de treino individualizado, seguro e eficaz, sendo cada membro avaliado sistematicamente. O usufruto da piscina em modalidade de Natação Livre apenas é possível após um teste de natação para garantir a segurança dos nossos membros. Também dispomos de um variado leque de aulas de grupo de forma a abordar todas as qualidades físicas e objetivos (treino de força, treino aeróbio, flexibilidade e mobilidade, dança e lazer)."
H2O Vita - Piscina,['Schwimmen'],False,"['S', 'M', 'L', 'XL']",S,Odivelas,"Rua Bento de Jesus Caraça, 12, Serra da Amoreira",https://urbansportsclub.com//de/venues/h2o-vita-piscina-2,"{'@context': 'http://schema.org', '@type': 'LocalBusiness', 'name': 'H2O Vita - Piscina', 'description': 'O H2O Vita é um clube que se diferencia pela qualidade do serviço que presta a todos os clientes, procurando que cada um tenha um programa de treino individualizado, seguro e eficaz, sendo cada membro avaliado sistematicamente. O usufruto da piscina em modalidade de Natação Livre apenas é possível após um teste de natação para garantir a segurança dos nossos membros. Também dispomos de um variado leque de aulas de grupo de forma a abordar todas as qualidades físicas e objetivos (treino de força, treino aeróbio, flexibilidade e mobilidade, dança e lazer)', 'address': {'@type': 'PostalAddress', 'addressLocality': 'Lisbon, Portugal', 'addressCountry': 'Portugal', 'postalCode': '2620-379', 'streetAddress': 'Rua Bento de Jesus Caraça, 12, Serra da Amoreira'}, 'telephone': '+351 21 934 7132', 'geo': {'@type': 'GeoCoordinates', 'latitude': '38.806376', 'longitude': '-9.191837'}, 'priceRange': '-', 'image': 'https://storage.googleapis.com/download/storage/v1/b/usc-pro-uscweb-live-media/o/de-live%2Foriginal_1024x576_piscina2_1599233467429027_admin.jpg?alt=media'}",38.806376,-9.191837,"O H2O Vita é um clube que se diferencia pela qualidade do serviço que presta a todos os clientes, procurando que cada um tenha um programa de treino individualizado, seguro e eficaz, sendo cada membro avaliado sistematicamente. O usufruto da piscina em modalidade de Natação Livre apenas é possível após um teste de natação para garantir a segurança dos nossos membros. Também dispomos de um variado leque de aulas de grupo de forma a abordar todas as qualidades físicas e objetivos (treino de força, treino aeróbio, flexibilidade e mobilidade, dança e lazer)"
Hammerbox Outdoor Training - Belém,"['Bootcamp', 'Fitness']",False,"['S', 'M', 'L', 'XL']",S,Belém,Av. da Índia 6,https://urbansportsclub.com//de/venues/hammerbox-outdoor-training-belem,"{'@context': 'http://schema.org', '@type': 'LocalBusiness', 'name': 'Hammerbox Outdoor Training - Belém', 'description': 'Treino ao ar livre em zona verde e junto ao rio do Jamor, espaço característico de prática de atividades desportivas e fitness. Permite elevada variedade de treino com recurso a material de treino funcional, espaços para correr e ótimas áreas para exercícios dinâmicos. Com os treinos na Hammerbox Outdoor Training podes esperar três coisas - ganhos de força, ganhos de resistência cardio-respiratória, dores de pernas. Se os teus objectivos se enquadram com, perda de massa gorda, ganhos de força, agilidade, resistência cardio-respiratória, diversão enquanto leva uma tareia de treino, então estes treinos são para ti. Não esperes mais, envia mensagem, faz a tua marcação e junta-te a nós!', 'address': {'@type': 'PostalAddress', 'addressLocality': 'Lisbon, Portugal', 'addressCountry': 'Portugal', 'postalCode': '1300-300', 'streetAddress': 'Av. da Índia 6'}, 'telephone': '+49 9107 54261', 'geo': {'@type': 'GeoCoordinates', 'latitude': '38.6964712', 'longitude': '-9.1978821'}, 'priceRange': '-', 'image': 'https://storage.googleapis.com/download/storage/v1/b/usc-pro-uscweb-live-media/o/de-live%2Foriginal_640x360_b82duqxf38iqvn0wrl4x_1691513489973509.png?generation=1691513490124251&amp;alt=media'}",38.6964712,-9.1978821,"Treino ao ar livre em zona verde e junto ao rio do Jamor, espaço característico de prática de atividades desportivas e fitness. Permite elevada variedade de treino com recurso a material de treino funcional, espaços para correr e ótimas áreas para exercícios dinâmicos. Com os treinos na Hammerbox Outdoor Training podes esperar três coisas - ganhos de força, ganhos de resistência cardio-respiratória, dores de pernas. Se os teus objectivos se enquadram com, perda de massa gorda, ganhos de força, agilidade, resistência cardio-respiratória, diversão enquanto leva uma tareia de treino, então estes treinos são para ti. Não esperes mais, envia mensagem, faz a tua marcação e junta-te a nós!"
Hammerbox Outdoor Training - Jamor,"['Bootcamp', 'Fitness']",False,"['S', 'M', 'L', 'XL']",S,Algés,Centro Náutico do Jamor,https://urbansportsclub.com//de/venues/hammerbox-outdoor-training,"{'@context': 'http://schema.org', '@type': 'LocalBusiness', 'name': 'Hammerbox Outdoor Training - Jamor', 'description': 'Treino ao ar livre em zona verde e junto ao rio do Jamor, espaço característico de prática de atividades desportivas e fitness. Permite elevada variedade de treino com recurso a material de treino funcional, espaços para correr e ótimas áreas para exercícios dinâmicos. Com os treinos na Hammerbox Outdoor Training podes esperar três coisas - ganhos de força, ganhos de resistência cardio-respiratória, dores de pernas. Se os teus objectivos se enquadram com, perda de massa gorda, ganhos de força, agilidade, resistência cardio-respiratória, diversão enquanto leva uma tareia de treino, então estes treinos são para ti. Não esperes mais, envia mensagem, faz a tua marcação e junta-te a nós!', 'address': {'@type': 'PostalAddress', 'addressLocality': 'Lisbon, Portugal', 'addressCountry': 'Portugal', 'postalCode': '2610-074', 'streetAddress': 'Centro Náutico do Jamor'}, 'telephone': '+49 9107 54261', 'geo': {'@type': 'GeoCoordinates', 'latitude': '38.7047364', 'longitude': '-9.2553779'}, 'priceRange': '-', 'image': 'https://storage.googleapis.com/download/storage/v1/b/usc-pro-uscweb-live-media/o/de-live%2Foriginal_640x360_kwinkwnkdmunn7ll8qwi_1691513507516479.png?generation=1691513507594924&amp;alt=media'}",38.7047364,-9.2553779,"Treino ao ar livre em zona verde e junto ao rio do Jamor, espaço característico de prática de atividades desportivas e fitness. Permite elevada variedade de treino com recurso a material de treino funcional, espaços para correr e ótimas áreas para exercícios dinâmicos. Com os treinos na Hammerbox Outdoor Training podes esperar três coisas - ganhos de força, ganhos de resistência cardio-respiratória, dores de pernas. Se os teus objectivos se enquadram com, perda de massa gorda, ganhos de força, agilidade, resistência cardio-respiratória, diversão enquanto leva uma tareia de treino, então estes treinos são para ti. Não esperes mais, envia mensagem, faz a tua marcação e junta-te a nós!"
Happy & Wild - Clínica Aquavida,['Massage'],True,"['L', 'XL']",L,Parede,Rua Dr. José Joaquim de Almeida 420 H,https://urbansportsclub.com//de/venues/happy-wild-clinica-aquavida,"{'@context': 'http://schema.org', '@type': 'LocalBusiness', 'name': 'Happy &amp; Wild - Clínica Aquavida', 'description': 'Massagem Faraónica A massagem faraónica é um estilo egípcio único, que mistura técnicas antigas e modernas usando óleos essenciais puros. Inclui tecidos profundos e massagem relaxante suave. É a melhor solução para remover a fadiga muscular e relaxar o corpo. A massagem é feita por um verdadeiro especialista egípcio. Massagem de Yoga A massagem de Yoga é uma técnica de alongamento e pontos de pressão de Corpo inteiro. É uma ótima maneira de afastar o corpo, eliminar a fadiga muscular, melhorar a amplitude de movimento e se recuperar de lesões. Massagem é feita no chão', 'address': {'@type': 'PostalAddress', 'addressLocality': 'Lisbon, Portugal', 'addressCountry': 'Portugal', 'postalCode': '2775-575', 'streetAddress': 'Rua Dr. José Joaquim de Almeida 420 H'}, 'telephone': '', 'geo': {'@type': 'GeoCoordinates', 'latitude': '38.69074', 'longitude': '-9.333154'}, 'priceRange': '-', 'image': 'https://storage.googleapis.com/download/storage/v1/b/usc-pro-uscweb-live-media/o/de-live%2Foriginal_1024x576_11_1574261256555516_admin.jpeg?alt=media'}",38.69074,-9.333154,"Massagem Faraónica A massagem faraónica é um estilo egípcio único, que mistura técnicas antigas e modernas usando óleos essenciais puros. Inclui tecidos profundos e massagem relaxante suave. É a melhor solução para remover a fadiga muscular e relaxar o corpo. A massagem é feita por um verdadeiro especialista egípcio. Massagem de Yoga A massagem de Yoga é uma técnica de alongamento e pontos de pressão de Corpo inteiro. É uma ótima maneira de afastar o corpo, eliminar a fadiga muscular, melhorar a amplitude de movimento e se recuperar de lesões. Massagem é feita no chão"
