name,disciplines,plus_options,plans,min_plan,district,street,link,metadata,latitude,longitude,description
Shapeshifters The View,['Fitness'],False,"['S', 'M', 'L', 'XL']",S,Konstanz,Reichenaustraße 39a,https://urbansportsclub.com//en/venues/shapeshifters-the-view,"{'@context': 'http://schema.org', '@type': 'LocalBusiness', 'name': 'Shapeshifters The View', 'description': '.', 'address': {'@type': 'PostalAddress', 'addressLocality': 'Konstanz, Germany', 'addressCountry': 'Germany', 'postalCode': '78467', 'streetAddress': 'Reichenaustraße 39a'}, 'telephone': '+49 7121 1451323', 'geo': {'@type': 'GeoCoordinates', 'latitude': '47.6718354', 'longitude': '9.161925'}, 'priceRange': '-', 'image': 'https://storage.googleapis.com/download/storage/v1/b/usc-pro-uscweb-live-media/o/de-live%2Foriginal_1024x576_pfpcpceuu5g7sflfnndv_1718350409709699.png?generation=1718350409798995&amp;alt=media'}",47.6718354,9.161925,.
Surfschule Treibgut Allensbach,['Stand Up Paddling'],False,"['M', 'L', 'XL']",M,Allensbach,Strandweg 30,https://urbansportsclub.com//en/venues/surfschule-treibgut-allensbach,"{'@context': 'http://schema.org', '@type': 'LocalBusiness', 'name': 'Surfschule Treibgut Allensbach', 'description': 'Treibgut Surfschule: Ihre erste Adresse für Wassersport und Verleih am Bodensee! Tauchen Sie ein in einzigartige Wassersportabenteuer mit Stand Up Paddling und Windsurfen. Egal ob Anfänger oder Fortgeschrittener, unsere erfahrenen Instruktoren begleiten Sie auf Ihrem Weg. Entdecken Sie unsere maßgeschneiderten Teamevents für Gruppen, Vereine, Schulklassen und Firmen, bei denen der Teamgeist im Fokus steht. Zusätzlich bieten wir auch einen Verleih von hochwertiger Ausrüstung an, damit Sie den Bodensee in Ihrem eigenen Tempo erkunden können. Genießen Sie nicht nur die malerische Kulisse des Bodensees, sondern auch die familiäre Atmosphäre unserer Surfschule. Mit Treibgut Surfschule erleben Sie Wassersport, Teambuilding und Verleih auf höchstem Niveau. Besuchen Sie uns und lassen Sie sich von der Faszination des Bodensees verzaubern!', 'address': {'@type': 'PostalAddress', 'addressLocality': 'Konstanz, Germany', 'addressCountry': 'Germany', 'postalCode': '78476', 'streetAddress': 'Strandweg 30'}, 'telephone': '+44 15203090644', 'geo': {'@type': 'GeoCoordinates', 'latitude': '47.7109849', 'longitude': '9.0775692'}, 'priceRange': '-', 'image': 'https://storage.googleapis.com/download/storage/v1/b/usc-pro-uscweb-live-media/o/de-live%2Foriginal_640x360_zy7tyu1snfkvecifbtjr_1708936827666387.png?generation=1708936827752286&amp;alt=media'}",47.7109849,9.0775692,"Treibgut Surfschule: Ihre erste Adresse für Wassersport und Verleih am Bodensee! Tauchen Sie ein in einzigartige Wassersportabenteuer mit Stand Up Paddling und Windsurfen. Egal ob Anfänger oder Fortgeschrittener, unsere erfahrenen Instruktoren begleiten Sie auf Ihrem Weg. Entdecken Sie unsere maßgeschneiderten Teamevents für Gruppen, Vereine, Schulklassen und Firmen, bei denen der Teamgeist im Fokus steht. Zusätzlich bieten wir auch einen Verleih von hochwertiger Ausrüstung an, damit Sie den Bodensee in Ihrem eigenen Tempo erkunden können. Genießen Sie nicht nur die malerische Kulisse des Bodensees, sondern auch die familiäre Atmosphäre unserer Surfschule. Mit Treibgut Surfschule erleben Sie Wassersport, Teambuilding und Verleih auf höchstem Niveau. Besuchen Sie uns und lassen Sie sich von der Faszination des Bodensees verzaubern!"
HEIUKI SUP & Kajak - Konstanz Rhein,['Stand Up Paddling'],False,"['L', 'XL']",L,Konstanz,"Turmstraße 30/32, 78467 Konstanz",https://urbansportsclub.com//en/venues/heiuki-sup-kajak-konstanz-rhein,"{'@context': 'http://schema.org', '@type': 'LocalBusiness', 'name': 'HEIUKI SUP &amp; Kajak - Konstanz Rhein', 'description': 'HEIUKI SUP &amp; Kajak Automat freut sich auf dich!', 'address': {'@type': 'PostalAddress', 'addressLocality': 'Konstanz, Germany', 'addressCountry': 'Germany', 'postalCode': '78467', 'streetAddress': 'Turmstraße 30/32, 78467 Konstanz'}, 'telephone': '', 'geo': {'@type': 'GeoCoordinates', 'latitude': '47.670267', 'longitude': '9.1543569'}, 'priceRange': '-', 'image': 'https://storage.googleapis.com/download/storage/v1/b/usc-pro-uscweb-live-media/o/de-live%2Foriginal_1688x950_StandUpPaddling%20(1)_1716906351740653_admin.jpg?generation=1716906351817772&amp;alt=media'}",47.670267,9.1543569,HEIUKI SUP &amp; Kajak Automat freut sich auf dich!
Körperformen Konstanz,"['EMS', 'EMS Cardio']",True,"['L', 'XL']",L,Konstanz,Bruder-Klaus-Straße 10a,https://urbansportsclub.com//en/venues/korperformen-konstanz,"{'@context': 'http://schema.org', '@type': 'LocalBusiness', 'name': 'Körperformen Konstanz', 'description': 'Ihr EMS Gesundheitsstudio in Konstanz Die Anwendung von sogenanntem „EMS Training“ ist mehr als ein Trend. EMS wirkt. Lassen Sie sich überzeugen. Wir bieten Ihnen in unserem EMS Gesundheitsstudio in Konstanz ein Konzept, das zu Ihnen passt – ob effektives Ganzkörpertraining, gezielter Muskelaufbau oder Rückentraining. Durch die effektive Körperformen EMS Anwendung erzielen Sie maximale Trainingserfolge in kurzer Zeit. Bei jedem Termin werden Sie von einem qualifizierten Personal Trainer betreut. So garantieren wir höchste Trainingssicherheit und begleiten Sie beim Erreichen Ihrer persönlichen Ziele. Mehr Lebensqualität dank EMS! - minimaler Zeitaufwand - maximales Ergebnis - effektives Rückentraining - fit in 20 Min. pro Woche - Personal Training', 'address': {'@type': 'PostalAddress', 'addressLocality': 'Konstanz, Germany', 'addressCountry': 'Germany', 'postalCode': '78467', 'streetAddress': 'Bruder-Klaus-Straße 10a'}, 'telephone': '', 'geo': {'@type': 'GeoCoordinates', 'latitude': '47.6736', 'longitude': '9.1733655'}, 'priceRange': '-', 'image': 'https://storage.googleapis.com/download/storage/v1/b/usc-pro-uscweb-live-media/o/de-live%2Foriginal_1600x900_8d1ef3b201ea-IMG_20190409_WA0003_163602161287372_admin.jpg?generation=1636021612190701&amp;alt=media'}",47.6736,9.1733655,"Ihr EMS Gesundheitsstudio in Konstanz Die Anwendung von sogenanntem „EMS Training“ ist mehr als ein Trend. EMS wirkt. Lassen Sie sich überzeugen. Wir bieten Ihnen in unserem EMS Gesundheitsstudio in Konstanz ein Konzept, das zu Ihnen passt – ob effektives Ganzkörpertraining, gezielter Muskelaufbau oder Rückentraining. Durch die effektive Körperformen EMS Anwendung erzielen Sie maximale Trainingserfolge in kurzer Zeit. Bei jedem Termin werden Sie von einem qualifizierten Personal Trainer betreut. So garantieren wir höchste Trainingssicherheit und begleiten Sie beim Erreichen Ihrer persönlichen Ziele. Mehr Lebensqualität dank EMS! - minimaler Zeitaufwand - maximales Ergebnis - effektives Rückentraining - fit in 20 Min. pro Woche - Personal Training"
Shapeshifters Imperia Gym,['Fitness'],False,"['S', 'M', 'L', 'XL']",S,Konstanz,Gottlieb-Daimler-Straße 5,https://urbansportsclub.com//en/venues/shapeshifters-imperia-gym,"{'@context': 'http://schema.org', '@type': 'LocalBusiness', 'name': 'Shapeshifters Imperia Gym', 'description': '.', 'address': {'@type': 'PostalAddress', 'addressLocality': 'Konstanz, Germany', 'addressCountry': 'Germany', 'postalCode': '78467', 'streetAddress': 'Gottlieb-Daimler-Straße 5'}, 'telephone': '+49 7121 1451323', 'geo': {'@type': 'GeoCoordinates', 'latitude': '47.672574', 'longitude': '9.1495662'}, 'priceRange': '-', 'image': 'https://storage.googleapis.com/download/storage/v1/b/usc-pro-uscweb-live-media/o/de-live%2Foriginal_1024x576_aqynwia7de0hsf5fxjsp_1718350530450073.png?generation=1718350530537534&amp;alt=media'}",47.672574,9.1495662,.
