name,disciplines,plus_options,plans,min_plan,district,street,link,metadata,latitude,longitude,description
Cryopoint Wiesbaden,"['Cryotherapy', 'Wellness']",True,"['L', 'XL']",L,Mitte,Goldgasse 2,https://urbansportsclub.com//en/venues/cryopoint-wiesbaden-2,"{'@context': 'http://schema.org', '@type': 'LocalBusiness', 'name': 'Cryopoint Wiesbaden', 'description': 'Lass dich von CRYOPOINT für 2 Minuten bei -110°C einfrieren und profitiere von unzähligen Vorteilen für die körperliche und geistige Gesundheit. Die extreme Kälte beschleunigt die Muskelregeneration nach intensiven Workouts, steigert die Leistungsfähigkeit, hilft bei der Gewichtsabnahme und verbessert die allgemeine Gesundheit und das Wohlbefinden. Lass dich von einem eiskalten Besuch überraschen und profitiere von den zahlreichen Vorteilen der Kraft der Kälte. Informationen über BOA Lymphmassage Die BOA Lymphmassage ist eine sehr angenehme Druckwellenmassage und soll auf natürliche Weise Ihren Körper und Organismus positiv unterstützen. Angewendet an Bauch, Beinen und Po kann BOA bei regelmäßiger und richtiger Anwendung in Kombination mit Bewegung und Ernährung Sie auf dem Weg zu Ihren persönlichen Zielen unterstützen. Die verschiedenen Massagen sind ebenso zum Shaping geeignet. • Schneller regenerieren • Körper formen und Umfang reduzieren • Bindegewebe stärken • Durchblutung verbessern • Entgiftung anregen CRYOSPOT die lokale Cryo CRYOSPOT ist die neuste Methode zur Hautstraffung, Aknebekämpfung und Regeneration ohne Operation oder Spritzen. Durch gezielte Kälteeinwirkung wird deine Haut auf natürliche Weise gekühlt. Kurze Anwendungsdauer von 3 Minuten. Probiere die Weltneuheit in deinem CRYOPOINT aus und überzeuge dich selbst. Die Anwendung von CRYOSPOT kann folgendes erzielen: -Verbesserung der Erholungszeit -Erhöhung des Energieniveaus und Ausdauer -Reduzierung von Rötungen -Verbesserung der Belastbarkeit -Porenverkleinerung -Kollagenproduktion kann angeregt werden -Straffung der Haut und Falten können reduziert werden -Giftstoffe im Körper können reduziert werden -Das Haarwachstum kann durch Kopfhautanwendungen angeregt werden', 'address': {'@type': 'PostalAddress', 'addressLocality': 'Wiesbaden, Germany', 'addressCountry': 'Germany', 'postalCode': '65183', 'streetAddress': 'Goldgasse 2'}, 'telephone': '', 'geo': {'@type': 'GeoCoordinates', 'latitude': '50.0837066', 'longitude': '8.2414205'}, 'priceRange': '-', 'image': 'https://storage.googleapis.com/download/storage/v1/b/usc-pro-uscweb-live-media/o/de-live%2Foriginal_1024x576_Cryo_AdobeStock_108602824%20(6)_1649236497617005_admin.jpeg?generation=1649236497729334&amp;alt=media'}",50.0837066,8.2414205,"Lass dich von CRYOPOINT für 2 Minuten bei -110°C einfrieren und profitiere von unzähligen Vorteilen für die körperliche und geistige Gesundheit. Die extreme Kälte beschleunigt die Muskelregeneration nach intensiven Workouts, steigert die Leistungsfähigkeit, hilft bei der Gewichtsabnahme und verbessert die allgemeine Gesundheit und das Wohlbefinden. Lass dich von einem eiskalten Besuch überraschen und profitiere von den zahlreichen Vorteilen der Kraft der Kälte. Informationen über BOA Lymphmassage Die BOA Lymphmassage ist eine sehr angenehme Druckwellenmassage und soll auf natürliche Weise Ihren Körper und Organismus positiv unterstützen. Angewendet an Bauch, Beinen und Po kann BOA bei regelmäßiger und richtiger Anwendung in Kombination mit Bewegung und Ernährung Sie auf dem Weg zu Ihren persönlichen Zielen unterstützen. Die verschiedenen Massagen sind ebenso zum Shaping geeignet. • Schneller regenerieren • Körper formen und Umfang reduzieren • Bindegewebe stärken • Durchblutung verbessern • Entgiftung anregen CRYOSPOT die lokale Cryo CRYOSPOT ist die neuste Methode zur Hautstraffung, Aknebekämpfung und Regeneration ohne Operation oder Spritzen. Durch gezielte Kälteeinwirkung wird deine Haut auf natürliche Weise gekühlt. Kurze Anwendungsdauer von 3 Minuten. Probiere die Weltneuheit in deinem CRYOPOINT aus und überzeuge dich selbst. Die Anwendung von CRYOSPOT kann folgendes erzielen: -Verbesserung der Erholungszeit -Erhöhung des Energieniveaus und Ausdauer -Reduzierung von Rötungen -Verbesserung der Belastbarkeit -Porenverkleinerung -Kollagenproduktion kann angeregt werden -Straffung der Haut und Falten können reduziert werden -Giftstoffe im Körper können reduziert werden -Das Haarwachstum kann durch Kopfhautanwendungen angeregt werden"
Kletterhalle Wiesbaden,['Climbing'],False,"['M', 'L', 'XL']",M,Dotzheim,Holzstraße 11,https://urbansportsclub.com//en/venues/kletterhalle-wiesbaden,"{'@context': 'http://schema.org', '@type': 'LocalBusiness', 'name': 'Kletterhalle Wiesbaden', 'description': 'Zentral und stadtnah in der Holzstraße 11 gelegen, zeichnet sich die Kletterhalle Wiesbaden durch abwechslungsreiche Kletterrouten sowohl im TopRope-, als auch im Vorstiegsbereich und einem großzügigen Dachbreich aus. Unsere Routen werden in in regelmäßigen Abständen von professionellen Routenbauern neu geschraubt und die Kletterrouten vom 3. bis zum 9. Klettergrad lassen keine Wünsche offen. Unser Bistro bietet Kaffee, Kaltgetränke und Speisen an und lädt vor oder nach der erfolgreichen Klettersession zum Verweilen ein. Egal ob Du erst am Anfang dieses faszinierenden Sports stehst oder bereits Erfahrungen hast, ob Du alleine, zu zweit oder als Firma/Verein hoch hinaus willst, die Kletterhalle Wiesbaden hat für jeden das passende Angebot. Solltest Du keine Erfahrung im Klettersport haben, bieten wir ein umfassendes Kursprogramm. Wer noch nie Klettern war und keine Erfahrung im Sichern hat, kann mit unserem Schnupperklettern die ersten Schritte in der Vertikalen machen. Wenn Du regelmäßig klettern möchtest, bieten wir unsere Grundkurse an. Hier lernst Du in zwei Stunden das Sichern und Klettern und alles was sonst noch dazugehört, damit Du dich sicher in unserer Kletterhalle auspowern kannst. Parkmöglichkeiten findet Ihr direkt vor unserer Tür und in unserer Tiefgarage und mit den öffentlichen Verkehrsmitteln nutzt am besten die Haltestelle Carl-von-Linde Straße. Wir freuen uns auf Deinen Besuch!', 'address': {'@type': 'PostalAddress', 'addressLocality': 'Wiesbaden, Germany', 'addressCountry': 'Germany', 'postalCode': '65197', 'streetAddress': 'Holzstraße 11'}, 'telephone': '', 'geo': {'@type': 'GeoCoordinates', 'latitude': '50.0746517', 'longitude': '8.205471'}, 'priceRange': '-', 'image': 'https://storage.googleapis.com/download/storage/v1/b/usc-pro-uscweb-live-media/o/de-live%2Foriginal_1817x1022_50c76140b3599_3.jpg?alt=media'}",50.0746517,8.205471,"Zentral und stadtnah in der Holzstraße 11 gelegen, zeichnet sich die Kletterhalle Wiesbaden durch abwechslungsreiche Kletterrouten sowohl im TopRope-, als auch im Vorstiegsbereich und einem großzügigen Dachbreich aus. Unsere Routen werden in in regelmäßigen Abständen von professionellen Routenbauern neu geschraubt und die Kletterrouten vom 3. bis zum 9. Klettergrad lassen keine Wünsche offen. Unser Bistro bietet Kaffee, Kaltgetränke und Speisen an und lädt vor oder nach der erfolgreichen Klettersession zum Verweilen ein. Egal ob Du erst am Anfang dieses faszinierenden Sports stehst oder bereits Erfahrungen hast, ob Du alleine, zu zweit oder als Firma/Verein hoch hinaus willst, die Kletterhalle Wiesbaden hat für jeden das passende Angebot. Solltest Du keine Erfahrung im Klettersport haben, bieten wir ein umfassendes Kursprogramm. Wer noch nie Klettern war und keine Erfahrung im Sichern hat, kann mit unserem Schnupperklettern die ersten Schritte in der Vertikalen machen. Wenn Du regelmäßig klettern möchtest, bieten wir unsere Grundkurse an. Hier lernst Du in zwei Stunden das Sichern und Klettern und alles was sonst noch dazugehört, damit Du dich sicher in unserer Kletterhalle auspowern kannst. Parkmöglichkeiten findet Ihr direkt vor unserer Tür und in unserer Tiefgarage und mit den öffentlichen Verkehrsmitteln nutzt am besten die Haltestelle Carl-von-Linde Straße. Wir freuen uns auf Deinen Besuch!"
Frei- und Hallenbad Kleinfeldchen,['Swimming'],False,"['S', 'M', 'L', 'XL']",S,Westend,Hollerbornstraße 9,https://urbansportsclub.com//en/venues/frei-und-hallenbad-kleinfeldchen,"{'@context': 'http://schema.org', '@type': 'LocalBusiness', 'name': 'Frei- und Hallenbad Kleinfeldchen', 'description': 'Mattiaqua - Wiesbadener Bäder freut sich auf Dich!', 'address': {'@type': 'PostalAddress', 'addressLocality': 'Wiesbaden, Germany', 'addressCountry': 'Germany', 'postalCode': '65197', 'streetAddress': 'Hollerbornstraße 9'}, 'telephone': '', 'geo': {'@type': 'GeoCoordinates', 'latitude': '50.0786062', 'longitude': '8.2139967'}, 'priceRange': '-', 'image': 'https://storage.googleapis.com/download/storage/v1/b/usc-pro-uscweb-live-media/o/de-live%2Foriginal_1638x921_toa8wpf1ecrlin30r5dd_1683018304347414.png?generation=1683018304439769&amp;alt=media'}",50.0786062,8.2139967,Mattiaqua - Wiesbadener Bäder freut sich auf Dich!
Top Sport Center,['Fitness'],False,"['M', 'L', 'XL']",M,Niedernhausen,Idsteiner Str. 98,https://urbansportsclub.com//en/venues/top-sport-center-1,"{'@context': 'http://schema.org', '@type': 'LocalBusiness', 'name': 'Top Sport Center', 'description': 'Unsere Highlights: - erstklassige Kraft- und Cardiogeräte - Wellness-Bereich: Sauna 90°, Biosauna und Dampfbad - verschiedene Kursangebote - kompetente Trainer - Einweisung inkl. Trainingsplanerstellung - individuelle Betreuung - kostenloses Parken - kostenloses WLAN - exklusives Startpaket', 'address': {'@type': 'PostalAddress', 'addressLocality': 'Wiesbaden, Germany', 'addressCountry': 'Germany', 'postalCode': '65527', 'streetAddress': 'Idsteiner Str. 98'}, 'telephone': '', 'geo': {'@type': 'GeoCoordinates', 'latitude': '50.1697642', 'longitude': '8.3074397'}, 'priceRange': '-', 'image': 'https://storage.googleapis.com/download/storage/v1/b/usc-pro-uscweb-live-media/o/de-live%2Foriginal_4320x2430_c3678801dbd2-IMG_7155_1658990412204516_admin.jpg?generation=1658990412393885&amp;alt=media'}",50.1697642,8.3074397,"Unsere Highlights: - erstklassige Kraft- und Cardiogeräte - Wellness-Bereich: Sauna 90°, Biosauna und Dampfbad - verschiedene Kursangebote - kompetente Trainer - Einweisung inkl. Trainingsplanerstellung - individuelle Betreuung - kostenloses Parken - kostenloses WLAN - exklusives Startpaket"
ladyFITNESS,"['Dance', 'Fitness', 'Functional Training', 'Pilates', 'Vibration Training', 'Yoga']",False,"['M', 'L', 'XL']",M,Mitte,Langgasse 32,https://urbansportsclub.com//en/venues/ladyfitness,"{'@context': 'http://schema.org', '@type': 'LocalBusiness', 'name': 'ladyFITNESS', 'description': 'DAS Fitness Studio im Herzen von Wiesbaden, wo Frau sich wohlfühlt. Wir führen Frauen zu ihrem Ziel, egal ob Figurstraffung oder Rückenstärkung, wir finden das Richtige für Sie und unterstützen Ihre Gesundheit und Ihr Wohlbefinden mit Empathie und Verständnis. Lernen Sie uns kennen und wir finden gemeinsam Ihre individuelle Lösung. Wir freuen uns auf Sie!', 'address': {'@type': 'PostalAddress', 'addressLocality': 'Wiesbaden, Germany', 'addressCountry': 'Germany', 'postalCode': '65183', 'streetAddress': 'Langgasse 32'}, 'telephone': '', 'geo': {'@type': 'GeoCoordinates', 'latitude': '50.084361', 'longitude': '8.2398944'}, 'priceRange': '-', 'image': 'https://storage.googleapis.com/download/storage/v1/b/usc-pro-uscweb-live-media/o/de-live%2Foriginal_1024x576_79b1b52205b2-shutterstock_1063968938_1__1563961791106060_admin.jpg?alt=media'}",50.084361,8.2398944,"DAS Fitness Studio im Herzen von Wiesbaden, wo Frau sich wohlfühlt. Wir führen Frauen zu ihrem Ziel, egal ob Figurstraffung oder Rückenstärkung, wir finden das Richtige für Sie und unterstützen Ihre Gesundheit und Ihr Wohlbefinden mit Empathie und Verständnis. Lernen Sie uns kennen und wir finden gemeinsam Ihre individuelle Lösung. Wir freuen uns auf Sie!"
Freibad Kallebad,['Swimming'],False,"['S', 'M', 'L', 'XL']",S,Biebrich,Wörther-See-Straße 14,https://urbansportsclub.com//en/venues/freibad-kallebad,"{'@context': 'http://schema.org', '@type': 'LocalBusiness', 'name': 'Freibad Kallebad', 'description': 'Mattiaqua - Wiesbadener Bäder freut sich auf Dich!', 'address': {'@type': 'PostalAddress', 'addressLocality': 'Wiesbaden, Germany', 'addressCountry': 'Germany', 'postalCode': '65187', 'streetAddress': 'Wörther-See-Straße 14'}, 'telephone': '', 'geo': {'@type': 'GeoCoordinates', 'latitude': '50.05573', 'longitude': '8.21337'}, 'priceRange': '-', 'image': 'https://storage.googleapis.com/download/storage/v1/b/usc-pro-uscweb-live-media/o/de-live%2Foriginal_1688x950_SchwimmenCompressed_1582793934540915_admin.jpg?alt=media'}",50.05573,8.21337,Mattiaqua - Wiesbadener Bäder freut sich auf Dich!
free Gesundheitszentrum,"['Fitness', 'Relaxation', 'Sauna']",False,"['S', 'M', 'L', 'XL']",S,Taunusstein,Grillparzerstraße 40,https://urbansportsclub.com//en/venues/free-gesundheitszentrum,"{'@context': 'http://schema.org', '@type': 'LocalBusiness', 'name': 'free Gesundheitszentrum', 'description': 'free Gesundheitszentrum freut sich auf Dich!', 'address': {'@type': 'PostalAddress', 'addressLocality': 'Wiesbaden, Germany', 'addressCountry': 'Germany', 'postalCode': '65232', 'streetAddress': 'Grillparzerstraße 40'}, 'telephone': '', 'geo': {'@type': 'GeoCoordinates', 'latitude': '50.14373', 'longitude': '8.15314'}, 'priceRange': '-', 'image': 'https://storage.googleapis.com/download/storage/v1/b/usc-pro-uscweb-live-media/o/de-live%2Foriginal_1686x948_fitnesscompressed_155663035453984_admin.jpg?alt=media'}",50.14373,8.15314,free Gesundheitszentrum freut sich auf Dich!
LADYFORM,"['Dance', 'Fitness', 'Pilates', 'Vibration Training', 'Yoga']",False,"['S', 'M', 'L', 'XL']",S,Nordenstadt,Ostring 5,https://urbansportsclub.com//en/venues/ladyform-wiesbaden,"{'@context': 'http://schema.org', '@type': 'LocalBusiness', 'name': 'LADYFORM', 'description': 'Das LADY FORM Betreuungssystem - einzigartig und individuell auf deine Bedürfnisse abgestimmt! Dich erwarten tolle Programme speziell für die Frau: Der Fettstoffwechsel- und Figur-Zirkel: - Stoffwechselaktivierung - Kräftigung von Herz und Kreislauf - Figurformung und Straffung five - Das Rücken- und Gelenkskonzept: - Schmerzfreier durch mehr Beweglichkeit - Positive Wirkung auf den Bewegungsapparat - Aktiviert den Energiefluss Vacu Walk - Sanftes Gehen im Unterdruck: - Stoffwechselaktivierung - Umfangverringerung - Verbesserung von Orangenhaut - Fördert Glättung und Straffung der Haut Gruppenprogramme: - Pilates, Yoga, Bauch Beine Po, Spinning, Wirbelsäulengymnastik, Zumba, Step, Flexibar u.v.m. Lymphdrainage: - Entschlackend und entspannend - Positive Wirkung auf die Lymphe, z.B. Entwässerung happyFigur: - von der Krankenkasse bezuschusst - Abnehm und Ernährungskurs individuell angepasst', 'address': {'@type': 'PostalAddress', 'addressLocality': 'Wiesbaden, Germany', 'addressCountry': 'Germany', 'postalCode': '65205', 'streetAddress': 'Ostring 5'}, 'telephone': '+49 6122 2279', 'geo': {'@type': 'GeoCoordinates', 'latitude': '50.0590325', 'longitude': '8.3439914'}, 'priceRange': '-', 'image': 'https://storage.googleapis.com/download/storage/v1/b/usc-pro-uscweb-live-media/o/de-live%2Foriginal_4928x2772_8295254f46e7-_FAA8857_1661334204640671_admin.jpg?generation=1661334204761726&amp;alt=media'}",50.0590325,8.3439914,"Das LADY FORM Betreuungssystem - einzigartig und individuell auf deine Bedürfnisse abgestimmt! Dich erwarten tolle Programme speziell für die Frau: Der Fettstoffwechsel- und Figur-Zirkel: - Stoffwechselaktivierung - Kräftigung von Herz und Kreislauf - Figurformung und Straffung five - Das Rücken- und Gelenkskonzept: - Schmerzfreier durch mehr Beweglichkeit - Positive Wirkung auf den Bewegungsapparat - Aktiviert den Energiefluss Vacu Walk - Sanftes Gehen im Unterdruck: - Stoffwechselaktivierung - Umfangverringerung - Verbesserung von Orangenhaut - Fördert Glättung und Straffung der Haut Gruppenprogramme: - Pilates, Yoga, Bauch Beine Po, Spinning, Wirbelsäulengymnastik, Zumba, Step, Flexibar u.v.m. Lymphdrainage: - Entschlackend und entspannend - Positive Wirkung auf die Lymphe, z.B. Entwässerung happyFigur: - von der Krankenkasse bezuschusst - Abnehm und Ernährungskurs individuell angepasst"
Clever Fit Hadamar,['Fitness'],False,"['S', 'M', 'L', 'XL']",S,Hadamar (WI),Hospitalstraße 2,https://urbansportsclub.com//en/venues/clever-fit-hadamar,"{'@context': 'http://schema.org', '@type': 'LocalBusiness', 'name': 'Clever Fit Hadamar', 'description': 'Clever Fit Hadamar freut sich auf Dich!', 'address': {'@type': 'PostalAddress', 'addressLocality': 'Wiesbaden, Germany', 'addressCountry': 'Germany', 'postalCode': '65589', 'streetAddress': 'Hospitalstraße 2'}, 'telephone': '', 'geo': {'@type': 'GeoCoordinates', 'latitude': '50.4469238', 'longitude': '8.0465364'}, 'priceRange': '-', 'image': 'https://storage.googleapis.com/download/storage/v1/b/usc-pro-uscweb-live-media/o/de-live%2Foriginal_1902x1070_7379576e52ec-Bildschirmfoto_2022_03_22_um_15.02.53_164821542389302_admin.png?generation=1648215423304282&amp;alt=media'}",50.4469238,8.0465364,Clever Fit Hadamar freut sich auf Dich!
clever fit Frriedberg,['Fitness'],False,"['S', 'M', 'L', 'XL']",S,Friedberg (Hessen),Hanauer Straße 39,https://urbansportsclub.com//en/venues/clever-fit-friedberg,"{'@context': 'http://schema.org', '@type': 'LocalBusiness', 'name': 'clever fit Frriedberg', 'description': 'Clever Fit Friedberg freut sich auf dich!', 'address': {'@type': 'PostalAddress', 'addressLocality': 'Wiesbaden, Germany', 'addressCountry': 'Germany', 'postalCode': '65205', 'streetAddress': 'Hanauer Straße 39'}, 'telephone': '+49 6031 6920088', 'geo': {'@type': 'GeoCoordinates', 'latitude': '50.3328526', 'longitude': '8.7594074'}, 'priceRange': '-', 'image': 'https://storage.googleapis.com/download/storage/v1/b/usc-pro-uscweb-live-media/o/de-live%2Foriginal_1280x720_7e5cd4ed27fb-PHOTO_2021_09_23_20_46_14_1648210876879233_admin.jpg?generation=1648210876989803&amp;alt=media'}",50.3328526,8.7594074,Clever Fit Friedberg freut sich auf dich!
Allround Fitness Center,"['Fitness', 'Functional Training']",False,"['M', 'L', 'XL']",M,Oestrich-Winkel,Am Elsterbach 8,https://urbansportsclub.com//en/venues/allround-fitness-center,"{'@context': 'http://schema.org', '@type': 'LocalBusiness', 'name': 'Allround Fitness Center', 'description': 'DAVID FITNESS freut sich auf DIch!', 'address': {'@type': 'PostalAddress', 'addressLocality': 'Wiesbaden, Germany', 'addressCountry': 'Germany', 'postalCode': '65375', 'streetAddress': 'Am Elsterbach 8'}, 'telephone': '', 'geo': {'@type': 'GeoCoordinates', 'latitude': '49.9921483', 'longitude': '8.0000635'}, 'priceRange': '-', 'image': 'https://storage.googleapis.com/download/storage/v1/b/usc-pro-uscweb-live-media/o/de-live%2Foriginal_1024x576_d741ymx57aeqfxnieg8m_1704978488649601.png?generation=1704978488692040&amp;alt=media'}",49.9921483,8.0000635,DAVID FITNESS freut sich auf DIch!
Drum Fitness Outdoor Mainz-Kastel,"['Fitness', 'Pilates']",False,"['S', 'M', 'L', 'XL']",S,Kastel,Rheinufer 13,https://urbansportsclub.com//en/venues/drum-fitness,"{'@context': 'http://schema.org', '@type': 'LocalBusiness', 'name': 'Drum Fitness Outdoor Mainz-Kastel', 'description': 'Drum Fitness freut sich auf Dich!', 'address': {'@type': 'PostalAddress', 'addressLocality': 'Wiesbaden, Germany', 'addressCountry': 'Germany', 'postalCode': '55252', 'streetAddress': 'Rheinufer 13'}, 'telephone': '+49 176 41455001', 'geo': {'@type': 'GeoCoordinates', 'latitude': '50.0055527', 'longitude': '8.2822678'}, 'priceRange': '-', 'image': 'https://storage.googleapis.com/download/storage/v1/b/usc-pro-uscweb-live-media/o/de-live%2Foriginal_640x360_jbois4luc9jtlbt5wnlh_1716460992843457.png?generation=1716460992926467&amp;alt=media'}",50.0055527,8.2822678,Drum Fitness freut sich auf Dich!
Fit mit Hund - Alexandra Rüßler,['Fitness'],False,"['S', 'M', 'L', 'XL']",S,Kostheim,Heßlerweg 40,https://urbansportsclub.com//en/venues/fit-mit-hund-alexandra-russler,"{'@context': 'http://schema.org', '@type': 'LocalBusiness', 'name': 'Fit mit Hund - Alexandra Rüßler', 'description': 'Ab jetzt gemeinsam fit! Immer mehr Hundehalter möchten den Hundespaziergang mit dem eigenen Fitnesstraining verbinden und trainieren bei Fit mit Hund! Zum einen ist das Bewusstsein, den Hund körperlich und geistig auszulasten gestiegen und gleichermaßen wurde der präventive Gesundheitsaspekt immer wichtiger. Insgesamt wird das Zeitmanagement komplexer und die Zeit auch mal Gutes für sich zu tun immer knapper. Seit 2006 ist Fit mit Hund mit dem Fitnesstraining für Hund und Halter am Markt erfolgreich und bietet Trainingsmöglichkeiten für Einsteiger, Walkingfans und Fortgeschrittene sowie für Hunde aller Rassen und Größen! Dabei wurde das Konzept in Zusammenarbeit von Trainern, Physiotherapeuten und Ärzten entwickelt.', 'address': {'@type': 'PostalAddress', 'addressLocality': 'Wiesbaden, Germany', 'addressCountry': 'Germany', 'postalCode': '55246', 'streetAddress': 'Heßlerweg 40'}, 'telephone': '', 'geo': {'@type': 'GeoCoordinates', 'latitude': '50.9446145', 'longitude': '6.9456868'}, 'priceRange': '-', 'image': 'https://urbansportsclub.com/images/merchant/venueHome.jpg'}",50.9446145,6.9456868,"Ab jetzt gemeinsam fit! Immer mehr Hundehalter möchten den Hundespaziergang mit dem eigenen Fitnesstraining verbinden und trainieren bei Fit mit Hund! Zum einen ist das Bewusstsein, den Hund körperlich und geistig auszulasten gestiegen und gleichermaßen wurde der präventive Gesundheitsaspekt immer wichtiger. Insgesamt wird das Zeitmanagement komplexer und die Zeit auch mal Gutes für sich zu tun immer knapper. Seit 2006 ist Fit mit Hund mit dem Fitnesstraining für Hund und Halter am Markt erfolgreich und bietet Trainingsmöglichkeiten für Einsteiger, Walkingfans und Fortgeschrittene sowie für Hunde aller Rassen und Größen! Dabei wurde das Konzept in Zusammenarbeit von Trainern, Physiotherapeuten und Ärzten entwickelt."
Freibad Maaraue,['Swimming'],False,"['S', 'M', 'L', 'XL']",S,Kostheim,Maaraue 27,https://urbansportsclub.com//en/venues/freibad-maaraue,"{'@context': 'http://schema.org', '@type': 'LocalBusiness', 'name': 'Freibad Maaraue', 'description': 'Mattiaqua - Wiesbadener Bäder freut sich auf Dich!', 'address': {'@type': 'PostalAddress', 'addressLocality': 'Wiesbaden, Germany', 'addressCountry': 'Germany', 'postalCode': '55246', 'streetAddress': 'Maaraue 27'}, 'telephone': '', 'geo': {'@type': 'GeoCoordinates', 'latitude': '49.9972077', 'longitude': '8.2916328'}, 'priceRange': '-', 'image': 'https://storage.googleapis.com/download/storage/v1/b/usc-pro-uscweb-live-media/o/de-live%2Foriginal_2000x1125_nilyxu0hdqsnhz87cyxf_1683018285792318.png?generation=1683018285916971&amp;alt=media'}",49.9972077,8.2916328,Mattiaqua - Wiesbadener Bäder freut sich auf Dich!
Hallenbad Kostheim,['Swimming'],False,"['S', 'M', 'L', 'XL']",S,Kostheim,Waldhofstraße 11,https://urbansportsclub.com//en/venues/hallenbad-kostheim,"{'@context': 'http://schema.org', '@type': 'LocalBusiness', 'name': 'Hallenbad Kostheim', 'description': 'Mattiaqua - Wiesbadener Bäder freut sich auf Dich!', 'address': {'@type': 'PostalAddress', 'addressLocality': 'Wiesbaden, Germany', 'addressCountry': 'Germany', 'postalCode': '55246', 'streetAddress': 'Waldhofstraße 11'}, 'telephone': '', 'geo': {'@type': 'GeoCoordinates', 'latitude': '50.0101799', 'longitude': '8.2960826'}, 'priceRange': '-', 'image': 'https://storage.googleapis.com/download/storage/v1/b/usc-pro-uscweb-live-media/o/de-live%2Foriginal_2000x1125_lc8yyel6etwh8ltw8ksd_1683018347703009.png?generation=1683018347878751&amp;alt=media'}",50.0101799,8.2960826,Mattiaqua - Wiesbadener Bäder freut sich auf Dich!
