name,disciplines,plus_options,plans,min_plan,district,street,link,metadata,latitude,longitude,description
Parkletix - Beuel,"['Fitness', 'Functional Training', 'Yoga']",False,"['Classic', 'Premium', 'Max']",Classic,Beuel,Elsa-Brändström-Straße 115 (Wiese davor),https://urbansportsclub.com//en/venues/parkletics-beuel-1,"{'@context': 'http://schema.org', '@type': 'LocalBusiness', 'name': 'Parkletix - Beuel', 'description': 'Gemeinsam mit Deinem Personal Coach arbeiten wir in kleinen Gruppen an Deiner Gesundheit und Fitness. Wir wollen keine Rekorde brechen! Freunde treffen, lachen, Spaß haben und dabei mit reichlich frischer Luft und in der Natur fit werden und bleiben. Unsere CrossRun- &amp; FunctionalCircle-Kurse sind für Anfänger und Fortgeschrittene geeignet. MACH´S Draußen und triff Deinen Coach und Deine Fitnessgruppe. Wir freuen uns auf Dich', 'address': {'@type': 'PostalAddress', 'addressLocality': 'Bonn, Germany', 'addressCountry': 'Germany', 'postalCode': '', 'streetAddress': 'Elsa-Brändström-Straße 115 (Wiese davor)'}, 'telephone': '', 'geo': {'@type': 'GeoCoordinates', 'latitude': '50.724616662702', 'longitude': '7.1304922581917'}, 'priceRange': '-', 'image': 'https://storage.googleapis.com/download/storage/v1/b/usc-pro-uscweb-live-media/o/de-live%2Foriginal_1024x576_USC%20Venues%204_162946202452071_admin.jpg?generation=1629462024152249&amp;alt=media'}",50.724616662702,7.1304922581917,"Gemeinsam mit Deinem Personal Coach arbeiten wir in kleinen Gruppen an Deiner Gesundheit und Fitness. Wir wollen keine Rekorde brechen! Freunde treffen, lachen, Spaß haben und dabei mit reichlich frischer Luft und in der Natur fit werden und bleiben. Unsere CrossRun- &amp; FunctionalCircle-Kurse sind für Anfänger und Fortgeschrittene geeignet. MACH´S Draußen und triff Deinen Coach und Deine Fitnessgruppe. Wir freuen uns auf Dich"
Actiwita Fitness,"['Fitness', 'Pilates', 'Yoga']",False,"['Essential', 'Classic', 'Premium', 'Max']",Essential,Bad Godesberg,Villichgasse 2,https://urbansportsclub.com//en/venues/actiwita-bad-godesberg,"{'@context': 'http://schema.org', '@type': 'LocalBusiness', 'name': 'Actiwita Fitness', 'description': 'actiwita Vitalstudio freut sich auf Dich!', 'address': {'@type': 'PostalAddress', 'addressLocality': 'Bonn, Germany', 'addressCountry': 'Germany', 'postalCode': '53177', 'streetAddress': 'Villichgasse 2'}, 'telephone': '022836815f66', 'geo': {'@type': 'GeoCoordinates', 'latitude': '50.6846563', 'longitude': '7.1531759'}, 'priceRange': '-', 'image': 'https://storage.googleapis.com/download/storage/v1/b/usc-pro-uscweb-live-media/o/venues%2Foriginal_1608x905_P6120014_1552476887121863_admin.jpg?generation=1751969979136541&amp;alt=media'}",50.6846563,7.1531759,actiwita Vitalstudio freut sich auf Dich!
Human Fitness - Nauort,['Functional Training'],False,"['Classic', 'Premium', 'Max']",Classic,Nauort,Zum Rödchen 38,https://urbansportsclub.com//en/venues/human-fitness-nauort,"{'@context': 'http://schema.org', '@type': 'LocalBusiness', 'name': 'Human Fitness - Nauort', 'description': 'Das Zirkeltraining oder auch Circuit Training gehört weltweit zu den wohl bekanntesten Trainingsformen überhaupt. Es wird im Sportunterricht, im Freizeit- und Leistungssport, im Fitnessstudio, Personaltraining oder im Verein eingesetzt. Unser OutdoorCircuit® vereint die besten Elemente des Functional- und Bodyweight-Trainings und bietet ein geniales Gruppentrainingssystem. Stabilität, Koordination, Kraft, Ausdauer, Agilität, Schnelligkeit und Beweglichkeit werden gleichzeitig trainiert und verbessert. Spezielle und einfache Bewegungsanalysen und Verfahren im Vorfeld ermöglichen es den Teilnehmern sehr schnell Fortschritte zu machen. Es fühlt sich an wie Personal Training und die Verbesserung der Teilnehmer wird somit nach wenigen Wochen mess- und sichtbar.', 'address': {'@type': 'PostalAddress', 'addressLocality': 'Bonn, Germany', 'addressCountry': 'Germany', 'postalCode': '56237', 'streetAddress': 'Zum Rödchen 38'}, 'telephone': '', 'geo': {'@type': 'GeoCoordinates', 'latitude': '50.461113187', 'longitude': '7.620441792'}, 'priceRange': '-', 'image': 'https://storage.googleapis.com/download/storage/v1/b/usc-pro-uscweb-live-media/o/de-live%2Foriginal_3543x1993_926984817225-OC_Training_160_Kopie_1661855201931312_admin.jpg?generation=1661855202017452&amp;alt=media'}",50.461113187,7.620441792,"Das Zirkeltraining oder auch Circuit Training gehört weltweit zu den wohl bekanntesten Trainingsformen überhaupt. Es wird im Sportunterricht, im Freizeit- und Leistungssport, im Fitnessstudio, Personaltraining oder im Verein eingesetzt. Unser OutdoorCircuit® vereint die besten Elemente des Functional- und Bodyweight-Trainings und bietet ein geniales Gruppentrainingssystem. Stabilität, Koordination, Kraft, Ausdauer, Agilität, Schnelligkeit und Beweglichkeit werden gleichzeitig trainiert und verbessert. Spezielle und einfache Bewegungsanalysen und Verfahren im Vorfeld ermöglichen es den Teilnehmern sehr schnell Fortschritte zu machen. Es fühlt sich an wie Personal Training und die Verbesserung der Teilnehmer wird somit nach wenigen Wochen mess- und sichtbar."
Next Level Sportsclub,"['Boxing Sports', 'Dance', 'Fitness', 'Functional Training', 'Indoor Cycling', 'Pilates', 'Relaxation', 'Yoga']",False,"['Classic', 'Premium', 'Max']",Classic,Niederkassel,Gierslinger Straße 5,https://urbansportsclub.com//en/venues/injoy-niederkassel,"{'@context': 'http://schema.org', '@type': 'LocalBusiness', 'name': 'Next Level Sportsclub', 'description': 'Injoy Niederkassel freut sich auf Dich!', 'address': {'@type': 'PostalAddress', 'addressLocality': 'Bonn, Germany', 'addressCountry': 'Germany', 'postalCode': '53859', 'streetAddress': 'Gierslinger Straße 5'}, 'telephone': '', 'geo': {'@type': 'GeoCoordinates', 'latitude': '50.8304352', 'longitude': '7.0294224'}, 'priceRange': '-', 'image': 'https://storage.googleapis.com/download/storage/v1/b/usc-pro-uscweb-live-media/o/de-live%2Foriginal_1686x948_fitnesscompressed_1556610872543855_admin.jpg?alt=media'}",50.8304352,7.0294224,Injoy Niederkassel freut sich auf Dich!
Parkletix - Am Ennert,['Running'],False,"['Classic', 'Premium', 'Max']",Classic,Beuel,An den Hecken,https://urbansportsclub.com//en/venues/parkletics-am-ennert-1,"{'@context': 'http://schema.org', '@type': 'LocalBusiness', 'name': 'Parkletix - Am Ennert', 'description': 'Gemeinsam mit Deinem Personal Coach arbeiten wir in kleinen Gruppen an Deiner Gesundheit und Fitness. Wir wollen keine Rekorde brechen! Freunde treffen, lachen, Spaß haben und dabei mit reichlich frischer Luft und in der Natur fit werden und bleiben. Unsere CrossRun- &amp; FunctionalCircle-Kurse sind für Anfänger und Fortgeschrittene geeignet. MACH´S Draußen und triff Deinen Coach und Deine Fitnessgruppe. Wir freuen uns auf Dich', 'address': {'@type': 'PostalAddress', 'addressLocality': 'Bonn, Germany', 'addressCountry': 'Germany', 'postalCode': '', 'streetAddress': 'An den Hecken'}, 'telephone': '', 'geo': {'@type': 'GeoCoordinates', 'latitude': '50.735027', 'longitude': '7.149537'}, 'priceRange': '-', 'image': 'https://storage.googleapis.com/download/storage/v1/b/usc-pro-uscweb-live-media/o/de-live%2Foriginal_1024x576_USC%20Venues%204_1629462107786277_admin.jpg?generation=1629462107901417&amp;alt=media'}",50.735027,7.149537,"Gemeinsam mit Deinem Personal Coach arbeiten wir in kleinen Gruppen an Deiner Gesundheit und Fitness. Wir wollen keine Rekorde brechen! Freunde treffen, lachen, Spaß haben und dabei mit reichlich frischer Luft und in der Natur fit werden und bleiben. Unsere CrossRun- &amp; FunctionalCircle-Kurse sind für Anfänger und Fortgeschrittene geeignet. MACH´S Draußen und triff Deinen Coach und Deine Fitnessgruppe. Wir freuen uns auf Dich"
Kronos Aktivclub,['Fitness'],False,"['Premium', 'Max']",Premium,Hennef,Rathausplatz 1,https://urbansportsclub.com//en/venues/kronos-aktivclub,"{'@context': 'http://schema.org', '@type': 'LocalBusiness', 'name': 'Kronos Aktivclub', 'description': '', 'address': {'@type': 'PostalAddress', 'addressLocality': 'Bonn, Germany', 'addressCountry': 'Germany', 'postalCode': '53773', 'streetAddress': 'Rathausplatz 1'}, 'telephone': '', 'geo': {'@type': 'GeoCoordinates', 'latitude': '50.7757082', 'longitude': '7.2849519'}, 'priceRange': '-', 'image': 'https://storage.googleapis.com/download/storage/v1/b/usc-pro-uscweb-live-media/o/de-live%2Foriginal_1024x576_wx21qarbtrguraaju676_1744700099989095.png?generation=1744700100086974&amp;alt=media'}",50.7757082,7.2849519,
17/7 performance gym,['Fitness'],False,"['Essential', 'Classic', 'Premium', 'Max']",Essential,Rheinbach,Industriestraße 32a,https://urbansportsclub.com//en/venues/17-7-performance-gym,"{'@context': 'http://schema.org', '@type': 'LocalBusiness', 'name': '17/7 performance gym', 'description': 'Unser Gym richtet sich sowohl an leistungsorientiere Athletinnen/Athleten wie auch an den Hobby-Fitnesssportler. Unser Ziel es, Kraft- und Fitnesstraining an hochwertigen Kraft- und Ausdauergeräten zu fairen Bedingungen in einer familiären Atmosphäre anzubieten. Hierzu bieten wir unseren Mitgliedern auf fünf Hallen (1.200m²) die neuesten Kraft- und Ausdauergeräte führender Hersteller und zwei Freihantelbereiche an, der seinesgleichen sucht. Zwei der genannten Hallen sind speziell auf funktionelles Training ausgerichtet, sodass Ihr Euch ohne Warten an den Racks oder an Freihanteln austoben könnt. Unser Fitnessstudio hat 365 Tage im Jahr (6 - 23 Uhr) täglich geöffnet. Wir freuen uns auf Deinen Besuch!', 'address': {'@type': 'PostalAddress', 'addressLocality': 'Bonn, Germany', 'addressCountry': 'Germany', 'postalCode': '53359', 'streetAddress': 'Industriestraße 32A'}, 'telephone': '', 'geo': {'@type': 'GeoCoordinates', 'latitude': '50.6377316', 'longitude': '6.9525984'}, 'priceRange': '-', 'image': 'https://storage.googleapis.com/download/storage/v1/b/usc-pro-uscweb-live-media/o/de-live%2Foriginal_2000x1125_dd86f587c17a-DSC00977_1557927303893674_admin.jpg?alt=media'}",50.6377316,6.9525984,"Unser Gym richtet sich sowohl an leistungsorientiere Athletinnen/Athleten wie auch an den Hobby-Fitnesssportler. Unser Ziel es, Kraft- und Fitnesstraining an hochwertigen Kraft- und Ausdauergeräten zu fairen Bedingungen in einer familiären Atmosphäre anzubieten. Hierzu bieten wir unseren Mitgliedern auf fünf Hallen (1.200m²) die neuesten Kraft- und Ausdauergeräte führender Hersteller und zwei Freihantelbereiche an, der seinesgleichen sucht. Zwei der genannten Hallen sind speziell auf funktionelles Training ausgerichtet, sodass Ihr Euch ohne Warten an den Racks oder an Freihanteln austoben könnt. Unser Fitnessstudio hat 365 Tage im Jahr (6 - 23 Uhr) täglich geöffnet. Wir freuen uns auf Deinen Besuch!"
All Fit,['Fitness'],False,"['Essential', 'Classic', 'Premium', 'Max']",Essential,Euskirchen,Kommerner Straße 72,https://urbansportsclub.com//en/venues/all-fit-gmbh,"{'@context': 'http://schema.org', '@type': 'LocalBusiness', 'name': 'All Fit', 'description': '.', 'address': {'@type': 'PostalAddress', 'addressLocality': 'Bonn, Germany', 'addressCountry': 'Germany', 'postalCode': '53879', 'streetAddress': 'Kommerner Straße 72'}, 'telephone': '+44 22517745054', 'geo': {'@type': 'GeoCoordinates', 'latitude': '50.659204', 'longitude': '6.7792905'}, 'priceRange': '-', 'image': 'https://storage.googleapis.com/download/storage/v1/b/usc-pro-uscweb-live-media/o/de-live%2Foriginal_1920x1080_k6wl7k897eevu516p0sy_1724249723368261.png?generation=1724249723484504&amp;alt=media'}",50.659204,6.7792905,.
Sportwelt Schäfer - Mechernich,['Fitness'],False,"['Classic', 'Premium', 'Max']",Classic,Mechernich,Seeweg 9,https://urbansportsclub.com//en/venues/sportwelt-schafer-mechernich,"{'@context': 'http://schema.org', '@type': 'LocalBusiness', 'name': 'Sportwelt Schäfer - Mechernich', 'description': 'Sportwelt Schäfer freut sich auf Dich!', 'address': {'@type': 'PostalAddress', 'addressLocality': 'Bonn, Germany', 'addressCountry': 'Germany', 'postalCode': '53894', 'streetAddress': 'Seeweg 9'}, 'telephone': '+49 2443 3158130', 'geo': {'@type': 'GeoCoordinates', 'latitude': '50.6062619', 'longitude': '6.6383756'}, 'priceRange': '-', 'image': 'https://storage.googleapis.com/download/storage/v1/b/usc-pro-uscweb-live-media/o/de-live%2Foriginal_1686x948_fitnesscompressed_1551355786908035_admin.jpg?alt=media'}",50.6062619,6.6383756,Sportwelt Schäfer freut sich auf Dich!
F3 Fitness Club,['Fitness'],False,"['Essential', 'Classic', 'Premium', 'Max']",Essential,Bornheim,Schumacherstraße 3-11,https://urbansportsclub.com//en/venues/f3-fitness-clubb,"{'@context': 'http://schema.org', '@type': 'LocalBusiness', 'name': 'F3 Fitness Club', 'description': 'Back to the Roots! Wir lassen ein altbewehrtes Trainingskonzept mit außergewöhnlichem Ambiente wieder aufleben. Wir setzen unseren Fokus auf ein effektives und intensives Training an unseren bewährten Geräten. Unser Old School Fitnessstudio ist deine Antwort auf die Massenabfertigung in großen Fitnessketten. Mit Spaß, Erfahrung und Motivation bringen wir dich zu deinen Zielen.', 'address': {'@type': 'PostalAddress', 'addressLocality': 'Bonn, Germany', 'addressCountry': 'Germany', 'postalCode': '53332', 'streetAddress': 'Schumacherstraße 3-11'}, 'telephone': '', 'geo': {'@type': 'GeoCoordinates', 'latitude': '50.7578581', 'longitude': '7.0073012'}, 'priceRange': '-', 'image': 'https://storage.googleapis.com/download/storage/v1/b/usc-pro-uscweb-live-media/o/de-live%2Foriginal_1686x948_fitnesscompressed_1554124103489185_admin.jpg?alt=media'}",50.7578581,7.0073012,"Back to the Roots! Wir lassen ein altbewehrtes Trainingskonzept mit außergewöhnlichem Ambiente wieder aufleben. Wir setzen unseren Fokus auf ein effektives und intensives Training an unseren bewährten Geräten. Unser Old School Fitnessstudio ist deine Antwort auf die Massenabfertigung in großen Fitnessketten. Mit Spaß, Erfahrung und Motivation bringen wir dich zu deinen Zielen."
FITOMAT - Sankt Augustin Menden,"['Bootcamp', 'Dance', 'Fitness', 'Pilates', 'Yoga']",False,"['Essential', 'Classic', 'Premium', 'Max']",Essential,Sankt Augustin,Gutenbergstraße 1-3,https://urbansportsclub.com//en/venues/fitomat-sankt-augustin-menden,"{'@context': 'http://schema.org', '@type': 'LocalBusiness', 'name': 'FITOMAT - Sankt Augustin Menden', 'description': '', 'address': {'@type': 'PostalAddress', 'addressLocality': 'Bonn, Germany', 'addressCountry': 'Germany', 'postalCode': '53757', 'streetAddress': 'Gutenbergstraße 1-3'}, 'telephone': '+44 15563044213', 'geo': {'@type': 'GeoCoordinates', 'latitude': '50.7841933', 'longitude': '7.1618699'}, 'priceRange': '-', 'image': 'https://storage.googleapis.com/download/storage/v1/b/usc-pro-uscweb-live-media/o/de-live%2Foriginal_640x360_qgnfpbimb8nrnblbaewp_1741956954480822.png?generation=1741956954530610&amp;alt=media'}",50.7841933,7.1618699,
clever fit Bad Neuenahr,['Fitness'],False,"['Classic', 'Premium', 'Max']",Classic,Bad Neuenahr-Ahrweiler,Sprengnetter-Campus 4,https://urbansportsclub.com//en/venues/clever-fit-bad-neuenahr,"{'@context': 'http://schema.org', '@type': 'LocalBusiness', 'name': 'clever fit Bad Neuenahr', 'description': 'CleverFit freut sich auf Dich!', 'address': {'@type': 'PostalAddress', 'addressLocality': 'Bonn, Germany', 'addressCountry': 'Germany', 'postalCode': '53474', 'streetAddress': 'Sprengnetter-Campus 4'}, 'telephone': '', 'geo': {'@type': 'GeoCoordinates', 'latitude': '50.5486121', 'longitude': '7.1311786'}, 'priceRange': '-', 'image': 'https://storage.googleapis.com/download/storage/v1/b/usc-pro-uscweb-live-media/o/de-live%2Foriginal_1024x576_Fitness%20(2)_1715674753882662_admin.jpg?generation=1715674753956602&amp;alt=media'}",50.5486121,7.1311786,CleverFit freut sich auf Dich!
Donna´s Bonn Plittersdorf,"['Dance', 'Fitness', 'Functional Training', 'Pilates', 'Relaxation', 'Yoga']",False,"['Classic', 'Premium', 'Max']",Classic,Bad Godesberg,Plittersdorfer Str. 131,https://urbansportsclub.com//en/venues/donnas-bonn-plittersdorf,"{'@context': 'http://schema.org', '@type': 'LocalBusiness', 'name': 'Donna´s Bonn Plittersdorf', 'description': 'Der Name Donna´s steht für hochwertige, individuelle Fitnesskonzepte, die sich kompetent und zukunftsorientiert auf fast alle Bedürfnisse des Kunden konzentrieren. Donna´s – die Antwort auf all Ihre Problemzonen und somit der Weg zu Ihrer persönlichen Wohlfühlfigur. Ihre Lebensqualität, Ihre körperliche und geistige Vitalität werden maßgeblich durch Ihre persönliche Fitness beeinflußt. Der positive Zusammenhang zwischen regelmäßigem Sport und Gesundheit wurde bereits durch zahlreiche, wissenschaftliche Studien und Forschungsergebnisse belegt. Sport – Das effektivste Medikament ohne Nebenwirkungen, denn wie heißt es so schön „Nur ein gesunder Geist wohnt in einem gesunden Körper“. Und somit ist das gesundheitsorientierte Körpertraining der wichtigste Pfeiler unserer Club- und Leistungsphilosophie. In allen Bereichen spüren Sie unsere Begeisterung zum Thema Fitness. In angenehmer Atmosphäre begeistern und begleiten wir Sie auf Wunsch durch individuelle Betreuung und kompetente Beratung. Unsere lizensierten Fitnesstrainer/innen und Dipl. Sportwissenschaftler unterstützen Sie gerne und helfen Ihnen, Ihre Figurwünsche zu realisieren. Gewichtsreduzierung, Konditions-, Koordinations- und Krafttraining – Es ist Ihr Körper, der für uns an erster Stelle steht. Überzeugen Sie sich selbst und erleben Sie unser Credo „Was Frauen wollen“. Wir freuen uns auf Sie im Donna´s … 4 Sterne Fitness für uns Frauen.', 'address': {'@type': 'PostalAddress', 'addressLocality': 'Bonn, Germany', 'addressCountry': 'Germany', 'postalCode': '53173', 'streetAddress': 'Plittersdorfer Str. 131'}, 'telephone': '', 'geo': {'@type': 'GeoCoordinates', 'latitude': '50.6959944', 'longitude': '7.1616915'}, 'priceRange': '-', 'image': 'https://storage.googleapis.com/download/storage/v1/b/usc-pro-uscweb-live-media/o/de-live%2Foriginal_1050x591_Plittersdorf.jpg?alt=media'}",50.6959944,7.1616915,"Der Name Donna´s steht für hochwertige, individuelle Fitnesskonzepte, die sich kompetent und zukunftsorientiert auf fast alle Bedürfnisse des Kunden konzentrieren. Donna´s – die Antwort auf all Ihre Problemzonen und somit der Weg zu Ihrer persönlichen Wohlfühlfigur. Ihre Lebensqualität, Ihre körperliche und geistige Vitalität werden maßgeblich durch Ihre persönliche Fitness beeinflußt. Der positive Zusammenhang zwischen regelmäßigem Sport und Gesundheit wurde bereits durch zahlreiche, wissenschaftliche Studien und Forschungsergebnisse belegt. Sport – Das effektivste Medikament ohne Nebenwirkungen, denn wie heißt es so schön „Nur ein gesunder Geist wohnt in einem gesunden Körper“. Und somit ist das gesundheitsorientierte Körpertraining der wichtigste Pfeiler unserer Club- und Leistungsphilosophie. In allen Bereichen spüren Sie unsere Begeisterung zum Thema Fitness. In angenehmer Atmosphäre begeistern und begleiten wir Sie auf Wunsch durch individuelle Betreuung und kompetente Beratung. Unsere lizensierten Fitnesstrainer/innen und Dipl. Sportwissenschaftler unterstützen Sie gerne und helfen Ihnen, Ihre Figurwünsche zu realisieren. Gewichtsreduzierung, Konditions-, Koordinations- und Krafttraining – Es ist Ihr Körper, der für uns an erster Stelle steht. Überzeugen Sie sich selbst und erleben Sie unser Credo „Was Frauen wollen“. Wir freuen uns auf Sie im Donna´s … 4 Sterne Fitness für uns Frauen."
Sportwelt Schäfer - Bad Münstereifel,['Fitness'],False,"['Classic', 'Premium', 'Max']",Classic,Bad Münstereifel,Im Goldenen Tal 8,https://urbansportsclub.com//en/venues/sportwelt-schafer,"{'@context': 'http://schema.org', '@type': 'LocalBusiness', 'name': 'Sportwelt Schäfer - Bad Münstereifel', 'description': 'Sportwelt Schäfer freut sich auf Dich!', 'address': {'@type': 'PostalAddress', 'addressLocality': 'Bonn, Germany', 'addressCountry': 'Germany', 'postalCode': '53902', 'streetAddress': 'Im Goldenen Tal 8'}, 'telephone': '+49 2253 7643', 'geo': {'@type': 'GeoCoordinates', 'latitude': '50.5460996', 'longitude': '6.7632481'}, 'priceRange': '-', 'image': 'https://storage.googleapis.com/download/storage/v1/b/usc-pro-uscweb-live-media/o/de-live%2Foriginal_1686x948_fitnesscompressed_1551355777374444_admin.jpg?alt=media'}",50.5460996,6.7632481,Sportwelt Schäfer freut sich auf Dich!
Fit & Fun Ahrweiler,['Fitness'],False,"['Classic', 'Premium', 'Max']",Classic,Bad Neuenahr-Ahrweiler,Am Silberberg 2,https://urbansportsclub.com//en/venues/fit-fun-ahrweiler,"{'@context': 'http://schema.org', '@type': 'LocalBusiness', 'name': 'Fit &amp; Fun Ahrweiler', 'description': 'Fit &amp; Fun, das Studio, in dem Sie Ihr Ziel erreichen! Unser Fitness- und Gesundheitsclub ist im Bereich Kraft, Beweglichkeit und Ausdauer sehr aktiv. Wir konnten uns daher bereits einen Namen als führendes Sportcenter der Region machen. Unser Erfolgskonzept beruht sowohl auf umfassender Beratung als auch auf fachkundiger Anleitung. Lassen Sie sich von unserem qualifiziertem Personal beraten und entscheiden Sie selbst. Wir werden gemeinsam die für Sie optimale Variante finden, damit auch Sie das komplette Angebot des Fit &amp; Fun Ahrweiler nutzen können. Testen Sie unser Angebot.', 'address': {'@type': 'PostalAddress', 'addressLocality': 'Bonn, Germany', 'addressCountry': 'Germany', 'postalCode': '53474', 'streetAddress': 'Am Silberberg 2'}, 'telephone': '', 'geo': {'@type': 'GeoCoordinates', 'latitude': '50.5394381', 'longitude': '7.087097'}, 'priceRange': '-', 'image': 'https://storage.googleapis.com/download/storage/v1/b/usc-pro-uscweb-live-media/o/de-live%2Foriginal_2032x1143_f872225264e8-20180717_123859_155397246521072_admin.jpg?alt=media'}",50.5394381,7.087097,"Fit &amp; Fun, das Studio, in dem Sie Ihr Ziel erreichen! Unser Fitness- und Gesundheitsclub ist im Bereich Kraft, Beweglichkeit und Ausdauer sehr aktiv. Wir konnten uns daher bereits einen Namen als führendes Sportcenter der Region machen. Unser Erfolgskonzept beruht sowohl auf umfassender Beratung als auch auf fachkundiger Anleitung. Lassen Sie sich von unserem qualifiziertem Personal beraten und entscheiden Sie selbst. Wir werden gemeinsam die für Sie optimale Variante finden, damit auch Sie das komplette Angebot des Fit &amp; Fun Ahrweiler nutzen können. Testen Sie unser Angebot."
