name,disciplines,plus_options,plans,min_plan,district,street,link,metadata,latitude,longitude,description
Fisioterapia i Osteopatia Sant Gervasi,['Massage'],True,"['L', 'XL']",L,Sant Gervasi-Galvany,"Carrer Alacant, 28",https://urbansportsclub.com//en/venues/fisioterapia-i-osteopatia-sant-gervasi,"{'@context': 'http://schema.org', '@type': 'LocalBusiness', 'name': 'Fisioterapia i Osteopatia Sant Gervasi', 'description': 'Fisioterapia y Osteopatía Sant Gervasi ha sido creado por Enric Obiols, Raúl Valero y Gerard Noguera. El objetivo principal de nuestro centro es realizar un trato más humano, cercano e individual de cada paciente. Nuestra misión como centro se basa en entender el problema principal de cada persona desde un punto de vista holístico y saber el origen de este para ayudar a mejorar la calidad de vida de nuestros pacientes. Ofreciendo un trato cercano al cliente sin que el tiempo de tratamiento sea un problema para la resolución de su problema. La honestidad, la confianza, el respeto al paciente, el continuo aprendizaje y la lucha por dar una mayor calidad de vida son nuestros valores principales. Actualmente, en el barrio de Sant Gervasi, contamos con un equipo de personas que siguen los mismos objetivos y valores, pero con la intención presente y futura de ser un centro de referencia de Fisioterapia y Osteopatía. Gracias a nuestra filosofía y a las características de nuestro equipo y centro, lo convierte en algo necesario e innovador. Seguiremos trabajando para mejorar a nivel personal y como centro. Servcios: Fisioterapia, osteopatía, readaptación física, prevención de lesiones y masajes.', 'address': {'@type': 'PostalAddress', 'addressLocality': 'Barcelona, Spain', 'addressCountry': 'Spain', 'postalCode': '08022', 'streetAddress': 'Carrer Alacant, 28'}, 'telephone': '+34 644 50 93 21', 'geo': {'@type': 'GeoCoordinates', 'latitude': '41.401191', 'longitude': '2.1350958'}, 'priceRange': '-', 'image': 'https://storage.googleapis.com/download/storage/v1/b/usc-pro-uscweb-live-media/o/de-live%2Foriginal_1600x900_WhatsApp%20Image%202021-06-01%20at%2017.18.45_1623666681207419_admin.jpeg?alt=media'}",41.401191,2.1350958,"Fisioterapia y Osteopatía Sant Gervasi ha sido creado por Enric Obiols, Raúl Valero y Gerard Noguera. El objetivo principal de nuestro centro es realizar un trato más humano, cercano e individual de cada paciente. Nuestra misión como centro se basa en entender el problema principal de cada persona desde un punto de vista holístico y saber el origen de este para ayudar a mejorar la calidad de vida de nuestros pacientes. Ofreciendo un trato cercano al cliente sin que el tiempo de tratamiento sea un problema para la resolución de su problema. La honestidad, la confianza, el respeto al paciente, el continuo aprendizaje y la lucha por dar una mayor calidad de vida son nuestros valores principales. Actualmente, en el barrio de Sant Gervasi, contamos con un equipo de personas que siguen los mismos objetivos y valores, pero con la intención presente y futura de ser un centro de referencia de Fisioterapia y Osteopatía. Gracias a nuestra filosofía y a las características de nuestro equipo y centro, lo convierte en algo necesario e innovador. Seguiremos trabajando para mejorar a nivel personal y como centro. Servcios: Fisioterapia, osteopatía, readaptación física, prevención de lesiones y masajes."
Sonia Franco Terapia Manual.Masaje y osteopatia,['Massage'],True,"['L', 'XL']",L,Vila de Gràcia,c/ de la Gleva 8,https://urbansportsclub.com//en/venues/cos-vital-espai-de-massatge,"{'@context': 'http://schema.org', '@type': 'LocalBusiness', 'name': 'Sonia Franco Terapia Manual.Masaje y osteopatia', 'description': 'Somos quiromasajistas profesionales, mejoramos la calidad de vida de las personas, proporcionando bienestar, salud y relajación. Nuestro trabajo es tratar y aliviar las tensiones que sufres, ayudarte a mejorar tu postura, a que seas consciente de tu cuerpo y conectar con él, lo que te llevará a tener una mejor relación contigo mismo. Nuestro enfoque es aunar el concepto más occidental del masaje con el concepto oriental. El masaje occidental presta una atención especial a la estructura corporal, a la postura correcta del cuerpo, cumple la finalidad de descarga de la musculatura, relajación, estiramiento y equilibrio, poniendo especial interés a las zonas de dolor para aliviarlo. Sin embargo el masaje oriental tiene un mayor significado filosófico y holístico. Concibe el cuerpo como una totalidad y la finalidad del masaje es procurar la armonía cuerpo-mente. En Cos vital Plus integramos estos dos conceptos. Nuestro objetivo es ser un referente en el mundo del masaje.', 'address': {'@type': 'PostalAddress', 'addressLocality': 'Barcelona, Spain', 'addressCountry': 'Spain', 'postalCode': '08006', 'streetAddress': 'c/ de la gleva 3 ; 0800'}, 'telephone': '+49 6531 56613', 'geo': {'@type': 'GeoCoordinates', 'latitude': '41.4027023', 'longitude': '2.1465784'}, 'priceRange': '-', 'image': 'https://storage.googleapis.com/download/storage/v1/b/usc-pro-uscweb-live-media/o/de-live%2Foriginal_1100x619_c6_1558079987457285_admin.jpg?alt=media'}",41.4027023,2.1465784,"Somos quiromasajistas profesionales, mejoramos la calidad de vida de las personas, proporcionando bienestar, salud y relajación. Nuestro trabajo es tratar y aliviar las tensiones que sufres, ayudarte a mejorar tu postura, a que seas consciente de tu cuerpo y conectar con él, lo que te llevará a tener una mejor relación contigo mismo. Nuestro enfoque es aunar el concepto más occidental del masaje con el concepto oriental. El masaje occidental presta una atención especial a la estructura corporal, a la postura correcta del cuerpo, cumple la finalidad de descarga de la musculatura, relajación, estiramiento y equilibrio, poniendo especial interés a las zonas de dolor para aliviarlo. Sin embargo el masaje oriental tiene un mayor significado filosófico y holístico. Concibe el cuerpo como una totalidad y la finalidad del masaje es procurar la armonía cuerpo-mente. En Cos vital Plus integramos estos dos conceptos. Nuestro objetivo es ser un referente en el mundo del masaje."
Sincronia Yoga - Espacio SATTVA,['Yoga'],False,"['M', 'L', 'XL']",M,Sant Gervasi-Galvany,"Carrer Sant Pere Martir, 33",https://urbansportsclub.com//en/venues/sincronia-yoga-1,"{'@context': 'http://schema.org', '@type': 'LocalBusiness', 'name': 'Sincronia Yoga - Espacio SATTVA', 'description': 'Sincronia Yoga es un centro de Yoga en el corazón del barrio de Gràcia, Barcelona. En este rincón del mundo, tal y como si fuera una pequeña India por la gran cantidad de centros de yoga que existen, Sincronia Yoga nace del encuentro de dos viejos amigos que iniciaron dos proyectos por separado: Sebastià Llorach en Sattva Yoga, fundado en el 2006 en el mismo local que la actual Mamayoga, e Ignasi Seró, con la práctica del Shiatsu y Movimiento y el Método Padovan en Barcelona, Cardedeu y Girona. En 2014 aunamos fuerzas para crear Sincronia Yoga, un espacio de práctica de diferentes estilos (hatha yoga, vinyasa yoga, yoga integral, yin yoga…), así como consciencia corporal, pranayama y meditación nidra y complementado con diferentes terapias manuales (shiatsu, quiromasaje, fisioterapia, acupuntura, ayurveda y método padovan). Cada persona y profesional aporta su visión y transmite su experiencia en base a un respeto hacia lo que amamos. Esta pasión es la que nos abre a respetar y poder ayudar a los demás con nuestra pequeña influencia diaria (¡abrimos los 365 días del año!). Es este contacto humano y esta cercanía personal las que nos motivan a seguir aprendiendo y compartiendo caminos. Unos son recorridos de amistad, otros de compañerismo y la mayoría de tránsito bajo la impronta de cada práctica y técnica. La ilusión de nuestro centro de yoga y terapias es ofrecer servicios de calidad a la gente que vive o trabaja concretamente en el barrio de Gràcia, como también en otros lugares, un trato de proximidad abierto a todos los niveles de practicantes, así como a todas las diferentes situaciones de salud que pueden acontecer a lo largo de nuestra vida. Muchas clases, muchos estilos, muchos niveles, y también muchas tarifas y modalidades de pago, para podernos adaptar a las diferentes situaciones del alumnado. Vita in motu como decían antiguamente, o adaptación al cambio y a las crisis como se sugiere más recientemente. *** MEDIDAS SANITARIAS *** https://www.youtube.com/watch?v=USXdNxzQINA&amp;feature=youtu.be', 'address': {'@type': 'PostalAddress', 'addressLocality': 'Barcelona, Spain', 'addressCountry': 'Spain', 'postalCode': '08012', 'streetAddress': 'Carrer Sant Pere Martir, 33'}, 'telephone': '', 'geo': {'@type': 'GeoCoordinates', 'latitude': '41.3995573', 'longitude': '2.1568812'}, 'priceRange': '-', 'image': 'https://storage.googleapis.com/download/storage/v1/b/usc-pro-uscweb-live-media/o/de-live%2Foriginal_640x360_garaynzylgpzibvdg7t6_1674724467591725.png?generation=1674724467764810&amp;alt=media'}",41.3995573,2.1568812,"Sincronia Yoga es un centro de Yoga en el corazón del barrio de Gràcia, Barcelona. En este rincón del mundo, tal y como si fuera una pequeña India por la gran cantidad de centros de yoga que existen, Sincronia Yoga nace del encuentro de dos viejos amigos que iniciaron dos proyectos por separado: Sebastià Llorach en Sattva Yoga, fundado en el 2006 en el mismo local que la actual Mamayoga, e Ignasi Seró, con la práctica del Shiatsu y Movimiento y el Método Padovan en Barcelona, Cardedeu y Girona. En 2014 aunamos fuerzas para crear Sincronia Yoga, un espacio de práctica de diferentes estilos (hatha yoga, vinyasa yoga, yoga integral, yin yoga…), así como consciencia corporal, pranayama y meditación nidra y complementado con diferentes terapias manuales (shiatsu, quiromasaje, fisioterapia, acupuntura, ayurveda y método padovan). Cada persona y profesional aporta su visión y transmite su experiencia en base a un respeto hacia lo que amamos. Esta pasión es la que nos abre a respetar y poder ayudar a los demás con nuestra pequeña influencia diaria (¡abrimos los 365 días del año!). Es este contacto humano y esta cercanía personal las que nos motivan a seguir aprendiendo y compartiendo caminos. Unos son recorridos de amistad, otros de compañerismo y la mayoría de tránsito bajo la impronta de cada práctica y técnica. La ilusión de nuestro centro de yoga y terapias es ofrecer servicios de calidad a la gente que vive o trabaja concretamente en el barrio de Gràcia, como también en otros lugares, un trato de proximidad abierto a todos los niveles de practicantes, así como a todas las diferentes situaciones de salud que pueden acontecer a lo largo de nuestra vida. Muchas clases, muchos estilos, muchos niveles, y también muchas tarifas y modalidades de pago, para podernos adaptar a las diferentes situaciones del alumnado. Vita in motu como decían antiguamente, o adaptación al cambio y a las crisis como se sugiere más recientemente. *** MEDIDAS SANITARIAS *** https://www.youtube.com/watch?v=USXdNxzQINA&amp;feature=youtu.be"
Lapso Studios,"['Cycling', 'Fitness', 'Indoor Cycling']",False,"['M', 'L', 'XL']",M,Sant Gervasi-Galvany,"Avinguda Diagonal, 606",https://urbansportsclub.com//en/venues/lapso-studios,"{'@context': 'http://schema.org', '@type': 'LocalBusiness', 'name': 'Lapso Studios', 'description': 'Lapso es un nuevo studio de fitness en Barcelona especializado en una modalidad de deporte que ya es tendencia en el mundo entero: Indoor cycling. Hasta aquí, bien. Pero hay algo más: se practica de forma instintiva y casi sin pensar. No siempre el deporte es sacrificio, y menos si le damos la vuelta y convertimos la energía en diversión. Otros: en Lapso cuentan con toallas, ducha (con amenities), restauración de la mano de Enlagloria Salad House, y venta de ropa de deporte de la mano de marcas como Girlfriend collective. Este servicio cuidado hasta el más mínimo detalle es posible gracias a los partners alineados con sus valores de marca de inclusividad, sostenibilidad y apoyo local.', 'address': {'@type': 'PostalAddress', 'addressLocality': 'Barcelona, Spain', 'addressCountry': 'Spain', 'postalCode': '08021', 'streetAddress': 'Avinguda Diagonal, 606'}, 'telephone': '', 'geo': {'@type': 'GeoCoordinates', 'latitude': '41.3928355', 'longitude': '2.1428953'}, 'priceRange': '-', 'image': 'https://storage.googleapis.com/download/storage/v1/b/usc-pro-uscweb-live-media/o/de-live%2Foriginal_1024x576_plantilla%20modif3_1636972556158507_admin.png?generation=1636972556259101&amp;alt=media'}",41.3928355,2.1428953,"Lapso es un nuevo studio de fitness en Barcelona especializado en una modalidad de deporte que ya es tendencia en el mundo entero: Indoor cycling. Hasta aquí, bien. Pero hay algo más: se practica de forma instintiva y casi sin pensar. No siempre el deporte es sacrificio, y menos si le damos la vuelta y convertimos la energía en diversión. Otros: en Lapso cuentan con toallas, ducha (con amenities), restauración de la mano de Enlagloria Salad House, y venta de ropa de deporte de la mano de marcas como Girlfriend collective. Este servicio cuidado hasta el más mínimo detalle es posible gracias a los partners alineados con sus valores de marca de inclusividad, sostenibilidad y apoyo local."
La Huella Workout Club Provenza CrossFit®,['Crosstraining'],False,"['S', 'M', 'L', 'XL']",S,L'Antiga Esquerra de l'Eixample,"Carrer de Provença, 126",https://urbansportsclub.com//en/venues/la-huella-workout-club-barcelona-crossfit,"{'@context': 'http://schema.org', '@type': 'LocalBusiness', 'name': 'La Huella Workout Club Provenza CrossFit®', 'description': 'El Club más underground de Barna El Box que cambió las reglas del Crossfit Entrenamiento grupal y personalizado STAY GARAGE', 'address': {'@type': 'PostalAddress', 'addressLocality': 'Barcelona, Spain', 'addressCountry': 'Spain', 'postalCode': '08029', 'streetAddress': 'Carrer de Provença, 126'}, 'telephone': '', 'geo': {'@type': 'GeoCoordinates', 'latitude': '41.3860671', 'longitude': '2.150281'}, 'priceRange': '-', 'image': 'https://storage.googleapis.com/download/storage/v1/b/usc-pro-uscweb-live-media/o/de-live%2Foriginal_1024x576_F04_NIKE_La%20Huella_0603_1635851807273210_admin.jpg?generation=1635851807364737&amp;alt=media'}",41.3860671,2.150281,El Club más underground de Barna El Box que cambió las reglas del Crossfit Entrenamiento grupal y personalizado STAY GARAGE
Fabrik Training Club,"['Crosstraining', 'Fitness', 'Functional Training', 'Hyrox', 'Yoga']",False,"['M', 'L', 'XL']",M,Dreta de l'Eixample,Calle Mallorca 337,https://urbansportsclub.com//en/venues/fabrik-boxtraining,"{'@context': 'http://schema.org', '@type': 'LocalBusiness', 'name': 'Fabrik Training Club', 'description': 'Centro de crosstraining, hyrox, strength &amp; conditioning, 400m2, disponemos de vestuarios y duchas, fuente de agua.', 'address': {'@type': 'PostalAddress', 'addressLocality': 'Barcelona, Spain', 'addressCountry': 'Spain', 'postalCode': '08037', 'streetAddress': 'Calle Mallorca 337'}, 'telephone': '+44 658091764', 'geo': {'@type': 'GeoCoordinates', 'latitude': '41.3998752', 'longitude': '2.1701805'}, 'priceRange': '-', 'image': 'https://storage.googleapis.com/download/storage/v1/b/usc-pro-uscweb-live-media/o/de-live%2Foriginal_3024x1701_2_1717489850262728_admin.jpg?generation=1717489850359039&amp;alt=media'}",41.3998752,2.1701805,"Centro de crosstraining, hyrox, strength &amp; conditioning, 400m2, disponemos de vestuarios y duchas, fuente de agua."
Group Training BCN,"['Fitness', 'Functional Training']",False,"['S', 'M', 'L', 'XL']",S,Sant Martí de Provençals,"C/ d'Aragó, 656",https://urbansportsclub.com//en/venues/group-training-bcn,"{'@context': 'http://schema.org', '@type': 'LocalBusiness', 'name': 'Group Training BCN', 'description': 'En group training contamos con el material, la experiencia y el método perfecto para ayudarte a conseguir ese reto que siempre has querido de una forma especifica y personalizada.', 'address': {'@type': 'PostalAddress', 'addressLocality': 'Barcelona, Spain', 'addressCountry': 'Spain', 'postalCode': '08018', 'streetAddress': 'C/ d&#039;Aragó, 656'}, 'telephone': '', 'geo': {'@type': 'GeoCoordinates', 'latitude': '41.4123654', 'longitude': '2.1925303'}, 'priceRange': '-', 'image': 'https://urbansportsclub.com/images/merchant/venueHome.jpg'}",41.4123654,2.1925303,"En group training contamos con el material, la experiencia y el método perfecto para ayudarte a conseguir ese reto que siempre has querido de una forma especifica y personalizada."
Tatiane Canario,"['Pilates', 'Pilates Reformer']",True,"['L', 'XL']",L,Sant Gervasi-Galvany,"Carrer de Neptú, 27",https://urbansportsclub.com//en/venues/tatiane-canario,"{'@context': 'http://schema.org', '@type': 'LocalBusiness', 'name': 'Tatiane Canario', 'description': 'Estudio exclusivo en la zona alta de Barcelona que ofrece clases muy personalizadas o bien a nivel particular o bien con grupos reducidos con máquinas reformers de la mayor calidad.', 'address': {'@type': 'PostalAddress', 'addressLocality': 'Barcelona, Spain', 'addressCountry': 'Spain', 'postalCode': '08006', 'streetAddress': 'Carrer de Neptú, 27'}, 'telephone': '+34 665 52 69 34', 'geo': {'@type': 'GeoCoordinates', 'latitude': '41.3980378', 'longitude': '2.1543658'}, 'priceRange': '-', 'image': 'https://storage.googleapis.com/download/storage/v1/b/usc-pro-uscweb-live-media/o/de-live%2Foriginal_1280x720__MG_4655_1555485147182253_admin.jpeg?alt=media'}",41.3980378,2.1543658,Estudio exclusivo en la zona alta de Barcelona que ofrece clases muy personalizadas o bien a nivel particular o bien con grupos reducidos con máquinas reformers de la mayor calidad.
The Warriors Martial Arts Club,"['Boxing Sports', 'Mixed Martial Arts', 'Traditional Asian Martial Arts']",False,"['S', 'M', 'L', 'XL']",S,Hospitalet,Carrer del Doctor Martí Julià 58,https://urbansportsclub.com//en/venues/the-warriors-martial-arts-club,"{'@context': 'http://schema.org', '@type': 'LocalBusiness', 'name': 'The Warriors Martial Arts Club', 'description': 'Club de artes marciales y entrenamiento físico, así como de deportes de contacto. Familiar y cercano, más que un gimnasio, una familia. Trato personalizado y atento. *** MEDIDAS SANITARIAS *** - Se bede acceder con calzado limpio diferente al usado por la calle - Limpiado de manos antes de entrar - Uso de mascarilla obligatoria en todo momento - Se debe traer 2 toallas (una para la clase y otra para ducharse si lo necesitan).', 'address': {'@type': 'PostalAddress', 'addressLocality': 'Barcelona, Spain', 'addressCountry': 'Spain', 'postalCode': '08903', 'streetAddress': 'Carrer del Doctor Martí Julià 58'}, 'telephone': '+49 6574 73169', 'geo': {'@type': 'GeoCoordinates', 'latitude': '41.3736864', 'longitude': '2.1221556'}, 'priceRange': '-', 'image': 'https://storage.googleapis.com/download/storage/v1/b/usc-pro-uscweb-live-media/o/de-live%2Foriginal_640x360_nmfxyldp9a11uckpsois_1672909960115831.png?generation=1672909960159872&amp;alt=media'}",41.3736864,2.1221556,"Club de artes marciales y entrenamiento físico, así como de deportes de contacto. Familiar y cercano, más que un gimnasio, una familia. Trato personalizado y atento. *** MEDIDAS SANITARIAS *** - Se bede acceder con calzado limpio diferente al usado por la calle - Limpiado de manos antes de entrar - Uso de mascarilla obligatoria en todo momento - Se debe traer 2 toallas (una para la clase y otra para ducharse si lo necesitan)."
Global Experience & Sport Club,"['Boxing Sports', 'Crosstraining', 'Fitness', 'Pilates', 'Yoga']",False,"['M', 'L', 'XL']",M,Barberà del Vallés,"Carrer de Nàpols, 1",https://urbansportsclub.com//en/venues/global-experience-sport-club,"{'@context': 'http://schema.org', '@type': 'LocalBusiness', 'name': 'Global Experience &amp; Sport Club', 'description': 'Descubre todas las instalaciones del centro Global Experience &amp; Sport Club, situado en Barberà del Vallès. Accede a sus servicios al mejor precio con Urban Sports. Aprovecha nuestra oferta para hacer Fitness, Crossfit, Funcional, Escalada, Zumba, Pilates, Yoga, Wellness, entre otras de las increíbles actividades que te propone el centro Global Experience &amp; Sport Club. Global Experience &amp; Sports Club refleja el espíritu de sus fundadores &quot;Una mente sonora es un cuerpo en movimiento&quot;. Queremos ofrecer un espacio en el que todo el mundo se sienta motivado para realizar todo tipo de actividades, independientemente de la edad, el nivel, el género...donde puedas encontrar un club deportivo, familiar, social y disfrutar de la mejor atención del personal, en unas instalaciones cuidadas hasta el último detalle y con la última tecnología en maquinaria y software de gestión deportiva.', 'address': {'@type': 'PostalAddress', 'addressLocality': 'Barcelona, Spain', 'addressCountry': 'Spain', 'postalCode': '08210', 'streetAddress': 'Carrer de Nàpols, 1'}, 'telephone': '', 'geo': {'@type': 'GeoCoordinates', 'latitude': '41.5220298', 'longitude': '2.1158454'}, 'priceRange': '-', 'image': 'https://storage.googleapis.com/download/storage/v1/b/usc-pro-uscweb-live-media/o/de-live%2Foriginal_1090x613_IMG_0480_1584002760394767_admin.jpg?alt=media'}",41.5220298,2.1158454,"Descubre todas las instalaciones del centro Global Experience &amp; Sport Club, situado en Barberà del Vallès. Accede a sus servicios al mejor precio con Urban Sports. Aprovecha nuestra oferta para hacer Fitness, Crossfit, Funcional, Escalada, Zumba, Pilates, Yoga, Wellness, entre otras de las increíbles actividades que te propone el centro Global Experience &amp; Sport Club. Global Experience &amp; Sports Club refleja el espíritu de sus fundadores &quot;Una mente sonora es un cuerpo en movimiento&quot;. Queremos ofrecer un espacio en el que todo el mundo se sienta motivado para realizar todo tipo de actividades, independientemente de la edad, el nivel, el género...donde puedas encontrar un club deportivo, familiar, social y disfrutar de la mejor atención del personal, en unas instalaciones cuidadas hasta el último detalle y con la última tecnología en maquinaria y software de gestión deportiva."
Nestra Center,"['Barre', 'Dance', 'Fitness', 'Meditation', 'Mixed Martial Arts', 'Yoga']",False,"['M', 'L', 'XL']",M,Barri Gòtic,"Carrer del Paradís, 5",https://urbansportsclub.com//en/venues/nestra-center,"{'@context': 'http://schema.org', '@type': 'LocalBusiness', 'name': 'Nestra Center', 'description': 'Nestra is a community centre for expression and reflection, for practices such as yoga, dancing and art. While the modern world more often transforms such practices into a pursuit of individual efficiency, they strive to reconnect to the base of it, aiming to cultivate a heightened consciousness, nurture self and social responsibility, creativity and joy. At Nestra, they believe that growth, healing and self-realization are rights for all, not privileges for a few, which is reflected in collaboration with NGOs and their commitment to social inclusivity. Their mission is to create a space where everyone, regardless of their background or abilities, finds a practice that resonates with them, makes them meet themselves and others, be creative and simply just be.', 'address': {'@type': 'PostalAddress', 'addressLocality': 'Barcelona, Spain', 'addressCountry': 'Spain', 'postalCode': '08002', 'streetAddress': 'Carrer del Paradís, 5'}, 'telephone': '', 'geo': {'@type': 'GeoCoordinates', 'latitude': '41.3833281', 'longitude': '2.1770864'}, 'priceRange': '-', 'image': 'https://storage.googleapis.com/download/storage/v1/b/usc-pro-uscweb-live-media/o/de-live%2Foriginal_1080x608_Copy%20of%20Weekly%20Schedule%20Post_1702589197288723_admin.png?generation=1702589197363115&amp;alt=media'}",41.3833281,2.1770864,"Nestra is a community centre for expression and reflection, for practices such as yoga, dancing and art. While the modern world more often transforms such practices into a pursuit of individual efficiency, they strive to reconnect to the base of it, aiming to cultivate a heightened consciousness, nurture self and social responsibility, creativity and joy. At Nestra, they believe that growth, healing and self-realization are rights for all, not privileges for a few, which is reflected in collaboration with NGOs and their commitment to social inclusivity. Their mission is to create a space where everyone, regardless of their background or abilities, finds a practice that resonates with them, makes them meet themselves and others, be creative and simply just be."
