name,disciplines,plus_options,plans,min_plan,district,street,link,metadata,latitude,longitude,description
Kältekammer Magdeburg,['Cryotherapy'],True,"['L', 'XL']",L,Altstadt,Otto von Guericke Straße 51,https://urbansportsclub.com//en/venues/kaltekammer-meri-sauna-magdeburg,"{'@context': 'http://schema.org', '@type': 'LocalBusiness', 'name': 'Kältekammer Magdeburg', 'description': 'Kalt, kälter. Kältekammer! Eine Behandlung der ganz besonderen Art bietet Ihnen ein Besuch unserer neuen Kältekammer. Die individuelle Ganzköperkältetherapie ist eine Reizbehandlung die mittlerweile nicht nur bei Rheumaerkrankungen und chronischen Schmerzen Anwendung findet. Mit dieser Behandlungsweise lassen sich Leiden und Beschweren wie zum Beispiel Multiple Sklerose, Neurodermitis, Muskel- und Gelenkerkrankungen, Depressionen, Angstzustände und Schlafstörungen lindern. Eine entzündungshemmende Wirkung sowie eine Beschleunigung des Heilprozesses wurden ebenfalls durch verschiedene Ärzte und Studien bewiesen.', 'address': {'@type': 'PostalAddress', 'addressLocality': 'Magdeburg, Germany', 'addressCountry': 'Germany', 'postalCode': '39104', 'streetAddress': 'Otto von Guericke Straße 51'}, 'telephone': '', 'geo': {'@type': 'GeoCoordinates', 'latitude': '52.1218487', 'longitude': '11.6269326'}, 'priceRange': '-', 'image': 'https://storage.googleapis.com/download/storage/v1/b/usc-pro-uscweb-live-media/o/de-live%2Foriginal_1200x675_addb45f2ec76-mecotec_03_160041914037280_admin.jpg?alt=media'}",52.1218487,11.6269326,"Kalt, kälter. Kältekammer! Eine Behandlung der ganz besonderen Art bietet Ihnen ein Besuch unserer neuen Kältekammer. Die individuelle Ganzköperkältetherapie ist eine Reizbehandlung die mittlerweile nicht nur bei Rheumaerkrankungen und chronischen Schmerzen Anwendung findet. Mit dieser Behandlungsweise lassen sich Leiden und Beschweren wie zum Beispiel Multiple Sklerose, Neurodermitis, Muskel- und Gelenkerkrankungen, Depressionen, Angstzustände und Schlafstörungen lindern. Eine entzündungshemmende Wirkung sowie eine Beschleunigung des Heilprozesses wurden ebenfalls durch verschiedene Ärzte und Studien bewiesen."
LuckyFitness.de Magdeburg,['Fitness'],False,"['M', 'L', 'XL']",M,Sudenburg,Salzmannstraße 23,https://urbansportsclub.com//en/venues/luckyfitnessde-magdeburg,"{'@context': 'http://schema.org', '@type': 'LocalBusiness', 'name': 'LuckyFitness.de Magdeburg', 'description': 'Willkommen bei LuckyFitness.de! Wir sind ein Anbieter von besonderen Premium Fitnessstudios, die sich ganz individuell nach deinen persönlichen Bedürfnissen richten. Neben unseren Filialen in Dessau und Magdeburg kannst du unsere Studios auch in Haldensleben, Roßlau und Schönebeck finden. Unsere freundlichen, kompetenten Trainer geben ihr Bestes, um dich mit viel Spaß im Training deinen persönlichen Zielen näher zu bringen. Sie schaffen so eine professionelle Atmosphäre, in der du dich wohl fühlst und gerne regelmäßig zum Training kommst, schließlich ist regelmäßiges Training der Schlüssel zum Erfolg! Ein Premium Fitnessstudio, ganz nach deinem Geschmack', 'address': {'@type': 'PostalAddress', 'addressLocality': 'Magdeburg, Germany', 'addressCountry': 'Germany', 'postalCode': '39112', 'streetAddress': 'Salzmannstraße 23'}, 'telephone': '', 'geo': {'@type': 'GeoCoordinates', 'latitude': '52.10728', 'longitude': '11.60366'}, 'priceRange': '-', 'image': 'https://storage.googleapis.com/download/storage/v1/b/usc-pro-uscweb-live-media/o/de-live%2Foriginal_1024x576_3bb7fa87f0aa-IMG_8549_1554103900283750_admin.jpg?alt=media'}",52.10728,11.60366,"Willkommen bei LuckyFitness.de! Wir sind ein Anbieter von besonderen Premium Fitnessstudios, die sich ganz individuell nach deinen persönlichen Bedürfnissen richten. Neben unseren Filialen in Dessau und Magdeburg kannst du unsere Studios auch in Haldensleben, Roßlau und Schönebeck finden. Unsere freundlichen, kompetenten Trainer geben ihr Bestes, um dich mit viel Spaß im Training deinen persönlichen Zielen näher zu bringen. Sie schaffen so eine professionelle Atmosphäre, in der du dich wohl fühlst und gerne regelmäßig zum Training kommst, schließlich ist regelmäßiges Training der Schlüssel zum Erfolg! Ein Premium Fitnessstudio, ganz nach deinem Geschmack"
Fitnesspark Aschersleben,"['Fitness', 'Functional Training', 'Indoor Cycling', 'Modern Self Defense', 'Yoga']",False,"['M', 'L', 'XL']",M,Aschersleben,Am Spittelsberg 6,https://urbansportsclub.com//en/venues/fitnesspark-aschersleben,"{'@context': 'http://schema.org', '@type': 'LocalBusiness', 'name': 'Fitnesspark Aschersleben', 'description': 'Unser Partner Fitnesspark Aschersleben/Hettstedt freut sich auf Dich!', 'address': {'@type': 'PostalAddress', 'addressLocality': 'Magdeburg, Germany', 'addressCountry': 'Germany', 'postalCode': '06449', 'streetAddress': 'Am Spittelsberg 6'}, 'telephone': '', 'geo': {'@type': 'GeoCoordinates', 'latitude': '51.7548431', 'longitude': '11.4339803'}, 'priceRange': '-', 'image': 'https://storage.googleapis.com/download/storage/v1/b/usc-pro-uscweb-live-media/o/de-live%2Foriginal_1686x948_fitnesscompressed_1552576403769547_admin.jpg?alt=media'}",51.7548431,11.4339803,Unser Partner Fitnesspark Aschersleben/Hettstedt freut sich auf Dich!
Naherholungszentrum Barleber See,['Swimming'],False,"['S', 'M', 'L', 'XL']",S,Barleber See,Buschweg,https://urbansportsclub.com//en/venues/naherholungszentrum-barleber-see,"{'@context': 'http://schema.org', '@type': 'LocalBusiness', 'name': 'Naherholungszentrum Barleber See', 'description': 'Über den Urban Sports Club kannst du in Magdeburg in den Bädern schwimmen gehen. In der Sommersaison können zudem auch die Freibäder besucht werden. Bitte achte auf die jeweiligen Besonderheiten rechts beim Besuch des jeweiligen Bades. Viel sonniges und nasses Vergnügen in den Bädern von Magdeburg!', 'address': {'@type': 'PostalAddress', 'addressLocality': 'Magdeburg, Germany', 'addressCountry': 'Germany', 'postalCode': '39126', 'streetAddress': 'Buschweg'}, 'telephone': '', 'geo': {'@type': 'GeoCoordinates', 'latitude': '52.215925', 'longitude': '11.656053'}, 'priceRange': '-', 'image': 'https://storage.googleapis.com/download/storage/v1/b/usc-pro-uscweb-live-media/o/de-live%2Foriginal_1024x576_b002-a-IMG_6997-Strandbereich-Nordost.jpg?alt=media'}",52.215925,11.656053,Über den Urban Sports Club kannst du in Magdeburg in den Bädern schwimmen gehen. In der Sommersaison können zudem auch die Freibäder besucht werden. Bitte achte auf die jeweiligen Besonderheiten rechts beim Besuch des jeweiligen Bades. Viel sonniges und nasses Vergnügen in den Bädern von Magdeburg!
clever fit Dessau-Rosslau,['Fitness'],False,"['M', 'L', 'XL']",M,Dessau,Kurt-Weil-Straße 38-41,https://urbansportsclub.com//en/venues/clever-fit-dessau-rosslau,"{'@context': 'http://schema.org', '@type': 'LocalBusiness', 'name': 'clever fit Dessau-Rosslau', 'description': 'Dein clever fit Studio ist mehr als nur ein Ort für Fitness und Muskelaufbau. Es ist der Treffpunkt deiner Community: Deine Ziele steckst du dir, du entscheidest, warum du noch gesünder, fitter, einfach noch besser werden willst. Auf deine Power sind wir vorbereitet und freuen uns dir in unseren Studios, moderne Geräte für ein All-Round Workout, Functional-Areas zum Auspowern, digitalisierten Features, Kursen und Aktionen mit genug Raum zur Erholung zur Seite zu stehen. clever fit steht für starke Leistungen. Du kannst in unseren Studios zahlreiche Wellness-Extras, top Geräte, ausgezeichnete Trainer und ein gepflegtes Ambiente erwarten. Denn einwandfreie Umkleiden, saubere Duschen und picobello Trainingsflächen sind für uns selbstverständlich. Schließlich möchten wir, dass du uns gerne und regelmäßig besuchst. Apropos, ein weiterer Pluspunkt: clever fit macht dich zeitlich flexibel. Unsere Öffnungszeiten passen in jeden Alltag. Von morgens bis nachts.', 'address': {'@type': 'PostalAddress', 'addressLocality': 'Magdeburg, Germany', 'addressCountry': 'Germany', 'postalCode': '06844', 'streetAddress': 'Kurt-Weil-Straße 38-41'}, 'telephone': '', 'geo': {'@type': 'GeoCoordinates', 'latitude': '51.8414027', 'longitude': '12.2455498'}, 'priceRange': '-', 'image': 'https://storage.googleapis.com/download/storage/v1/b/usc-pro-uscweb-live-media/o/de-live%2Foriginal_1303x733_Prenzlauer%20Berg_1632486481298192_admin.png?generation=1632486481392653&amp;alt=media'}",51.8414027,12.2455498,"Dein clever fit Studio ist mehr als nur ein Ort für Fitness und Muskelaufbau. Es ist der Treffpunkt deiner Community: Deine Ziele steckst du dir, du entscheidest, warum du noch gesünder, fitter, einfach noch besser werden willst. Auf deine Power sind wir vorbereitet und freuen uns dir in unseren Studios, moderne Geräte für ein All-Round Workout, Functional-Areas zum Auspowern, digitalisierten Features, Kursen und Aktionen mit genug Raum zur Erholung zur Seite zu stehen. clever fit steht für starke Leistungen. Du kannst in unseren Studios zahlreiche Wellness-Extras, top Geräte, ausgezeichnete Trainer und ein gepflegtes Ambiente erwarten. Denn einwandfreie Umkleiden, saubere Duschen und picobello Trainingsflächen sind für uns selbstverständlich. Schließlich möchten wir, dass du uns gerne und regelmäßig besuchst. Apropos, ein weiterer Pluspunkt: clever fit macht dich zeitlich flexibel. Unsere Öffnungszeiten passen in jeden Alltag. Von morgens bis nachts."
Fitness First Wernigerode,"['Fitness', 'Functional Training', 'Yoga']",False,"['M', 'L', 'XL']",M,Aschersleben,Dornbergsweg 28,https://urbansportsclub.com//en/venues/fitnessloft-wernigerode,"{'@context': 'http://schema.org', '@type': 'LocalBusiness', 'name': 'Fitness First Wernigerode', 'description': 'FITNESSLOFT FITNESS NEU ERLEBEN. „Fitness neu erleben“ – hier stehst Du im Mittelpunkt. Seit der Gründung 2009 breitet sich das FitnessLOFT mit seinem individuellen Lifestyle-Entwurf stetig weiter aus. Wir beweisen, was andere nur versprechen: Im LOFT erreichst Du Deine Ziele – ohne Kompromiss! Wie das geht? Qualitative Ausstattung und loftiges Ambiente schaffen einen Wohlfühlort, den Du am liebsten gar nicht mehr verlassen möchtest. Moderne Geräte, fundierte Trainingsmethoden und eigens ausgebildete Trainer sind dem FitnessLOFT wichtig. Dank Kraft- und Cardiogeräten, dem populären TRX- und Vibrationstraining sowie dem modernen, chipgesteuerten milon Zirkel können Mitglieder sich in die Form ihres Lebens trainieren. Deine Workout-Buddys dürfen nicht fehlen? Bei dem im Monat 200 Kurse umfassenden Kursprogramm bleibt kein T-Shirt trocken – zusammen schafft ihr alles! Von Zumba® über Langhantelkurse bis hin zu Pilates kann sich ordentlich ausgepowert werden - und das zu einem fairen Preis-Leistungsverhältnis. Du willst Teil der Fitnessloft-Community werden? Dann verschaffe Dir einen eigenen Eindruck und besuche uns. Das FitnessLOFT-Team freut sich auf Dich.', 'address': {'@type': 'PostalAddress', 'addressLocality': 'Magdeburg, Germany', 'addressCountry': 'Germany', 'postalCode': '38855', 'streetAddress': 'Dornbergsweg 28'}, 'telephone': '', 'geo': {'@type': 'GeoCoordinates', 'latitude': '51.8475241', 'longitude': '10.7856023'}, 'priceRange': '-', 'image': 'https://storage.googleapis.com/download/storage/v1/b/usc-pro-uscweb-live-media/o/de-live%2Foriginal_640x360_fnrg67acrffm1qrtkmji_1699345809980495.png?generation=1699345810066393&amp;alt=media'}",51.8475241,10.7856023,"FITNESSLOFT FITNESS NEU ERLEBEN. „Fitness neu erleben“ – hier stehst Du im Mittelpunkt. Seit der Gründung 2009 breitet sich das FitnessLOFT mit seinem individuellen Lifestyle-Entwurf stetig weiter aus. Wir beweisen, was andere nur versprechen: Im LOFT erreichst Du Deine Ziele – ohne Kompromiss! Wie das geht? Qualitative Ausstattung und loftiges Ambiente schaffen einen Wohlfühlort, den Du am liebsten gar nicht mehr verlassen möchtest. Moderne Geräte, fundierte Trainingsmethoden und eigens ausgebildete Trainer sind dem FitnessLOFT wichtig. Dank Kraft- und Cardiogeräten, dem populären TRX- und Vibrationstraining sowie dem modernen, chipgesteuerten milon Zirkel können Mitglieder sich in die Form ihres Lebens trainieren. Deine Workout-Buddys dürfen nicht fehlen? Bei dem im Monat 200 Kurse umfassenden Kursprogramm bleibt kein T-Shirt trocken – zusammen schafft ihr alles! Von Zumba® über Langhantelkurse bis hin zu Pilates kann sich ordentlich ausgepowert werden - und das zu einem fairen Preis-Leistungsverhältnis. Du willst Teil der Fitnessloft-Community werden? Dann verschaffe Dir einen eigenen Eindruck und besuche uns. Das FitnessLOFT-Team freut sich auf Dich."
Sports Factory,"['Dance', 'Fitness', 'Functional Training', 'Indoor Cycling', 'Meditation', 'Modern Self Defense', 'Qi Gong and Tai Chi', 'Trampoline']",False,"['S', 'M', 'L', 'XL']",S,Neustädter Feld,Milchweg 1,https://urbansportsclub.com//en/venues/sports-factory,"{'@context': 'http://schema.org', '@type': 'LocalBusiness', 'name': 'Sports Factory', 'description': 'Sport Factory bietet jede Menge Geräte an denen du dein Fitness-Level kontinuierlich verbessern kannst oder probiere einen Ihrer zahlreichen Kurse wie zum Beispiel Jumping aus. Entspanne beim Saunieren im Wellnessbereich! Das Studio liegt an der Kreuzung Milchweg und Burgstaller Weg nahe den Haltestellen Danziger Dorf und Milchweg im Süden von Magdeburg (in der neuen Neustadt)', 'address': {'@type': 'PostalAddress', 'addressLocality': 'Magdeburg, Germany', 'addressCountry': 'Germany', 'postalCode': '39128', 'streetAddress': 'Milchweg 1'}, 'telephone': '', 'geo': {'@type': 'GeoCoordinates', 'latitude': '52.1623293', 'longitude': '11.6202883'}, 'priceRange': '-', 'image': 'https://storage.googleapis.com/download/storage/v1/b/usc-pro-uscweb-live-media/o/de-live%2Foriginal_1024x576_2015-04-24_14_23_30_logo2.png?alt=media'}",52.1623293,11.6202883,Sport Factory bietet jede Menge Geräte an denen du dein Fitness-Level kontinuierlich verbessern kannst oder probiere einen Ihrer zahlreichen Kurse wie zum Beispiel Jumping aus. Entspanne beim Saunieren im Wellnessbereich! Das Studio liegt an der Kreuzung Milchweg und Burgstaller Weg nahe den Haltestellen Danziger Dorf und Milchweg im Süden von Magdeburg (in der neuen Neustadt)
EASYFITNESS Halberstadt,['Fitness'],False,"['M', 'L', 'XL']",M,Halberstadt,Große Ringstraße 50-51,https://urbansportsclub.com//en/venues/easyfitness-halberstadt,"{'@context': 'http://schema.org', '@type': 'LocalBusiness', 'name': 'EASYFITNESS Halberstadt', 'description': 'KOMM REIN. SEI DU SELBST. MACH DEIN DING. Fitness und aktives Gesundheitstraining gehören heute zum Lifestyle. Es geht mittlerweile um mehr als nur um fit werden und Sport in einem Fitnessstudio. Es geht um die Gemeinschaft und um das persönliche Wachstum &amp; die Selbstverwirklichung, um das Erleben der und des Raumes – eben um einen ganz eigenen Lifestyle. Lifestyle and Sport ist das Leitmotiv der Philosophie von EASYFITNESS. Wir stehen dafür, Euch die Inspiration für einen aktiven Alltag zu bieten, Freunde zu treffen und neue Kontakte zu knüpfen. Das Erfolgsrezept dahinter ist denkbar einfach: Sportliche Aktivitäten sollen zu einem festen Lebensbestandteil werden und für jeden zugänglich sein, unabhängig vom Alter, der bisherigen Fitness oder dem Gesundheitszustand. Mit einem attraktiven Beitrag und einer hochwertigen Studioausstattung spricht EASYFITNESS all jene an, die preisbewusst sind, einen hohen Anspruch an das Geräteangebot und Ihr Training stellen und keine Abstriche beim Ambiente des Clubs machen. Die EASYFITNESS-Philosophie „lifestyle and sport“ inspiriert die Mitglieder zu einem aktiven und engagierten Leben. Der Fitness- und Gesundheitssport bei EASYFITNESS soll so einfach und locker sein, dass ihn jeder Mensch in möglichst kurzer Zeit ausüben kann.', 'address': {'@type': 'PostalAddress', 'addressLocality': 'Magdeburg, Germany', 'addressCountry': 'Germany', 'postalCode': '38820', 'streetAddress': 'Große Ringstraße 50-51'}, 'telephone': '', 'geo': {'@type': 'GeoCoordinates', 'latitude': '51.896229', 'longitude': '11.0766298'}, 'priceRange': '-', 'image': 'https://storage.googleapis.com/download/storage/v1/b/usc-pro-uscweb-live-media/o/de-live%2Foriginal_1024x576_1_163552131385747_admin.jpg?generation=1635521313168837&amp;alt=media'}",51.896229,11.0766298,"KOMM REIN. SEI DU SELBST. MACH DEIN DING. Fitness und aktives Gesundheitstraining gehören heute zum Lifestyle. Es geht mittlerweile um mehr als nur um fit werden und Sport in einem Fitnessstudio. Es geht um die Gemeinschaft und um das persönliche Wachstum &amp; die Selbstverwirklichung, um das Erleben der und des Raumes – eben um einen ganz eigenen Lifestyle. Lifestyle and Sport ist das Leitmotiv der Philosophie von EASYFITNESS. Wir stehen dafür, Euch die Inspiration für einen aktiven Alltag zu bieten, Freunde zu treffen und neue Kontakte zu knüpfen. Das Erfolgsrezept dahinter ist denkbar einfach: Sportliche Aktivitäten sollen zu einem festen Lebensbestandteil werden und für jeden zugänglich sein, unabhängig vom Alter, der bisherigen Fitness oder dem Gesundheitszustand. Mit einem attraktiven Beitrag und einer hochwertigen Studioausstattung spricht EASYFITNESS all jene an, die preisbewusst sind, einen hohen Anspruch an das Geräteangebot und Ihr Training stellen und keine Abstriche beim Ambiente des Clubs machen. Die EASYFITNESS-Philosophie „lifestyle and sport“ inspiriert die Mitglieder zu einem aktiven und engagierten Leben. Der Fitness- und Gesundheitssport bei EASYFITNESS soll so einfach und locker sein, dass ihn jeder Mensch in möglichst kurzer Zeit ausüben kann."
Erich-Radermacher-Bad,['Swimming'],False,"['S', 'M', 'L', 'XL']",S,Neu Olvenstedt,Johannes-Göderitz-Straße 113,https://urbansportsclub.com//en/venues/erich-radermacher-bad,"{'@context': 'http://schema.org', '@type': 'LocalBusiness', 'name': 'Erich-Radermacher-Bad', 'description': 'Über den Urban Sports Club kannst du in Magdeburg in den Bädern schwimmen gehen. In der Sommersaison können zudem auch die Freibäder besucht werden. Bitte achte auf die jeweiligen Besonderheiten rechts beim Besuch des jeweiligen Bades. Viel sonniges und nasses Vergnügen in den Bädern von Magdeburg!', 'address': {'@type': 'PostalAddress', 'addressLocality': 'Magdeburg, Germany', 'addressCountry': 'Germany', 'postalCode': '39130', 'streetAddress': 'Johannes-Göderitz-Straße 113'}, 'telephone': '', 'geo': {'@type': 'GeoCoordinates', 'latitude': '52.153418', 'longitude': '11.595973'}, 'priceRange': '-', 'image': 'https://storage.googleapis.com/download/storage/v1/b/usc-pro-uscweb-live-media/o/de-live%2Foriginal_2048x1152_P7141172_7SAQL.jpg?alt=media'}",52.153418,11.595973,Über den Urban Sports Club kannst du in Magdeburg in den Bädern schwimmen gehen. In der Sommersaison können zudem auch die Freibäder besucht werden. Bitte achte auf die jeweiligen Besonderheiten rechts beim Besuch des jeweiligen Bades. Viel sonniges und nasses Vergnügen in den Bädern von Magdeburg!
LuckyFitness.de Dessau,['Fitness'],False,"['M', 'L', 'XL']",M,Dessau,Kreuzbergstraße 35a,https://urbansportsclub.com//en/venues/luckyfitnessde-dessau,"{'@context': 'http://schema.org', '@type': 'LocalBusiness', 'name': 'LuckyFitness.de Dessau', 'description': 'Willkommen bei LuckyFitness.de! Wir sind ein Anbieter von besonderen Premium Fitnessstudios, die sich ganz individuell nach deinen persönlichen Bedürfnissen richten. Neben unseren Filialen in Dessau und Magdeburg kannst du unsere Studios auch in Haldensleben, Roßlau und Schönebeck finden. Unsere freundlichen, kompetenten Trainer geben ihr Bestes, um dich mit viel Spaß im Training deinen persönlichen Zielen näher zu bringen. Sie schaffen so eine professionelle Atmosphäre, in der du dich wohl fühlst und gerne regelmäßig zum Training kommst, schließlich ist regelmäßiges Training der Schlüssel zum Erfolg! Ein Premium Fitnessstudio, ganz nach deinem Geschmack', 'address': {'@type': 'PostalAddress', 'addressLocality': 'Magdeburg, Germany', 'addressCountry': 'Germany', 'postalCode': '06849', 'streetAddress': 'Kreuzbergstraße 35a'}, 'telephone': '', 'geo': {'@type': 'GeoCoordinates', 'latitude': '51.8012205', 'longitude': '12.2548873'}, 'priceRange': '-', 'image': 'https://storage.googleapis.com/download/storage/v1/b/usc-pro-uscweb-live-media/o/de-live%2Foriginal_1280x720_DSC_2931-HDR-Bearbeitet_1553778186739510_admin.jpeg?alt=media'}",51.8012205,12.2548873,"Willkommen bei LuckyFitness.de! Wir sind ein Anbieter von besonderen Premium Fitnessstudios, die sich ganz individuell nach deinen persönlichen Bedürfnissen richten. Neben unseren Filialen in Dessau und Magdeburg kannst du unsere Studios auch in Haldensleben, Roßlau und Schönebeck finden. Unsere freundlichen, kompetenten Trainer geben ihr Bestes, um dich mit viel Spaß im Training deinen persönlichen Zielen näher zu bringen. Sie schaffen so eine professionelle Atmosphäre, in der du dich wohl fühlst und gerne regelmäßig zum Training kommst, schließlich ist regelmäßiges Training der Schlüssel zum Erfolg! Ein Premium Fitnessstudio, ganz nach deinem Geschmack"
Schwimmhalle Große Diesdorfer Straße,['Swimming'],False,"['S', 'M', 'L', 'XL']",S,Stadtfeld West,Große Diesdorfer Straße 104a,https://urbansportsclub.com//en/venues/schwimmhalle-grosse-diesdorfer-strasse,"{'@context': 'http://schema.org', '@type': 'LocalBusiness', 'name': 'Schwimmhalle Große Diesdorfer Straße', 'description': 'Über den Urban Sports Club kannst du in Magdeburg in den Bädern schwimmen gehen. In der Sommersaison können zudem auch die Freibäder besucht werden. Bitte achte auf die jeweiligen Besonderheiten rechts beim Besuch des jeweiligen Bades. Viel sonniges und nasses Vergnügen in den Bädern von Magdeburg!', 'address': {'@type': 'PostalAddress', 'addressLocality': 'Magdeburg, Germany', 'addressCountry': 'Germany', 'postalCode': '39110', 'streetAddress': 'Große Diesdorfer Straße 104a'}, 'telephone': '', 'geo': {'@type': 'GeoCoordinates', 'latitude': '52.1289602', 'longitude': '11.5785599'}, 'priceRange': '-', 'image': 'https://storage.googleapis.com/download/storage/v1/b/usc-pro-uscweb-live-media/o/de-live%2Foriginal_1024x576_Au%C3%9Fenansicht%20S%C3%BCdwestseite.jpg?alt=media'}",52.1289602,11.5785599,Über den Urban Sports Club kannst du in Magdeburg in den Bädern schwimmen gehen. In der Sommersaison können zudem auch die Freibäder besucht werden. Bitte achte auf die jeweiligen Besonderheiten rechts beim Besuch des jeweiligen Bades. Viel sonniges und nasses Vergnügen in den Bädern von Magdeburg!
SFC - Squash und Fitness Center Magdeburg,"['Fitness', 'Indoor Cycling', 'Pilates', 'Squash', 'Yoga']",False,"['M', 'L', 'XL']",M,Fermersleben,Alt Fermersleben 2,https://urbansportsclub.com//en/venues/sfc-squash-und-fitness-center-magdeburg,"{'@context': 'http://schema.org', '@type': 'LocalBusiness', 'name': 'SFC - Squash und Fitness Center Magdeburg', 'description': 'Bei Ihnen geht es um Sie, Ihren Körper, und ihre Gesundheit! Ihre Gesunderhaltung &amp; Ihre Fitness gehören in qualifizierte Hände.Qualifizierte Mitarbeiter und erprobte Programme sind die Grundlage um Sie sicher zum Trainingserfolg zu führen. 87% aller Bundesbürger wünschen sich Gesundheit für sich und ihre Familien. Für 99% ist der Schlüssel zum Glück „Gesundheit und Wohlbefinden&quot;. Die gute Nachricht ist: dafür können Sie etwas tun. Mit Bewegung. Bewegung gehört zum Leben. Damit Sie vital bleiben und erfüllt leben können. Sie bieten ein Zuhause für Fitness und Gesunderhaltung. Erleben auch Sie die besondere SFC Atmosphäre, denn Fitness ist mehr als nur Bewegung. Das Ziel: dass auch Sie sagen können: „Ich fühl mich gut“.', 'address': {'@type': 'PostalAddress', 'addressLocality': 'Magdeburg, Germany', 'addressCountry': 'Germany', 'postalCode': '39122', 'streetAddress': 'Alt Fermersleben 2'}, 'telephone': '+49 391 4015461', 'geo': {'@type': 'GeoCoordinates', 'latitude': '52.0976265', 'longitude': '11.6488097'}, 'priceRange': '-', 'image': 'https://storage.googleapis.com/download/storage/v1/b/usc-pro-uscweb-live-media/o/de-live%2Foriginal_1209x680_89701-d-magdeburg-webdaten-slider-2000x680px-1.jpg?alt=media'}",52.0976265,11.6488097,"Bei Ihnen geht es um Sie, Ihren Körper, und ihre Gesundheit! Ihre Gesunderhaltung &amp; Ihre Fitness gehören in qualifizierte Hände.Qualifizierte Mitarbeiter und erprobte Programme sind die Grundlage um Sie sicher zum Trainingserfolg zu führen. 87% aller Bundesbürger wünschen sich Gesundheit für sich und ihre Familien. Für 99% ist der Schlüssel zum Glück „Gesundheit und Wohlbefinden&quot;. Die gute Nachricht ist: dafür können Sie etwas tun. Mit Bewegung. Bewegung gehört zum Leben. Damit Sie vital bleiben und erfüllt leben können. Sie bieten ein Zuhause für Fitness und Gesunderhaltung. Erleben auch Sie die besondere SFC Atmosphäre, denn Fitness ist mehr als nur Bewegung. Das Ziel: dass auch Sie sagen können: „Ich fühl mich gut“."
