name,disciplines,plus_options,plans,min_plan,district,street,link,metadata,latitude,longitude,description
Clever Fit Heidelberg,['Fitness'],False,"['Classic', 'Premium', 'Max']",Classic,Boxberg,Im Breitspiel 8,https://urbansportsclub.com//en/venues/clever-fit-heidelberg,"{'@context': 'http://schema.org', '@type': 'LocalBusiness', 'name': 'Clever Fit Heidelberg', 'description': 'Clever Fit Mannheim - Heidelberg freut sich auf deinen Besuch!', 'address': {'@type': 'PostalAddress', 'addressLocality': 'Heidelberg, Germany', 'addressCountry': 'Germany', 'postalCode': '69126', 'streetAddress': 'Im Breitspiel 8'}, 'telephone': '', 'geo': {'@type': 'GeoCoordinates', 'latitude': '49.363611', 'longitude': '8.6857645'}, 'priceRange': '-', 'image': 'https://storage.googleapis.com/download/storage/v1/b/usc-pro-uscweb-live-media/o/de-live%2Foriginal_1686x948_fitnesscompressed_1568192370382813_admin.jpg?alt=media'}",49.363611,8.6857645,Clever Fit Mannheim - Heidelberg freut sich auf deinen Besuch!
Hallenbad Köpfel,['Swimming'],False,"['Essential', 'Classic', 'Premium', 'Max']",Essential,Ziegelhausen,Stiftweg 32,https://urbansportsclub.com//en/venues/hallenbad-kopfel,"{'@context': 'http://schema.org', '@type': 'LocalBusiness', 'name': 'Hallenbad Köpfel', 'description': 'Raus aus dem Alltag – rein ins Vergnügen. In Heidelberg können Sie in fünf Schwimmbädern baden. Ob Sportbad mitten in der Stadt, Freibad mit großem Park und Breitwellenrutsche oder Hallenbad mit Sauna und Aquafitnesskursen – bei uns findet jeder sein persönliches Lieblingsbad. Übrigens: Alle unsere Bäder sind als nachhaltige Betriebe ausgezeichnet.', 'address': {'@type': 'PostalAddress', 'addressLocality': 'Heidelberg, Germany', 'addressCountry': 'Germany', 'postalCode': '69118', 'streetAddress': 'Stiftweg 32'}, 'telephone': '', 'geo': {'@type': 'GeoCoordinates', 'latitude': '49.4239128', 'longitude': '8.7425775'}, 'priceRange': '-', 'image': 'https://storage.googleapis.com/download/storage/v1/b/usc-pro-uscweb-live-media/o/de-live%2Foriginal_5760x3240_228f38e54c2c-Koepfel_Bad_IMG_7688_rgb_1664547984987091_admin.jpg?generation=1664547985099274&amp;alt=media'}",49.4239128,8.7425775,"Raus aus dem Alltag – rein ins Vergnügen. In Heidelberg können Sie in fünf Schwimmbädern baden. Ob Sportbad mitten in der Stadt, Freibad mit großem Park und Breitwellenrutsche oder Hallenbad mit Sauna und Aquafitnesskursen – bei uns findet jeder sein persönliches Lieblingsbad. Übrigens: Alle unsere Bäder sind als nachhaltige Betriebe ausgezeichnet."
SRH Campussports,"['Fitness', 'Swimming']",False,"['Essential', 'Classic', 'Premium', 'Max']",Essential,Wieblingen,Bonhoefferstraße 4/1,https://urbansportsclub.com//en/venues/srh-campussports,"{'@context': 'http://schema.org', '@type': 'LocalBusiness', 'name': 'SRH Campussports', 'description': 'SRH Campussports freut sich auf deinen Besuch!', 'address': {'@type': 'PostalAddress', 'addressLocality': 'Heidelberg, Germany', 'addressCountry': 'Germany', 'postalCode': '69123', 'streetAddress': 'Bonhoefferstraße 4/1'}, 'telephone': '', 'geo': {'@type': 'GeoCoordinates', 'latitude': '49.41289', 'longitude': '8.6523'}, 'priceRange': '-', 'image': 'https://storage.googleapis.com/download/storage/v1/b/usc-pro-uscweb-live-media/o/de-live%2Foriginal_1686x948_fitnesscompressed_156699186581456_admin.jpg?alt=media'}",49.41289,8.6523,SRH Campussports freut sich auf deinen Besuch!
Multiness Heidelberg,['Fitness'],False,"['Classic', 'Premium', 'Max']",Classic,Ziegelhausen,Im Hofert 28,https://urbansportsclub.com//en/venues/multiness-heidelberg,"{'@context': 'http://schema.org', '@type': 'LocalBusiness', 'name': 'Multiness Heidelberg', 'description': 'Multiness Heidelberg freut sich auf deinen Besuch!', 'address': {'@type': 'PostalAddress', 'addressLocality': 'Heidelberg, Germany', 'addressCountry': 'Germany', 'postalCode': '69118', 'streetAddress': 'Im Hofert 28'}, 'telephone': '', 'geo': {'@type': 'GeoCoordinates', 'latitude': '49.4107903', 'longitude': '8.7715259'}, 'priceRange': '-', 'image': 'https://storage.googleapis.com/download/storage/v1/b/usc-pro-uscweb-live-media/o/de-live%2Foriginal_1686x948_fitnesscompressed_156699044789587_admin.jpg?alt=media'}",49.4107903,8.7715259,Multiness Heidelberg freut sich auf deinen Besuch!
Hallenbad Hasenleiser,['Swimming'],False,"['Essential', 'Classic', 'Premium', 'Max']",Essential,Rohrbach,Baden-Badener Str. 14,https://urbansportsclub.com//en/venues/hallenbad-hasenleiser,"{'@context': 'http://schema.org', '@type': 'LocalBusiness', 'name': 'Hallenbad Hasenleiser', 'description': 'Raus aus dem Alltag – rein ins Vergnügen. In Heidelberg können Sie in fünf Schwimmbädern baden. Ob Sportbad mitten in der Stadt, Freibad mit großem Park und Breitwellenrutsche oder Hallenbad mit Sauna und Aquafitnesskursen – bei uns findet jeder sein persönliches Lieblingsbad. Übrigens: Alle unsere Bäder sind als nachhaltige Betriebe ausgezeichnet.', 'address': {'@type': 'PostalAddress', 'addressLocality': 'Heidelberg, Germany', 'addressCountry': 'Germany', 'postalCode': '69126', 'streetAddress': 'Baden-Badener Str. 14'}, 'telephone': '', 'geo': {'@type': 'GeoCoordinates', 'latitude': '49.3772771', 'longitude': '8.680473'}, 'priceRange': '-', 'image': 'https://storage.googleapis.com/download/storage/v1/b/usc-pro-uscweb-live-media/o/de-live%2Foriginal_1688x950_Swimming_1664547601248899_admin.jpg?generation=1664547601314454&amp;alt=media'}",49.3772771,8.680473,"Raus aus dem Alltag – rein ins Vergnügen. In Heidelberg können Sie in fünf Schwimmbädern baden. Ob Sportbad mitten in der Stadt, Freibad mit großem Park und Breitwellenrutsche oder Hallenbad mit Sauna und Aquafitnesskursen – bei uns findet jeder sein persönliches Lieblingsbad. Übrigens: Alle unsere Bäder sind als nachhaltige Betriebe ausgezeichnet."
Fit&Fun Physio und Fitness,['Fitness'],False,"['Essential', 'Classic', 'Premium', 'Max']",Essential,Waghäusel,Goethestraße 63,https://urbansportsclub.com//en/venues/fitfun-physio-und-fitness,"{'@context': 'http://schema.org', '@type': 'LocalBusiness', 'name': 'Fit&amp;Fun Physio und Fitness', 'description': 'Das Fit &amp; Fun Physio und Fitness freut sich auf Dich!', 'address': {'@type': 'PostalAddress', 'addressLocality': 'Heidelberg, Germany', 'addressCountry': 'Germany', 'postalCode': '68753', 'streetAddress': 'Goethestraße 63'}, 'telephone': '+44 7254 745187', 'geo': {'@type': 'GeoCoordinates', 'latitude': '49.2472731', 'longitude': '8.531292'}, 'priceRange': '-', 'image': 'https://storage.googleapis.com/download/storage/v1/b/usc-pro-uscweb-live-media/o/de-live%2Foriginal_1360x765_iblhuiwzeufuqxbywgz4_171869855634270.png?generation=1718698556124764&amp;alt=media'}",49.2472731,8.531292,Das Fit &amp; Fun Physio und Fitness freut sich auf Dich!
Citybad Darmstädter Hof Centrum,['Swimming'],False,"['Essential', 'Classic', 'Premium', 'Max']",Essential,Altstadt,Fahrtgasse 12,https://urbansportsclub.com//en/venues/citybad-darmstadter-hof-centrum,"{'@context': 'http://schema.org', '@type': 'LocalBusiness', 'name': 'Citybad Darmstädter Hof Centrum', 'description': 'Raus aus dem Alltag – rein ins Vergnügen. In Heidelberg können Sie in fünf Schwimmbädern baden. Ob Sportbad mitten in der Stadt, Freibad mit großem Park und Breitwellenrutsche oder Hallenbad mit Sauna und Aquafitnesskursen – bei uns findet jeder sein persönliches Lieblingsbad. Übrigens: Alle unsere Bäder sind als nachhaltige Betriebe ausgezeichnet.', 'address': {'@type': 'PostalAddress', 'addressLocality': 'Heidelberg, Germany', 'addressCountry': 'Germany', 'postalCode': '69117', 'streetAddress': 'Fahrtgasse 12'}, 'telephone': '', 'geo': {'@type': 'GeoCoordinates', 'latitude': '49.4106655', 'longitude': '8.6947889'}, 'priceRange': '-', 'image': 'https://storage.googleapis.com/download/storage/v1/b/usc-pro-uscweb-live-media/o/de-live%2Foriginal_5760x3240_2b79d127b8a6-City_Bad_IMG_4818_rgb_1664547347336818_admin.jpg?generation=1664547347525655&amp;alt=media'}",49.4106655,8.6947889,"Raus aus dem Alltag – rein ins Vergnügen. In Heidelberg können Sie in fünf Schwimmbädern baden. Ob Sportbad mitten in der Stadt, Freibad mit großem Park und Breitwellenrutsche oder Hallenbad mit Sauna und Aquafitnesskursen – bei uns findet jeder sein persönliches Lieblingsbad. Übrigens: Alle unsere Bäder sind als nachhaltige Betriebe ausgezeichnet."
BrilliantSpaces Haus Trinitatis Speyer,['Yoga'],False,"['Classic', 'Premium', 'Max']",Classic,Altstadt,Johannesstraße 6A,https://urbansportsclub.com//en/venues/brilliantspaces-haus-trinitatis-speyer,"{'@context': 'http://schema.org', '@type': 'LocalBusiness', 'name': 'BrilliantSpaces Haus Trinitatis Speyer', 'description': 'BrilliantHealth Maike Beth freut sich auf Dich!', 'address': {'@type': 'PostalAddress', 'addressLocality': 'Heidelberg, Germany', 'addressCountry': 'Germany', 'postalCode': '67346', 'streetAddress': 'Johannesstraße 6A'}, 'telephone': '+49 160 2622535', 'geo': {'@type': 'GeoCoordinates', 'latitude': '49.3180074', 'longitude': '8.4371318'}, 'priceRange': '-', 'image': 'https://urbansportsclub.com/images/merchant/venueHome.jpg'}",49.3180074,8.4371318,BrilliantHealth Maike Beth freut sich auf Dich!
Dragon-Sport,['Fitness'],False,"['Classic', 'Premium', 'Max']",Classic,Leimen,Am Breiten Bäumchen 1,https://urbansportsclub.com//en/venues/dragon-sport,"{'@context': 'http://schema.org', '@type': 'LocalBusiness', 'name': 'Dragon-Sport', 'description': 'Dragon-Sport in Sinsheim freut sich auf Dich!', 'address': {'@type': 'PostalAddress', 'addressLocality': 'Heidelberg, Germany', 'addressCountry': 'Germany', 'postalCode': '74889', 'streetAddress': 'Am Breiten Bäumchen 1'}, 'telephone': '', 'geo': {'@type': 'GeoCoordinates', 'latitude': '49.2454639', 'longitude': '8.8804519'}, 'priceRange': '-', 'image': 'https://storage.googleapis.com/download/storage/v1/b/usc-pro-uscweb-live-media/o/de-live%2Foriginal_1024x576_IMG_20190718_130325%20%28Copy%29_1565698052876492_admin.jpg?alt=media'}",49.2454639,8.8804519,Dragon-Sport in Sinsheim freut sich auf Dich!
HD Kirchheim | Gregor-Mendel-Realschule,['Fitness'],False,"['Classic', 'Premium', 'Max']",Classic,Kirchheim,Harbigweg 24,https://urbansportsclub.com//en/venues/outdoor-athleten-outdoor-circuit-im-harbigweg,"{'@context': 'http://schema.org', '@type': 'LocalBusiness', 'name': 'HD Kirchheim | Gregor-Mendel-Realschule', 'description': 'Schlanker, fitter und stärker in 8 Wochen! Keine Lust mehr zu hungern und dich im Fitnessstudio alleine zu quälen? Unsere Alternative: draußen trainieren mit Personal Trainer und Ernährungsplan', 'address': {'@type': 'PostalAddress', 'addressLocality': 'Heidelberg, Germany', 'addressCountry': 'Germany', 'postalCode': '69124', 'streetAddress': 'Harbigweg 24'}, 'telephone': '', 'geo': {'@type': 'GeoCoordinates', 'latitude': '49.3872178', 'longitude': '8.6657743'}, 'priceRange': '-', 'image': 'https://storage.googleapis.com/download/storage/v1/b/usc-pro-uscweb-live-media/o/de-live%2Foriginal_1376x774_HD%20Kirchheim%20_1641826547572254_admin.png?generation=1641826547669328&amp;alt=media'}",49.3872178,8.6657743,"Schlanker, fitter und stärker in 8 Wochen! Keine Lust mehr zu hungern und dich im Fitnessstudio alleine zu quälen? Unsere Alternative: draußen trainieren mit Personal Trainer und Ernährungsplan"
HD Neckarwiese | Cafe Frisch Wiese,"['Bootcamp', 'Fitness']",False,"['Classic', 'Premium', 'Max']",Classic,Neuenheim,Uferstraße 80,https://urbansportsclub.com//en/venues/outdoor-athleten-ernst-walz-brucke,"{'@context': 'http://schema.org', '@type': 'LocalBusiness', 'name': 'HD Neckarwiese | Cafe Frisch Wiese', 'description': 'Schlanker, fitter und stärker in 8 Wochen! Keine Lust mehr zu hungern und dich im Fitnessstudio alleine zu quälen? Unsere Alternative: draußen trainieren mit Personal Trainer und Ernährungsplan', 'address': {'@type': 'PostalAddress', 'addressLocality': 'Heidelberg, Germany', 'addressCountry': 'Germany', 'postalCode': '69120', 'streetAddress': 'Uferstraße 80'}, 'telephone': '', 'geo': {'@type': 'GeoCoordinates', 'latitude': '49.4114302', 'longitude': '8.676684'}, 'priceRange': '-', 'image': 'https://storage.googleapis.com/download/storage/v1/b/usc-pro-uscweb-live-media/o/de-live%2Foriginal_1376x774_HD%20Ernst%20Walz%20Bru%CC%88cke%20Morgens_1641826606651672_admin.png?generation=1641826606748834&amp;alt=media'}",49.4114302,8.676684,"Schlanker, fitter und stärker in 8 Wochen! Keine Lust mehr zu hungern und dich im Fitnessstudio alleine zu quälen? Unsere Alternative: draußen trainieren mit Personal Trainer und Ernährungsplan"
Lauf & Fitnessakademie Heidelberg,"['Fitness', 'Running']",False,"['Essential', 'Classic', 'Premium', 'Max']",Essential,Wieblingen,Tiergartenstraße 126,https://urbansportsclub.com//en/venues/lauf-fitnessakademie-heidelberg,"{'@context': 'http://schema.org', '@type': 'LocalBusiness', 'name': 'Lauf &amp; Fitnessakademie Heidelberg', 'description': 'Du willst endlich mal so richtig durchstarten, wusstest aber bisher nicht wie? Ganz egal, ob du einfach nur fit werden möchtest, einen Ausgleich zum stressigen Alltag suchst oder die Vorbereitung auf einen Marathon dein Ziel ist - die Lauf &amp; Fitnessakademie unterstützt dich bei der Erreichung deiner Ziele! Unser Team besteht aus langjährigen Lauf-, Fitness- und Athletiktrainerinnen und -trainern, die deinen Fortschritt mit Ihrer Expertise unterstützen.', 'address': {'@type': 'PostalAddress', 'addressLocality': 'Heidelberg, Germany', 'addressCountry': 'Germany', 'postalCode': '69121', 'streetAddress': 'Tiergartenstraße 126'}, 'telephone': '', 'geo': {'@type': 'GeoCoordinates', 'latitude': '49.4271327', 'longitude': '8.6605839'}, 'priceRange': '-', 'image': 'https://storage.googleapis.com/download/storage/v1/b/usc-pro-uscweb-live-media/o/de-live%2Foriginal_1024x576_udi7h1dbgpgkjrvrn5ie_1706781046168031.jpg?generation=1706781046215409&amp;alt=media'}",49.4271327,8.6605839,"Du willst endlich mal so richtig durchstarten, wusstest aber bisher nicht wie? Ganz egal, ob du einfach nur fit werden möchtest, einen Ausgleich zum stressigen Alltag suchst oder die Vorbereitung auf einen Marathon dein Ziel ist - die Lauf &amp; Fitnessakademie unterstützt dich bei der Erreichung deiner Ziele! Unser Team besteht aus langjährigen Lauf-, Fitness- und Athletiktrainerinnen und -trainern, die deinen Fortschritt mit Ihrer Expertise unterstützen."
REVIVE Fitness Club Aglasterhausen,['Fitness'],False,"['Essential', 'Classic', 'Premium', 'Max']",Essential,Altstadt,Im oberen Tal 22,https://urbansportsclub.com//en/venues/revive-fitness-club-aglasterhausen-1,"{'@context': 'http://schema.org', '@type': 'LocalBusiness', 'name': 'REVIVE Fitness Club Aglasterhausen', 'description': 'REVIVE Fitness Club freut sich auf Dich!', 'address': {'@type': 'PostalAddress', 'addressLocality': 'Heidelberg, Germany', 'addressCountry': 'Germany', 'postalCode': '74858', 'streetAddress': 'Im oberen Tal 22'}, 'telephone': '', 'geo': {'@type': 'GeoCoordinates', 'latitude': '49.3466891', 'longitude': '8.9822325'}, 'priceRange': '-', 'image': 'https://urbansportsclub.com/images/merchant/venueHome.jpg'}",49.3466891,8.9822325,REVIVE Fitness Club freut sich auf Dich!
REVIVE Fitness Club Schwaigern,['Fitness'],False,"['Essential', 'Classic', 'Premium', 'Max']",Essential,Altstadt,Neippergerstr. 1,https://urbansportsclub.com//en/venues/revive-fitness-club-schwaigern-1,"{'@context': 'http://schema.org', '@type': 'LocalBusiness', 'name': 'REVIVE Fitness Club Schwaigern', 'description': 'REVIVE Fitness Club freut sich auf Dich!', 'address': {'@type': 'PostalAddress', 'addressLocality': 'Heidelberg, Germany', 'addressCountry': 'Germany', 'postalCode': '74858', 'streetAddress': 'Neippergerstr. 1'}, 'telephone': '', 'geo': {'@type': 'GeoCoordinates', 'latitude': '49.3569024', 'longitude': '8.9883984'}, 'priceRange': '-', 'image': 'https://urbansportsclub.com/images/merchant/venueHome.jpg'}",49.3569024,8.9883984,REVIVE Fitness Club freut sich auf Dich!
Reha & Sport Lounge,['Fitness'],False,"['Classic', 'Premium', 'Max']",Classic,Südstadt,Hauptstraße 22 A,https://urbansportsclub.com//en/venues/reha-sport-lounge,"{'@context': 'http://schema.org', '@type': 'LocalBusiness', 'name': 'Reha &amp; Sport Lounge', 'description': 'Reha &amp; Sport Lounge freut sich auf deinen Besuch!', 'address': {'@type': 'PostalAddress', 'addressLocality': 'Heidelberg, Germany', 'addressCountry': 'Germany', 'postalCode': '67105', 'streetAddress': 'Hauptstraße 22 A'}, 'telephone': '', 'geo': {'@type': 'GeoCoordinates', 'latitude': '49.3836093', 'longitude': '8.3742604'}, 'priceRange': '-', 'image': 'https://storage.googleapis.com/download/storage/v1/b/usc-pro-uscweb-live-media/o/de-live%2Foriginal_1688x950_Gesundheit_1565699697386732_admin.jpg?alt=media'}",49.3836093,8.3742604,Reha &amp; Sport Lounge freut sich auf deinen Besuch!
Wing Tsun Fit2Fight Heidelberg,['Traditional Asian Martial Arts'],False,"['Classic', 'Premium', 'Max']",Classic,Altstadt,Plöck 60-62,https://urbansportsclub.com//en/venues/wing-tsun-fit2fight-heidelberg,"{'@context': 'http://schema.org', '@type': 'LocalBusiness', 'name': 'Wing Tsun Fit2Fight Heidelberg', 'description': 'Lehrer mit 30jähriger Erfahrung im Wing Tsun/Ving Tsun / Wing Chun und Sportwissenschaften/Sport-/Sonderpädagogik', 'address': {'@type': 'PostalAddress', 'addressLocality': 'Heidelberg, Germany', 'addressCountry': 'Germany', 'postalCode': '69115', 'streetAddress': 'Plöck 60-62'}, 'telephone': '', 'geo': {'@type': 'GeoCoordinates', 'latitude': '49.4094626', 'longitude': '8.7043035'}, 'priceRange': '-', 'image': 'https://storage.googleapis.com/download/storage/v1/b/usc-pro-uscweb-live-media/o/de-live%2Foriginal_1688x950_ModerneSelbstverteidigungCompressed_1570192618103389_admin.jpg?alt=media'}",49.4094626,8.7043035,Lehrer mit 30jähriger Erfahrung im Wing Tsun/Ving Tsun / Wing Chun und Sportwissenschaften/Sport-/Sonderpädagogik
fitbox Heidelberg Bahnstadt,['EMS'],True,"['Premium', 'Max']",Premium,Bahnstadt,Grüne Meile 26,https://urbansportsclub.com//en/venues/fitbox-heidelberg-bahnstadt,"{'@context': 'http://schema.org', '@type': 'LocalBusiness', 'name': 'fitbox Heidelberg Bahnstadt', 'description': 'Du hast genug von Fitnesstrainern und Ernährungsberatern, die Dir in Werbeanzeigen suggerieren, dass Du nur mit ihrem Konzept ganz schnell und einfach Deinen Traumkörper erreichen kannst? Dann kannst Du ab sofort in der fitbox Heidelberg Bahnstadt Deinen Traum wahr werden lassen. Durch die bewährte EMS Technologie erhältst Du ein hocheffektives und intensives Ganzkörper Fitnesstraining in nur kurzen Trainingseinheiten. Der fitbox 3ECK-Ansatz bestehend aus Ernährung, Cardio- und Krafttraining schafft für Dich die besten Voraussetzungen für maximalen Erfolg beim Erreichen Deiner Fitnessziele. Jede EMS Trainingseinheit findet unter der Aufsicht eines lizenzierten EMS Personal Trainers statt, der Dich motiviert und zu Höchstleistungen pusht.', 'address': {'@type': 'PostalAddress', 'addressLocality': 'Heidelberg, Germany', 'addressCountry': 'Germany', 'postalCode': '69115', 'streetAddress': 'Grüne Meile 26'}, 'telephone': '', 'geo': {'@type': 'GeoCoordinates', 'latitude': '49.4038835', 'longitude': '8.6666446'}, 'priceRange': '-', 'image': 'https://storage.googleapis.com/download/storage/v1/b/usc-pro-uscweb-live-media/o/de-live%2Foriginal_4032x2268_075f8f560ce7-IMG_1605_1677075006688245_admin.jpg?generation=1677075006968030&amp;alt=media'}",49.4038835,8.6666446,"Du hast genug von Fitnesstrainern und Ernährungsberatern, die Dir in Werbeanzeigen suggerieren, dass Du nur mit ihrem Konzept ganz schnell und einfach Deinen Traumkörper erreichen kannst? Dann kannst Du ab sofort in der fitbox Heidelberg Bahnstadt Deinen Traum wahr werden lassen. Durch die bewährte EMS Technologie erhältst Du ein hocheffektives und intensives Ganzkörper Fitnesstraining in nur kurzen Trainingseinheiten. Der fitbox 3ECK-Ansatz bestehend aus Ernährung, Cardio- und Krafttraining schafft für Dich die besten Voraussetzungen für maximalen Erfolg beim Erreichen Deiner Fitnessziele. Jede EMS Trainingseinheit findet unter der Aufsicht eines lizenzierten EMS Personal Trainers statt, der Dich motiviert und zu Höchstleistungen pusht."
