name,disciplines,plus_options,plans,min_plan,district,street,link,metadata,latitude,longitude,description
Yogimotion Studio Reuschenberg,['Yoga'],False,"['Classic', 'Premium', 'Max']",Classic,Neuss,Am Reuschenberger Markt 2,https://urbansportsclub.com//en/venues/yogimotion-studio-reuschenberg-4,"{'@context': 'http://schema.org', '@type': 'LocalBusiness', 'name': 'Yogimotion Studio Reuschenberg', 'description': 'Yogimotion bietet Dir verschiedene Kurse mit unterschiedlichen Schwerpunkten an. Erlebe sanftes, dynamisches und körperbetontes Hatha-Yoga bei Yogimotion. In schönen Räumen mit Fußbodenheizung erwartet Dich eine ganzheitliche Praxis für Körper und Geist. Du wirst Dich beweglicher, ruhiger und gelassener fühlen. Oder auf den Punkt gebracht: Du bist viel mehr bei Dir. Ob Einsteiger oder Fortgeschrittene – hier findest du das für Dich passende Angebot im Kursangebot. Melde Dich gern per E-Mail an oder komm&#039; spontan vorbei - ganz wie Du magst!', 'address': {'@type': 'PostalAddress', 'addressLocality': 'Düsseldorf, Germany', 'addressCountry': 'Germany', 'postalCode': '41466', 'streetAddress': 'Am Reuschenberger Markt 2'}, 'telephone': '+49 177 8888098', 'geo': {'@type': 'GeoCoordinates', 'latitude': '51.1666099', 'longitude': '6.6833952'}, 'priceRange': '-', 'image': 'https://storage.googleapis.com/download/storage/v1/b/usc-pro-uscweb-live-media/o/de-live%2Foriginal_1280x720_OpenHouse_hres_13_T8UDV.jpg?alt=media'}",51.1666099,6.6833952,"Yogimotion bietet Dir verschiedene Kurse mit unterschiedlichen Schwerpunkten an. Erlebe sanftes, dynamisches und körperbetontes Hatha-Yoga bei Yogimotion. In schönen Räumen mit Fußbodenheizung erwartet Dich eine ganzheitliche Praxis für Körper und Geist. Du wirst Dich beweglicher, ruhiger und gelassener fühlen. Oder auf den Punkt gebracht: Du bist viel mehr bei Dir. Ob Einsteiger oder Fortgeschrittene – hier findest du das für Dich passende Angebot im Kursangebot. Melde Dich gern per E-Mail an oder komm&#039; spontan vorbei - ganz wie Du magst!"
Parkletix - Zoopark - Düsseltal,['Fitness'],False,"['Classic', 'Premium', 'Max']",Classic,Stadtbezirk 2,Grunerstraße,https://urbansportsclub.com//en/venues/parkletix-zoopark-dusseltal,"{'@context': 'http://schema.org', '@type': 'LocalBusiness', 'name': 'Parkletix - Zoopark - Düsseltal', 'description': 'Gemeinsam mit Deinem Personal Coach arbeiten wir in kleinen Gruppen an Deiner Gesundheit und Fitness. Wir wollen keine Rekorde brechen! Freunde treffen, lachen, Spaß haben und dabei mit reichlich frischer Luft und in der Natur fit werden und bleiben. Unsere CrossRun- &amp; FunctionalCircle-Kurse sind für Anfänger und Fortgeschrittene geeignet. MACH´S Draußen und triff Deinen Coach und Deine Fitnessgruppe. Wir freuen uns auf Dich', 'address': {'@type': 'PostalAddress', 'addressLocality': 'Düsseldorf, Germany', 'addressCountry': 'Germany', 'postalCode': '40239', 'streetAddress': 'Brehmplatz. 1'}, 'telephone': '', 'geo': {'@type': 'GeoCoordinates', 'latitude': '51.2387487', 'longitude': '6.8033299'}, 'priceRange': '-', 'image': 'https://storage.googleapis.com/download/storage/v1/b/usc-pro-uscweb-live-media/o/de-live%2Foriginal_1024x576_d7d69cd91e9b-USC_Dorf__1659012647548966_admin.jpg?generation=1659012647606251&amp;alt=media'}",51.2387487,6.8033299,"Gemeinsam mit Deinem Personal Coach arbeiten wir in kleinen Gruppen an Deiner Gesundheit und Fitness. Wir wollen keine Rekorde brechen! Freunde treffen, lachen, Spaß haben und dabei mit reichlich frischer Luft und in der Natur fit werden und bleiben. Unsere CrossRun- &amp; FunctionalCircle-Kurse sind für Anfänger und Fortgeschrittene geeignet. MACH´S Draußen und triff Deinen Coach und Deine Fitnessgruppe. Wir freuen uns auf Dich"
Angerbad Hallenbad,['Swimming'],False,"['Essential', 'Classic', 'Premium', 'Max']",Essential,Ratingen,Hauser Ring 52,https://urbansportsclub.com//en/venues/angerbad-hallenbad,"{'@context': 'http://schema.org', '@type': 'LocalBusiness', 'name': 'Angerbad Hallenbad', 'description': 'Die Ratinger Bäder freuen sich auf dich!', 'address': {'@type': 'PostalAddress', 'addressLocality': 'Düsseldorf, Germany', 'addressCountry': 'Germany', 'postalCode': '40878', 'streetAddress': 'Hauser Ring 52'}, 'telephone': '', 'geo': {'@type': 'GeoCoordinates', 'latitude': '51.3030002', 'longitude': '6.8450471'}, 'priceRange': '-', 'image': 'https://storage.googleapis.com/download/storage/v1/b/usc-pro-uscweb-live-media/o/de-live%2Foriginal_4585x2579_Hallenbad%20Angerbad_1696856971105296_admin.jpg?generation=1696856971229715&amp;alt=media'}",51.3030002,6.8450471,Die Ratinger Bäder freuen sich auf dich!
Yio Yoga in Oberbilk,['Yoga'],False,"['Classic', 'Premium', 'Max']",Classic,Oberbilk,Kirchstraße 20,https://urbansportsclub.com//en/venues/yio-yoga-in-oberbilk-1,"{'@context': 'http://schema.org', '@type': 'LocalBusiness', 'name': 'Yio Yoga in Oberbilk', 'description': 'Yoga in Oberbilk Seit 2019 biete ich in den schönen Räumlichkeiten des Klanghauses in Düsseldorf Oberbilk Yogakurse für Einsteiger und Geübte an. Unterrichtet wird ausrichtungsbasiertes Hatha Yoga, Vinyasa Yoga und Yin Yoga. Falls Du noch nie Yoga gemacht hast, es aber dennoch gern einmal ausprobieren magst, melde Dich gern vorab bei mir. Die Stunden sind so konzipiert dass jede/r auf dem eigenen Level praktizieren kann, da Variationen angeboten werden. Dabei wird stets Dein individueller Körper und Deine persönlichen Möglichkeiten berücksichtigt. Mittels vorhandenen Hilfsmitteln wie Block und Gurt oder aber auch durch behutsam ausgeführte Hands-On erfährst Du Unterstützung, so dass Du sicher und körpergerecht Yoga erfahren und praktizieren kannst. Und keine Sorge! Du brauchst nicht hyperflexibel oder besonders sportlich sein. Pack Dir einfach bequeme Sportkleidung ein und dann los! Der Unterricht findet in kleinerer Gruppen bis maximal 12 Personen statt. Für aktuelle Corona Regeln und weiterführende Informationen schau gern auf meiner Webseite nach: www.yoga-in-oberbilk.de Ich freu mich dich auf der Matte zu treffen! Herzliche Grüße Steffi', 'address': {'@type': 'PostalAddress', 'addressLocality': 'Düsseldorf, Germany', 'addressCountry': 'Germany', 'postalCode': '40227', 'streetAddress': 'Kirchstraße 20'}, 'telephone': '', 'geo': {'@type': 'GeoCoordinates', 'latitude': '51.2126671', 'longitude': '6.8029893'}, 'priceRange': '-', 'image': 'https://storage.googleapis.com/download/storage/v1/b/usc-pro-uscweb-live-media/o/de-live%2Foriginal_1156x650_9f2e379d3b2e-yio_start_1642497270884908_admin.jpg?generation=1642497270996744&amp;alt=media'}",51.2126671,6.8029893,"Yoga in Oberbilk Seit 2019 biete ich in den schönen Räumlichkeiten des Klanghauses in Düsseldorf Oberbilk Yogakurse für Einsteiger und Geübte an. Unterrichtet wird ausrichtungsbasiertes Hatha Yoga, Vinyasa Yoga und Yin Yoga. Falls Du noch nie Yoga gemacht hast, es aber dennoch gern einmal ausprobieren magst, melde Dich gern vorab bei mir. Die Stunden sind so konzipiert dass jede/r auf dem eigenen Level praktizieren kann, da Variationen angeboten werden. Dabei wird stets Dein individueller Körper und Deine persönlichen Möglichkeiten berücksichtigt. Mittels vorhandenen Hilfsmitteln wie Block und Gurt oder aber auch durch behutsam ausgeführte Hands-On erfährst Du Unterstützung, so dass Du sicher und körpergerecht Yoga erfahren und praktizieren kannst. Und keine Sorge! Du brauchst nicht hyperflexibel oder besonders sportlich sein. Pack Dir einfach bequeme Sportkleidung ein und dann los! Der Unterricht findet in kleinerer Gruppen bis maximal 12 Personen statt. Für aktuelle Corona Regeln und weiterführende Informationen schau gern auf meiner Webseite nach: www.yoga-in-oberbilk.de Ich freu mich dich auf der Matte zu treffen! Herzliche Grüße Steffi"
Rundum Yoga The Vacation Club,['Yoga'],False,"['Classic', 'Premium', 'Max']",Classic,Hafen,Am Handeslhafen 30,https://urbansportsclub.com//en/venues/rundum-yoga-marina-club,"{'@context': 'http://schema.org', '@type': 'LocalBusiness', 'name': 'Rundum Yoga The Vacation Club', 'description': 'Rundum Yoga freut sich auf Dich! Es ist wichtig das aus gegeben Anlass jeder: * Seine eigene Yogamatte mitbringt. * Einen Mundschutz beim Betreten und beim Verlassen des Studios trägt. * Persönlich über die App angemeldet ist. Sind diese Voraussetzungen nicht erfüllt, ist eine Teilnahme leider nicht möglich. Danke!', 'address': {'@type': 'PostalAddress', 'addressLocality': 'Düsseldorf, Germany', 'addressCountry': 'Germany', 'postalCode': '40221', 'streetAddress': 'Am Handeslhafen 30'}, 'telephone': '', 'geo': {'@type': 'GeoCoordinates', 'latitude': '51.2168081', 'longitude': '6.7588661'}, 'priceRange': '-', 'image': 'https://storage.googleapis.com/download/storage/v1/b/usc-pro-uscweb-live-media/o/de-live%2Foriginal_1024x576_Marina_Club_Urban%20Sports_%20Rundum_Yoga_28.07.20_4_1626875317644598_admin.jpeg?alt=media'}",51.2168081,6.7588661,"Rundum Yoga freut sich auf Dich! Es ist wichtig das aus gegeben Anlass jeder: * Seine eigene Yogamatte mitbringt. * Einen Mundschutz beim Betreten und beim Verlassen des Studios trägt. * Persönlich über die App angemeldet ist. Sind diese Voraussetzungen nicht erfüllt, ist eine Teilnahme leider nicht möglich. Danke!"
Clever Fit - Neuss,"['Fitness', 'Functional Training', 'Vibration Training']",False,"['Essential', 'Classic', 'Premium', 'Max']",Essential,Neuss,Am Reuschenberger Markt 2,https://urbansportsclub.com//en/venues/clever-fit-neuss,"{'@context': 'http://schema.org', '@type': 'LocalBusiness', 'name': 'Clever Fit - Neuss', 'description': 'Der erste Schritt zum Erfolg - Dein Training im clever fit. Genieße die entspannte clever fit Atmosphäre und besuche uns jetzt im Studio.', 'address': {'@type': 'PostalAddress', 'addressLocality': 'Düsseldorf, Germany', 'addressCountry': 'Germany', 'postalCode': '41466', 'streetAddress': 'Am Reuschenberger Markt 2'}, 'telephone': '', 'geo': {'@type': 'GeoCoordinates', 'latitude': '51.1666099', 'longitude': '6.6833952'}, 'priceRange': '-', 'image': 'https://storage.googleapis.com/download/storage/v1/b/usc-pro-uscweb-live-media/o/de-live%2Foriginal_1061x597_42059698_2143904025872028_8169018485502902272_n_1549883727104804_admin.jpeg?alt=media'}",51.1666099,6.6833952,Der erste Schritt zum Erfolg - Dein Training im clever fit. Genieße die entspannte clever fit Atmosphäre und besuche uns jetzt im Studio.
H2Oh! Tönisvorst,['Swimming'],False,"['Classic', 'Premium', 'Max']",Classic,Tönisvorst,Schelthofer Straße 80,https://urbansportsclub.com//en/venues/h2oh-tnisvorst,"{'@context': 'http://schema.org', '@type': 'LocalBusiness', 'name': 'H2Oh! Tönisvorst', 'description': '', 'address': {'@type': 'PostalAddress', 'addressLocality': 'Düsseldorf, Germany', 'addressCountry': 'Germany', 'postalCode': '47918', 'streetAddress': 'Schelthofer Straße 80'}, 'telephone': '+44 21 6614 7000', 'geo': {'@type': 'GeoCoordinates', 'latitude': '51.3218957', 'longitude': '6.4806712'}, 'priceRange': '-', 'image': 'https://storage.googleapis.com/download/storage/v1/b/usc-pro-uscweb-live-media/o/de-live%2Foriginal_640x360_tb62anofrp1lfmcv1vag_173882687140194.png?generation=1738826871124658&amp;alt=media'}",51.3218957,6.4806712,
Kraftbunker - Calisthenics in der Athletenschmiede,['Functional Training'],False,"['Essential', 'Classic', 'Premium', 'Max']",Essential,Oberbilk,AREAL BÖHLER - Hansaallee 321/Gebäude 5,https://urbansportsclub.com//en/venues/kraftbunker-park-stahlwerkstrasse,"{'@context': 'http://schema.org', '@type': 'LocalBusiness', 'name': 'Kraftbunker - Calisthenics in der Athletenschmiede', 'description': 'Calisthenics haben viele schon mal gehört, aber was ist das eigentlich genau? Calisthenics ist Kraftsport mit dem eigenen Körpergewicht! Aber so einfach wie es erklärt ist, ist der Einstieg leider nicht. Bei diesem Gruppentraining in Präsenz lernt ihr die Basis Übungen kennen und baut die Kraftbasis auf, die ihr für die späteren (fortgeschrittenen) Übungen benötigt.', 'address': {'@type': 'PostalAddress', 'addressLocality': 'Düsseldorf, Germany', 'addressCountry': 'Germany', 'postalCode': ' 40549', 'streetAddress': 'AREAL BÖHLER - Hansaallee 321/Gebäude 5'}, 'telephone': '+49 179 4250532', 'geo': {'@type': 'GeoCoordinates', 'latitude': '51.244102256', 'longitude': '6.712256831'}, 'priceRange': '-', 'image': 'https://storage.googleapis.com/download/storage/v1/b/usc-pro-uscweb-live-media/o/de-live%2Foriginal_1348x758_cg3zqlrlkuckg9b4enqb_169357430388077.png?generation=1693574303178270&amp;alt=media'}",51.244102256,6.712256831,"Calisthenics haben viele schon mal gehört, aber was ist das eigentlich genau? Calisthenics ist Kraftsport mit dem eigenen Körpergewicht! Aber so einfach wie es erklärt ist, ist der Einstieg leider nicht. Bei diesem Gruppentraining in Präsenz lernt ihr die Basis Übungen kennen und baut die Kraftbasis auf, die ihr für die späteren (fortgeschrittenen) Übungen benötigt."
all inclusive Fitness Langenfeld City,"['Dance', 'Fitness', 'Indoor Cycling', 'Pilates']",False,"['Essential', 'Classic', 'Premium', 'Max']",Essential,Langenfeld,Galerieplatz 1,https://urbansportsclub.com//en/venues/ai-fitness-studio-langenfeld-city,"{'@context': 'http://schema.org', '@type': 'LocalBusiness', 'name': 'all inclusive Fitness Langenfeld City', 'description': 'Als eine der am schnellsten wachsenden und innovativsten Fitnessstudioketten in Deutschland, ist der Kern unseres Unternehmens eine ehrliche Leidenschaft für Fitness, Gesundheit und Wellbeing. Ziel ist es, unseren Mitgliedern ein erstklassiges Fitnesserlebnis zu bieten, das begeistert, motiviert und dabei erschwinglich bleibt. Um dies zu erreichen, verfolgt Ai Fitness seit 2003 einen ganzheitlichen Ansatz, der auf vier verschiedenen Säulen beruht: Hohe Servicequalität, niedrige Preise All inclusive an 365 Tagen im Jahr. Wir bieten ein herausragendes Leistungsangebot und das zu einem fairen und transparenten Preis. Vielfalt in Training und Ausstattung Fitnesstraining hat sich in den letzten Jahren extrem diversifiziert. Unsere Trainingsmöglichkeiten spiegeln dies wieder und bieten für jeden etwas. Angenehmes Umfeld und Ambiente In jedem unserer Studios hat eine angenehme Trainingsatmosphäre oberste Priorität. So sorgen wir für Motivation und Erfolg im Training. Effiziente Strukturen und Abläufe Mit über 20 Jahren Erfahrung in der Branche wissen wir, worauf es ankommt. Das Ergebnis ist ein erstklassiger Service bei gleichzeitig niedrigen Preisen. Wir kombinieren diese Erfolgsfaktoren zu einem Rundum-Sorglos-Paket, dass jedem Mitglied an 365 Tagen im Jahr zur Verfügung steht. Dabei richtet sich unser Angebot an ein breites Publikum – egal ob Anfänger, Hobbysportler oder fortgeschrittener Athlet – jeder findet hier sein sportliches Zuhause und eine erstklassige Betreuung. In der Praxis findet sich dieses Konzept in der Studiogestaltung wieder. Jeder Ai Fitnessclub ist gemäß der unterschiedlichen Trainingskonzepte in verschiedene Bereiche unterteilt: Funktionales Training, klassisches Gerätetraining, Fitnesskurse, Zirkeltraining oder Cardio – hier findet jeder seinen ganz eigenen Lieblingsbereich. Mit zertifizierten Trainern, einer großen Bandbreite an Trainingsmöglichkeiten, State of the Art-Fitnessequipment, einem vielseitigen Kursangebot, Gesundheitscheck und innovativen Sonderleistungen haben wir den Begriff all inclusive Fitness etabliert. Abgerundet wird dieses attraktive Gesamtpaket durch eine offene und lichtdurchflutete Architektur, hochwertige Umkleiden und Sanitärbereiche mit kostenlosen Duschen sowie unserem stets hilfsbereites Personal. In unseren Studios schaffen wir eine einzigartige Atmosphäre, in der jeder willkommen ist und sich wohlfühlen kann. Unsere Mitglieder sollen sich dabei nicht nur als Kunden, sondern Teil einer inspirierenden und motivierenden Community verstehen. Mit regelmäßigen Aktionen und dynamischen After-Work-Events schaffen wir ein vertrauensvolles Umfeld, das sonst oftmals durch Anonymität gekennzeichnet ist. Fitness in Wohlfühl-Atmosphäre – denn nur wer sich wirklich wohlfühlt, kommt auch gerne zum Training und hat langfristig Erfolg. Und der Trainingserfolg unserer Mitglieder ist dabei unsere Leidenschaft. Ein Ai Fitnessstudio findet sich bestimmt auch in deiner Nähe. Überzeuge dich selbst und lerne uns im Rahmen eines kostenlosen Probetrainings kennen. Wir freuen uns auf dich. Ai Fitness - Erlebe den Unterschied! Bitte schaue vor deinem Besuch in die Hausordnung: https://www.ai-fitness.de/service/hausordnung', 'address': {'@type': 'PostalAddress', 'addressLocality': 'Düsseldorf, Germany', 'addressCountry': 'Germany', 'postalCode': '40764', 'streetAddress': 'Galerieplatz 1'}, 'telephone': '+44 15792633513', 'geo': {'@type': 'GeoCoordinates', 'latitude': '51.111685', 'longitude': '6.9501891'}, 'priceRange': '-', 'image': 'https://storage.googleapis.com/download/storage/v1/b/usc-pro-uscweb-live-media/o/de-live%2Foriginal_1200x675_bewbe9w0d7muh8xgu4um_1722494470731908.png?generation=1722494470794781&amp;alt=media'}",51.111685,6.9501891,"Als eine der am schnellsten wachsenden und innovativsten Fitnessstudioketten in Deutschland, ist der Kern unseres Unternehmens eine ehrliche Leidenschaft für Fitness, Gesundheit und Wellbeing. Ziel ist es, unseren Mitgliedern ein erstklassiges Fitnesserlebnis zu bieten, das begeistert, motiviert und dabei erschwinglich bleibt. Um dies zu erreichen, verfolgt Ai Fitness seit 2003 einen ganzheitlichen Ansatz, der auf vier verschiedenen Säulen beruht: Hohe Servicequalität, niedrige Preise All inclusive an 365 Tagen im Jahr. Wir bieten ein herausragendes Leistungsangebot und das zu einem fairen und transparenten Preis. Vielfalt in Training und Ausstattung Fitnesstraining hat sich in den letzten Jahren extrem diversifiziert. Unsere Trainingsmöglichkeiten spiegeln dies wieder und bieten für jeden etwas. Angenehmes Umfeld und Ambiente In jedem unserer Studios hat eine angenehme Trainingsatmosphäre oberste Priorität. So sorgen wir für Motivation und Erfolg im Training. Effiziente Strukturen und Abläufe Mit über 20 Jahren Erfahrung in der Branche wissen wir, worauf es ankommt. Das Ergebnis ist ein erstklassiger Service bei gleichzeitig niedrigen Preisen. Wir kombinieren diese Erfolgsfaktoren zu einem Rundum-Sorglos-Paket, dass jedem Mitglied an 365 Tagen im Jahr zur Verfügung steht. Dabei richtet sich unser Angebot an ein breites Publikum – egal ob Anfänger, Hobbysportler oder fortgeschrittener Athlet – jeder findet hier sein sportliches Zuhause und eine erstklassige Betreuung. In der Praxis findet sich dieses Konzept in der Studiogestaltung wieder. Jeder Ai Fitnessclub ist gemäß der unterschiedlichen Trainingskonzepte in verschiedene Bereiche unterteilt: Funktionales Training, klassisches Gerätetraining, Fitnesskurse, Zirkeltraining oder Cardio – hier findet jeder seinen ganz eigenen Lieblingsbereich. Mit zertifizierten Trainern, einer großen Bandbreite an Trainingsmöglichkeiten, State of the Art-Fitnessequipment, einem vielseitigen Kursangebot, Gesundheitscheck und innovativen Sonderleistungen haben wir den Begriff all inclusive Fitness etabliert. Abgerundet wird dieses attraktive Gesamtpaket durch eine offene und lichtdurchflutete Architektur, hochwertige Umkleiden und Sanitärbereiche mit kostenlosen Duschen sowie unserem stets hilfsbereites Personal. In unseren Studios schaffen wir eine einzigartige Atmosphäre, in der jeder willkommen ist und sich wohlfühlen kann. Unsere Mitglieder sollen sich dabei nicht nur als Kunden, sondern Teil einer inspirierenden und motivierenden Community verstehen. Mit regelmäßigen Aktionen und dynamischen After-Work-Events schaffen wir ein vertrauensvolles Umfeld, das sonst oftmals durch Anonymität gekennzeichnet ist. Fitness in Wohlfühl-Atmosphäre – denn nur wer sich wirklich wohlfühlt, kommt auch gerne zum Training und hat langfristig Erfolg. Und der Trainingserfolg unserer Mitglieder ist dabei unsere Leidenschaft. Ein Ai Fitnessstudio findet sich bestimmt auch in deiner Nähe. Überzeuge dich selbst und lerne uns im Rahmen eines kostenlosen Probetrainings kennen. Wir freuen uns auf dich. Ai Fitness - Erlebe den Unterschied! Bitte schaue vor deinem Besuch in die Hausordnung: https://www.ai-fitness.de/service/hausordnung"
Seestern Fitnessclub Süd,"['Fitness', 'Tennis']",False,"['Classic', 'Premium', 'Max']",Classic,Urdenbach,Hugo-Wilderer-Weg 21,https://urbansportsclub.com//en/venues/seestern-fitnessclub-sud,"{'@context': 'http://schema.org', '@type': 'LocalBusiness', 'name': 'Seestern Fitnessclub Süd', 'description': 'Trainiere, um gesund zu bleiben. Dieses Motto wird im Seestern Fitnessclub Süd sehr groß geschrieben. Mit 4700 qm ist er eines der führenden Unternehmen im Bereich Sport und Gesundheit im Düsseldorfer Süden und bietet dir optimale Trainingsbedingungen mit kompetenter Betreuung. Neben Cardio-, Geräte- und Freihanteltraining gibt es einen neuen Functional Training Bereich, welcher noch weiterausgebaut und –entwickelt wird. Das vielfältige Kursprogramm reicht von Aerobic über Zumba bis hin zu Jumping Fitness und Yoga. Darüber hinaus rundet die Power Plate das exklusive Fitness-Angebot ab. Und das ist noch nicht alles. Der Seestern Fitnessclub verfügt außerdem über eine aufwändig renovierte 5-Feld-Tennis-Halle, welche mit besonders gelenkschonendem Granulatboden ausgestattet ist und den Tennis-Freunden unter uns hohen Spielkomfort ähnlich eines Asche-Platzes bietet. Die Halle ist besonders gut ausgeleuchtet und wärmegedämmt. Dementsprechend kannst du hier ganzjährig und wetterunabhängig Roger Federer nacheifern!! Du möchtest deinen Muskeln nach dem Training etwas Gutes tun und die Regernation vorantreiben? Dann mach deinen Besuch im Seestern Fitnessclub mit einem Saunagang perfekt :-)', 'address': {'@type': 'PostalAddress', 'addressLocality': 'Düsseldorf, Germany', 'addressCountry': 'Germany', 'postalCode': '40593', 'streetAddress': 'Hugo-Wilderer-Weg 21'}, 'telephone': '+49 211 9707910', 'geo': {'@type': 'GeoCoordinates', 'latitude': '51.1526911', 'longitude': '6.8880517'}, 'priceRange': '-', 'image': 'https://storage.googleapis.com/download/storage/v1/b/usc-pro-uscweb-live-media/o/de-live%2Foriginal_2000x1125_Seestern_Fitnessclub_S%C3%BCd_2911_DE_Urban_Sports_Club_4_1542626613736784_admin.jpg?alt=media'}",51.1526911,6.8880517,"Trainiere, um gesund zu bleiben. Dieses Motto wird im Seestern Fitnessclub Süd sehr groß geschrieben. Mit 4700 qm ist er eines der führenden Unternehmen im Bereich Sport und Gesundheit im Düsseldorfer Süden und bietet dir optimale Trainingsbedingungen mit kompetenter Betreuung. Neben Cardio-, Geräte- und Freihanteltraining gibt es einen neuen Functional Training Bereich, welcher noch weiterausgebaut und –entwickelt wird. Das vielfältige Kursprogramm reicht von Aerobic über Zumba bis hin zu Jumping Fitness und Yoga. Darüber hinaus rundet die Power Plate das exklusive Fitness-Angebot ab. Und das ist noch nicht alles. Der Seestern Fitnessclub verfügt außerdem über eine aufwändig renovierte 5-Feld-Tennis-Halle, welche mit besonders gelenkschonendem Granulatboden ausgestattet ist und den Tennis-Freunden unter uns hohen Spielkomfort ähnlich eines Asche-Platzes bietet. Die Halle ist besonders gut ausgeleuchtet und wärmegedämmt. Dementsprechend kannst du hier ganzjährig und wetterunabhängig Roger Federer nacheifern!! Du möchtest deinen Muskeln nach dem Training etwas Gutes tun und die Regernation vorantreiben? Dann mach deinen Besuch im Seestern Fitnessclub mit einem Saunagang perfekt :-)"
Physio Funkel,['Functional Training'],False,"['Classic', 'Premium', 'Max']",Classic,Neuss,Kaarster Straße 50,https://urbansportsclub.com//en/venues/physio-funkel,"{'@context': 'http://schema.org', '@type': 'LocalBusiness', 'name': 'Physio Funkel', 'description': '', 'address': {'@type': 'PostalAddress', 'addressLocality': 'Düsseldorf, Germany', 'addressCountry': 'Germany', 'postalCode': '41462', 'streetAddress': 'Kaarster Straße 50'}, 'telephone': '+49 1575 4848371', 'geo': {'@type': 'GeoCoordinates', 'latitude': '51.2187205', 'longitude': '6.658814'}, 'priceRange': '-', 'image': 'https://storage.googleapis.com/download/storage/v1/b/usc-pro-uscweb-live-media/o/de-live%2Foriginal_1179x663_vwuum3xjyq55ju7dqsbb_175153527867192.png?generation=1751535278162056&amp;alt=media'}",51.2187205,6.658814,
