name,disciplines,plus_options,plans,min_plan,district,street,link,metadata,latitude,longitude,description
Balance Club Lumiar,"['Aqua', 'Fitness', 'Indoorcycling', 'Pilates', 'Yoga']",False,"['S', 'M', 'L', 'XL']",S,Lumiar,Rua Amílcar Cabral 40-B,https://urbansportsclub.com//de/venues/balance-club-lumiar,"{'@context': 'http://schema.org', '@type': 'LocalBusiness', 'name': 'Balance Club Lumiar', 'description': 'Um Clube de excelência, uma Marca com 14 anos de experiência, onde primamos pela diferença, onde o seu treino é adaptado à sua medida e aos seus objetivos. A extensão de sua casa, dividida em várias áreas: - Zona de Treino de Força, com máquinas de tecnologia de ponta e inteligente - Zona de Pesos Livres - Área de Treino Funcional - Estúdios de Aulas de Grupo - Área da Piscina, com o seu próprio balneário de apoio', 'address': {'@type': 'PostalAddress', 'addressLocality': 'Lisbon, Portugal', 'addressCountry': 'Portugal', 'postalCode': '1750-020', 'streetAddress': 'Rua Amílcar Cabral 40-B'}, 'telephone': '', 'geo': {'@type': 'GeoCoordinates', 'latitude': '38.764965', 'longitude': '-9.1519'}, 'priceRange': '-', 'image': 'https://storage.googleapis.com/download/storage/v1/b/usc-pro-uscweb-live-media/o/de-live%2Foriginal_1024x576_BC%20Lumiar%20%283%29_1627896494368377_admin.jpeg?alt=media'}",38.764965,-9.1519,"Um Clube de excelência, uma Marca com 14 anos de experiência, onde primamos pela diferença, onde o seu treino é adaptado à sua medida e aos seus objetivos. A extensão de sua casa, dividida em várias áreas: - Zona de Treino de Força, com máquinas de tecnologia de ponta e inteligente - Zona de Pesos Livres - Área de Treino Funcional - Estúdios de Aulas de Grupo - Área da Piscina, com o seu próprio balneário de apoio"
Padel Benfica,['Padel'],False,"['M', 'L', 'XL']",M,Benfica,Parque Silva Porto,https://urbansportsclub.com//de/venues/padel-benfica,"{'@context': 'http://schema.org', '@type': 'LocalBusiness', 'name': 'Padel Benfica', 'description': 'Este simpático clube, situado no coração de Lisboa junto ao jardim zoológico, dispõe de uma escola de ténis destinada a crianças e adultos. Se preferir, poderá apenas desfrutar das refeições ligeiras no snack-bar e da fantástica esplanada. O ténis Laranjeiras possui dois excelentes campos de ténis de piso rápido cujos adeptos não tem poupado elogios. O campos foram recentemente objecto de obras de manutenção que melhoraram significativamente este equipamento.', 'address': {'@type': 'PostalAddress', 'addressLocality': 'Lisbon, Portugal', 'addressCountry': 'Portugal', 'postalCode': '1500-475', 'streetAddress': 'Parque Silva Porto'}, 'telephone': '', 'geo': {'@type': 'GeoCoordinates', 'latitude': '38.7488528', 'longitude': '-9.203616'}, 'priceRange': '-', 'image': 'https://storage.googleapis.com/download/storage/v1/b/usc-pro-uscweb-live-media/o/de-live%2Foriginal_1024x576_58444033_2173234666106192_1628895870613192704_n_1569402558169889_admin.jpg?alt=media'}",38.7488528,-9.203616,"Este simpático clube, situado no coração de Lisboa junto ao jardim zoológico, dispõe de uma escola de ténis destinada a crianças e adultos. Se preferir, poderá apenas desfrutar das refeições ligeiras no snack-bar e da fantástica esplanada. O ténis Laranjeiras possui dois excelentes campos de ténis de piso rápido cujos adeptos não tem poupado elogios. O campos foram recentemente objecto de obras de manutenção que melhoraram significativamente este equipamento."
Solinca Classic Colombo,"['Aqua', 'Fitness', 'Funktionelles Training', 'Indoorcycling', 'Pilates', 'Qi Gong und Tai Chi', 'Schwimmen', 'Tanzen', 'Yoga']",False,"['M', 'L', 'XL']",M,Benfica,"Solinca Colombo, Centro Comercial Colombo Loja A 201 , Avenida Lusiada",https://urbansportsclub.com//de/venues/solinca-classic-colombo,"{'@context': 'http://schema.org', '@type': 'LocalBusiness', 'name': 'Solinca Classic Colombo', 'description': 'Queremos ajudar a mudar Portugal, uma pessoa de cada vez, estimulando hábitos de vida saudáveis, através da prática regular de exercício físico, contribuindo para uma vida mais equilibrada e feliz. Solinca está determinada a garantir FITNESS PARA TODOS! Tanto no Solinca Classic, com piscina, sauna, banho turco e jacuzzi, como no Solinca Light, terá sempre acesso a planos adaptados aos seus objetivos de treino, às melhores aulas de grupo (incluindo todas as modalidades Les Mills), sempre com o apoio dos melhores profissionais de fitness do país.', 'address': {'@type': 'PostalAddress', 'addressLocality': 'Lisbon, Portugal', 'addressCountry': 'Portugal', 'postalCode': '1500-392', 'streetAddress': 'Solinca Colombo, Centro Comercial Colombo Loja A 201 , Avenida Lusiada'}, 'telephone': '+351 21 012 9670', 'geo': {'@type': 'GeoCoordinates', 'latitude': '38.755511', 'longitude': '-9.1869918'}, 'priceRange': '-', 'image': 'https://storage.googleapis.com/download/storage/v1/b/usc-pro-uscweb-live-media/o/de-live%2Foriginal_1024x576_Solinca%20Classic%20Colombo_162159628135794_admin.jpg?alt=media'}",38.755511,-9.1869918,"Queremos ajudar a mudar Portugal, uma pessoa de cada vez, estimulando hábitos de vida saudáveis, através da prática regular de exercício físico, contribuindo para uma vida mais equilibrada e feliz. Solinca está determinada a garantir FITNESS PARA TODOS! Tanto no Solinca Classic, com piscina, sauna, banho turco e jacuzzi, como no Solinca Light, terá sempre acesso a planos adaptados aos seus objetivos de treino, às melhores aulas de grupo (incluindo todas as modalidades Les Mills), sempre com o apoio dos melhores profissionais de fitness do país."
Solinca Light Alvalade,"['Crosstraining', 'Fitness', 'Funktionelles Training', 'Indoorcycling', 'Pilates', 'Yoga']",False,"['S', 'M', 'L', 'XL']",S,Alvalade,"Solinca Alvalade - Rua Francisco Stromp, nº14 C",https://urbansportsclub.com//de/venues/solinca-light-alvalade,"{'@context': 'http://schema.org', '@type': 'LocalBusiness', 'name': 'Solinca Light Alvalade', 'description': 'Queremos ajudar a mudar Portugal, uma pessoa de cada vez, estimulando hábitos de vida saudáveis, através da prática regular de exercício físico, contribuindo para uma vida mais equilibrada e feliz. Solinca está determinada a garantir FITNESS PARA TODOS! Tanto no Solinca Classic, com piscina, sauna, banho turco e jacuzzi, como no Solinca Light, terá sempre acesso a planos adaptados aos seus objetivos de treino, às melhores aulas de grupo (incluindo todas as modalidades Les Mills), sempre com o apoio dos melhores profissionais de fitness do país.', 'address': {'@type': 'PostalAddress', 'addressLocality': 'Lisbon, Portugal', 'addressCountry': 'Portugal', 'postalCode': '1600-464', 'streetAddress': 'Solinca Alvalade - Rua Francisco Stromp, nº14 C'}, 'telephone': '+351 934 557 603', 'geo': {'@type': 'GeoCoordinates', 'latitude': '38.7638954', 'longitude': '-9.1596606'}, 'priceRange': '-', 'image': 'https://storage.googleapis.com/download/storage/v1/b/usc-pro-uscweb-live-media/o/de-live%2Foriginal_1024x576_Solinca%20Light%20Alvalade_1621602892384262_admin.jpg?alt=media'}",38.7638954,-9.1596606,"Queremos ajudar a mudar Portugal, uma pessoa de cada vez, estimulando hábitos de vida saudáveis, através da prática regular de exercício físico, contribuindo para uma vida mais equilibrada e feliz. Solinca está determinada a garantir FITNESS PARA TODOS! Tanto no Solinca Classic, com piscina, sauna, banho turco e jacuzzi, como no Solinca Light, terá sempre acesso a planos adaptados aos seus objetivos de treino, às melhores aulas de grupo (incluindo todas as modalidades Les Mills), sempre com o apoio dos melhores profissionais de fitness do país."
Estúdio One,"['Fitness', 'Pilates']",False,"['S', 'M', 'L', 'XL']",S,Carnide,"Estrada da Luz, 220 B",https://urbansportsclub.com//de/venues/estudio-one,"{'@context': 'http://schema.org', '@type': 'LocalBusiness', 'name': 'Estúdio One', 'description': 'O Estúdio One é um espaço único e acolhedor que tem como principal objetivo oferecer-lhe uma experiência personalizada e inesquecível de treino. Somos uma equipa multidisciplinar empenhada e focada na saúde física, mental e emocional dos nossos alunos. Para irmos ao encontro das necessidades individuais de cada cliente, temos duas áreas de actuação: treino personalizado e aulas em pequenos grupos (step coreografado, pilates, localizada, legs one, hiit e abdominais), presencial e online.', 'address': {'@type': 'PostalAddress', 'addressLocality': 'Lisbon, Portugal', 'addressCountry': 'Portugal', 'postalCode': '1600-430', 'streetAddress': 'Estrada da Luz, 220 B'}, 'telephone': '+351 965 720 676', 'geo': {'@type': 'GeoCoordinates', 'latitude': '38.7595076', 'longitude': '-9.1812802'}, 'priceRange': '-', 'image': 'https://storage.googleapis.com/download/storage/v1/b/usc-pro-uscweb-live-media/o/de-live%2Foriginal_1212x682_unnamed-6%20-%20co%CC%81pia_1641933377300672_admin.jpg?generation=1641933377426297&amp;alt=media'}",38.7595076,-9.1812802,"O Estúdio One é um espaço único e acolhedor que tem como principal objetivo oferecer-lhe uma experiência personalizada e inesquecível de treino. Somos uma equipa multidisciplinar empenhada e focada na saúde física, mental e emocional dos nossos alunos. Para irmos ao encontro das necessidades individuais de cada cliente, temos duas áreas de actuação: treino personalizado e aulas em pequenos grupos (step coreografado, pilates, localizada, legs one, hiit e abdominais), presencial e online."
Índice Gym,"['Fitness', 'Indoorcycling', 'Pilates', 'Yoga']",False,"['S', 'M', 'L', 'XL']",S,Sintra,R. Marquês Pombal 122,https://urbansportsclub.com//de/venues/indice-gym-massagem,"{'@context': 'http://schema.org', '@type': 'LocalBusiness', 'name': 'Índice Gym', 'description': 'O Índice Gym está a aguardar a tua visita!', 'address': {'@type': 'PostalAddress', 'addressLocality': 'Lisbon, Portugal', 'addressCountry': 'Portugal', 'postalCode': '2735-313', 'streetAddress': 'Rua Marquês de Pombal n122 A/B'}, 'telephone': '+351 929 062 880', 'geo': {'@type': 'GeoCoordinates', 'latitude': '38.7743136', 'longitude': '-9.3138827'}, 'priceRange': '-', 'image': 'https://storage.googleapis.com/download/storage/v1/b/usc-pro-uscweb-live-media/o/de-live%2Foriginal_1688x950_Funktionelles%20Training%20compressed_1581518216177651_admin.jpg?alt=media'}",38.7743136,-9.3138827,O Índice Gym está a aguardar a tua visita!
Fitness Factory Alverca,['Fitness'],False,"['S', 'M', 'L', 'XL']",S,Alverca do Ribatejo,Fitness Factory Alverca,https://urbansportsclub.com//de/venues/fitness-factory-alverca,"{'@context': 'http://schema.org', '@type': 'LocalBusiness', 'name': 'Fitness Factory Alverca', 'description': 'Espaço com cerca de 1200 metros quadrados, dividido por áreas específicas, uma dedicada ao cardio, outra dedicada à musculação e pesos livres e outra zona de treino funcional, cross box. O ginásio dispõe também de dois estúdios de aulas de grupo. O espaço é amplo e aberto, com bastante luz natural, orientado para os atletas fazerem o seu treino, de forma autónoma, mas sempre com acompanhamento atento de um personal trainer/instrutor, sempre que necessário.', 'address': {'@type': 'PostalAddress', 'addressLocality': 'Lisbon, Portugal', 'addressCountry': 'Portugal', 'postalCode': '2619-501', 'streetAddress': 'Fitness Factory Alverca'}, 'telephone': '', 'geo': {'@type': 'GeoCoordinates', 'latitude': '38.8850832', 'longitude': '-9.0470747'}, 'priceRange': '-', 'image': 'https://storage.googleapis.com/download/storage/v1/b/usc-pro-uscweb-live-media/o/de-live%2Foriginal_1536x864_FF7_1695986215592488_admin.jpg?generation=1695986215661443&amp;alt=media'}",38.8850832,-9.0470747,"Espaço com cerca de 1200 metros quadrados, dividido por áreas específicas, uma dedicada ao cardio, outra dedicada à musculação e pesos livres e outra zona de treino funcional, cross box. O ginásio dispõe também de dois estúdios de aulas de grupo. O espaço é amplo e aberto, com bastante luz natural, orientado para os atletas fazerem o seu treino, de forma autónoma, mas sempre com acompanhamento atento de um personal trainer/instrutor, sempre que necessário."
Ninja Factory,"['Boxsport', 'Fitness', 'Funktionelles Training', 'Parkour']",False,"['M', 'L', 'XL']",M,Amadora,Rua do Entreposto Industrial nº15,https://urbansportsclub.com//de/venues/ninja-factory,"{'@context': 'http://schema.org', '@type': 'LocalBusiness', 'name': 'Ninja Factory', 'description': 'A Ninja Factory reúne num só espaço com 1000m2, várias modalidades desportivas alternativas, com a garantia de uma experiência de treino única com todo o cuidado e segurança. Aproveite a visita para conhecer a nossa oferta de serviços de saúde e bem-estar. Cuide da mente e do corpo num só espaço.', 'address': {'@type': 'PostalAddress', 'addressLocality': 'Lisbon, Portugal', 'addressCountry': 'Portugal', 'postalCode': '2610', 'streetAddress': 'Rua do Entreposto Industrial nº15'}, 'telephone': '+49 9190 27005', 'geo': {'@type': 'GeoCoordinates', 'latitude': '38.740905137', 'longitude': '-9.228070602'}, 'priceRange': '-', 'image': 'https://storage.googleapis.com/download/storage/v1/b/usc-pro-uscweb-live-media/o/de-live%2Foriginal_1638x921_IMG_9567_1685457192377210_admin.jpg?generation=1685457192451864&amp;alt=media'}",38.740905137,-9.228070602,"A Ninja Factory reúne num só espaço com 1000m2, várias modalidades desportivas alternativas, com a garantia de uma experiência de treino única com todo o cuidado e segurança. Aproveite a visita para conhecer a nossa oferta de serviços de saúde e bem-estar. Cuide da mente e do corpo num só espaço."
Pole Dance Portugal,"['Aerial', 'Fitness', 'Pole Dance']",False,"['M', 'L', 'XL']",M,Carnaxide,"Estrada da Portela, Pole Dance Portugal",https://urbansportsclub.com//de/venues/pole-dance-portugal-1,"{'@context': 'http://schema.org', '@type': 'LocalBusiness', 'name': 'Pole Dance Portugal', 'description': 'Venha experimentar as aulas da Pole Dance Portugal em Carnaxide (Oeiras). Oferecemos aulas de alta qualidade para todos os níveis. As nossas turmas são pequenas e o instrutor ajusta o movimento consoante o nível de cada aluno. O nosso espaço é elegante, tem muita luz natural e uma ótima energia para treinar. Venha aprender essa arte maravilhosa com os melhores professores e sinta-se mais confiante no seu corpo e mente. Não perca esta oportunidade!', 'address': {'@type': 'PostalAddress', 'addressLocality': 'Lisbon, Portugal', 'addressCountry': 'Portugal', 'postalCode': '2790-000', 'streetAddress': 'Estrada da Portela, Pole Dance Portugal'}, 'telephone': '+351 915 202 116', 'geo': {'@type': 'GeoCoordinates', 'latitude': '38.7209065', 'longitude': '-9.2218831'}, 'priceRange': '-', 'image': 'https://storage.googleapis.com/download/storage/v1/b/usc-pro-uscweb-live-media/o/de-live%2Foriginal_3851x2166_image00002_1682001501162997_admin.jpeg?generation=1682001501241709&amp;alt=media'}",38.7209065,-9.2218831,"Venha experimentar as aulas da Pole Dance Portugal em Carnaxide (Oeiras). Oferecemos aulas de alta qualidade para todos os níveis. As nossas turmas são pequenas e o instrutor ajusta o movimento consoante o nível de cada aluno. O nosso espaço é elegante, tem muita luz natural e uma ótima energia para treinar. Venha aprender essa arte maravilhosa com os melhores professores e sinta-se mais confiante no seu corpo e mente. Não perca esta oportunidade!"
Arena Fitness Clubs - Aqua & Fitness Club,"['Aqua', 'Fitness', 'Funktionelles Training', 'Indoorcycling', 'Pilates', 'Schwimmen', 'Tanzen', 'Yoga']",False,"['M', 'L', 'XL']",M,Oeiras,"Rua Av.ª, Av. Dr. Francisco de Sá Carneiro 13L,Oeiras",https://urbansportsclub.com//de/venues/arena-fitness-clubs-aqua-fitness-club,"{'@context': 'http://schema.org', '@type': 'LocalBusiness', 'name': 'Arena Fitness Clubs - Aqua &amp; Fitness Club', 'description': 'Nos ginásios Arena temos como objetivo fazer com que o exercício e o bem estar sejam acessíveis a todos, independentemente da idade, ajudando cada um a descobrir o seu próprio potencial.', 'address': {'@type': 'PostalAddress', 'addressLocality': 'Lisbon, Portugal', 'addressCountry': 'Portugal', 'postalCode': '2780-241', 'streetAddress': 'Rua Av.ª, Av. Dr. Francisco de Sá Carneiro 13L,Oeiras'}, 'telephone': '+351 21 193 5462', 'geo': {'@type': 'GeoCoordinates', 'latitude': '38.691673', 'longitude': '-9.304768'}, 'priceRange': '-', 'image': 'https://storage.googleapis.com/download/storage/v1/b/usc-pro-uscweb-live-media/o/de-live%2Foriginal_1024x576_transferir%20%281%29_1585137700703405_admin.jpeg?alt=media'}",38.691673,-9.304768,"Nos ginásios Arena temos como objetivo fazer com que o exercício e o bem estar sejam acessíveis a todos, independentemente da idade, ajudando cada um a descobrir o seu próprio potencial."
People Family Club Mafra,"['Aqua', 'Boxsport', 'Crosstraining', 'Fitness', 'Funktionelles Training', 'Indoorcycling', 'Pilates', 'Schwimmen', 'Yoga']",False,"['M', 'L', 'XL']",M,Mafra,Rua do Sol Nascente,https://urbansportsclub.com//de/venues/people-family-club-mafra,"{'@context': 'http://schema.org', '@type': 'LocalBusiness', 'name': 'People Family Club Mafra', 'description': 'O People Family Club é um clube familiar de exercício físico, nutrição e bem-estar. Conta com atividades de ginásio, piscina, aulas de fitness e spa. Em termos de possibilidades de utilização, a oferta do People Family Club integra as várias atividades enumeradas de treino, e serviços complementares, como por exemplo, toalha para o treino, baby-sitting, fornecimento de água mineral ou estacionamento interior. Tudo à disposição para seu pleno bem-estar!', 'address': {'@type': 'PostalAddress', 'addressLocality': 'Lisbon, Portugal', 'addressCountry': 'Portugal', 'postalCode': '2640-431', 'streetAddress': 'Rua do Sol Nascente'}, 'telephone': '', 'geo': {'@type': 'GeoCoordinates', 'latitude': '38.9425393', 'longitude': '-9.3497655'}, 'priceRange': '-', 'image': 'https://storage.googleapis.com/download/storage/v1/b/usc-pro-uscweb-live-media/o/de-live%2Foriginal_1024x576_Mafra%201_1621441584818481_admin.jpg?alt=media'}",38.9425393,-9.3497655,"O People Family Club é um clube familiar de exercício físico, nutrição e bem-estar. Conta com atividades de ginásio, piscina, aulas de fitness e spa. Em termos de possibilidades de utilização, a oferta do People Family Club integra as várias atividades enumeradas de treino, e serviços complementares, como por exemplo, toalha para o treino, baby-sitting, fornecimento de água mineral ou estacionamento interior. Tudo à disposição para seu pleno bem-estar!"
Solinca Classic Loures,"['Aqua', 'Fitness', 'Funktionelles Training', 'Indoorcycling', 'Pilates', 'Qi Gong und Tai Chi', 'Schwimmen', 'Yoga']",False,"['M', 'L', 'XL']",M,Loures,"Solinca Loures - LoureShopping, Loja A. Av. Descobertas nº 90",https://urbansportsclub.com//de/venues/solinca-classic-loures,"{'@context': 'http://schema.org', '@type': 'LocalBusiness', 'name': 'Solinca Classic Loures', 'description': 'Queremos ajudar a mudar Portugal, uma pessoa de cada vez, estimulando hábitos de vida saudáveis, através da prática regular de exercício físico, contribuindo para uma vida mais equilibrada e feliz. Solinca está determinada a garantir FITNESS PARA TODOS! Tanto no Solinca Classic, com piscina, sauna, banho turco e jacuzzi, como no Solinca Light, terá sempre acesso a planos adaptados aos seus objetivos de treino, às melhores aulas de grupo (incluindo todas as modalidades Les Mills), sempre com o apoio dos melhores profissionais de fitness do país.', 'address': {'@type': 'PostalAddress', 'addressLocality': 'Lisbon, Portugal', 'addressCountry': 'Portugal', 'postalCode': '2670-457', 'streetAddress': 'Solinca Loures - LoureShopping, Loja A. Av. Descobertas nº 90'}, 'telephone': '+351 21 152 7390', 'geo': {'@type': 'GeoCoordinates', 'latitude': '38.833397', 'longitude': '-9.15667'}, 'priceRange': '-', 'image': 'https://storage.googleapis.com/download/storage/v1/b/usc-pro-uscweb-live-media/o/de-live%2Foriginal_1024x576_Solinca%20Classic%20Loures_1621596764495910_admin.jpg?alt=media'}",38.833397,-9.15667,"Queremos ajudar a mudar Portugal, uma pessoa de cada vez, estimulando hábitos de vida saudáveis, através da prática regular de exercício físico, contribuindo para uma vida mais equilibrada e feliz. Solinca está determinada a garantir FITNESS PARA TODOS! Tanto no Solinca Classic, com piscina, sauna, banho turco e jacuzzi, como no Solinca Light, terá sempre acesso a planos adaptados aos seus objetivos de treino, às melhores aulas de grupo (incluindo todas as modalidades Les Mills), sempre com o apoio dos melhores profissionais de fitness do país."
Solinca Lagoas Park,"['Fitness', 'Indoorcycling', 'Pilates', 'Schwimmen', 'Yoga']",False,"['M', 'L', 'XL']",M,Oeiras,Solinca Lagoas,https://urbansportsclub.com//de/venues/solinca-lagoas-park,"{'@context': 'http://schema.org', '@type': 'LocalBusiness', 'name': 'Solinca Lagoas Park', 'description': 'Queremos ajudar a mudar Portugal, uma pessoa de cada vez, estimulando hábitos de vida saudáveis, através da prática regular de exercício físico, contribuindo para uma vida mais equilibrada e feliz. Solinca está determinada a garantir FITNESS PARA TODOS! Tanto no Solinca Classic, com piscina, sauna, banho turco e jacuzzi, como no Solinca Light, terá sempre acesso a planos adaptados aos seus objetivos de treino, às melhores aulas de grupo (incluindo todas as modalidades Les Mills), sempre com o apoio dos melhores profissionais de fitness do país.', 'address': {'@type': 'PostalAddress', 'addressLocality': 'Lisbon, Portugal', 'addressCountry': 'Portugal', 'postalCode': '2740-245', 'streetAddress': 'Solinca Lagoas'}, 'telephone': '', 'geo': {'@type': 'GeoCoordinates', 'latitude': '38.7142716', 'longitude': '-9.3089739'}, 'priceRange': '-', 'image': 'https://storage.googleapis.com/download/storage/v1/b/usc-pro-uscweb-live-media/o/de-live%2Foriginal_1024x576_Solinca%20Classic%20Lagoas_1689075791896457_admin.jpg?generation=1689075791995219&amp;alt=media'}",38.7142716,-9.3089739,"Queremos ajudar a mudar Portugal, uma pessoa de cada vez, estimulando hábitos de vida saudáveis, através da prática regular de exercício físico, contribuindo para uma vida mais equilibrada e feliz. Solinca está determinada a garantir FITNESS PARA TODOS! Tanto no Solinca Classic, com piscina, sauna, banho turco e jacuzzi, como no Solinca Light, terá sempre acesso a planos adaptados aos seus objetivos de treino, às melhores aulas de grupo (incluindo todas as modalidades Les Mills), sempre com o apoio dos melhores profissionais de fitness do país."
Solinca Light Estoril,"['Crosstraining', 'Fitness', 'Funktionelles Training', 'Indoorcycling', 'Pilates', 'Yoga']",False,"['S', 'M', 'L', 'XL']",S,Estoril,Solinca Light Estoril,https://urbansportsclub.com//de/venues/solinca-light-estoril,"{'@context': 'http://schema.org', '@type': 'LocalBusiness', 'name': 'Solinca Light Estoril', 'description': 'Queremos ajudar a mudar Portugal, uma pessoa de cada vez, estimulando hábitos de vida saudáveis, através da prática regular de exercício físico, contribuindo para uma vida mais equilibrada e feliz. Solinca está determinada a garantir FITNESS PARA TODOS! Tanto no Solinca Classic, com piscina, sauna, banho turco e jacuzzi, como no Solinca Light, terá sempre acesso a planos adaptados aos seus objetivos de treino, às melhores aulas de grupo (incluindo todas as modalidades Les Mills), sempre com o apoio dos melhores profissionais de fitness do país.', 'address': {'@type': 'PostalAddress', 'addressLocality': 'Lisbon, Portugal', 'addressCountry': 'Portugal', 'postalCode': '2765', 'streetAddress': 'Solinca Light Estoril'}, 'telephone': '', 'geo': {'@type': 'GeoCoordinates', 'latitude': '38.7139609', 'longitude': '-9.3863234'}, 'priceRange': '-', 'image': 'https://storage.googleapis.com/download/storage/v1/b/usc-pro-uscweb-live-media/o/de-live%2Foriginal_1024x576_Solinca%20Light%20Odivelas_1678801860363589_admin.jpg?generation=1678801860453051&amp;alt=media'}",38.7139609,-9.3863234,"Queremos ajudar a mudar Portugal, uma pessoa de cada vez, estimulando hábitos de vida saudáveis, através da prática regular de exercício físico, contribuindo para uma vida mais equilibrada e feliz. Solinca está determinada a garantir FITNESS PARA TODOS! Tanto no Solinca Classic, com piscina, sauna, banho turco e jacuzzi, como no Solinca Light, terá sempre acesso a planos adaptados aos seus objetivos de treino, às melhores aulas de grupo (incluindo todas as modalidades Les Mills), sempre com o apoio dos melhores profissionais de fitness do país."
