name,disciplines,plus_options,plans,min_plan,district,street,link,metadata,latitude,longitude,description
dasGYM,['Fitness'],False,"['Classic', 'Premium', 'Max']",Classic,Euskirchen,Narzissenweg 23,https://urbansportsclub.com//en/venues/dasgym,"{'@context': 'http://schema.org', '@type': 'LocalBusiness', 'name': 'dasGYM', 'description': 'dasGYM Euskirchen ist ein Ort, indem Sportler sich wohlfühlen und ihrer Leidschaft nachkommen können. Dabei spielt es keine Rolle ob du jung oder alt, Frau oder Mann, Trainingseinsteiger oder ambitionierter Fitnessprofi bist. Das moderne Ambiente lädt nicht nur zum gemütlichen Austausch ein, sondern ist auch wichtiger Bestandteil des Fintesslifestyles. Das Studio ist über 2000qm groß und mit einem umfangreichen Angebot an modernsten Trainingsgeräten (DHZ-Fitness und gym80) ausgestattet. dasGYM bietet den größten Functional Bereich im Umkreis, hierkommen Gewichtsschlitten, Slingtrainer, Functional-Tower uvm. zum Einsatz. Für alle die das Gruppentraining lieben, wird ein facettenreicher Kursplan angeboten. Von A wie Aerobic bis Z wie Zirkeltraining ist alles dabei. Nicht nur die Großen kommen im dasGYM auf ihre Kosten. Auch die heranwachsenden Sportler, haben hier die Möglichkeit sich zu entfalten. Neben Kinderkursen findet mehrmals wöchentlich eine Kinderbetreuung statt. dasGYM Euskirchen lebt die Vision eines professionellen Studios, eine kompetente Beratung vom Service Mitarbeiter bis hin zum Trainer sind uns wichtig. Wir möchten nicht behaupten das beste Studio im Umland zu sein, aber zumindest ganz nah dran.', 'address': {'@type': 'PostalAddress', 'addressLocality': 'Bonn, Germany', 'addressCountry': 'Germany', 'postalCode': '53881', 'streetAddress': 'Narzissenweg 23'}, 'telephone': '', 'geo': {'@type': 'GeoCoordinates', 'latitude': '50.646571', 'longitude': '6.8053251'}, 'priceRange': '-', 'image': 'https://storage.googleapis.com/download/storage/v1/b/usc-pro-uscweb-live-media/o/de-live%2Foriginal_1200x675_511c5531d976-dasGYM_Facebook_Logo_Wei%C3%9F_1567669985465319_admin.jpg?alt=media'}",50.646571,6.8053251,"dasGYM Euskirchen ist ein Ort, indem Sportler sich wohlfühlen und ihrer Leidschaft nachkommen können. Dabei spielt es keine Rolle ob du jung oder alt, Frau oder Mann, Trainingseinsteiger oder ambitionierter Fitnessprofi bist. Das moderne Ambiente lädt nicht nur zum gemütlichen Austausch ein, sondern ist auch wichtiger Bestandteil des Fintesslifestyles. Das Studio ist über 2000qm groß und mit einem umfangreichen Angebot an modernsten Trainingsgeräten (DHZ-Fitness und gym80) ausgestattet. dasGYM bietet den größten Functional Bereich im Umkreis, hierkommen Gewichtsschlitten, Slingtrainer, Functional-Tower uvm. zum Einsatz. Für alle die das Gruppentraining lieben, wird ein facettenreicher Kursplan angeboten. Von A wie Aerobic bis Z wie Zirkeltraining ist alles dabei. Nicht nur die Großen kommen im dasGYM auf ihre Kosten. Auch die heranwachsenden Sportler, haben hier die Möglichkeit sich zu entfalten. Neben Kinderkursen findet mehrmals wöchentlich eine Kinderbetreuung statt. dasGYM Euskirchen lebt die Vision eines professionellen Studios, eine kompetente Beratung vom Service Mitarbeiter bis hin zum Trainer sind uns wichtig. Wir möchten nicht behaupten das beste Studio im Umland zu sein, aber zumindest ganz nah dran."
Stuntwerk Troisdorf,"['Bouldering', 'Fitness', 'Yoga']",False,"['Classic', 'Premium', 'Max']",Classic,Troisdorf,Kölner Straße 2,https://urbansportsclub.com//en/venues/stuntwerk-troisdorf,"{'@context': 'http://schema.org', '@type': 'LocalBusiness', 'name': 'Stuntwerk Troisdorf', 'description': 'Das große und vielfältige Stuntwerk bietet dir nicht nur Bouldern, sondern auch spannende Fitness-Kurse, spezielles Yoga, funktionelles Trainingxa0und denxa0Trendsport der Straße &quot;Parkour&quot;. Hier kannst du dich als Mitglied des Urban Sports Clubs auspowern, fit werden und Spaß haben. Die Boulderhallexa0umfasst neben einfachen und komplexen Boulderrouten, Duschen und Umkleiden auch einen Bereich, in demxa0du zu den Kursen deine Kraft und Koordination für das Bouldern verbessern kannst. Wer danach noch entspannen will, kann in dem hauseigenen Bistro noch eine Kleinigkeit essen oder den Blick über die Halle genießen! Probierxa0doch einfach mal Bouldern aus und lerne deinen Körper ganz neu kennen! Bitte melde dich telefonischxa002218889390xa0oder perxa0Mailxa0für deinenxa0Kursxa0an (zum offenen Parkour- und Bouldertreff ist keine Anmeldung erforderlich).', 'address': {'@type': 'PostalAddress', 'addressLocality': 'Bonn, Germany', 'addressCountry': 'Germany', 'postalCode': '53840', 'streetAddress': 'Kölner Straße 2'}, 'telephone': '+49 221 8889390', 'geo': {'@type': 'GeoCoordinates', 'latitude': '50.8140067', 'longitude': '7.1629448'}, 'priceRange': '-', 'image': 'https://storage.googleapis.com/download/storage/v1/b/usc-pro-uscweb-live-media/o/de-live%2Foriginal_640x360_vryopcuqgnexgyxctyc0_1717597654451285.png?generation=1717597654501079&amp;alt=media'}",50.8140067,7.1629448,"Das große und vielfältige Stuntwerk bietet dir nicht nur Bouldern, sondern auch spannende Fitness-Kurse, spezielles Yoga, funktionelles Trainingxa0und denxa0Trendsport der Straße &quot;Parkour&quot;. Hier kannst du dich als Mitglied des Urban Sports Clubs auspowern, fit werden und Spaß haben. Die Boulderhallexa0umfasst neben einfachen und komplexen Boulderrouten, Duschen und Umkleiden auch einen Bereich, in demxa0du zu den Kursen deine Kraft und Koordination für das Bouldern verbessern kannst. Wer danach noch entspannen will, kann in dem hauseigenen Bistro noch eine Kleinigkeit essen oder den Blick über die Halle genießen! Probierxa0doch einfach mal Bouldern aus und lerne deinen Körper ganz neu kennen! Bitte melde dich telefonischxa002218889390xa0oder perxa0Mailxa0für deinenxa0Kursxa0an (zum offenen Parkour- und Bouldertreff ist keine Anmeldung erforderlich)."
The Vinyasa People Yoga Studio,"['Meditation', 'Pilates', 'Yoga']",False,"['Classic', 'Premium', 'Max']",Classic,Südstadt,Kaiserstr. 1a,https://urbansportsclub.com//en/venues/the-vinyasa-people-yoga-studio,"{'@context': 'http://schema.org', '@type': 'LocalBusiness', 'name': 'The Vinyasa People Yoga Studio', 'description': '.', 'address': {'@type': 'PostalAddress', 'addressLocality': 'Bonn, Germany', 'addressCountry': 'Germany', 'postalCode': '53113', 'streetAddress': 'Kaiserstr. 1a'}, 'telephone': '+49 228 18030024', 'geo': {'@type': 'GeoCoordinates', 'latitude': '50.7314273', 'longitude': '7.1020266'}, 'priceRange': '-', 'image': 'https://storage.googleapis.com/download/storage/v1/b/usc-pro-uscweb-live-media/o/de-live%2Foriginal_640x360_an5zjcil160upkj354qg_1715092772158355.png?generation=1715092772229386&amp;alt=media'}",50.7314273,7.1020266,.
CityFit Black Label Spich,['Fitness'],False,"['Classic', 'Premium', 'Max']",Classic,Troisdorf,Junkersring 3,https://urbansportsclub.com//en/venues/cityfit-vertikal,"{'@context': 'http://schema.org', '@type': 'LocalBusiness', 'name': 'CityFit Black Label Spich', 'description': 'Cityfit Vertikal freut sich auf dich!', 'address': {'@type': 'PostalAddress', 'addressLocality': 'Bonn, Germany', 'addressCountry': 'Germany', 'postalCode': '53844', 'streetAddress': 'Junkersring 3'}, 'telephone': '+44 22418468720', 'geo': {'@type': 'GeoCoordinates', 'latitude': '50.8158686', 'longitude': '7.1079335'}, 'priceRange': '-', 'image': 'https://storage.googleapis.com/download/storage/v1/b/usc-pro-uscweb-live-media/o/de-live%2Foriginal_640x360_eaeyuxdqe4zo8znjlv1g_1731080066475929.png?generation=1731080066610019&amp;alt=media'}",50.8158686,7.1079335,Cityfit Vertikal freut sich auf dich!
CityFit Black Label St.Augustin,['Fitness'],False,"['Classic', 'Premium', 'Max']",Classic,Sankt Augustin,Bonner Straße 137,https://urbansportsclub.com//en/venues/cityfit-staugustin,"{'@context': 'http://schema.org', '@type': 'LocalBusiness', 'name': 'CityFit Black Label St.Augustin', 'description': 'CityFit freut sich auf Dich!', 'address': {'@type': 'PostalAddress', 'addressLocality': 'Bonn, Germany', 'addressCountry': 'Germany', 'postalCode': '53757', 'streetAddress': 'Bonner Straße 137'}, 'telephone': '+44 22419447377', 'geo': {'@type': 'GeoCoordinates', 'latitude': '50.7792175', 'longitude': '7.1909308'}, 'priceRange': '-', 'image': 'https://storage.googleapis.com/download/storage/v1/b/usc-pro-uscweb-live-media/o/de-live%2Foriginal_640x360_tciblk9fn2sdkhkdyhgj_1731082321818452.png?generation=1731082321918878&amp;alt=media'}",50.7792175,7.1909308,CityFit freut sich auf Dich!
HallenFreizeitBad Bornheim,['Swimming'],False,"['Classic', 'Premium', 'Max']",Classic,Bornheim,Rilkestraße 3,https://urbansportsclub.com//en/venues/hallenfreizeitbad-bornheim-1,"{'@context': 'http://schema.org', '@type': 'LocalBusiness', 'name': 'HallenFreizeitBad Bornheim', 'description': 'HallenFreizeitBad Bornheim freut sich auf dich!', 'address': {'@type': 'PostalAddress', 'addressLocality': 'Bonn, Germany', 'addressCountry': 'Germany', 'postalCode': '53332', 'streetAddress': 'Rilkestraße 3'}, 'telephone': '+44 022223716', 'geo': {'@type': 'GeoCoordinates', 'latitude': '50.7618489', 'longitude': '6.9983819'}, 'priceRange': '-', 'image': 'https://storage.googleapis.com/download/storage/v1/b/usc-pro-uscweb-live-media/o/de-live%2Foriginal_497x280_zeu5wemyu7vdiiod0ibd_172682769957336.png?generation=1726827699145009&amp;alt=media'}",50.7618489,6.9983819,HallenFreizeitBad Bornheim freut sich auf dich!
BE FIT Rheinbach,['Fitness'],False,"['Classic', 'Premium', 'Max']",Classic,Rheinbach,An den Märkten 9,https://urbansportsclub.com//en/venues/be-fit-rheinbach-1,"{'@context': 'http://schema.org', '@type': 'LocalBusiness', 'name': 'BE FIT Rheinbach', 'description': '', 'address': {'@type': 'PostalAddress', 'addressLocality': 'Bonn, Germany', 'addressCountry': 'Germany', 'postalCode': '53359', 'streetAddress': 'An den Märkten 9'}, 'telephone': '+44 22268987740', 'geo': {'@type': 'GeoCoordinates', 'latitude': '50.6233881', 'longitude': '6.9636141'}, 'priceRange': '-', 'image': 'https://urbansportsclub.com/images/merchant/venueHome.jpg'}",50.6233881,6.9636141,
all inclusive Fitness Bonn,"['Dance', 'Fitness', 'Functional Training', 'Pilates', 'Yoga']",False,"['Essential', 'Classic', 'Premium', 'Max']",Essential,Beuel,Pützchens Chaussee 16,https://urbansportsclub.com//en/venues/ai-fitness-studio-bonn,"{'@context': 'http://schema.org', '@type': 'LocalBusiness', 'name': 'all inclusive Fitness Bonn', 'description': 'Als eine der am schnellsten wachsenden und innovativsten Fitnessstudioketten in Deutschland, ist der Kern unseres Unternehmens eine ehrliche Leidenschaft für Fitness, Gesundheit und Wellbeing. Ziel ist es, unseren Mitgliedern ein erstklassiges Fitnesserlebnis zu bieten, das begeistert, motiviert und dabei erschwinglich bleibt. Um dies zu erreichen, verfolgt Ai Fitness seit 2003 einen ganzheitlichen Ansatz, der auf vier verschiedenen Säulen beruht: Hohe Servicequalität, niedrige Preise All inclusive an 365 Tagen im Jahr. Wir bieten ein herausragendes Leistungsangebot und das zu einem fairen und transparenten Preis. Vielfalt in Training und Ausstattung Fitnesstraining hat sich in den letzten Jahren extrem diversifiziert. Unsere Trainingsmöglichkeiten spiegeln dies wieder und bieten für jeden etwas. Angenehmes Umfeld und Ambiente In jedem unserer Studios hat eine angenehme Trainingsatmosphäre oberste Priorität. So sorgen wir für Motivation und Erfolg im Training. Effiziente Strukturen und Abläufe Mit über 20 Jahren Erfahrung in der Branche wissen wir, worauf es ankommt. Das Ergebnis ist ein erstklassiger Service bei gleichzeitig niedrigen Preisen. Wir kombinieren diese Erfolgsfaktoren zu einem Rundum-Sorglos-Paket, dass jedem Mitglied an 365 Tagen im Jahr zur Verfügung steht. Dabei richtet sich unser Angebot an ein breites Publikum – egal ob Anfänger, Hobbysportler oder fortgeschrittener Athlet – jeder findet hier sein sportliches Zuhause und eine erstklassige Betreuung. In der Praxis findet sich dieses Konzept in der Studiogestaltung wieder. Jeder Ai Fitnessclub ist gemäß der unterschiedlichen Trainingskonzepte in verschiedene Bereiche unterteilt: Funktionales Training, klassisches Gerätetraining, Fitnesskurse, Zirkeltraining oder Cardio – hier findet jeder seinen ganz eigenen Lieblingsbereich. Mit zertifizierten Trainern, einer großen Bandbreite an Trainingsmöglichkeiten, State of the Art-Fitnessequipment, einem vielseitigen Kursangebot, Gesundheitscheck und innovativen Sonderleistungen haben wir den Begriff all inclusive Fitness etabliert. Abgerundet wird dieses attraktive Gesamtpaket durch eine offene und lichtdurchflutete Architektur, hochwertige Umkleiden und Sanitärbereiche mit kostenlosen Duschen sowie unserem stets hilfsbereites Personal. In unseren Studios schaffen wir eine einzigartige Atmosphäre, in der jeder willkommen ist und sich wohlfühlen kann. Unsere Mitglieder sollen sich dabei nicht nur als Kunden, sondern Teil einer inspirierenden und motivierenden Community verstehen. Mit regelmäßigen Aktionen und dynamischen After-Work-Events schaffen wir ein vertrauensvolles Umfeld, das sonst oftmals durch Anonymität gekennzeichnet ist. Fitness in Wohlfühl-Atmosphäre – denn nur wer sich wirklich wohlfühlt, kommt auch gerne zum Training und hat langfristig Erfolg. Und der Trainingserfolg unserer Mitglieder ist dabei unsere Leidenschaft. Ein Ai Fitnessstudio findet sich bestimmt auch in deiner Nähe. Überzeuge dich selbst und lerne uns im Rahmen eines kostenlosen Probetrainings kennen. Wir freuen uns auf dich. Ai Fitness - Erlebe den Unterschied! Bitte schaue vor deinem Besuch in die Hausordnung: https://www.ai-fitness.de/service/hausordnung', 'address': {'@type': 'PostalAddress', 'addressLocality': 'Bonn, Germany', 'addressCountry': 'Germany', 'postalCode': '53227', 'streetAddress': 'Pützchens Chaussee 16'}, 'telephone': '+44 15792633527', 'geo': {'@type': 'GeoCoordinates', 'latitude': '50.7414758', 'longitude': '7.1373835'}, 'priceRange': '-', 'image': 'https://storage.googleapis.com/download/storage/v1/b/usc-pro-uscweb-live-media/o/de-live%2Foriginal_1200x675_navp0s5jubuippaexsp5_1722492708177641.png?generation=1722492708237561&amp;alt=media'}",50.7414758,7.1373835,"Als eine der am schnellsten wachsenden und innovativsten Fitnessstudioketten in Deutschland, ist der Kern unseres Unternehmens eine ehrliche Leidenschaft für Fitness, Gesundheit und Wellbeing. Ziel ist es, unseren Mitgliedern ein erstklassiges Fitnesserlebnis zu bieten, das begeistert, motiviert und dabei erschwinglich bleibt. Um dies zu erreichen, verfolgt Ai Fitness seit 2003 einen ganzheitlichen Ansatz, der auf vier verschiedenen Säulen beruht: Hohe Servicequalität, niedrige Preise All inclusive an 365 Tagen im Jahr. Wir bieten ein herausragendes Leistungsangebot und das zu einem fairen und transparenten Preis. Vielfalt in Training und Ausstattung Fitnesstraining hat sich in den letzten Jahren extrem diversifiziert. Unsere Trainingsmöglichkeiten spiegeln dies wieder und bieten für jeden etwas. Angenehmes Umfeld und Ambiente In jedem unserer Studios hat eine angenehme Trainingsatmosphäre oberste Priorität. So sorgen wir für Motivation und Erfolg im Training. Effiziente Strukturen und Abläufe Mit über 20 Jahren Erfahrung in der Branche wissen wir, worauf es ankommt. Das Ergebnis ist ein erstklassiger Service bei gleichzeitig niedrigen Preisen. Wir kombinieren diese Erfolgsfaktoren zu einem Rundum-Sorglos-Paket, dass jedem Mitglied an 365 Tagen im Jahr zur Verfügung steht. Dabei richtet sich unser Angebot an ein breites Publikum – egal ob Anfänger, Hobbysportler oder fortgeschrittener Athlet – jeder findet hier sein sportliches Zuhause und eine erstklassige Betreuung. In der Praxis findet sich dieses Konzept in der Studiogestaltung wieder. Jeder Ai Fitnessclub ist gemäß der unterschiedlichen Trainingskonzepte in verschiedene Bereiche unterteilt: Funktionales Training, klassisches Gerätetraining, Fitnesskurse, Zirkeltraining oder Cardio – hier findet jeder seinen ganz eigenen Lieblingsbereich. Mit zertifizierten Trainern, einer großen Bandbreite an Trainingsmöglichkeiten, State of the Art-Fitnessequipment, einem vielseitigen Kursangebot, Gesundheitscheck und innovativen Sonderleistungen haben wir den Begriff all inclusive Fitness etabliert. Abgerundet wird dieses attraktive Gesamtpaket durch eine offene und lichtdurchflutete Architektur, hochwertige Umkleiden und Sanitärbereiche mit kostenlosen Duschen sowie unserem stets hilfsbereites Personal. In unseren Studios schaffen wir eine einzigartige Atmosphäre, in der jeder willkommen ist und sich wohlfühlen kann. Unsere Mitglieder sollen sich dabei nicht nur als Kunden, sondern Teil einer inspirierenden und motivierenden Community verstehen. Mit regelmäßigen Aktionen und dynamischen After-Work-Events schaffen wir ein vertrauensvolles Umfeld, das sonst oftmals durch Anonymität gekennzeichnet ist. Fitness in Wohlfühl-Atmosphäre – denn nur wer sich wirklich wohlfühlt, kommt auch gerne zum Training und hat langfristig Erfolg. Und der Trainingserfolg unserer Mitglieder ist dabei unsere Leidenschaft. Ein Ai Fitnessstudio findet sich bestimmt auch in deiner Nähe. Überzeuge dich selbst und lerne uns im Rahmen eines kostenlosen Probetrainings kennen. Wir freuen uns auf dich. Ai Fitness - Erlebe den Unterschied! Bitte schaue vor deinem Besuch in die Hausordnung: https://www.ai-fitness.de/service/hausordnung"
KW Bonn,"['Dance', 'Fitness', 'Pilates', 'Yoga']",False,"['Classic', 'Premium', 'Max']",Classic,Dottendorf,In der Raste 3,https://urbansportsclub.com//en/venues/kw-bonn,"{'@context': 'http://schema.org', '@type': 'LocalBusiness', 'name': 'KW Bonn', 'description': 'Herzlich Willkommen im KW! Im KW BONN finden Sie etwas, was Ihnen nicht viele Mitbewerber anbieten können: erstklassige Geräte, ein umfangreiches Kursangebot und eine wirklich gute Betreuung. Das Ganze in angenehm urbaner Umgebung mit großzügigen und hellen Trainingsflächen. Klingt selbstverständlich? Ist es nicht! – Machen Sie den Vergleich! Wir freuen uns auf Ihren Besuch! Wir bieten Ihnen: - Gerätetraining - Kurse', 'address': {'@type': 'PostalAddress', 'addressLocality': 'Bonn, Germany', 'addressCountry': 'Germany', 'postalCode': '53129', 'streetAddress': 'In der Raste 3'}, 'telephone': '+49 228 93390727', 'geo': {'@type': 'GeoCoordinates', 'latitude': '50.7076592', 'longitude': '7.123726'}, 'priceRange': '-', 'image': 'https://storage.googleapis.com/download/storage/v1/b/usc-pro-uscweb-live-media/o/de-live%2Foriginal_2090x1176_8b56f9a3f86b-REX_3686_155247410393087_admin.jpg?alt=media'}",50.7076592,7.123726,"Herzlich Willkommen im KW! Im KW BONN finden Sie etwas, was Ihnen nicht viele Mitbewerber anbieten können: erstklassige Geräte, ein umfangreiches Kursangebot und eine wirklich gute Betreuung. Das Ganze in angenehm urbaner Umgebung mit großzügigen und hellen Trainingsflächen. Klingt selbstverständlich? Ist es nicht! – Machen Sie den Vergleich! Wir freuen uns auf Ihren Besuch! Wir bieten Ihnen: - Gerätetraining - Kurse"
