name,disciplines,plus_options,plans,min_plan,district,street,link,metadata,latitude,longitude,description
R-EVOLUTION SCHOOL,"['Aerial', 'Fitness', 'Functional Training', 'Parkour']",False,"['Classic', 'Premium', 'Max']",Classic,Russafa,Carrer de Dénia 1,https://urbansportsclub.com//en/venues/r-evolution-school,"{'@context': 'http://schema.org', '@type': 'LocalBusiness', 'name': 'R-EVOLUTION SCHOOL', 'description': 'Con más de diez años de experiencia en el mundo del parkour y el método natural en Valencia, hoy nos juntamos para poder ofrecer a la ciudad la primera escuela profesional deportiva de actividades naturales, urbanas, alternativas y de innovación. Una forma diferente de hacer actividad física, deporte y salud. La alternativa al gimnasio tradicional. Nuestros sistemas de entrenamiento se basan en el movimiento, la creatividad y la motivación personal. Buscamos una utilidad a tu tiempo, entrena pero aprende y sé útil para los demás. R-evolution School pretende romper con los estándares competitivos bajo los cuáles se basan hoy en día los métodos de aprendizaje y la educación deportiva, para fomentar desde la base la cooperación y la auto-superación. Apostamos por la parte social y cultural, buscando la socialización y una filosofía natural de cooperación, de diversión y motivación para el buen entrenamiento, eficaz y seguro, pero sobretodo útil para la vida de cada día.', 'address': {'@type': 'PostalAddress', 'addressLocality': 'Valencia, Spain', 'addressCountry': 'Spain', 'postalCode': '46004', 'streetAddress': 'Carrer de Dénia 1'}, 'telephone': '+49 6889 17352', 'geo': {'@type': 'GeoCoordinates', 'latitude': '39.4635174', 'longitude': '-0.3726512'}, 'priceRange': '-', 'image': 'https://storage.googleapis.com/download/storage/v1/b/usc-pro-uscweb-live-media/o/de-live%2Foriginal_1024x576_FOTOS%20TELAS%202_1620817480346835_admin.jpg?alt=media'}",39.4635174,-0.3726512,"Con más de diez años de experiencia en el mundo del parkour y el método natural en Valencia, hoy nos juntamos para poder ofrecer a la ciudad la primera escuela profesional deportiva de actividades naturales, urbanas, alternativas y de innovación. Una forma diferente de hacer actividad física, deporte y salud. La alternativa al gimnasio tradicional. Nuestros sistemas de entrenamiento se basan en el movimiento, la creatividad y la motivación personal. Buscamos una utilidad a tu tiempo, entrena pero aprende y sé útil para los demás. R-evolution School pretende romper con los estándares competitivos bajo los cuáles se basan hoy en día los métodos de aprendizaje y la educación deportiva, para fomentar desde la base la cooperación y la auto-superación. Apostamos por la parte social y cultural, buscando la socialización y una filosofía natural de cooperación, de diversión y motivación para el buen entrenamiento, eficaz y seguro, pero sobretodo útil para la vida de cada día."
Rebel Box,['Crosstraining'],False,"['Essential', 'Classic', 'Premium', 'Max']",Essential,Algirós,Carrer del Poeta Mas y Ros 55,https://urbansportsclub.com//en/venues/rebel-box,"{'@context': 'http://schema.org', '@type': 'LocalBusiness', 'name': 'Rebel Box', 'description': 'Rebel box es un centro deportivo donde impartimos clases dirigidas de crosstraining, halterofilia, endurance y movilidad. Todas las clases están dirigidas por personal cualificado que se encarga de que los usuarios hagan bien la técnica y escalan todos los ejercicios para ir mejorando progresivamente. Está equipado con las mejores marcas como xenios, rogue y concept. También es posible entrenar de open box. Dispone por supuesto de vestuarios y duchas.', 'address': {'@type': 'PostalAddress', 'addressLocality': 'Valencia, Spain', 'addressCountry': 'Spain', 'postalCode': '46022', 'streetAddress': 'Carrer del Poeta Mas y Ros 55'}, 'telephone': '+49 641 371187', 'geo': {'@type': 'GeoCoordinates', 'latitude': '39.4698634', 'longitude': '-0.3457988'}, 'priceRange': '-', 'image': 'https://storage.googleapis.com/download/storage/v1/b/usc-pro-uscweb-live-media/o/de-live%2Foriginal_942x529_v8a7hykghd1dx5kdqfev_1709290460316113.png?generation=1709290460408387&amp;alt=media'}",39.4698634,-0.3457988,"Rebel box es un centro deportivo donde impartimos clases dirigidas de crosstraining, halterofilia, endurance y movilidad. Todas las clases están dirigidas por personal cualificado que se encarga de que los usuarios hagan bien la técnica y escalan todos los ejercicios para ir mejorando progresivamente. Está equipado con las mejores marcas como xenios, rogue y concept. También es posible entrenar de open box. Dispone por supuesto de vestuarios y duchas."
Richelli Osteopatía,['Massage'],True,"['Premium', 'Max']",Premium,Beteró,"Calle Pedro de Valencia, 19 bis",https://urbansportsclub.com//en/venues/richelli-osteopatia,"{'@context': 'http://schema.org', '@type': 'LocalBusiness', 'name': 'Richelli Osteopatía', 'description': 'EL MÉTODO: Richelli’s Therapy Solutions es una metodología de tratamiento y exploración propia que permite optimizar al máximo con una mínima intervención sobre los tejidos causantes de la lesión. LAS HERRAMIENTAS: Siete herramientas con infinidad de técnicas de aplicación capaces de resolver de forma más eficiente, duradera y temprana las lesiones en músculos, tendones y ligamentos. LA FORMACIÓN: Los Cursos de Terapia Manual Instrumentalizada (TMI) se imparten a nivel internacional y están avalados por la International Board of Certification in Physiotherapy (IBOC). *** Medidas sanitarias *** Los pacientes: 1º Se les pedirá que lleven mascarilla para poder ser atendidos. En caso de no llevarla podrán adquirir una en nuestras instalaciones. 2º Los pacientes con síntomas compatibles con covi19 no serán atendidos. Tos, fiebre o estornudos. 3º Los pacientes dejarán su calzado a la entrada de la clínica en un mueble habilitado para tal fin. 4º Los pacientes se lavaran las manos con solución hidroalcohólica o agua y jabón al entrar. 5º Los pacientes utilizarán papel para tocar las superficies de grifos o cisternas de váter. 6º Se ruega a los pacientes de no venir acompañados excepto necesidad por ser menores o personas con dificultades.', 'address': {'@type': 'PostalAddress', 'addressLocality': 'Valencia, Spain', 'addressCountry': 'Spain', 'postalCode': '46022', 'streetAddress': 'Calle Pedro de Valencia, 19 bis'}, 'telephone': '+34 601 27 53 97', 'geo': {'@type': 'GeoCoordinates', 'latitude': '39.4687335', 'longitude': '-0.3365922'}, 'priceRange': '-', 'image': 'https://storage.googleapis.com/download/storage/v1/b/usc-pro-uscweb-live-media/o/de-live%2Foriginal_2896x1629_Box%202_1586445742542514_admin.jpg?alt=media'}",39.4687335,-0.3365922,"EL MÉTODO: Richelli’s Therapy Solutions es una metodología de tratamiento y exploración propia que permite optimizar al máximo con una mínima intervención sobre los tejidos causantes de la lesión. LAS HERRAMIENTAS: Siete herramientas con infinidad de técnicas de aplicación capaces de resolver de forma más eficiente, duradera y temprana las lesiones en músculos, tendones y ligamentos. LA FORMACIÓN: Los Cursos de Terapia Manual Instrumentalizada (TMI) se imparten a nivel internacional y están avalados por la International Board of Certification in Physiotherapy (IBOC). *** Medidas sanitarias *** Los pacientes: 1º Se les pedirá que lleven mascarilla para poder ser atendidos. En caso de no llevarla podrán adquirir una en nuestras instalaciones. 2º Los pacientes con síntomas compatibles con covi19 no serán atendidos. Tos, fiebre o estornudos. 3º Los pacientes dejarán su calzado a la entrada de la clínica en un mueble habilitado para tal fin. 4º Los pacientes se lavaran las manos con solución hidroalcohólica o agua y jabón al entrar. 5º Los pacientes utilizarán papel para tocar las superficies de grifos o cisternas de váter. 6º Se ruega a los pacientes de no venir acompañados excepto necesidad por ser menores o personas con dificultades."
SHAOLIN FITNESS,"['Fitness', 'Indoor Cycling']",False,"['Essential', 'Classic', 'Premium', 'Max']",Essential,Xirivella,"Carrer del Forn Vicente Roca Cervera, 35",https://urbansportsclub.com//en/venues/shaolin-fitness,"{'@context': 'http://schema.org', '@type': 'LocalBusiness', 'name': 'SHAOLIN FITNESS', 'description': 'Disponemos de un total de cuatro salas y un tatami, dedicadas a musculación, cardiovascular y otra serie de actividades que puedes consultar en el menú superior. Todos nuestro material es de última generación y los monitores super cualificados. El ambiente que se respira en el gimnasio es sano y cordial. Te encontrarás como en casa. Vente con nosotros. No te arrepentirás. MEDIDAS SANITARIAS - Mascarilla, gel, distancia de seguridad, temperatura y limpieza del calzado ( a la entrada y a la salida)', 'address': {'@type': 'PostalAddress', 'addressLocality': 'Valencia, Spain', 'addressCountry': 'Spain', 'postalCode': '46950', 'streetAddress': 'Carrer del Forn Vicente Roca Cervera, 35'}, 'telephone': '+34 617 34 34 24', 'geo': {'@type': 'GeoCoordinates', 'latitude': '39.4646906', 'longitude': '-0.4224968'}, 'priceRange': '-', 'image': 'https://storage.googleapis.com/download/storage/v1/b/usc-pro-uscweb-live-media/o/de-live%2Foriginal_1024x576_plantilla%20modificada%205_1581502462508581_admin.png?alt=media'}",39.4646906,-0.4224968,"Disponemos de un total de cuatro salas y un tatami, dedicadas a musculación, cardiovascular y otra serie de actividades que puedes consultar en el menú superior. Todos nuestro material es de última generación y los monitores super cualificados. El ambiente que se respira en el gimnasio es sano y cordial. Te encontrarás como en casa. Vente con nosotros. No te arrepentirás. MEDIDAS SANITARIAS - Mascarilla, gel, distancia de seguridad, temperatura y limpieza del calzado ( a la entrada y a la salida)"
SOIFIT,"['Fitness', 'Functional Training']",False,"['Classic', 'Premium', 'Max']",Classic,Mestalla,"Calle Amadeo de Saboya, 46010, Valencia (España)",https://urbansportsclub.com//en/venues/soifit-performance,"{'@context': 'http://schema.org', '@type': 'LocalBusiness', 'name': 'SOIFIT', 'description': 'Centro exclusivo en Valencia de entrenamiento personal y asesoramiento en nutrición y dietética. Abordamos de forma individualizada y desde un punto de vista multidisciplinar cada uno de tus objetivos. Equipo humano especializado, instalaciones modernas, equipadas y bien comunicadas para ser tu aliado y acompañarte en tus retos personales.', 'address': {'@type': 'PostalAddress', 'addressLocality': 'Valencia, Spain', 'addressCountry': 'Spain', 'postalCode': '46010', 'streetAddress': 'Calle Amadeo de Saboya, 46010, Valencia (España)'}, 'telephone': '+34 666 48 63 26', 'geo': {'@type': 'GeoCoordinates', 'latitude': '39.4737362', 'longitude': '-0.3615572'}, 'priceRange': '-', 'image': 'https://storage.googleapis.com/download/storage/v1/b/usc-pro-uscweb-live-media/o/de-live%2Foriginal_1688x950_Personal%20TrainingCompressed_155178843414127_admin.jpg?alt=media'}",39.4737362,-0.3615572,"Centro exclusivo en Valencia de entrenamiento personal y asesoramiento en nutrición y dietética. Abordamos de forma individualizada y desde un punto de vista multidisciplinar cada uno de tus objetivos. Equipo humano especializado, instalaciones modernas, equipadas y bien comunicadas para ser tu aliado y acompañarte en tus retos personales."
STONE Pilates,['Pilates'],False,"['Classic', 'Premium', 'Max']",Classic,Les Tendetes,Carrer de la Vall de la Ballestera 10,https://urbansportsclub.com//en/venues/stone-pilates,"{'@context': 'http://schema.org', '@type': 'LocalBusiness', 'name': 'STONE Pilates', 'description': 'En Fisio Reino ofrecemos servicios Terapéuticos y Deportivos como Fisioterapia, Podología, Nutrición, Pilates Reformer y Aéreo y Electroestimulación. Contamos con excelentes profesionales titulados y nos ubicamos en el centro de Valencia. Medidas sanitarias tomadas: - Es obligatorio el uso de mascarilla.', 'address': {'@type': 'PostalAddress', 'addressLocality': 'Valencia, Spain', 'addressCountry': 'Spain', 'postalCode': '46015', 'streetAddress': 'Carrer de la Vall de la Ballestera 10'}, 'telephone': '+34 665 19 11 66', 'geo': {'@type': 'GeoCoordinates', 'latitude': '39.480755', 'longitude': '-0.3946726'}, 'priceRange': '-', 'image': 'https://urbansportsclub.com/images/merchant/venueHome.jpg'}",39.480755,-0.3946726,"En Fisio Reino ofrecemos servicios Terapéuticos y Deportivos como Fisioterapia, Podología, Nutrición, Pilates Reformer y Aéreo y Electroestimulación. Contamos con excelentes profesionales titulados y nos ubicamos en el centro de Valencia. Medidas sanitarias tomadas: - Es obligatorio el uso de mascarilla."
Speck Crossfit® Box,['Crosstraining'],False,"['Classic', 'Premium', 'Max']",Classic,Patraix,"C. de Campos Crespo, 57",https://urbansportsclub.com//en/venues/speck-crossfitr-box,"{'@context': 'http://schema.org', '@type': 'LocalBusiness', 'name': 'Speck Crossfit® Box', 'description': 'CrossFit®xa0es una metodología de entrenamiento de movimientos constantemente variados y ejecutados a alta intensidad.xa0Es un programa de fuerza central y acondicionamiento el cual se adapta a cualquier nivel, edad o condición física.xa0Aprenderás de forma progresiva y segura.', 'address': {'@type': 'PostalAddress', 'addressLocality': 'Valencia, Spain', 'addressCountry': 'Spain', 'postalCode': '46017', 'streetAddress': 'C. de Campos Crespo, 57'}, 'telephone': '+34 633 03 40 24', 'geo': {'@type': 'GeoCoordinates', 'latitude': '39.45421', 'longitude': '-0.39853'}, 'priceRange': '-', 'image': 'https://storage.googleapis.com/download/storage/v1/b/usc-pro-uscweb-live-media/o/de-live%2Foriginal_1024x576_120476702_115735866955846_3735911076610244458_n_1619023389954097_admin.jpg?alt=media'}",39.45421,-0.39853,"CrossFit®xa0es una metodología de entrenamiento de movimientos constantemente variados y ejecutados a alta intensidad.xa0Es un programa de fuerza central y acondicionamiento el cual se adapta a cualquier nivel, edad o condición física.xa0Aprenderás de forma progresiva y segura."
Sport Albalat,"['Aqua', 'Boxing Sports', 'Fitness', 'Functional Training', 'Indoor Cycling', 'Pilates', 'Yoga']",False,"['Essential', 'Classic', 'Premium', 'Max']",Essential,Albors,"Carrer de Teresa Gil de Vidaura, 1",https://urbansportsclub.com//en/venues/sport-albalat,"{'@context': 'http://schema.org', '@type': 'LocalBusiness', 'name': 'Sport Albalat', 'description': 'Centro Sport Albalat es un espacio donde se aúnan, con la mayor profesionalidad, el deporte y el relax. Entrenamiento Personal Diseñaremos planes de entrenamiento específicos atendiendo a los retos deportivos y objetivos de cada persona. La individualización es la base de todos nuestros servicios. Clases Colectivas Tenemos clases colectivas para iniciarte en el mundo del ejercicio físico, para ponerte en forma y para mejorar tu rendimiento. Piscina Cursillos de natación y actividades basadas en ejercicios de tonificación en la piscina. MEDIDAS SANITARIAS - Mascarilla - Gel y distancia de seguridad - Limpiar cada máquina después de su uso', 'address': {'@type': 'PostalAddress', 'addressLocality': 'Valencia, Spain', 'addressCountry': 'Spain', 'postalCode': '46135', 'streetAddress': 'Carrer de Teresa Gil de Vidaura, 1'}, 'telephone': '+34 633 40 07 27', 'geo': {'@type': 'GeoCoordinates', 'latitude': '39.5465231', 'longitude': '-0.3440637'}, 'priceRange': '-', 'image': 'https://storage.googleapis.com/download/storage/v1/b/usc-pro-uscweb-live-media/o/de-live%2Foriginal_1600x900_foto%202_158253928033213_admin.jpg?alt=media'}",39.5465231,-0.3440637,"Centro Sport Albalat es un espacio donde se aúnan, con la mayor profesionalidad, el deporte y el relax. Entrenamiento Personal Diseñaremos planes de entrenamiento específicos atendiendo a los retos deportivos y objetivos de cada persona. La individualización es la base de todos nuestros servicios. Clases Colectivas Tenemos clases colectivas para iniciarte en el mundo del ejercicio físico, para ponerte en forma y para mejorar tu rendimiento. Piscina Cursillos de natación y actividades basadas en ejercicios de tonificación en la piscina. MEDIDAS SANITARIAS - Mascarilla - Gel y distancia de seguridad - Limpiar cada máquina después de su uso"
Studio 24,"['Pilates', 'Yoga']",False,"['Essential', 'Classic', 'Premium', 'Max']",Essential,En Corts,"Calle Obispo Jaime Pérez, 28",https://urbansportsclub.com//en/venues/studio-24,"{'@context': 'http://schema.org', '@type': 'LocalBusiness', 'name': 'Studio 24', 'description': '¡Studio 24 está a la espera de tu visita! Medidas sanitarias tomadas: - El uso de mascarilla será obligatorio. - Se desinfectarán las manos con gel hidroalcohólico. - Se desinfectará la suela del calzado antes de entrar en el centro. - Solo se atenderán aquellos que tengan reserva previa.', 'address': {'@type': 'PostalAddress', 'addressLocality': 'Valencia, Spain', 'addressCountry': 'Spain', 'postalCode': '46004', 'streetAddress': 'Calle Obispo Jaime Pérez, 28'}, 'telephone': '+34 606 00 95 28', 'geo': {'@type': 'GeoCoordinates', 'latitude': '39.4580674', 'longitude': '-0.3656962'}, 'priceRange': '-', 'image': 'https://storage.googleapis.com/download/storage/v1/b/usc-pro-uscweb-live-media/o/de-live%2Foriginal_1127x634_43592858_2191722134450445_6474908548726784000_o_1556280492633915_admin.jpg?alt=media'}",39.4580674,-0.3656962,¡Studio 24 está a la espera de tu visita! Medidas sanitarias tomadas: - El uso de mascarilla será obligatorio. - Se desinfectarán las manos con gel hidroalcohólico. - Se desinfectará la suela del calzado antes de entrar en el centro. - Solo se atenderán aquellos que tengan reserva previa.
Studio 24 - PLUS,['Functional Training'],True,"['Premium', 'Max']",Premium,Russafa,"Calle Obispo Jaime Pérez, 28",https://urbansportsclub.com//en/venues/studio-24-plus,"{'@context': 'http://schema.org', '@type': 'LocalBusiness', 'name': 'Studio 24 - PLUS', 'description': '¡Studio 24 está a la espera de tu visita! Medidas sanitarias tomadas: - El uso de mascarilla será obligatorio. - Se desinfectarán las manos con gel hidroalcohólico. - Se desinfectará la suela del calzado antes de entrar en el centro. - Solo se atenderán aquellos que tengan reserva previa.', 'address': {'@type': 'PostalAddress', 'addressLocality': 'Valencia, Spain', 'addressCountry': 'Spain', 'postalCode': '46004', 'streetAddress': 'Calle Obispo Jaime Pérez, 28'}, 'telephone': '+34 606 00 95 28', 'geo': {'@type': 'GeoCoordinates', 'latitude': '39.4580674', 'longitude': '-0.3656962'}, 'priceRange': '-', 'image': 'https://urbansportsclub.com/images/merchant/venueHome.jpg'}",39.4580674,-0.3656962,¡Studio 24 está a la espera de tu visita! Medidas sanitarias tomadas: - El uso de mascarilla será obligatorio. - Se desinfectarán las manos con gel hidroalcohólico. - Se desinfectará la suela del calzado antes de entrar en el centro. - Solo se atenderán aquellos que tengan reserva previa.
Stylos,['Dance'],False,"['Essential', 'Classic', 'Premium', 'Max']",Essential,Mislata,"Carrer de Santa Teresa, 7",https://urbansportsclub.com//en/venues/stylos,"{'@context': 'http://schema.org', '@type': 'LocalBusiness', 'name': 'Stylos', 'description': 'Stylo&#039;s cuenta con 1000 metros de instalaciones. Tres salas, vestuarios con ducha y una amplia sala de espera, hacen que sean las mejores de una escuela de baile en Valencia. MEDIDAS SANITARIAS - Mascarilla durante las clases, temperatura, desinfección de calzado, gel y distancia de seguridad', 'address': {'@type': 'PostalAddress', 'addressLocality': 'Valencia, Spain', 'addressCountry': 'Spain', 'postalCode': '46920', 'streetAddress': 'Carrer de Santa Teresa, 7'}, 'telephone': '+34 963 59 10 40', 'geo': {'@type': 'GeoCoordinates', 'latitude': '39.4749135', 'longitude': '-0.4191273'}, 'priceRange': '-', 'image': 'https://storage.googleapis.com/download/storage/v1/b/usc-pro-uscweb-live-media/o/de-live%2Foriginal_1160x653_14352444_1784700225122558_1204890304864960408_o_1577108121359152_admin.jpg?alt=media'}",39.4749135,-0.4191273,"Stylo&#039;s cuenta con 1000 metros de instalaciones. Tres salas, vestuarios con ducha y una amplia sala de espera, hacen que sean las mejores de una escuela de baile en Valencia. MEDIDAS SANITARIAS - Mascarilla durante las clases, temperatura, desinfección de calzado, gel y distancia de seguridad"
Taronja Box Valencia,['Crosstraining'],False,"['Classic', 'Premium', 'Max']",Classic,Beniferri,Carrer del Doctor Nicasi Benlloch 86,https://urbansportsclub.com//en/venues/taronja-box,"{'@context': 'http://schema.org', '@type': 'LocalBusiness', 'name': 'Taronja Box Valencia', 'description': 'Taronja Box es un centro deportivo que ofrece Workout semi personalizados, ya que nuestras clases tienen un máximo de 10 personas. Ofrecemos horarios perfectos para las personas con una vida bastante ocupada y que no dispone de los horarios comunes para entrenar. Así como un amplio horario de Open Box para todos los que solo necesitan un lugar tranquilo para hacer vuestra propia planificación sin ningún problema. También tenemos servicios de entrenamiento personal, descarga muscular y fisioterapia. Ven y conócenos. MEDIDAS SANITARIAS - Mascarilla, gel y distancia de seguridad', 'address': {'@type': 'PostalAddress', 'addressLocality': 'Valencia, Spain', 'addressCountry': 'Spain', 'postalCode': '46035', 'streetAddress': 'Carrer del Doctor Nicasi Benlloch 86'}, 'telephone': '+49 6250 64028', 'geo': {'@type': 'GeoCoordinates', 'latitude': '39.4922993', 'longitude': '-0.3967467'}, 'priceRange': '-', 'image': 'https://storage.googleapis.com/download/storage/v1/b/usc-pro-uscweb-live-media/o/de-live%2Foriginal_320x180_upym3hgsabtt4mdl9olj_1677219876664097.png?generation=1677219876711485&amp;alt=media'}",39.4922993,-0.3967467,"Taronja Box es un centro deportivo que ofrece Workout semi personalizados, ya que nuestras clases tienen un máximo de 10 personas. Ofrecemos horarios perfectos para las personas con una vida bastante ocupada y que no dispone de los horarios comunes para entrenar. Así como un amplio horario de Open Box para todos los que solo necesitan un lugar tranquilo para hacer vuestra propia planificación sin ningún problema. También tenemos servicios de entrenamiento personal, descarga muscular y fisioterapia. Ven y conócenos. MEDIDAS SANITARIAS - Mascarilla, gel y distancia de seguridad"
The Box Puzol,"['Crosstraining', 'Fitness', 'Hyrox', 'Yoga']",False,"['Essential', 'Classic', 'Premium', 'Max']",Essential,Port de Sagunt,"Felipe Sebastia, 6",https://urbansportsclub.com//en/venues/the-box-puzol,"{'@context': 'http://schema.org', '@type': 'LocalBusiness', 'name': 'The Box Puzol', 'description': 'Entrenamiento en el que no existe la rutina, sesiones de una hora de duración y siempre bajo la supervisión de los entrenadores.', 'address': {'@type': 'PostalAddress', 'addressLocality': 'Valencia, Spain', 'addressCountry': 'Spain', 'postalCode': '46530', 'streetAddress': 'Felipe Sebastia, 6'}, 'telephone': '+34 652 69 23 51', 'geo': {'@type': 'GeoCoordinates', 'latitude': '39.6176205', 'longitude': '-0.3053839'}, 'priceRange': '-', 'image': 'https://storage.googleapis.com/download/storage/v1/b/usc-pro-uscweb-live-media/o/de-live%2Foriginal_1024x576_pl1_1629991132615395_admin.png?generation=1629991132701970&amp;alt=media'}",39.6176205,-0.3053839,"Entrenamiento en el que no existe la rutina, sesiones de una hora de duración y siempre bajo la supervisión de los entrenadores."
