name,disciplines,plus_options,plans,min_plan,district,street,link,metadata,latitude,longitude,description
BODYart Personal Fitness Lounge,['Vibrationstraining'],False,"['L', 'XL']",L,Rüttenscheid,Rüttenscheiderstr. 194,https://urbansportsclub.com//de/venues/bodyart-personal-fitness-lounge,"{'@context': 'http://schema.org', '@type': 'LocalBusiness', 'name': 'BODYart Personal Fitness Lounge', 'description': 'Das BODYart in Essen-Rüttenscheid bietet dir effektives Training auf hightech-Niveau. Muskelstärkung, Figurformung und Gewichtsreduktion lassen sich mit wenigen Trainingseinheiten erzielen. Und das bei minimalem Zeiteinsatz! Das Vibrationstraining stammt aus der Weltraumforschung und wurde entwickelt, um dem Knochen- und Muskelschwund in der Schwerelosigkeit entgegenzuwirken. Dreidimensionale Schwingungen sorgen für reflexgesteuerte Reaktionen der Körpermuskulatur. Rund 97% der Muskeln werden hierbei gleichzeitig aktiviert – ein Ergebnis, das sich mit herkömmlichen Trainingsmethoden nicht erreichen lässt. Mit den medizinisch zertifizierten Geräten lassen sich ganz speziell auch die nur schwer erreichbaren Muskelgruppen, wie die tiefe Bauch- Rücken- und Beckenbodenmuskulatur, stärken.', 'address': {'@type': 'PostalAddress', 'addressLocality': 'Essen, Germany', 'addressCountry': 'Germany', 'postalCode': '45131', 'streetAddress': 'Rüttenscheiderstr. 194'}, 'telephone': '+49 201 25900795', 'geo': {'@type': 'GeoCoordinates', 'latitude': '51.427383', 'longitude': '7.0023213'}, 'priceRange': '-', 'image': 'https://storage.googleapis.com/download/storage/v1/b/usc-pro-uscweb-live-media/o/de-live%2Foriginal_1024x576_Vibrationstraining_SFB2V.png?alt=media'}",51.427383,7.0023213,"Das BODYart in Essen-Rüttenscheid bietet dir effektives Training auf hightech-Niveau. Muskelstärkung, Figurformung und Gewichtsreduktion lassen sich mit wenigen Trainingseinheiten erzielen. Und das bei minimalem Zeiteinsatz! Das Vibrationstraining stammt aus der Weltraumforschung und wurde entwickelt, um dem Knochen- und Muskelschwund in der Schwerelosigkeit entgegenzuwirken. Dreidimensionale Schwingungen sorgen für reflexgesteuerte Reaktionen der Körpermuskulatur. Rund 97% der Muskeln werden hierbei gleichzeitig aktiviert – ein Ergebnis, das sich mit herkömmlichen Trainingsmethoden nicht erreichen lässt. Mit den medizinisch zertifizierten Geräten lassen sich ganz speziell auch die nur schwer erreichbaren Muskelgruppen, wie die tiefe Bauch- Rücken- und Beckenbodenmuskulatur, stärken."
Be Body - EMS Training Essen,"['EMS', 'EMS Cardio']",True,"['L', 'XL']",L,Bergerhausen,Rellinghauserstrasse 268,https://urbansportsclub.com//de/venues/be-body-ems-training-essen,"{'@context': 'http://schema.org', '@type': 'LocalBusiness', 'name': 'Be Body - EMS Training Essen', 'description': 'BeBody in Dortmund bietet dir das fortschrittlichste EMS Training für schnelle &amp; sichtbare Ergebnisse. Bei BeBody erwartet dich eine angenehme und einladende Atmosphäre. Um dir die Exklusivität des Personal Trainings bieten zu können, finden sämtliche EMS-Trainings ausschließlich nach vorheriger Terminvereinbarung statt. Nur so kann die Regelmäßigkeit des Trainings gewährleistet und gemeinsam der &quot;innere Schweinehund&quot; bezwungen werden. Dein BeBody-Team erarbeitet gemeinsam mit dir, deinen persönlichen Trainingsplan und hält deine Ziele und deine Fortschritte fest. Um langfristig etwas von den erzielten Erfolgen zu haben, bietet dir BeBody zusätzlich zum Personal Training, exklusiv die Ernährungsberatung samt Erstellung des passenden Ernährungskonzeptes an. Vereinbare einfach und schnell deinen Termin bei BeBody. Das Team freut sich auf deinen Besuch!', 'address': {'@type': 'PostalAddress', 'addressLocality': 'Essen, Germany', 'addressCountry': 'Germany', 'postalCode': '45136', 'streetAddress': 'Rellinghauserstrasse 268'}, 'telephone': '', 'geo': {'@type': 'GeoCoordinates', 'latitude': '51.4367391', 'longitude': '7.0295312'}, 'priceRange': '-', 'image': 'https://storage.googleapis.com/download/storage/v1/b/usc-pro-uscweb-live-media/o/de-live%2Foriginal_1024x576_custom-7735_AWWBC.jpg?alt=media'}",51.4367391,7.0295312,"BeBody in Dortmund bietet dir das fortschrittlichste EMS Training für schnelle &amp; sichtbare Ergebnisse. Bei BeBody erwartet dich eine angenehme und einladende Atmosphäre. Um dir die Exklusivität des Personal Trainings bieten zu können, finden sämtliche EMS-Trainings ausschließlich nach vorheriger Terminvereinbarung statt. Nur so kann die Regelmäßigkeit des Trainings gewährleistet und gemeinsam der &quot;innere Schweinehund&quot; bezwungen werden. Dein BeBody-Team erarbeitet gemeinsam mit dir, deinen persönlichen Trainingsplan und hält deine Ziele und deine Fortschritte fest. Um langfristig etwas von den erzielten Erfolgen zu haben, bietet dir BeBody zusätzlich zum Personal Training, exklusiv die Ernährungsberatung samt Erstellung des passenden Ernährungskonzeptes an. Vereinbare einfach und schnell deinen Termin bei BeBody. Das Team freut sich auf deinen Besuch!"
BeBody EMS Training - Gelsenkirchen,"['EMS', 'EMS Cardio']",True,"['L', 'XL']",L,Gelsenkirchen,Cranger Str. 389,https://urbansportsclub.com//de/venues/bebody-ems-training-gelsenkirchen,"{'@context': 'http://schema.org', '@type': 'LocalBusiness', 'name': 'BeBody EMS Training - Gelsenkirchen', 'description': 'BeBody bietet dir das fortschrittlichste EMS Training für schnelle &amp; sichtbare Ergebnisse. Bei BeBody erwartet dich eine angenehme und einladende Atmosphäre. Um dir die Exklusivität des Personal Trainings bieten zu können, finden sämtliche EMS-Trainings ausschließlich nach vorheriger Terminvereinbarung statt. Nur so kann die Regelmäßigkeit des Trainings gewährleistet und gemeinsam der &quot;innere Schweinehund&quot; bezwungen werden. Dein BeBody-Team erarbeitet gemeinsam mit dir, deinen persönlichen Trainingsplan und hält deine Ziele und deine Fortschritte fest. Um langfristig etwas von den erzielten Erfolgen zu haben, bietet dir BeBody zusätzlich zum Personal Training, exklusiv die Ernährungsberatung samt Erstellung des passenden Ernährungskonzeptes an. Vereinbare einfach und schnell deinen Termin bei BeBody. Das Team freut sich auf deinen Besuch!', 'address': {'@type': 'PostalAddress', 'addressLocality': 'Essen, Germany', 'addressCountry': 'Germany', 'postalCode': '45891', 'streetAddress': 'Cranger Str. 389'}, 'telephone': '', 'geo': {'@type': 'GeoCoordinates', 'latitude': '51.5540656', 'longitude': '7.0996892'}, 'priceRange': '-', 'image': 'https://storage.googleapis.com/download/storage/v1/b/usc-pro-uscweb-live-media/o/de-live%2Foriginal_1650x928_EMSCompressed_1543839471951409_admin.jpg?alt=media'}",51.5540656,7.0996892,"BeBody bietet dir das fortschrittlichste EMS Training für schnelle &amp; sichtbare Ergebnisse. Bei BeBody erwartet dich eine angenehme und einladende Atmosphäre. Um dir die Exklusivität des Personal Trainings bieten zu können, finden sämtliche EMS-Trainings ausschließlich nach vorheriger Terminvereinbarung statt. Nur so kann die Regelmäßigkeit des Trainings gewährleistet und gemeinsam der &quot;innere Schweinehund&quot; bezwungen werden. Dein BeBody-Team erarbeitet gemeinsam mit dir, deinen persönlichen Trainingsplan und hält deine Ziele und deine Fortschritte fest. Um langfristig etwas von den erzielten Erfolgen zu haben, bietet dir BeBody zusätzlich zum Personal Training, exklusiv die Ernährungsberatung samt Erstellung des passenden Ernährungskonzeptes an. Vereinbare einfach und schnell deinen Termin bei BeBody. Das Team freut sich auf deinen Besuch!"
Bodystreet Essen Paulinenstraße,['EMS'],True,['XL'],XL,Rüttenscheid,Elfriedenstraße 40,https://urbansportsclub.com//de/venues/bodystreet-essen-paulinenstrasse,"{'@context': 'http://schema.org', '@type': 'LocalBusiness', 'name': 'Bodystreet Essen Paulinenstraße', 'description': 'Das EMS-Studio, das Zeit spart: 20 Minuten Training pro Woche reichen! Bodystreet setzt auf EMS-Training. Das ist eine innovative und besonders effiziente Muskelstimulierung und hilft bei den wichtigsten Trainingszielen: Gewicht verlieren, Rücken stärken, Muskeln aufbauen, Körper straffen, Wohlbefinden steigern, etc.', 'address': {'@type': 'PostalAddress', 'addressLocality': 'Essen, Germany', 'addressCountry': 'Germany', 'postalCode': '45130', 'streetAddress': 'Elfriedenstraße 40'}, 'telephone': '', 'geo': {'@type': 'GeoCoordinates', 'latitude': '51.4338203', 'longitude': '7.0117058'}, 'priceRange': '-', 'image': 'https://storage.googleapis.com/download/storage/v1/b/usc-pro-uscweb-live-media/o/de-live%2Foriginal_3000x1688_090f1bf05b72-paul_drinnen_3_1658934059581788_admin.jpg?generation=1658934059737463&amp;alt=media'}",51.4338203,7.0117058,"Das EMS-Studio, das Zeit spart: 20 Minuten Training pro Woche reichen! Bodystreet setzt auf EMS-Training. Das ist eine innovative und besonders effiziente Muskelstimulierung und hilft bei den wichtigsten Trainingszielen: Gewicht verlieren, Rücken stärken, Muskeln aufbauen, Körper straffen, Wohlbefinden steigern, etc."
Bootchamps - Essen,['Bootcamp'],False,"['M', 'L', 'XL']",M,Holsterhausen,Am Alfredspark,https://urbansportsclub.com//de/venues/bootchamps-essen,"{'@context': 'http://schema.org', '@type': 'LocalBusiness', 'name': 'Bootchamps - Essen', 'description': 'Be a ChAMP, join the CAMP! Unser hochintensives Zirkeltraining bringt deinen gesamten Körper in Bewegung und die Kalorienverbrennung läuft auf Hochtouren! Egal ob Einsteiger oder Experte – gemeinsam mit Gleichgesinnten pusht ihr euch im Team gegenseitig zu Bestleistungen. Ob im Bootcamp, beim BootTrail oder im Personal Training (1:1 oder 2:1) - an der frischen Luft und in natürlicher Umgebung sorgen unsere bestens ausgebildeten Personal-Coaches für den richtigen Mix aus Abwechslung, Spaß &amp; Motivation. Für Firmen bieten wir maßgeschneiderte Lösungen im Rahmen des Betrieblichen Gesundheitsmanagement. Vereine profitieren von professionellem Athletiktraining. Ein Ereignis besonderer Art sind unsere Fitness-Reisen, die BOOTChAMP&#039;s Beach Camps. Informiere dich jetzt auf https://www.bootchamps.de über die Trainingszeiten an deinem Wunschstandort oder nutze unsere neue Live-Chat-Funktion um deine Fragen los zu werden. Dein BOOTCHAMP`s Team freut sich darauf, dich fit machen zu dürfen.', 'address': {'@type': 'PostalAddress', 'addressLocality': 'Essen, Germany', 'addressCountry': 'Germany', 'postalCode': '45145', 'streetAddress': 'Am Alfredspark'}, 'telephone': '', 'geo': {'@type': 'GeoCoordinates', 'latitude': '51.445124', 'longitude': '6.983541'}, 'priceRange': '-', 'image': 'https://storage.googleapis.com/download/storage/v1/b/usc-pro-uscweb-live-media/o/de-live%2Foriginal_1064x599_8FF3B211-3A88-4B4A-948F-E03EAFA9A988_1551962497185071_admin.jpeg?alt=media'}",51.445124,6.983541,"Be a ChAMP, join the CAMP! Unser hochintensives Zirkeltraining bringt deinen gesamten Körper in Bewegung und die Kalorienverbrennung läuft auf Hochtouren! Egal ob Einsteiger oder Experte – gemeinsam mit Gleichgesinnten pusht ihr euch im Team gegenseitig zu Bestleistungen. Ob im Bootcamp, beim BootTrail oder im Personal Training (1:1 oder 2:1) - an der frischen Luft und in natürlicher Umgebung sorgen unsere bestens ausgebildeten Personal-Coaches für den richtigen Mix aus Abwechslung, Spaß &amp; Motivation. Für Firmen bieten wir maßgeschneiderte Lösungen im Rahmen des Betrieblichen Gesundheitsmanagement. Vereine profitieren von professionellem Athletiktraining. Ein Ereignis besonderer Art sind unsere Fitness-Reisen, die BOOTChAMP&#039;s Beach Camps. Informiere dich jetzt auf https://www.bootchamps.de über die Trainingszeiten an deinem Wunschstandort oder nutze unsere neue Live-Chat-Funktion um deine Fragen los zu werden. Dein BOOTCHAMP`s Team freut sich darauf, dich fit machen zu dürfen."
Bootchamps - Hattingen,['Bootcamp'],False,"['M', 'L', 'XL']",M,Hattingen,Sünsbruch 1,https://urbansportsclub.com//de/venues/bootchamps-hattingen,"{'@context': 'http://schema.org', '@type': 'LocalBusiness', 'name': 'Bootchamps - Hattingen', 'description': 'Be a ChAMP, join the CAMP! Unser hochintensives Zirkeltraining bringt deinen gesamten Körper in Bewegung und die Kalorienverbrennung läuft auf Hochtouren! Egal ob Einsteiger oder Experte – gemeinsam mit Gleichgesinnten pusht ihr euch im Team gegenseitig zu Bestleistungen. Ob im Bootcamp, beim BootTrail oder im Personal Training (1:1 oder 2:1) - an der frischen Luft und in natürlicher Umgebung sorgen unsere bestens ausgebildeten Personal-Coaches für den richtigen Mix aus Abwechslung, Spaß &amp; Motivation. Für Firmen bieten wir maßgeschneiderte Lösungen im Rahmen des Betrieblichen Gesundheitsmanagement. Vereine profitieren von professionellem Athletiktraining. Ein Ereignis besonderer Art sind unsere Fitness-Reisen, die BOOTChAMP&#039;s Beach Camps. Informiere dich jetzt auf https://www.bootchamps.de über die Trainingszeiten an deinem Wunschstandort oder nutze unsere neue Live-Chat-Funktion um deine Fragen los zu werden. Dein BOOTCHAMP`s Team freut sich darauf, dich fit machen zu dürfen.', 'address': {'@type': 'PostalAddress', 'addressLocality': 'Essen, Germany', 'addressCountry': 'Germany', 'postalCode': '45527', 'streetAddress': 'Sünsbruch 1'}, 'telephone': '', 'geo': {'@type': 'GeoCoordinates', 'latitude': '51.388092', 'longitude': '7.194225'}, 'priceRange': '-', 'image': 'https://storage.googleapis.com/download/storage/v1/b/usc-pro-uscweb-live-media/o/de-live%2Foriginal_1051x591_A7E6463A-241A-4A49-81E5-06DD858AA59D_1551962609178584_admin.jpeg?alt=media'}",51.388092,7.194225,"Be a ChAMP, join the CAMP! Unser hochintensives Zirkeltraining bringt deinen gesamten Körper in Bewegung und die Kalorienverbrennung läuft auf Hochtouren! Egal ob Einsteiger oder Experte – gemeinsam mit Gleichgesinnten pusht ihr euch im Team gegenseitig zu Bestleistungen. Ob im Bootcamp, beim BootTrail oder im Personal Training (1:1 oder 2:1) - an der frischen Luft und in natürlicher Umgebung sorgen unsere bestens ausgebildeten Personal-Coaches für den richtigen Mix aus Abwechslung, Spaß &amp; Motivation. Für Firmen bieten wir maßgeschneiderte Lösungen im Rahmen des Betrieblichen Gesundheitsmanagement. Vereine profitieren von professionellem Athletiktraining. Ein Ereignis besonderer Art sind unsere Fitness-Reisen, die BOOTChAMP&#039;s Beach Camps. Informiere dich jetzt auf https://www.bootchamps.de über die Trainingszeiten an deinem Wunschstandort oder nutze unsere neue Live-Chat-Funktion um deine Fragen los zu werden. Dein BOOTCHAMP`s Team freut sich darauf, dich fit machen zu dürfen."
EMS Studio Kettwig,"['EMS', 'EMS Cardio']",True,"['L', 'XL']",L,Kettwig,Ringstr. 155,https://urbansportsclub.com//de/venues/ems-studio-kettwig,"{'@context': 'http://schema.org', '@type': 'LocalBusiness', 'name': 'EMS Studio Kettwig', 'description': 'Beim EMS Studio in Essen-Kettwig erfährst du nicht nur, wie effektiv und erfolgreich EMS Training ist, sondern wirst dazu ganz persönlich und professionell betreut und fühlst dich einfach aufgehoben. Mit diesem 20-minütigen Training erzielst du die gleichen Effekte wie mit einem mehrstündigen, herkömmlichen Kraft- und Gerätetraining. Das Körpergefühl verbessert sich, die Leistungsfähigkeit wird gesteigert und du fühlst dich stabiler und straffer. Egal ob Rückenschmerzen, Körperformung, Rückbildung nach der Schwangerschaft oder Cellulite - Das Team begleitet dich vom erfassen deines Trainingszieles, über die Trainingsplanung und Ausführung bis zur Zielerreichung und ist voll für dich da!', 'address': {'@type': 'PostalAddress', 'addressLocality': 'Essen, Germany', 'addressCountry': 'Germany', 'postalCode': '45219', 'streetAddress': 'Ringstr. 155'}, 'telephone': '', 'geo': {'@type': 'GeoCoordinates', 'latitude': '51.3592065', 'longitude': '6.9339778'}, 'priceRange': '-', 'image': 'https://storage.googleapis.com/download/storage/v1/b/usc-pro-uscweb-live-media/o/de-live%2Foriginal_1600x900_14524537_1264521910266423_8205919168508101808_o.jpg?alt=media'}",51.3592065,6.9339778,"Beim EMS Studio in Essen-Kettwig erfährst du nicht nur, wie effektiv und erfolgreich EMS Training ist, sondern wirst dazu ganz persönlich und professionell betreut und fühlst dich einfach aufgehoben. Mit diesem 20-minütigen Training erzielst du die gleichen Effekte wie mit einem mehrstündigen, herkömmlichen Kraft- und Gerätetraining. Das Körpergefühl verbessert sich, die Leistungsfähigkeit wird gesteigert und du fühlst dich stabiler und straffer. Egal ob Rückenschmerzen, Körperformung, Rückbildung nach der Schwangerschaft oder Cellulite - Das Team begleitet dich vom erfassen deines Trainingszieles, über die Trainingsplanung und Ausführung bis zur Zielerreichung und ist voll für dich da!"
Easyfitness Bottrop,['Fitness'],False,"['M', 'L', 'XL']",M,Bottrop,Hansastraße 7,https://urbansportsclub.com//de/venues/easyfitness-bottrop,"{'@context': 'http://schema.org', '@type': 'LocalBusiness', 'name': 'Easyfitness Bottrop', 'description': 'Easyfitness Bottrop freut sich auf Dich!', 'address': {'@type': 'PostalAddress', 'addressLocality': 'Essen, Germany', 'addressCountry': 'Germany', 'postalCode': '46236', 'streetAddress': 'Hansastraße 7'}, 'telephone': '', 'geo': {'@type': 'GeoCoordinates', 'latitude': '51.5215268', 'longitude': '6.9246518'}, 'priceRange': '-', 'image': 'https://storage.googleapis.com/download/storage/v1/b/usc-pro-uscweb-live-media/o/de-live%2Foriginal_1024x576_tatunv92ztzsjlznjt5v_1683715514487290.jpg?generation=1683715514523740&amp;alt=media'}",51.5215268,6.9246518,Easyfitness Bottrop freut sich auf Dich!
Easyfitness Hattingen,['Fitness'],False,"['M', 'L', 'XL']",M,Hattingen,Heggerstraße 24,https://urbansportsclub.com//de/venues/easyfitness-hattingen,"{'@context': 'http://schema.org', '@type': 'LocalBusiness', 'name': 'Easyfitness Hattingen', 'description': 'Easyfitness freut sich auf Dich!', 'address': {'@type': 'PostalAddress', 'addressLocality': 'Essen, Germany', 'addressCountry': 'Germany', 'postalCode': '45525', 'streetAddress': 'Heggerstraße 24'}, 'telephone': '', 'geo': {'@type': 'GeoCoordinates', 'latitude': '51.399596', 'longitude': '7.1854397'}, 'priceRange': '-', 'image': 'https://storage.googleapis.com/download/storage/v1/b/usc-pro-uscweb-live-media/o/de-live%2Foriginal_1024x576_fitnesscompressed%20(29)_1640338582316185_admin.jpg?generation=1640338582861012&amp;alt=media'}",51.399596,7.1854397,Easyfitness freut sich auf Dich!
Go! Fitness,"['Fitness', 'Indoorcycling', 'Moderne Selbstverteidigung', 'Pilates', 'Traditionell-Asiatische Kampfkünste', 'Yoga']",False,"['S', 'M', 'L', 'XL']",S,Kray,Am Zehnthof 194,https://urbansportsclub.com//de/venues/go-fitness,"{'@context': 'http://schema.org', '@type': 'LocalBusiness', 'name': 'Go! Fitness', 'description': 'Warum GO! Fitness??? Du stehst in den Startlöchern zu mehr Vitalität. Deine Gegner: Alltagsstress, Übergewicht oder gesundheitliche Probleme. Oder du willst einfach noch mehr aus dir rausholen. Egal was dich bewegt, im GO! bekommst du die professionelle Unterstützung vom Startblock bis zur Ziellinie. Im GO! verbesserst du deine Vitalität in angenehmer Atmosphäre, gemeinsam mit Gleichgesinnten. Kein Stress und keine Superhelden. Jung und Alt – jeder bekommt hier sein individuelles Vitalitätsprogramm rund um bewusste Bewegung, gesunde Ernährung und wohltuende Entspannung. Du kannst deine Gesundheit fördern, dich zu Ernährungsthemen beraten lassen, dich intensiv bewegen oder den perfekten Ausgleich finden. Also, worauf wartest Du noch? Starte jetzt zu einem gesünderen Lebensstil.', 'address': {'@type': 'PostalAddress', 'addressLocality': 'Essen, Germany', 'addressCountry': 'Germany', 'postalCode': '45307', 'streetAddress': 'Am Zehnthof 194'}, 'telephone': '', 'geo': {'@type': 'GeoCoordinates', 'latitude': '51.4580704', 'longitude': '7.0724138'}, 'priceRange': '-', 'image': 'https://storage.googleapis.com/download/storage/v1/b/usc-pro-uscweb-live-media/o/de-live%2Foriginal_1024x576_1013495_455159861278851_664821221_n.jpg?alt=media'}",51.4580704,7.0724138,"Warum GO! Fitness??? Du stehst in den Startlöchern zu mehr Vitalität. Deine Gegner: Alltagsstress, Übergewicht oder gesundheitliche Probleme. Oder du willst einfach noch mehr aus dir rausholen. Egal was dich bewegt, im GO! bekommst du die professionelle Unterstützung vom Startblock bis zur Ziellinie. Im GO! verbesserst du deine Vitalität in angenehmer Atmosphäre, gemeinsam mit Gleichgesinnten. Kein Stress und keine Superhelden. Jung und Alt – jeder bekommt hier sein individuelles Vitalitätsprogramm rund um bewusste Bewegung, gesunde Ernährung und wohltuende Entspannung. Du kannst deine Gesundheit fördern, dich zu Ernährungsthemen beraten lassen, dich intensiv bewegen oder den perfekten Ausgleich finden. Also, worauf wartest Du noch? Starte jetzt zu einem gesünderen Lebensstil."
Himalaya Yoga - Essen,['Yoga'],False,"['M', 'L', 'XL']",M,Rüttenscheid,Dohmanns Kamp 2,https://urbansportsclub.com//de/venues/himalaya-yoga-essen,"{'@context': 'http://schema.org', '@type': 'LocalBusiness', 'name': 'Himalaya Yoga - Essen', 'description': 'HATHA - TRADITIONELLES YOGA FÜR ANFÄNGER UND YOGA-MEISTER. Yogi Gaurav aus dem Himalaya ist jetzt in Deutschland! 🙏 Sei dabei wenn traditionelles Hatha Yoga auf die Ruhe der höchsten Berge der Welt trifft! So werden diese 60 Minuten auch DEIN Leben mit sofortiger Wirkung beeinflussen: 👉 Erfahre tiefere Dimensionen und direkte Fortschritte deines Yoga 👉Erlebe innere Ruhe durch traditionelles Hatha Yoga des Himalaya 👉Reinige dein Körpersystem - physisch, mental und energetisch', 'address': {'@type': 'PostalAddress', 'addressLocality': 'Essen, Germany', 'addressCountry': 'Germany', 'postalCode': '45130', 'streetAddress': 'Dohmanns Kamp 2'}, 'telephone': '', 'geo': {'@type': 'GeoCoordinates', 'latitude': '51.4394438', 'longitude': '7.0076751'}, 'priceRange': '-', 'image': 'https://storage.googleapis.com/download/storage/v1/b/usc-pro-uscweb-live-media/o/de-live%2Foriginal_3648x2052_e79caf61339e-IMG_20210214_184202_1708687522121050_admin.jpeg?generation=1708687522201508&amp;alt=media'}",51.4394438,7.0076751,"HATHA - TRADITIONELLES YOGA FÜR ANFÄNGER UND YOGA-MEISTER. Yogi Gaurav aus dem Himalaya ist jetzt in Deutschland! 🙏 Sei dabei wenn traditionelles Hatha Yoga auf die Ruhe der höchsten Berge der Welt trifft! So werden diese 60 Minuten auch DEIN Leben mit sofortiger Wirkung beeinflussen: 👉 Erfahre tiefere Dimensionen und direkte Fortschritte deines Yoga 👉Erlebe innere Ruhe durch traditionelles Hatha Yoga des Himalaya 👉Reinige dein Körpersystem - physisch, mental und energetisch"
Kampfsportschule Essen,"['Boxsport', 'Lauftreff', 'Yoga']",False,"['M', 'L', 'XL']",M,Bergerhausen,Schürmannstraße 43A,https://urbansportsclub.com//de/venues/kampfsportschule-psv-essen,"{'@context': 'http://schema.org', '@type': 'LocalBusiness', 'name': 'Kampfsportschule Essen', 'description': 'Kampfsporttraining und Fitness-Kurse für Frauen und Männer. Hier kann jeder mit trainieren und so die vielen schönen Seiten des Kampfsports für sich selbst entdecken. Neben einer starken und rücksichtsvollen Gemeinschaft findest Du in der Kampfsportschule Essen ein professionelles Trainerteam für den Ausbau Deiner Fähigkeiten. Wir sind eine Abteilung des Polizeisportvereins Essen 1922 e. V. Als Kampfsport-Schule Essen bieten wir Kampfsporttraining und Fitness-Kurse für Frauen und Männer. Doch was bedeutet dies für dich? An sechs Tagen die Woche kannst Du in unserem Gym Brasilian Jiu-Jitsu, Muay Thai (Thaiboxen), klassisches Boxen, Luta Livre (brasilianisches Ringen, auch Grappling gennant), Mixed Martial Arts , Yoga, funktionelle Fitness/Crossfitness und vieles mehr trainieren. Alles von Interesse findest Du hier auf unserer Seite. Sollten noch Fragen offenbleiben, schreib uns gerne persönlich. Hoffentlich bis bald auf der Matte.', 'address': {'@type': 'PostalAddress', 'addressLocality': 'Essen, Germany', 'addressCountry': 'Germany', 'postalCode': '45136', 'streetAddress': 'Schürmannstraße 43A'}, 'telephone': '', 'geo': {'@type': 'GeoCoordinates', 'latitude': '51.433069', 'longitude': '7.031428'}, 'priceRange': '-', 'image': 'https://storage.googleapis.com/download/storage/v1/b/usc-pro-uscweb-live-media/o/de-live%2Foriginal_1024x576_887774972523-Lowkick_1_163722986092514_admin.jpg?generation=1637229860174625&amp;alt=media'}",51.433069,7.031428,"Kampfsporttraining und Fitness-Kurse für Frauen und Männer. Hier kann jeder mit trainieren und so die vielen schönen Seiten des Kampfsports für sich selbst entdecken. Neben einer starken und rücksichtsvollen Gemeinschaft findest Du in der Kampfsportschule Essen ein professionelles Trainerteam für den Ausbau Deiner Fähigkeiten. Wir sind eine Abteilung des Polizeisportvereins Essen 1922 e. V. Als Kampfsport-Schule Essen bieten wir Kampfsporttraining und Fitness-Kurse für Frauen und Männer. Doch was bedeutet dies für dich? An sechs Tagen die Woche kannst Du in unserem Gym Brasilian Jiu-Jitsu, Muay Thai (Thaiboxen), klassisches Boxen, Luta Livre (brasilianisches Ringen, auch Grappling gennant), Mixed Martial Arts , Yoga, funktionelle Fitness/Crossfitness und vieles mehr trainieren. Alles von Interesse findest Du hier auf unserer Seite. Sollten noch Fragen offenbleiben, schreib uns gerne persönlich. Hoffentlich bis bald auf der Matte."
