name,disciplines,plus_options,plans,min_plan,district,street,link,metadata,latitude,longitude,description
Kadampa Meditationszentrum Wiesbaden,"['Fitness', 'Meditation']",False,"['M', 'L', 'XL']",M,Mitte,Herderstraße 17,https://urbansportsclub.com//en/venues/kadampa-meditationszentrum-wiesbaden,"{'@context': 'http://schema.org', '@type': 'LocalBusiness', 'name': 'Kadampa Meditationszentrum Wiesbaden', 'description': 'Meditation hilft uns, inneren Frieden zu erfahren – ungeachtet der äußeren Umstände – und befähigt uns, negative Gedanken durch die Kraft des eigenen Geistes zu überwinden. Wenn die Unruhe der ablenkenden Gedanken nachlässt und unser Geist still wird, steigen tiefes Glück und Zufriedenheit ganz natürlich aus unserem Inneren empor. Im Rahmen dieses Kurses lernst du Meditationen kennen die für jeden geeignet und leicht zu praktizieren sind. Es werden die wesentlichen Punkte der Meditation vermittelt. Die Meditationen können leicht praktiziert werden, haben dennoch große Kraft, unser Leben positiv zu beeinflussen. Wenn die Unruhe der ablenkenden Gedanken nachlässt und unser Geist still wird, steigen tiefes Glück und Zufriedenheit ganz natürlich aus unserem Inneren empor. Im Rahmen dieses Kurses lernst du Meditationen kennen die für jeden geeignet und leicht zu praktizieren sind. Es werden die wesentlichen Punkte der Meditation vermittelt. Die Meditationen können leicht praktiziert werden, haben dennoch große Kraft, unser Leben positiv zu beeinflussen.', 'address': {'@type': 'PostalAddress', 'addressLocality': 'Wiesbaden, Germany', 'addressCountry': 'Germany', 'postalCode': '65185', 'streetAddress': 'Herderstraße 17'}, 'telephone': '', 'geo': {'@type': 'GeoCoordinates', 'latitude': '50.0739681', 'longitude': '8.2348883'}, 'priceRange': '-', 'image': 'https://storage.googleapis.com/download/storage/v1/b/usc-pro-uscweb-live-media/o/de-live%2Foriginal_2000x1125_728e3655a44d-20190920_122413_1__1569405768576671_admin.jpg?alt=media'}",50.0739681,8.2348883,"Meditation hilft uns, inneren Frieden zu erfahren – ungeachtet der äußeren Umstände – und befähigt uns, negative Gedanken durch die Kraft des eigenen Geistes zu überwinden. Wenn die Unruhe der ablenkenden Gedanken nachlässt und unser Geist still wird, steigen tiefes Glück und Zufriedenheit ganz natürlich aus unserem Inneren empor. Im Rahmen dieses Kurses lernst du Meditationen kennen die für jeden geeignet und leicht zu praktizieren sind. Es werden die wesentlichen Punkte der Meditation vermittelt. Die Meditationen können leicht praktiziert werden, haben dennoch große Kraft, unser Leben positiv zu beeinflussen. Wenn die Unruhe der ablenkenden Gedanken nachlässt und unser Geist still wird, steigen tiefes Glück und Zufriedenheit ganz natürlich aus unserem Inneren empor. Im Rahmen dieses Kurses lernst du Meditationen kennen die für jeden geeignet und leicht zu praktizieren sind. Es werden die wesentlichen Punkte der Meditation vermittelt. Die Meditationen können leicht praktiziert werden, haben dennoch große Kraft, unser Leben positiv zu beeinflussen."
LADYFORM - EMS,['EMS'],True,"['L', 'XL']",L,Nordenstadt,Ostring 5,https://urbansportsclub.com//en/venues/ladyform-ems,"{'@context': 'http://schema.org', '@type': 'LocalBusiness', 'name': 'LADYFORM - EMS', 'description': 'Das LADY FORM Betreuungssystem - einzigartig und individuell auf deine Bedürfnisse abgestimmt! Dich erwarten tolle Programme speziell für die Frau: Der Fettstoffwechsel- und Figur-Zirkel: - Stoffwechselaktivierung - Kräftigung von Herz und Kreislauf - Figurformung und Straffung five - Das Rücken- und Gelenkskonzept: - Schmerzfreier durch mehr Beweglichkeit - Positive Wirkung auf den Bewegungsapparat - Aktiviert den Energiefluss Vacu Walk - Sanftes Gehen im Unterdruck: - Stoffwechselaktivierung - Umfangverringerung - Verbesserung von Orangenhaut - Fördert Glättung und Straffung der Haut Gruppenprogramme: - Pilates, Yoga, Bauch Beine Po, Spinning, Wirbelsäulengymnastik, Zumba, Step, Flexibar u.v.m. Lymphdrainage: - Entschlackend und entspannend - Positive Wirkung auf die Lymphe, z.B. Entwässerung happyFigur: - von der Krankenkasse bezuschusst - Abnehm und Ernährungskurs individuell angepasst', 'address': {'@type': 'PostalAddress', 'addressLocality': 'Wiesbaden, Germany', 'addressCountry': 'Germany', 'postalCode': '65205', 'streetAddress': 'Ostring 5'}, 'telephone': '+49 6122 2279', 'geo': {'@type': 'GeoCoordinates', 'latitude': '50.0590325', 'longitude': '8.3439914'}, 'priceRange': '-', 'image': 'https://storage.googleapis.com/download/storage/v1/b/usc-pro-uscweb-live-media/o/de-live%2Foriginal_1024x576_jxs1acjvmh4earyiraux_1692191542128534.png?generation=1692191542230855&amp;alt=media'}",50.0590325,8.3439914,"Das LADY FORM Betreuungssystem - einzigartig und individuell auf deine Bedürfnisse abgestimmt! Dich erwarten tolle Programme speziell für die Frau: Der Fettstoffwechsel- und Figur-Zirkel: - Stoffwechselaktivierung - Kräftigung von Herz und Kreislauf - Figurformung und Straffung five - Das Rücken- und Gelenkskonzept: - Schmerzfreier durch mehr Beweglichkeit - Positive Wirkung auf den Bewegungsapparat - Aktiviert den Energiefluss Vacu Walk - Sanftes Gehen im Unterdruck: - Stoffwechselaktivierung - Umfangverringerung - Verbesserung von Orangenhaut - Fördert Glättung und Straffung der Haut Gruppenprogramme: - Pilates, Yoga, Bauch Beine Po, Spinning, Wirbelsäulengymnastik, Zumba, Step, Flexibar u.v.m. Lymphdrainage: - Entschlackend und entspannend - Positive Wirkung auf die Lymphe, z.B. Entwässerung happyFigur: - von der Krankenkasse bezuschusst - Abnehm und Ernährungskurs individuell angepasst"
Laura Bernstein® Kosmetik Studio,['Massage'],True,"['L', 'XL']",L,Mitte,Neugasse 15-19,https://urbansportsclub.com//en/venues/laura-bernstein-kosmetik-studio,"{'@context': 'http://schema.org', '@type': 'LocalBusiness', 'name': 'Laura Bernstein® Kosmetik Studio', 'description': '.', 'address': {'@type': 'PostalAddress', 'addressLocality': 'Wiesbaden, Germany', 'addressCountry': 'Germany', 'postalCode': '65183', 'streetAddress': 'Neugasse 15-19'}, 'telephone': '+49 176 80060376', 'geo': {'@type': 'GeoCoordinates', 'latitude': '50.0819286', 'longitude': '8.2399995'}, 'priceRange': '-', 'image': 'https://storage.googleapis.com/download/storage/v1/b/usc-pro-uscweb-live-media/o/de-live%2Foriginal_1686x948_pemjfsbswku9idxkecwf_1712912899879665.png?generation=1712912899956581&amp;alt=media'}",50.0819286,8.2399995,.
Outdoor Nation Wiesbaden - Am Schlachthof,['Bootcamp'],False,"['S', 'M', 'L', 'XL']",S,Mitte,Murnaustraße 1,https://urbansportsclub.com//en/venues/outdoor-nation-am-schlachthof,"{'@context': 'http://schema.org', '@type': 'LocalBusiness', 'name': 'Outdoor Nation Wiesbaden - Am Schlachthof', 'description': 'Wir machen Fitness einfach, effizient und für jeden erschwinglich. Outdoor-Nation verkörpert ein Lebensgefühl.Unter freiem Himmel, bei Wind und Wetter die eigenen Muskeln stählen, Körper und Geist in Form bringen. Zusammen mit tollen Menschen durchhalten, kämpfen und motivieren.', 'address': {'@type': 'PostalAddress', 'addressLocality': 'Wiesbaden, Germany', 'addressCountry': 'Germany', 'postalCode': '65189', 'streetAddress': 'Murnaustraße 1'}, 'telephone': '', 'geo': {'@type': 'GeoCoordinates', 'latitude': '50.066147', 'longitude': '8.248071'}, 'priceRange': '-', 'image': 'https://storage.googleapis.com/download/storage/v1/b/usc-pro-uscweb-live-media/o/de-live%2Foriginal_1024x576_titelbild%20Urban%20Sportsclub_1572252303669981_admin.jpg?alt=media'}",50.066147,8.248071,"Wir machen Fitness einfach, effizient und für jeden erschwinglich. Outdoor-Nation verkörpert ein Lebensgefühl.Unter freiem Himmel, bei Wind und Wetter die eigenen Muskeln stählen, Körper und Geist in Form bringen. Zusammen mit tollen Menschen durchhalten, kämpfen und motivieren."
PitschWalk - Powerwalking Wiesbaden,"['Fitness', 'Running']",False,"['S', 'M', 'L', 'XL']",S,Amöneburg,Rheingaustraße 140,https://urbansportsclub.com//en/venues/pitschwalk-wiesbaden,"{'@context': 'http://schema.org', '@type': 'LocalBusiness', 'name': 'PitschWalk - Powerwalking Wiesbaden', 'description': 'Du möchtest raus, Dich bewegen, Fitness, Wellness und Spaß in der Gruppe? Dann bist Du beim Powerwalking genau richtig! Powerwalking ist ein gelenkschonendes Outdoor-Fitnesstraining für den ganzen Körper. Es ist für alle Altersgruppen und jeden Fitnesslevel geeignet, sofern keine gesundheitlichen Einschränkungen bestehen. Powerwalking steigert sowohl Deine körperliche als auch Deine mentale Fitness, stärkt Dein Immunsystem und unterstützt Dich beim Abnehmen. PitschWalk bietet an allen 6 Standorten im Rhein-Main-Gebiet mehrmals wöchentlich ein ca. 60- bis 75-minütiges Powerwalking-Training an, bestehend aus einem kurzen Aufwärmprogramm, zwischen 45 und 60 Minuten Powerwalking auf wechselnden Routen mit 1 - 3 kurzen Fitness- und/oder Koordinationsübungen zwischendurch, Cool Down-Phase und Dehnübungen zum Abschluss. Du kannst zu jedem Termin einsteigen und erhältst unmittelbar vor Beginn Deines ersten Trainings eine ca. 10-minütige Einführung in die richtige Walkingtechnik. Dein Powerwalking-Trainer achtet bei jedem Termin auf Deine Technik und unterstützt Dich beim Erreichen Deiner Ziele, sei es einfach mehr Bewegung, mehr Ausdauer und/oder eine höhere Geschwindigkeit. Das Powerwalking-Training findet bei jedem Wetter statt, Ausnahmen sind Starkregen, Gewitter und Glatteis.', 'address': {'@type': 'PostalAddress', 'addressLocality': 'Wiesbaden, Germany', 'addressCountry': 'Germany', 'postalCode': '65203', 'streetAddress': 'Rheingaustraße 140'}, 'telephone': '', 'geo': {'@type': 'GeoCoordinates', 'latitude': '50.0374263', 'longitude': '8.2340881'}, 'priceRange': '-', 'image': 'https://storage.googleapis.com/download/storage/v1/b/usc-pro-uscweb-live-media/o/de-live%2Foriginal_1438x809_PitschWalk%20-%20Powerwalker%20Winter%20-%20eigene%20Aufnahme_1580464690413656_admin.png?alt=media'}",50.0374263,8.2340881,"Du möchtest raus, Dich bewegen, Fitness, Wellness und Spaß in der Gruppe? Dann bist Du beim Powerwalking genau richtig! Powerwalking ist ein gelenkschonendes Outdoor-Fitnesstraining für den ganzen Körper. Es ist für alle Altersgruppen und jeden Fitnesslevel geeignet, sofern keine gesundheitlichen Einschränkungen bestehen. Powerwalking steigert sowohl Deine körperliche als auch Deine mentale Fitness, stärkt Dein Immunsystem und unterstützt Dich beim Abnehmen. PitschWalk bietet an allen 6 Standorten im Rhein-Main-Gebiet mehrmals wöchentlich ein ca. 60- bis 75-minütiges Powerwalking-Training an, bestehend aus einem kurzen Aufwärmprogramm, zwischen 45 und 60 Minuten Powerwalking auf wechselnden Routen mit 1 - 3 kurzen Fitness- und/oder Koordinationsübungen zwischendurch, Cool Down-Phase und Dehnübungen zum Abschluss. Du kannst zu jedem Termin einsteigen und erhältst unmittelbar vor Beginn Deines ersten Trainings eine ca. 10-minütige Einführung in die richtige Walkingtechnik. Dein Powerwalking-Trainer achtet bei jedem Termin auf Deine Technik und unterstützt Dich beim Erreichen Deiner Ziele, sei es einfach mehr Bewegung, mehr Ausdauer und/oder eine höhere Geschwindigkeit. Das Powerwalking-Training findet bei jedem Wetter statt, Ausnahmen sind Starkregen, Gewitter und Glatteis."
Sportpark Simmern,"['Dance', 'Fitness', 'Tennis', 'Yoga']",False,"['M', 'L', 'XL']",M,Simmern,Am Naturfreibad,https://urbansportsclub.com//en/venues/sportpark-simmern,"{'@context': 'http://schema.org', '@type': 'LocalBusiness', 'name': 'Sportpark Simmern', 'description': 'Bereits seit 1987 leisten wir im Sportpark einen bedeutsamen Beitrag zum Sportangebot für die Region Simmern-Hunsrück. Mit der Eröffnung des Fitnessstudios im Jahr 2001 bieten wir sowohl Freizeit- und Leistungssportlern als auch gesundheitsorientierten Menschen ein umfassendes Angebot für alle Generationen unter einem Dach. Die Liebe zum Sport und Bereitschaft Sport zu leben drückt sich in unserer Philosophie Wir Leben Sport aus. Mitglieder, Gäste und natürlich unsere Mitarbeiter gehen mit allem Engagement an das Thema Training heran. Unter dem Motto Menschen begegnen Menschen werden wir im Sportpark alles tun, sich wohl zu fühlen, zu entspannen, fit zu werden und sich fit zu halten. Figur- und Muskeltraining / Herz-Kreislauftraining / vielseitiges Kursprogramm / Sauna / eGym / Rücken- und Gelenkzentrum / Tennis / Physiotherapie / Reha Sport / Präventions-Kurse WICHTIG: Wir bitten vor deinem ersten Besuch bei uns um eine Terminvereinbarung zur Begrüßung und Einführung an die Geräte. Telefon: 06761 – 7010 / Email: fitness@sportpark-simmern.de https://www.facebook.com/Sportpark.Simmern', 'address': {'@type': 'PostalAddress', 'addressLocality': 'Wiesbaden, Germany', 'addressCountry': 'Germany', 'postalCode': '55469', 'streetAddress': 'Am Naturfreibad'}, 'telephone': '', 'geo': {'@type': 'GeoCoordinates', 'latitude': '49.9756965', 'longitude': '7.5248435'}, 'priceRange': '-', 'image': 'https://storage.googleapis.com/download/storage/v1/b/usc-pro-uscweb-live-media/o/de-live%2Foriginal_2000x1125_c6609bdd391a-Sportpark_12_1616592764856987_admin.jpg?alt=media'}",49.9756965,7.5248435,"Bereits seit 1987 leisten wir im Sportpark einen bedeutsamen Beitrag zum Sportangebot für die Region Simmern-Hunsrück. Mit der Eröffnung des Fitnessstudios im Jahr 2001 bieten wir sowohl Freizeit- und Leistungssportlern als auch gesundheitsorientierten Menschen ein umfassendes Angebot für alle Generationen unter einem Dach. Die Liebe zum Sport und Bereitschaft Sport zu leben drückt sich in unserer Philosophie Wir Leben Sport aus. Mitglieder, Gäste und natürlich unsere Mitarbeiter gehen mit allem Engagement an das Thema Training heran. Unter dem Motto Menschen begegnen Menschen werden wir im Sportpark alles tun, sich wohl zu fühlen, zu entspannen, fit zu werden und sich fit zu halten. Figur- und Muskeltraining / Herz-Kreislauftraining / vielseitiges Kursprogramm / Sauna / eGym / Rücken- und Gelenkzentrum / Tennis / Physiotherapie / Reha Sport / Präventions-Kurse WICHTIG: Wir bitten vor deinem ersten Besuch bei uns um eine Terminvereinbarung zur Begrüßung und Einführung an die Geräte. Telefon: 06761 – 7010 / Email: fitness@sportpark-simmern.de https://www.facebook.com/Sportpark.Simmern"
Studio 85,['Yoga'],False,"['L', 'XL']",L,Biebrich,Rheingaustraße 85B,https://urbansportsclub.com//en/venues/studio-85,"{'@context': 'http://schema.org', '@type': 'LocalBusiness', 'name': 'Studio 85', 'description': 'STUDIO 85 ist eine Yogaschule für alle, die sich nach einer regelmäßigen Yogapraxis sehnen, die Yoga lernen wollen oder schon können, für die, die Yoga als therapeutische Unterstützung brauchen, für alle die, die ihren Körper fit halten und ihren Geist zur Ruhe kommen lassen wollen. Unser lichtdurchflutetes Loft bietet zwei grosse Räume zum Praktizieren mit Blick auf die Rheinwiesen. Eine kleine Lounge lädt nach der Praxis zum Verweilen und zum gegenseitigen Austausch ein.', 'address': {'@type': 'PostalAddress', 'addressLocality': 'Wiesbaden, Germany', 'addressCountry': 'Germany', 'postalCode': '65203', 'streetAddress': 'Rheingaustraße 85B'}, 'telephone': '', 'geo': {'@type': 'GeoCoordinates', 'latitude': '50.0409302', 'longitude': '8.2163455'}, 'priceRange': '-', 'image': 'https://storage.googleapis.com/download/storage/v1/b/usc-pro-uscweb-live-media/o/de-live%2Foriginal_7836x4408_ad8692f1f458-87_1659529270169607_admin.jpg?generation=1659529270339591&amp;alt=media'}",50.0409302,8.2163455,"STUDIO 85 ist eine Yogaschule für alle, die sich nach einer regelmäßigen Yogapraxis sehnen, die Yoga lernen wollen oder schon können, für die, die Yoga als therapeutische Unterstützung brauchen, für alle die, die ihren Körper fit halten und ihren Geist zur Ruhe kommen lassen wollen. Unser lichtdurchflutetes Loft bietet zwei grosse Räume zum Praktizieren mit Blick auf die Rheinwiesen. Eine kleine Lounge lädt nach der Praxis zum Verweilen und zum gegenseitigen Austausch ein."
Thai Massagen Chivadee,['Massage'],True,"['L', 'XL']",L,Mitte,Bahnhofstraße 20,https://urbansportsclub.com//en/venues/thai-massagen-chivadee,"{'@context': 'http://schema.org', '@type': 'LocalBusiness', 'name': 'Thai Massagen Chivadee', 'description': 'Wir sind als einziges Studio im ges. Rhein-Main Gebiet im Thai-Spa e.V. Deutschland. Das garantiert dem Kunden (Besucher) das wir streng nach den Vorschriften des thail. Gesundheitsministerium arbeiten. Wichtig für Sie als Kunden: unsere Mitarbeiterinnen müssen zertifiziert sein. Die Wurzeln der Thai-Massage liegen in der ayurvedischen Medizin Indiens. Für den Kunden ist außerdem Hygiene und Sauberkeit ein wichtiges Auswahl-Kriterium. Nur unser Studio, im ges. Rhein-Main Gebiet, ist Hygiene-Zertifiziert. Auf der Toilette und auch im Personalbereich sind an den Waschgelegenheiten Desinfektions-Geräte angebracht, um diesen Ansprüchen zu genügen. Bedingungen die auch für Arzt-Praxen erforderlich sind. Einweg-Sandalen-, garantiert für jeden Kunden „neue saubere, Handtücher. Auf Wunsch Einweg-Laken aus med. Bereich. Gern auch Einweg-Unterhosen für Mann u. Frau. Ausführliche Beschreibungen zum Thai-Massagen liegen im Studio aus. Wir sind Mitglied im DGAM (Deutsche Gesellschaft für alternative Medizin) -, Mitglied im Fachverband „WBG“ (Fachverband Wellness, Beauty und Gesundheit e.V.). Sie finden uns unter www.theralupa.de. Heilungsaussagen sind uns vom Deutschen Gesetzgeber untersagt. Wir arbeiten, bei Bedarf, mit Frau Suzanne Wenzel (staatl. geprüfte Heilpraktikerin) 65183 Wiesbaden zusammen. Videos (in 5 Sprachen) / Informationsmaterial in Deutsch /englisch / arabisch liegt im Studio aus. Sondereinbauten im WC für unsere Kunden aus dem arabischen Raum zur Durchführung Ihrer Reinigungsrituale. Unsere arab. Flyer liegen z,B. in div. Moscheen aus. Ein Stück Thailand vom Feinstem in Wiesbaden einer weltoffenen Stadt. (Landeshauptstadt von Hessen). Interior im thailändischen Stil dekoriert mit ständig frischen, lebendigen Orchideen von unserer Chefin Frau Buabarn (Universitätsabschluss in Design / Art – studiert in Bangkok). Wir freuen uns auf Ihren Besuch. PS: Preislisten / Flyer in mehreren Sprachen abrufbar per email: hallo@chivadee.de Pflegeprodukte aus französischer Produktion (Jean en Provence / Grain de Pastel (Toulouse)', 'address': {'@type': 'PostalAddress', 'addressLocality': 'Wiesbaden, Germany', 'addressCountry': 'Germany', 'postalCode': '65185', 'streetAddress': 'Bahnhofstraße 20'}, 'telephone': '+49 611 36024808', 'geo': {'@type': 'GeoCoordinates', 'latitude': '50.0774464', 'longitude': '8.2427842'}, 'priceRange': '-', 'image': 'https://storage.googleapis.com/download/storage/v1/b/usc-pro-uscweb-live-media/o/de-live%2Foriginal_1024x576_Deckseite_1568273476282014_admin.jpg?alt=media'}",50.0774464,8.2427842,"Wir sind als einziges Studio im ges. Rhein-Main Gebiet im Thai-Spa e.V. Deutschland. Das garantiert dem Kunden (Besucher) das wir streng nach den Vorschriften des thail. Gesundheitsministerium arbeiten. Wichtig für Sie als Kunden: unsere Mitarbeiterinnen müssen zertifiziert sein. Die Wurzeln der Thai-Massage liegen in der ayurvedischen Medizin Indiens. Für den Kunden ist außerdem Hygiene und Sauberkeit ein wichtiges Auswahl-Kriterium. Nur unser Studio, im ges. Rhein-Main Gebiet, ist Hygiene-Zertifiziert. Auf der Toilette und auch im Personalbereich sind an den Waschgelegenheiten Desinfektions-Geräte angebracht, um diesen Ansprüchen zu genügen. Bedingungen die auch für Arzt-Praxen erforderlich sind. Einweg-Sandalen-, garantiert für jeden Kunden „neue saubere, Handtücher. Auf Wunsch Einweg-Laken aus med. Bereich. Gern auch Einweg-Unterhosen für Mann u. Frau. Ausführliche Beschreibungen zum Thai-Massagen liegen im Studio aus. Wir sind Mitglied im DGAM (Deutsche Gesellschaft für alternative Medizin) -, Mitglied im Fachverband „WBG“ (Fachverband Wellness, Beauty und Gesundheit e.V.). Sie finden uns unter www.theralupa.de. Heilungsaussagen sind uns vom Deutschen Gesetzgeber untersagt. Wir arbeiten, bei Bedarf, mit Frau Suzanne Wenzel (staatl. geprüfte Heilpraktikerin) 65183 Wiesbaden zusammen. Videos (in 5 Sprachen) / Informationsmaterial in Deutsch /englisch / arabisch liegt im Studio aus. Sondereinbauten im WC für unsere Kunden aus dem arabischen Raum zur Durchführung Ihrer Reinigungsrituale. Unsere arab. Flyer liegen z,B. in div. Moscheen aus. Ein Stück Thailand vom Feinstem in Wiesbaden einer weltoffenen Stadt. (Landeshauptstadt von Hessen). Interior im thailändischen Stil dekoriert mit ständig frischen, lebendigen Orchideen von unserer Chefin Frau Buabarn (Universitätsabschluss in Design / Art – studiert in Bangkok). Wir freuen uns auf Ihren Besuch. PS: Preislisten / Flyer in mehreren Sprachen abrufbar per email: hallo@chivadee.de Pflegeprodukte aus französischer Produktion (Jean en Provence / Grain de Pastel (Toulouse)"
Wu-Te Akademie Wiesbaden,"['Modern Self Defense', 'Traditional Asian Martial Arts']",False,"['M', 'L', 'XL']",M,Mitte,Bahnhofstraße 35,https://urbansportsclub.com//en/venues/wiesbaden-wu-te-akademie,"{'@context': 'http://schema.org', '@type': 'LocalBusiness', 'name': 'Wu-Te Akademie Wiesbaden', 'description': 'Die Wu-Te Akademie freut sich auf Dich!', 'address': {'@type': 'PostalAddress', 'addressLocality': 'Wiesbaden, Germany', 'addressCountry': 'Germany', 'postalCode': '65185', 'streetAddress': 'Bahnhofstraße 35'}, 'telephone': '+49 171 4744048', 'geo': {'@type': 'GeoCoordinates', 'latitude': '50.07661', 'longitude': '8.242075'}, 'priceRange': '-', 'image': 'https://storage.googleapis.com/download/storage/v1/b/usc-pro-uscweb-live-media/o/de-live%2Foriginal_1061x597_LangDoppelklein1_F2T3Y.jpeg?alt=media'}",50.07661,8.242075,Die Wu-Te Akademie freut sich auf Dich!
Yogastudio Prana Oestrich-Winkel,['Yoga'],False,"['L', 'XL']",L,Oestrich-Winkel,Kirchstrasse 61,https://urbansportsclub.com//en/venues/yogastudio-prana-oestrich-winkel,"{'@context': 'http://schema.org', '@type': 'LocalBusiness', 'name': 'Yogastudio Prana Oestrich-Winkel', 'description': '.', 'address': {'@type': 'PostalAddress', 'addressLocality': 'Wiesbaden, Germany', 'addressCountry': 'Germany', 'postalCode': '65375', 'streetAddress': 'Kirchstrasse 61'}, 'telephone': '', 'geo': {'@type': 'GeoCoordinates', 'latitude': '50.0027669', 'longitude': '8.0025599'}, 'priceRange': '-', 'image': 'https://storage.googleapis.com/download/storage/v1/b/usc-pro-uscweb-live-media/o/de-live%2Foriginal_1688x949_jc5xduoompvzspfjygzw_1710343595972062.png?generation=1710343596115212&amp;alt=media'}",50.0027669,8.0025599,.
clever fit Nastätten,['Fitness'],False,"['M', 'L', 'XL']",M,Nastätten,Industriestraße 4,https://urbansportsclub.com//en/venues/clever-fit-nasttten,"{'@context': 'http://schema.org', '@type': 'LocalBusiness', 'name': 'clever fit Nastätten', 'description': 'CleverFit freut sich auf Dich!', 'address': {'@type': 'PostalAddress', 'addressLocality': 'Wiesbaden, Germany', 'addressCountry': 'Germany', 'postalCode': '56355', 'streetAddress': 'Industriestraße 4'}, 'telephone': '', 'geo': {'@type': 'GeoCoordinates', 'latitude': '50.1976127', 'longitude': '7.8489498'}, 'priceRange': '-', 'image': 'https://storage.googleapis.com/download/storage/v1/b/usc-pro-uscweb-live-media/o/de-live%2Foriginal_1024x576_Fitness%20(3)_1715679454160341_admin.jpg?generation=1715679454235819&amp;alt=media'}",50.1976127,7.8489498,CleverFit freut sich auf Dich!
