name,disciplines,plus_options,plans,min_plan,district,street,link,metadata,latitude,longitude,description
Siegtalbad Wissen,['Swimming'],False,"['Essential', 'Classic', 'Premium', 'Max']",Essential,Wissen,Stadionstraße 42,https://urbansportsclub.com//en/venues/siegtalbad-wissen,"{'@context': 'http://schema.org', '@type': 'LocalBusiness', 'name': 'Siegtalbad Wissen', 'description': 'Auf geht´s ins Badeabenteuer Das Badeparadies verfügt über vielseitige Angebote. Ein Edelstahlbecken 25 x 8 m, die große 60-Meter-Rutsche, die Sprunganlage und das Vierjahreszeitenbecken mit Sprudelbänken und Strömungskanal ermöglichen eine Menge Spaß und Abwechslung. Edelstahlbecken 25 x 8 m große 60-Meter-Rutsche Vierjahreszeitenbecken mit Sprudelbänken und Strömungskanal Sprungturm Liegewiesen große 60-Meter-Rutsche Planschbereich Sprungturm Bistro', 'address': {'@type': 'PostalAddress', 'addressLocality': 'Bonn, Germany', 'addressCountry': 'Germany', 'postalCode': '57537', 'streetAddress': 'Stadionstraße 42'}, 'telephone': '', 'geo': {'@type': 'GeoCoordinates', 'latitude': '50.7847419', 'longitude': '7.7194374'}, 'priceRange': '-', 'image': 'https://storage.googleapis.com/download/storage/v1/b/usc-pro-uscweb-live-media/o/de-live%2Foriginal_1760x990_a6564c1e6a41-21.12._019479_170591708371395_admin.jpg?generation=1705917083158418&amp;alt=media'}",50.7847419,7.7194374,"Auf geht´s ins Badeabenteuer Das Badeparadies verfügt über vielseitige Angebote. Ein Edelstahlbecken 25 x 8 m, die große 60-Meter-Rutsche, die Sprunganlage und das Vierjahreszeitenbecken mit Sprudelbänken und Strömungskanal ermöglichen eine Menge Spaß und Abwechslung. Edelstahlbecken 25 x 8 m große 60-Meter-Rutsche Vierjahreszeitenbecken mit Sprudelbänken und Strömungskanal Sprungturm Liegewiesen große 60-Meter-Rutsche Planschbereich Sprungturm Bistro"
Tanzschule Max7 - Altstadt,"['Dance', 'Yoga']",False,"['Classic', 'Premium', 'Max']",Classic,Altstadt,Maxstraße 7,https://urbansportsclub.com//en/venues/tanzschule-max7-altstadt,"{'@context': 'http://schema.org', '@type': 'LocalBusiness', 'name': 'Tanzschule Max7 - Altstadt', 'description': 'Tanzschule Max7 freut sich auf Dich!', 'address': {'@type': 'PostalAddress', 'addressLocality': 'Bonn, Germany', 'addressCountry': 'Germany', 'postalCode': '53111', 'streetAddress': 'Maxstraße 7'}, 'telephone': '+44 22 8266 6834', 'geo': {'@type': 'GeoCoordinates', 'latitude': '50.7382542', 'longitude': '7.0925953'}, 'priceRange': '-', 'image': 'https://storage.googleapis.com/download/storage/v1/b/usc-pro-uscweb-live-media/o/de-live%2Foriginal_1053x592_fs77wvdf5orzh1vogxsl_1732115050710740.png?generation=1732115050769087&amp;alt=media'}",50.7382542,7.0925953,Tanzschule Max7 freut sich auf Dich!
Schwimmbad Friesdorf (Kombibad Tragluft),['Swimming'],False,"['Essential', 'Classic', 'Premium', 'Max']",Essential,Dottendorf,Margaretenstr. 14,https://urbansportsclub.com//en/venues/schwimmbad-friesdorf-kombibad-tragluft,"{'@context': 'http://schema.org', '@type': 'LocalBusiness', 'name': 'Schwimmbad Friesdorf (Kombibad Tragluft)', 'description': 'Bäder bieten spritziges Freizeitvergnügen Bonn verfügt über acht Schwimmbäder: fünf Freibäder, ein kombiniertes Hallen-/Freibad und zwei Schwimmhallen. Kombibad Hardtbergbad Der Freibadteil des Hardtbergbades verfügt über ein Sportbecken und zwei Nichtschwimmerbecken. Das Planschbecken mit Bachlauf bietet vor allem Familien mit Kindern viele Möglichkeiten zur Erholung und Aktivitäten. Im Sandspielplatz befinden sich ein Matschbereich und eine Kinderbaustelle. Ebenfalls steht ein Beach-Volleyballfeld zur Verfügung. Die Anlage ist behindertengerecht und zugänglich für Rollstuhlfahrer. Die Schwimmhalle ist barrierefrei für Rollstuhlfahrer. Dort ermöglicht ein mobiler Poollifter Gehbehinderten einen stufenlosen Beckeneinstieg. Freibäder Melbbad Das Melbbad in Poppelsdorf ist sehr idyllisch am Hang des Venusberges gelegen. Die Wiesen mit südwestlicher Lage laden zum Sonnenbaden ein. Besonders Studenten nutzen das der Universität nahe gelegene Bad zum Sonnenbaden und Schwimmen. Das Bad verfügt über zwei Beach-Volleyballfelder. Freibad Friesdorf „Friesi“ Das 1961 eröffnete kleine Freibad mitten in Friesdorf hat trotz seiner geringen Wasserfläche viel zu bieten. Den Badegästen stehen im Sommer ein Sportbecken, ein Lehrschwimmbecken sowie ein Planschbecken zur Verfügung. Des Weiteren gibt es viele Attraktionen wie Beachvolleyballanlage, Tischtennisplatte, Torwand, Basketballfeld, kleine Fußballtore und eine Wippe sowie eine kleine Rutsche, die zu einem schönen unvergesslichen Freibadbesuch beitragen. Zusätzlich ist seit Ende 2012 eine neue Kinderspiellandschaft mit vielen Klettermöglichkeiten in einem riesigen Sandbereich entstanden, der zum Bauen von Burgen einlädt. Die Lage fast im Mittelpunkt von Friesdorf macht es für viele Einwohner, besonders für viele Kinder, zum &quot;Swimmingpool&quot;. Panoramabad Rüngsdorf Manche sagen, dass es wegen seiner landschaftlich überaus reizvollen Lage unmittelbar am Rhein mit Blick auf das Siebengebirge eines der schönsten Freibäder am Rhein überhaupt sei. Der in der Nacht beleuchtete ellipsenförmige Zehnmeterturm ist das charakteristische Wahrzeichen des Freibades Rüngsdorf. Die Liegewiese und auch das Attraktionsbecken des Bades bieten für Jung und Alt genügend Möglichkeiten zur Entspannung. Außerdem gibt es einen Abenteuerspielplatz mit großzügigem Sandspielbereich einschließlich eines sogenannten Matschplatzes und eine Wassergroßrutsche mit einer Länge von zirka 27,5 Meter. Ennertbad Keine neun Flugstunden entfernt, sondern am Fuße des Siebengebirges erwartet den Badegast das wohl nördlichste Eiland der Karibik. Mit bunten Motiven von Papageien, Affen und exotischen Vögeln auf dem neugestalteten Haupt- und Umkleidegebäude sorgten Künstler für viel karibisches Flair. Darüber hinaus verzieren karibische Wasserwelten das 50-Meter-Sportbecken sowie das separate Sprungbecken mit seinem Fünf-Meter-Turm. Nichtschwimmer fühlen sich im großflächigen Nichtschwimmerbecken mit seinen Wasserpilzen, Wasserkanonen und der Wasserrutsche pudelwohl. Römerbad Auf historischem Boden, direkt am Rhein gelegen, wo einst römische Badehäuser den Stadtgründern Erfrischung boten, können heute die Schwimmerinnen und Schwimmer ihre Bahnen ziehen. Das Schwimmbad verfügt über das einzige Wellenbad in Bonn. Ein weiteres Highlight: Die Wasserspringer haben die Wahl von einem Meter bis hinauf zur Zehn-Meter-Plattform. Das verkehrsgünstig gelegene Bad im Bonner Norden startet mit einem neuen Kinderbecken in die Sommersaison 2019. Die Hallenbäder sind während der Freibadsaison geschlossen. Beueler Bütt Beuel In der Beueler Bütt laden ein Mehrzweck- und ein Lehrschwimmbecken zur Erholung ein. Die stadtnahe Lage macht dieses Bad besonders reizvoll für Badegäste, die im Innenstadtbereich arbeiten oder wohnen. Es stehen Unterwasser-Massagedüsen und eine Wasserschütte zur Verfügung. Eine privat betriebene Sauna- und Massageabteilung sorgt für Erholung, und die Terrasse mit Liegestühlen und eine Liegewiese laden zum Verweilen ein. Frankenbad Das Frankenbad ist ein Hallenschwimmbad, das über ein Kurzbahnsportbecken, ein Mehrzweckbecken und ein Lehrschwimmbecken verfügt. Es wurde in den 80er Jahren durch die Austragung des Arena-Meetings in Schwimmerkreisen bekannt. Hier werden regelmäßig Schwimmwettkämpfe ausgetragen.', 'address': {'@type': 'PostalAddress', 'addressLocality': 'Bonn, Germany', 'addressCountry': 'Germany', 'postalCode': '53175', 'streetAddress': 'Margaretenstr. 14'}, 'telephone': '', 'geo': {'@type': 'GeoCoordinates', 'latitude': '50.69743', 'longitude': '7.12489'}, 'priceRange': '-', 'image': 'https://storage.googleapis.com/download/storage/v1/b/usc-pro-uscweb-live-media/o/de-live%2Foriginal_1920x1080_620fe9d4c2a8-Friesdorf_1560687009192835_admin.jpg?alt=media'}",50.69743,7.12489,"Bäder bieten spritziges Freizeitvergnügen Bonn verfügt über acht Schwimmbäder: fünf Freibäder, ein kombiniertes Hallen-/Freibad und zwei Schwimmhallen. Kombibad Hardtbergbad Der Freibadteil des Hardtbergbades verfügt über ein Sportbecken und zwei Nichtschwimmerbecken. Das Planschbecken mit Bachlauf bietet vor allem Familien mit Kindern viele Möglichkeiten zur Erholung und Aktivitäten. Im Sandspielplatz befinden sich ein Matschbereich und eine Kinderbaustelle. Ebenfalls steht ein Beach-Volleyballfeld zur Verfügung. Die Anlage ist behindertengerecht und zugänglich für Rollstuhlfahrer. Die Schwimmhalle ist barrierefrei für Rollstuhlfahrer. Dort ermöglicht ein mobiler Poollifter Gehbehinderten einen stufenlosen Beckeneinstieg. Freibäder Melbbad Das Melbbad in Poppelsdorf ist sehr idyllisch am Hang des Venusberges gelegen. Die Wiesen mit südwestlicher Lage laden zum Sonnenbaden ein. Besonders Studenten nutzen das der Universität nahe gelegene Bad zum Sonnenbaden und Schwimmen. Das Bad verfügt über zwei Beach-Volleyballfelder. Freibad Friesdorf „Friesi“ Das 1961 eröffnete kleine Freibad mitten in Friesdorf hat trotz seiner geringen Wasserfläche viel zu bieten. Den Badegästen stehen im Sommer ein Sportbecken, ein Lehrschwimmbecken sowie ein Planschbecken zur Verfügung. Des Weiteren gibt es viele Attraktionen wie Beachvolleyballanlage, Tischtennisplatte, Torwand, Basketballfeld, kleine Fußballtore und eine Wippe sowie eine kleine Rutsche, die zu einem schönen unvergesslichen Freibadbesuch beitragen. Zusätzlich ist seit Ende 2012 eine neue Kinderspiellandschaft mit vielen Klettermöglichkeiten in einem riesigen Sandbereich entstanden, der zum Bauen von Burgen einlädt. Die Lage fast im Mittelpunkt von Friesdorf macht es für viele Einwohner, besonders für viele Kinder, zum &quot;Swimmingpool&quot;. Panoramabad Rüngsdorf Manche sagen, dass es wegen seiner landschaftlich überaus reizvollen Lage unmittelbar am Rhein mit Blick auf das Siebengebirge eines der schönsten Freibäder am Rhein überhaupt sei. Der in der Nacht beleuchtete ellipsenförmige Zehnmeterturm ist das charakteristische Wahrzeichen des Freibades Rüngsdorf. Die Liegewiese und auch das Attraktionsbecken des Bades bieten für Jung und Alt genügend Möglichkeiten zur Entspannung. Außerdem gibt es einen Abenteuerspielplatz mit großzügigem Sandspielbereich einschließlich eines sogenannten Matschplatzes und eine Wassergroßrutsche mit einer Länge von zirka 27,5 Meter. Ennertbad Keine neun Flugstunden entfernt, sondern am Fuße des Siebengebirges erwartet den Badegast das wohl nördlichste Eiland der Karibik. Mit bunten Motiven von Papageien, Affen und exotischen Vögeln auf dem neugestalteten Haupt- und Umkleidegebäude sorgten Künstler für viel karibisches Flair. Darüber hinaus verzieren karibische Wasserwelten das 50-Meter-Sportbecken sowie das separate Sprungbecken mit seinem Fünf-Meter-Turm. Nichtschwimmer fühlen sich im großflächigen Nichtschwimmerbecken mit seinen Wasserpilzen, Wasserkanonen und der Wasserrutsche pudelwohl. Römerbad Auf historischem Boden, direkt am Rhein gelegen, wo einst römische Badehäuser den Stadtgründern Erfrischung boten, können heute die Schwimmerinnen und Schwimmer ihre Bahnen ziehen. Das Schwimmbad verfügt über das einzige Wellenbad in Bonn. Ein weiteres Highlight: Die Wasserspringer haben die Wahl von einem Meter bis hinauf zur Zehn-Meter-Plattform. Das verkehrsgünstig gelegene Bad im Bonner Norden startet mit einem neuen Kinderbecken in die Sommersaison 2019. Die Hallenbäder sind während der Freibadsaison geschlossen. Beueler Bütt Beuel In der Beueler Bütt laden ein Mehrzweck- und ein Lehrschwimmbecken zur Erholung ein. Die stadtnahe Lage macht dieses Bad besonders reizvoll für Badegäste, die im Innenstadtbereich arbeiten oder wohnen. Es stehen Unterwasser-Massagedüsen und eine Wasserschütte zur Verfügung. Eine privat betriebene Sauna- und Massageabteilung sorgt für Erholung, und die Terrasse mit Liegestühlen und eine Liegewiese laden zum Verweilen ein. Frankenbad Das Frankenbad ist ein Hallenschwimmbad, das über ein Kurzbahnsportbecken, ein Mehrzweckbecken und ein Lehrschwimmbecken verfügt. Es wurde in den 80er Jahren durch die Austragung des Arena-Meetings in Schwimmerkreisen bekannt. Hier werden regelmäßig Schwimmwettkämpfe ausgetragen."
Donna´s Bonn Endenich,"['Dance', 'Fitness', 'Functional Training', 'Pilates', 'Relaxation', 'Yoga']",False,"['Classic', 'Premium', 'Max']",Classic,Weststadt,Karlsstraße 33,https://urbansportsclub.com//en/venues/donnas-bonn-endenich,"{'@context': 'http://schema.org', '@type': 'LocalBusiness', 'name': 'Donna´s Bonn Endenich', 'description': 'Der Name Donna´s steht für hochwertige, individuelle Fitnesskonzepte, die sich kompetent und zukunftsorientiert auf fast alle Bedürfnisse des Kunden konzentrieren. Donna´s – die Antwort auf all Ihre Problemzonen und somit der Weg zu Ihrer persönlichen Wohlfühlfigur. Ihre Lebensqualität, Ihre körperliche und geistige Vitalität werden maßgeblich durch Ihre persönliche Fitness beeinflußt. Der positive Zusammenhang zwischen regelmäßigem Sport und Gesundheit wurde bereits durch zahlreiche, wissenschaftliche Studien und Forschungsergebnisse belegt. Sport – Das effektivste Medikament ohne Nebenwirkungen, denn wie heißt es so schön „Nur ein gesunder Geist wohnt in einem gesunden Körper“. Und somit ist das gesundheitsorientierte Körpertraining der wichtigste Pfeiler unserer Club- und Leistungsphilosophie. In allen Bereichen spüren Sie unsere Begeisterung zum Thema Fitness. In angenehmer Atmosphäre begeistern und begleiten wir Sie auf Wunsch durch individuelle Betreuung und kompetente Beratung. Unsere lizensierten Fitnesstrainer/innen und Dipl. Sportwissenschaftler unterstützen Sie gerne und helfen Ihnen, Ihre Figurwünsche zu realisieren. Gewichtsreduzierung, Konditions-, Koordinations- und Krafttraining – Es ist Ihr Körper, der für uns an erster Stelle steht. Überzeugen Sie sich selbst und erleben Sie unser Credo „Was Frauen wollen“. Wir freuen uns auf Sie im Donna´s … 4 Sterne Fitness für uns Frauen.', 'address': {'@type': 'PostalAddress', 'addressLocality': 'Bonn, Germany', 'addressCountry': 'Germany', 'postalCode': '53115', 'streetAddress': 'Karlsstraße 33'}, 'telephone': '', 'geo': {'@type': 'GeoCoordinates', 'latitude': '50.7331463', 'longitude': '7.0828598'}, 'priceRange': '-', 'image': 'https://storage.googleapis.com/download/storage/v1/b/usc-pro-uscweb-live-media/o/de-live%2Foriginal_1918x1079_USC-Donnas-Endenich_013_156153838945123_admin.jpg?alt=media'}",50.7331463,7.0828598,"Der Name Donna´s steht für hochwertige, individuelle Fitnesskonzepte, die sich kompetent und zukunftsorientiert auf fast alle Bedürfnisse des Kunden konzentrieren. Donna´s – die Antwort auf all Ihre Problemzonen und somit der Weg zu Ihrer persönlichen Wohlfühlfigur. Ihre Lebensqualität, Ihre körperliche und geistige Vitalität werden maßgeblich durch Ihre persönliche Fitness beeinflußt. Der positive Zusammenhang zwischen regelmäßigem Sport und Gesundheit wurde bereits durch zahlreiche, wissenschaftliche Studien und Forschungsergebnisse belegt. Sport – Das effektivste Medikament ohne Nebenwirkungen, denn wie heißt es so schön „Nur ein gesunder Geist wohnt in einem gesunden Körper“. Und somit ist das gesundheitsorientierte Körpertraining der wichtigste Pfeiler unserer Club- und Leistungsphilosophie. In allen Bereichen spüren Sie unsere Begeisterung zum Thema Fitness. In angenehmer Atmosphäre begeistern und begleiten wir Sie auf Wunsch durch individuelle Betreuung und kompetente Beratung. Unsere lizensierten Fitnesstrainer/innen und Dipl. Sportwissenschaftler unterstützen Sie gerne und helfen Ihnen, Ihre Figurwünsche zu realisieren. Gewichtsreduzierung, Konditions-, Koordinations- und Krafttraining – Es ist Ihr Körper, der für uns an erster Stelle steht. Überzeugen Sie sich selbst und erleben Sie unser Credo „Was Frauen wollen“. Wir freuen uns auf Sie im Donna´s … 4 Sterne Fitness für uns Frauen."
Ma Loka - Yoga,['Yoga'],False,"['Classic', 'Premium', 'Max']",Classic,Alfter,Am Herrenwingert 10,https://urbansportsclub.com//en/venues/ma-loka-yoga,"{'@context': 'http://schema.org', '@type': 'LocalBusiness', 'name': 'Ma Loka - Yoga', 'description': 'Wir sind ein kleines neues Studio im Herzen von Alfter und heißen dich herzlich willkommen zu unserer Vielfalt an Yogakursen und Angeboten. Wir sind ein junges Team an Yogalehrer_innen mit langjähriger Erfahrung im Unterrichten und in der eigenen Praxis. So findest du bei uns sanfte Yogakurse, die besonders die Entspannung fördern, dynamische Kurse, die dein Körper in alle Richtungen Ausdehnen, kräftigen und fordern, aber auch klassische Yogakurse, die nah an den einzelnen Traditionen anknüpfen. Ganzheitliches Yoga ist uns wichtig und so beinhalten unsere Kurse immer Atemtechniken, Bewegungen (Asanas) und Entspannungstechniken. Auch die Kraft der Meditationen und Mantren wollen wir euch nicht vorenthalten und kommen in der ein oder anderen Einheit vor. Wir freuen uns auf dich! Ob aus Alfter, Bonn oder Umgebung, ob Yoganeuling oder Fortgeschritten! Love &amp; Shanti, Ma Loka', 'address': {'@type': 'PostalAddress', 'addressLocality': 'Bonn, Germany', 'addressCountry': 'Germany', 'postalCode': '53347', 'streetAddress': 'Am Herrenwingert 10'}, 'telephone': '', 'geo': {'@type': 'GeoCoordinates', 'latitude': '50.7372944', 'longitude': '7.0098808'}, 'priceRange': '-', 'image': 'https://storage.googleapis.com/download/storage/v1/b/usc-pro-uscweb-live-media/o/de-live%2Foriginal_1773x997_018357c90855-MaLoka_Portraits_29%20M_1629191940200077_admin.jpg?generation=1629191940299597&amp;alt=media'}",50.7372944,7.0098808,"Wir sind ein kleines neues Studio im Herzen von Alfter und heißen dich herzlich willkommen zu unserer Vielfalt an Yogakursen und Angeboten. Wir sind ein junges Team an Yogalehrer_innen mit langjähriger Erfahrung im Unterrichten und in der eigenen Praxis. So findest du bei uns sanfte Yogakurse, die besonders die Entspannung fördern, dynamische Kurse, die dein Körper in alle Richtungen Ausdehnen, kräftigen und fordern, aber auch klassische Yogakurse, die nah an den einzelnen Traditionen anknüpfen. Ganzheitliches Yoga ist uns wichtig und so beinhalten unsere Kurse immer Atemtechniken, Bewegungen (Asanas) und Entspannungstechniken. Auch die Kraft der Meditationen und Mantren wollen wir euch nicht vorenthalten und kommen in der ein oder anderen Einheit vor. Wir freuen uns auf dich! Ob aus Alfter, Bonn oder Umgebung, ob Yoganeuling oder Fortgeschritten! Love &amp; Shanti, Ma Loka"
Human Fitness - Engers,['Functional Training'],False,"['Classic', 'Premium', 'Max']",Classic,Neuwied,Spielplatz Michaelspark Rheinwiese,https://urbansportsclub.com//en/venues/human-fitness-nr-engers,"{'@context': 'http://schema.org', '@type': 'LocalBusiness', 'name': 'Human Fitness - Engers', 'description': 'Das Zirkeltraining oder auch Circuit Training gehört weltweit zu den wohl bekanntesten Trainingsformen überhaupt. Es wird im Sportunterricht, im Freizeit- und Leistungssport, im Fitnessstudio, Personaltraining oder im Verein eingesetzt. Unser OutdoorCircuit® vereint die besten Elemente des Functional- und Bodyweight-Trainings und bietet ein geniales Gruppentrainingssystem. Stabilität, Koordination, Kraft, Ausdauer, Agilität, Schnelligkeit und Beweglichkeit werden gleichzeitig trainiert und verbessert. Spezielle und einfache Bewegungsanalysen und Verfahren im Vorfeld ermöglichen es den Teilnehmern sehr schnell Fortschritte zu machen. Es fühlt sich an wie Personal Training und die Verbesserung der Teilnehmer wird somit nach wenigen Wochen mess- und sichtbar.', 'address': {'@type': 'PostalAddress', 'addressLocality': 'Bonn, Germany', 'addressCountry': 'Germany', 'postalCode': '56566', 'streetAddress': 'Spielplatz Michaelspark Rheinwiese'}, 'telephone': '', 'geo': {'@type': 'GeoCoordinates', 'latitude': '50.421016695', 'longitude': '7.551891456'}, 'priceRange': '-', 'image': 'https://storage.googleapis.com/download/storage/v1/b/usc-pro-uscweb-live-media/o/de-live%2Foriginal_3543x1993_926984817225-OC_Training_160_Kopie_1661777223373656_admin.jpg?generation=1661777223588622&amp;alt=media'}",50.421016695,7.551891456,"Das Zirkeltraining oder auch Circuit Training gehört weltweit zu den wohl bekanntesten Trainingsformen überhaupt. Es wird im Sportunterricht, im Freizeit- und Leistungssport, im Fitnessstudio, Personaltraining oder im Verein eingesetzt. Unser OutdoorCircuit® vereint die besten Elemente des Functional- und Bodyweight-Trainings und bietet ein geniales Gruppentrainingssystem. Stabilität, Koordination, Kraft, Ausdauer, Agilität, Schnelligkeit und Beweglichkeit werden gleichzeitig trainiert und verbessert. Spezielle und einfache Bewegungsanalysen und Verfahren im Vorfeld ermöglichen es den Teilnehmern sehr schnell Fortschritte zu machen. Es fühlt sich an wie Personal Training und die Verbesserung der Teilnehmer wird somit nach wenigen Wochen mess- und sichtbar."
athletik klub,['Fitness'],False,"['Classic', 'Premium', 'Max']",Classic,Beuel,Siebenmorgenweg 10c,https://urbansportsclub.com//en/venues/fnxnl-lab-bonn,"{'@context': 'http://schema.org', '@type': 'LocalBusiness', 'name': 'athletik klub', 'description': 'Wir sind kein normales Fitness-Studio. Wir geben 100% um dich weiter zu bringen. Hier gibt es keine leeren Versprechen und keine Ausreden. Bei uns werden Bewegungen erlernt und keine Geräte geschmiert. Unser eng betreutes, funktionelles Gruppentraining (max. 8-12 Personen) ist effektiv und ganzheitlich. Egal ab 18 oder 80 Jahre alt, Couch-Potato oder Sportler*in.. Alle können mitmachen! Es wird nur unter Aufsicht unserer Coaches trainiert. Individueller Leistungsstand und körperliche Einschränkungen werden berücksichtigt. Neue Kurse starten bald! Neben neuen Kurszeiten kommen folgende Kurse dazu: Einsteiger = Zurück zur Basis. Grundübungen lernen und die Statik des Körpers verstehen. Beweglichkeit = Kein normales Dehnen, kein Yoga.. aktives Mobilitätstraining für mehr Bewegungsfreiheit.', 'address': {'@type': 'PostalAddress', 'addressLocality': 'Bonn, Germany', 'addressCountry': 'Germany', 'postalCode': '53229', 'streetAddress': 'Siebenmorgenweg 10c'}, 'telephone': '+49 177 8972403', 'geo': {'@type': 'GeoCoordinates', 'latitude': '50.7428961', 'longitude': '7.126304'}, 'priceRange': '-', 'image': 'https://storage.googleapis.com/download/storage/v1/b/usc-pro-uscweb-live-media/o/de-live%2Foriginal_1600x900_1%20(Thumbnail)%20(1)_1649762358585786_admin.png?generation=1649762358683730&amp;alt=media'}",50.7428961,7.126304,"Wir sind kein normales Fitness-Studio. Wir geben 100% um dich weiter zu bringen. Hier gibt es keine leeren Versprechen und keine Ausreden. Bei uns werden Bewegungen erlernt und keine Geräte geschmiert. Unser eng betreutes, funktionelles Gruppentraining (max. 8-12 Personen) ist effektiv und ganzheitlich. Egal ab 18 oder 80 Jahre alt, Couch-Potato oder Sportler*in.. Alle können mitmachen! Es wird nur unter Aufsicht unserer Coaches trainiert. Individueller Leistungsstand und körperliche Einschränkungen werden berücksichtigt. Neue Kurse starten bald! Neben neuen Kurszeiten kommen folgende Kurse dazu: Einsteiger = Zurück zur Basis. Grundübungen lernen und die Statik des Körpers verstehen. Beweglichkeit = Kein normales Dehnen, kein Yoga.. aktives Mobilitätstraining für mehr Bewegungsfreiheit."
Parkletix - Bonn-Poppelsdorf,['Functional Training'],False,"['Classic', 'Premium', 'Max']",Classic,Weststadt,Beethovenpl. 12,https://urbansportsclub.com//en/venues/parkletix-bonn-poppelsdorf-1,"{'@context': 'http://schema.org', '@type': 'LocalBusiness', 'name': 'Parkletix - Bonn-Poppelsdorf', 'description': 'Gemeinsam mit Deinem Personal Coach arbeiten wir in kleinen Gruppen an Deiner Gesundheit und Fitness. Wir wollen keine Rekorde brechen! Freunde treffen, lachen, Spaß haben und dabei mit reichlich frischer Luft und in der Natur fit werden und bleiben. Unsere CrossRun- &amp; FunctionalCircle-Kurse sind für Anfänger und Fortgeschrittene geeignet. MACH´S Draußen und triff Deinen Coach und Deine Fitnessgruppe. Wir freuen uns auf Dich', 'address': {'@type': 'PostalAddress', 'addressLocality': 'Bonn, Germany', 'addressCountry': 'Germany', 'postalCode': '53115', 'streetAddress': 'Beethovenpl. 12'}, 'telephone': '', 'geo': {'@type': 'GeoCoordinates', 'latitude': '50.7309648', 'longitude': '7.0895575'}, 'priceRange': '-', 'image': 'https://storage.googleapis.com/download/storage/v1/b/usc-pro-uscweb-live-media/o/de-live%2Foriginal_1634x919_Parkletix-Logo_158210366661420_admin.png?alt=media'}",50.7309648,7.0895575,"Gemeinsam mit Deinem Personal Coach arbeiten wir in kleinen Gruppen an Deiner Gesundheit und Fitness. Wir wollen keine Rekorde brechen! Freunde treffen, lachen, Spaß haben und dabei mit reichlich frischer Luft und in der Natur fit werden und bleiben. Unsere CrossRun- &amp; FunctionalCircle-Kurse sind für Anfänger und Fortgeschrittene geeignet. MACH´S Draußen und triff Deinen Coach und Deine Fitnessgruppe. Wir freuen uns auf Dich"
