name,disciplines,plus_options,plans,min_plan,district,street,link,metadata,latitude,longitude,description
clever Fit Landshut,['Yoga'],False,"['M', 'L', 'XL']",M,Landshut,Oberndorferstraße 2,https://urbansportsclub.com//en/venues/clever-fit-landshut,"{'@context': 'http://schema.org', '@type': 'LocalBusiness', 'name': 'clever Fit Landshut', 'description': 'Clever Fit Landshut freut sich auf deinen Besuch!', 'address': {'@type': 'PostalAddress', 'addressLocality': 'Landshut, Germany', 'addressCountry': 'Germany', 'postalCode': '84032', 'streetAddress': 'Oberndorferstraße 2'}, 'telephone': '+49 871 96691377', 'geo': {'@type': 'GeoCoordinates', 'latitude': '48.550208', 'longitude': '12.1383947'}, 'priceRange': '-', 'image': 'https://storage.googleapis.com/download/storage/v1/b/usc-pro-uscweb-live-media/o/de-live%2Foriginal_640x360_hazwzhqpm3m7vtz6z3pq_1689236547250854.jpg?generation=1689236547444402&amp;alt=media'}",48.550208,12.1383947,Clever Fit Landshut freut sich auf deinen Besuch!
Jumpers Fitness Landshut-Kumhausen,['Fitness'],False,"['S', 'M', 'L', 'XL']",S,Landshut,Ziegelfeldstraße 1,https://urbansportsclub.com//en/venues/jumpers-landshut-kumhausen,"{'@context': 'http://schema.org', '@type': 'LocalBusiness', 'name': 'Jumpers Fitness Landshut-Kumhausen', 'description': 'Ich packe meinen Koffer und nehme mit: meine Sportsachen – und meine Urban Sports Club-App. Und schon geht&#039;s los! Als Urban Sports Mitglied kannst du in allen jumpers Standorten in Deutschland einchecken. Ob du deine Oma in Hessen besuchst, auf Geschäftsreise in Baden-Württemberg bist oder Urlaub in Bayern, Rheinland-Pfalz oder dem Saarland machst: Auf dein Sportprogramm musst du nicht verzichten. Alle Jumpers Studios bieten dir Kraft- und Ausdauertraining. Genauso steht dir aber auch Functional- oder Zirkeltraining zur Verfügung. Du möchtest mehr erfahren über das volle Angebot im Jumpers Studio deiner Wahl? Dann folge dem link zur Jumpers-website. Deine Urban Sports Club Mitgliedschaft entspricht den Angeboten des Jumpers Premium-Pakets (ausgenommen Cardio Scan). Das Jumpers Team freut sich bereits auf deinen Besuch!', 'address': {'@type': 'PostalAddress', 'addressLocality': 'Landshut, Germany', 'addressCountry': 'Germany', 'postalCode': '84036', 'streetAddress': 'Ziegelfeldstraße 1'}, 'telephone': '+44 15792613125', 'geo': {'@type': 'GeoCoordinates', 'latitude': '48.4983764', 'longitude': '12.1593458'}, 'priceRange': '-', 'image': 'https://storage.googleapis.com/download/storage/v1/b/usc-pro-uscweb-live-media/o/de-live%2Foriginal_1200x675_utvnw2getpd9jijstbp5_1722851418156403.png?generation=1722851418258092&amp;alt=media'}",48.4983764,12.1593458,"Ich packe meinen Koffer und nehme mit: meine Sportsachen – und meine Urban Sports Club-App. Und schon geht&#039;s los! Als Urban Sports Mitglied kannst du in allen jumpers Standorten in Deutschland einchecken. Ob du deine Oma in Hessen besuchst, auf Geschäftsreise in Baden-Württemberg bist oder Urlaub in Bayern, Rheinland-Pfalz oder dem Saarland machst: Auf dein Sportprogramm musst du nicht verzichten. Alle Jumpers Studios bieten dir Kraft- und Ausdauertraining. Genauso steht dir aber auch Functional- oder Zirkeltraining zur Verfügung. Du möchtest mehr erfahren über das volle Angebot im Jumpers Studio deiner Wahl? Dann folge dem link zur Jumpers-website. Deine Urban Sports Club Mitgliedschaft entspricht den Angeboten des Jumpers Premium-Pakets (ausgenommen Cardio Scan). Das Jumpers Team freut sich bereits auf deinen Besuch!"
clever fit Dingolfing,"['Bootcamp', 'Dance', 'Fitness', 'Pilates', 'Yoga']",False,"['M', 'L', 'XL']",M,Dingolfing,Bräuhausgasse 29,https://urbansportsclub.com//en/venues/clever-fit-dingolfing,"{'@context': 'http://schema.org', '@type': 'LocalBusiness', 'name': 'clever fit Dingolfing', 'description': 'clever fit Dingolfing freut sich auf Dich!', 'address': {'@type': 'PostalAddress', 'addressLocality': 'Landshut, Germany', 'addressCountry': 'Germany', 'postalCode': '84130', 'streetAddress': 'Bräuhausgasse 29'}, 'telephone': '', 'geo': {'@type': 'GeoCoordinates', 'latitude': '48.6320681', 'longitude': '12.5022087'}, 'priceRange': '-', 'image': 'https://storage.googleapis.com/download/storage/v1/b/usc-pro-uscweb-live-media/o/de-live%2Foriginal_1686x948_fitnesscompressed_1578321892685292_admin.jpg?alt=media'}",48.6320681,12.5022087,clever fit Dingolfing freut sich auf Dich!
clever fit Groupfitness,"['Bootcamp', 'Dance', 'Fitness', 'Indoor Cycling', 'Pilates', 'Qi Gong and Tai Chi', 'Relaxation', 'Yoga']",False,"['M', 'L', 'XL']",M,Landshut,Porschestr. 21,https://urbansportsclub.com//en/venues/clever-fit-premium-landshut,"{'@context': 'http://schema.org', '@type': 'LocalBusiness', 'name': 'clever fit Groupfitness', 'description': 'clever fit Groupfitness freut sich auf deinen Besuch!', 'address': {'@type': 'PostalAddress', 'addressLocality': 'Landshut, Germany', 'addressCountry': 'Germany', 'postalCode': '84030', 'streetAddress': 'Porschestr. 21'}, 'telephone': '', 'geo': {'@type': 'GeoCoordinates', 'latitude': '48.5548853', 'longitude': '12.1514286'}, 'priceRange': '-', 'image': 'https://storage.googleapis.com/download/storage/v1/b/usc-pro-uscweb-live-media/o/de-live%2Foriginal_2048x1152_13301332_995109887232816_4032402343902227780_o_1551266813786260_admin.jpg?alt=media'}",48.5548853,12.1514286,clever fit Groupfitness freut sich auf deinen Besuch!
Global Gym Wörth,['Fitness'],False,"['M', 'L', 'XL']",M,Wörth an der Isar,Luitpoldpark 2,https://urbansportsclub.com//en/venues/global-gym-worht-an-der-isar-gbr,"{'@context': 'http://schema.org', '@type': 'LocalBusiness', 'name': 'Global Gym Wörth', 'description': 'Das Global Gym freut sich auf Dich!', 'address': {'@type': 'PostalAddress', 'addressLocality': 'Landshut, Germany', 'addressCountry': 'Germany', 'postalCode': '84109', 'streetAddress': 'Luitpoldpark 2'}, 'telephone': '', 'geo': {'@type': 'GeoCoordinates', 'latitude': '48.6263691', 'longitude': '12.3199091'}, 'priceRange': '-', 'image': 'https://storage.googleapis.com/download/storage/v1/b/usc-pro-uscweb-live-media/o/de-live%2Foriginal_640x360_l8ezneebbjyie78kfnaw_1698252596110827.png?generation=1698252596158032&amp;alt=media'}",48.6263691,12.3199091,Das Global Gym freut sich auf Dich!
